PMID,abstract,journal,mesh_UIds,mesh_terms,paper,qual_UIds,qual_terms,webpage,year
25236210,"For the first time, a rapid, sensitive and accurate liquid chromatography-atmospheric pressure chemical ionisation-tandem mass spectrometry (LC-APCI-MS/MS) method was developed for determination of validamycin A in agricultural food samples (rice, agaric, almond, cabbage, green onion, carrot, tomato, cucumber and spinach). The validamycin A residue was extracted with methanol-water (9/1, v/v) or methanol by vortex, and a HLB solid-phase extraction cartridge was used for cleaning up the extracts. LC-APCI-MS/MS data acquisition was carried out in multiple reaction monitoring (MRM) mode. A series of matrix-matched calibration solutions ranging from 2.5 to 50ngmL(-1) were used to record calibration curve. The limit of quantification (LOQ) was 10μgkg(-1). The average recoveries, measured at three concentrations levels (10.0, 50.0, 100.0μgkg(-1)) were in the range 83.5-109.6%. The proposed method offers the best sensitivity and specificity for the routine analysis of validamycin A in agricultural food samples. ",Food chemistry,"['D001274', 'D002851', 'D018556', 'D007294', 'D015203', 'D012680', 'D052616', 'D053719']","['Atmospheric Pressure', 'Chromatography, High Pressure Liquid', 'Crops, Agricultural', 'Inositol', 'Reproducibility of Results', 'Sensitivity and Specificity', 'Solid Phase Extraction', 'Tandem Mass Spectrometry']",Determination of validamycin A in agricultural food samples by solid-phase extraction combined with liquid chromatography-atmospheric pressure chemical ionisation-tandem mass spectrometry.,"[None, 'Q000379', 'Q000737', 'Q000031', None, None, 'Q000379', 'Q000379']","[None, 'methods', 'chemistry', 'analogs & derivatives', None, None, 'methods', 'methods']",https://www.ncbi.nlm.nih.gov/pubmed/25236210,2015
25201790,"Almond gum is a naturally occurring polymer produced by almond trees and shrubs. Its abundance, as well as its low cost production makes it a potential feedstock for use in food and pharmaceuticals. In this regard, almond gum oligosaccharides were enzymatically generated, purified and their monosaccharide composition assessed using gas chromatography-flame ionization detector. Oligosaccharide analyses show that the most prominent residues were galactose and arabinose with traces of xylose, rhamnose, glucose and mannose. The glycosyl linkage positions were analyzed using gas chromatography - mass spectrometry showing a main chain composed of galactose units [→3)-Gal-(1→] branched mainly with arabinose residues [Ara-(1→]. The potent role of the generated oligosaccharides on rats wound healing was investigated. They have been applied either alone or supplemented, as active substance, with cream formulation, on full-thickness wound created on the dorsum of the rats. The effect of oligosaccharides was assessed by measuring the wound closure percentage, reaching an average of around 100% when applied alone or supplemented to cream formulation. The healing percentage for the control group was only 74.3% at the same day. The histological evaluation of skin sections visualized by light microscopy revealed an improved collagen deposition and an increased fibroblast and vascular densities. ",Journal of tissue viability,"['D000375', 'D000818', 'D002845', 'D009844', 'D000068181', 'D051381', 'D017208', 'D012867', 'D014945']","['Aging', 'Animals', 'Chromatography', 'Oligosaccharides', 'Prunus dulcis', 'Rats', 'Rats, Wistar', 'Skin', 'Wound Healing']",Healing efficiency of oligosaccharides generated from almond gum (Prunus amygdalus) on dermal wounds of adult rats.,"[None, None, None, 'Q000302', 'Q000737', None, None, 'Q000293', 'Q000187']","[None, None, None, 'isolation & purification', 'chemistry', None, None, 'injuries', 'drug effects']",https://www.ncbi.nlm.nih.gov/pubmed/25201790,2016
25064238,"Total mercury, at μg kg(-1) level, was determined in different types of nuts (cashew nut, Brazil nuts, almond, pistachio, peanut, walnut) using a direct mercury analyser after previous sample defatting and by cold vapour atomic fluorescence spectrometry. There is not enough sensitivity in the second approach to determine Hg in previously digested samples due to the strong matrix effect. Mercury levels in 25 edible nut samples from Brazil and Spain were found in the range from 0.6 to 2.7μg kg(-1) by using the pyrolysis of sample after the extraction of the nut fat. The accuracy of the proposed method was confirmed by analysing certified reference materials of Coal Fly Ash-NIST SRM 1633b, Fucus-IAEA 140 and three unpolished Rice Flour NIES-10. The observed results were in good agreement with the certified values. The recoveries of different amounts of mercury added to nut samples ranged from 94 to 101%. RSD values corresponding to three measurements varied between 2.0 and 14% and the limit of detection and quantification of the method were 0.08 and 0.3μg kg(-1), respectively.",Analytica chimica acta,"['D002138', 'D057230', 'D008628', 'D009754', 'D013050']","['Calibration', 'Limit of Detection', 'Mercury', 'Nuts', 'Spectrometry, Fluorescence']",Determination of total mercury in nuts at ultratrace level.,"[None, None, 'Q000032', 'Q000737', 'Q000379']","[None, None, 'analysis', 'chemistry', 'methods']",https://www.ncbi.nlm.nih.gov/pubmed/25064238,2015
24873870,"The fate of aflatoxins during processing of contaminated almonds into nougat, pastries, and almond syrup was evaluated by testing the effect of each processing step (blanching, peeling, roasting, caramelization, cooking, and water infusion) on the distribution and levels of aflatoxins. Blanching and peeling did not reduce total aflatoxins that were distributed between peeled almonds (90-93%) and skins (7-10%). Roasting of peeled almonds reduced up to 50% of aflatoxins. Up to 70% reduction of aflatoxins was observed during preparation and cooking of almond nougat in caramelized sugar. Aflatoxins were substantially stable during preparation and cooking of almond pastries. The whole process of almond syrup preparation produced a marked increase of total aflatoxins (up to 270%) that were distributed between syrup (18-25%) and spent almonds (75-82%). The increase of total aflatoxins was probably due to the activation of almond enzymes during the infusion step that released free aflatoxins from masked aflatoxins. ",Journal of agricultural and food chemistry,"['D000348', 'D002138', 'D002851', 'D005506', 'D005511', 'D005516', 'D027861']","['Aflatoxins', 'Calibration', 'Chromatography, High Pressure Liquid', 'Food Contamination', 'Food Handling', 'Food Microbiology', 'Prunus']",Effect of almond processing on levels and distribution of aflatoxins in finished products and byproducts.,"['Q000032', None, None, 'Q000032', 'Q000379', None, 'Q000737']","['analysis', None, None, 'analysis', 'methods', None, 'chemistry']",https://www.ncbi.nlm.nih.gov/pubmed/24873870,2015
24832991,"Multivariate screening methods are increasingly being implemented but there is no worldwide harmonized criterion for their validation. This study contributes to establish protocols for validating these methodologies. We propose the following strategy: (1) Establish the multivariate classification model and use receiver operating characteristic (ROC) curves to optimize the significance level (α) for setting the model's boundaries. (2) Evaluate the performance parameter from the contingency table results and performance characteristic curves (PCC curves). The adulteration of hazelnut paste with almond paste and chickpea flour has been used as a case study. Samples were analyzed by infrared (IR) spectroscopy and the multivariate classification technique used was soft independent modeling of class analogies (SIMCA). The ROC study showed that the optimal α value for setting the SIMCA boundaries was 0.03 in both cases. The sensitivity value was 93%, specificity 100% for almond and 98% for chickpea, and efficiency 97% for almond and 93% for chickpea. ",Analytica chimica acta,"['D005504', 'D005607', 'D015999', 'D012372', 'D013055']","['Food Analysis', 'Fraud', 'Multivariate Analysis', 'ROC Curve', 'Spectrophotometry, Infrared']",Validation of multivariate screening methodology. Case study: detection of food fraud.,"['Q000379', None, None, None, None]","['methods', None, None, None, None]",https://www.ncbi.nlm.nih.gov/pubmed/24832991,2015
24779985,"In Isfahan province of Iran, pistachio and almond are used specifically as ingredients to produce Gaz sweets, which are a typical product of Isfahan and exported to many countries. In this survey, 112 samples were gathered from different corresponding Gaz producers from 2007 to 2012 to evaluate the occurrence of aflatoxins (AF) in these products. Samples were analysed for AFB1, AFB2, AFG1 and AFG2 using immunoaffinity column clean-up (IC) and quantified by high-performance liquid chromatography (HPLC) with fluorescence detection. Among the samples analysed, AFB1 was detected in 13.4% of the samples above the maximum limit (ML) as set in Iran (5 µg/kg). Total AF (AFT) was above the ML in 9.8% of the samples. This study showed that full consideration is equally essential for nuts used as ingredients in special food products such as the Gaz sweets as for nuts for direct human consumption. It suggests a need for modifying the current trend of supervision.","Food additives & contaminants. Part B, Surveillance","['D000348', 'D002846', 'D002851', 'D007492', 'D027927', 'D012015', 'D013050']","['Aflatoxins', 'Chromatography, Affinity', 'Chromatography, High Pressure Liquid', 'Iran', 'Pistacia', 'Reference Standards', 'Spectrometry, Fluorescence']","Aflatoxin in pistachio nuts used as ingredients in Gaz sweets produced in Isfahan, Iran.","['Q000032', None, None, None, 'Q000737', None, None]","['analysis', None, None, None, 'chemistry', None, None]",https://www.ncbi.nlm.nih.gov/pubmed/24779985,2014
23871025,"Indirect quantification of total cyanogenic compounds (cyanogens) in plants was studied using a novel ninhydrin-based spectrophotometric micromethod. The ninhydrin-cyanide system obeys Beer's law in the range from 20 μg L(-1) to 800 μg L(-1) CN(-) with molar absorptivity ε=1.4×10(5) L mol(-1)cm(-1). Recovery at 100 μg L(-1) CN(-) was 100.5±0.1% and LOD and LOQ were 8 and 22 μg L(-1), respectively. The conditions for ninhydrin reagent preparation were discussed. The extraction and separation solutions, extraction and incubation time, and solvent volume were also investigated for maximum recovery of total cyanogens. 0.1% NaHCO3 was used as an extraction solvent for cyanide formed after enzymatic hydrolysis of cyanogens. The procedure was suitable for samples containing more than 90 mg CN(-)/100 g sample. When cyanogen concentrations were lower, the resulted cyanide was separated by microdiffusion in a Conway cell. Water was used as a hydrolysis medium and a donor solvent, while 2% Na2CO3 as an absorbing solution. Total cyanogen content in plum and almond kernels, as well as apple and flax seeds was determined.",Food chemistry,"['D019597', 'D005638', 'D027845', 'D009555', 'D009570', 'D010936', 'D027861', 'D012639', 'D013053']","['Flax', 'Fruit', 'Malus', 'Ninhydrin', 'Nitriles', 'Plant Extracts', 'Prunus', 'Seeds', 'Spectrophotometry']",A modified ninhydrin micro-assay for determination of total cyanogens in plants.,"['Q000737', 'Q000737', 'Q000737', 'Q000737', 'Q000032', 'Q000032', 'Q000737', 'Q000737', 'Q000295']","['chemistry', 'chemistry', 'chemistry', 'chemistry', 'analysis', 'analysis', 'chemistry', 'chemistry', 'instrumentation']",https://www.ncbi.nlm.nih.gov/pubmed/23871025,2014
23614683,"Mycotoxins in foods have long been recognized as potential health hazards due to their toxic and carcinogenic properties. A simple and rapid method was developed to detect 26 mycotoxins (aflatoxins, ochratoxins, fumonisins, trichothecenes, and ergot alkaloids) in corn, rice, wheat, almond, peanut, and pistachio products using high-performance liquid chromatography-triple-quadrupole mass spectrometry. Test portions of homogenized grain or nut products were extracted with acetonitrile/water (85:15, v/v), followed by high-speed centrifugation and dilution with water. Mean recoveries (± standard deviations) were 84 ± 6, 89 ± 6, 97 ± 9, 87 ± 12, 104 ± 16, and 92 ± 18% from corn, rice, wheat, almond, peanut, and pistachio products, respectively, and the matrix-dependent instrument quantitation limits ranged from 0.2 to 12.8 μg/kg, depending on the mycotoxin. Matrix effects, as measured by the slope ratios of matrix-matched and solvent-only calibration curves, revealed primarily suppression and were more pronounced in nuts than in grains. The measured mycotoxin concentrations in 11 corn and wheat reference materials were not different from the certified concentrations. Nineteen mycotoxins were identified and measured in 35 of 70 commercial grain and nut products, ranging from 0.3 ± 0.1 μg/kg (aflatoxin B1 in peanuts) to 1143 ± 87 μg/kg (fumonisin B1 in corn flour). This rapid and efficient method was shown to be rugged and effective for the multiresidue analysis of mycotoxins in finished grain and nut products.",Journal of agricultural and food chemistry,"['D002851', 'D002523', 'D005504', 'D005506', 'D013058', 'D009183', 'D009754']","['Chromatography, High Pressure Liquid', 'Edible Grain', 'Food Analysis', 'Food Contamination', 'Mass Spectrometry', 'Mycotoxins', 'Nuts']",Multi-mycotoxin analysis of finished grain and nut products using high-performance liquid chromatography-triple-quadrupole mass spectrometry.,"['Q000379', 'Q000737', 'Q000379', 'Q000032', 'Q000379', 'Q000032', 'Q000737']","['methods', 'chemistry', 'methods', 'analysis', 'methods', 'analysis', 'chemistry']",https://www.ncbi.nlm.nih.gov/pubmed/23614683,2013
23498967,"Tree nuts are a widely consumed food. Although enjoyed safely by most individuals, allergic reactions to tree nuts, including almond, are not uncommon. Almond prunin (Pru du 6), an 11S globulin (legumin), is an abundant nut seed protein and a major allergen. Conformational epitope mapping studies of prunin have been performed with a murine monoclonal antibody (mAb) 4C10. This mAb reacts with non-reduced but not reduced prunin in immunoblotting assays, indicating the recognition of a conformational epitope. 4C10 competes with patient IgE, as assessed by ELISA, indicating clinical significance of the epitope. To characterize the 4C10 epitope, hydrogen/deuterium exchange (HDX) monitored by 14.5 T Fourier transform ion cyclotron resonance mass spectrometry (MS) was performed on the native prunin-4C10 complex and on uncomplexed native prunin. Several epitope candidate peptides that differ in deuterium uptake between the complexed and uncomplexed forms were identified. The epitope was further mapped by analyzing chimeric molecules incorporating segments of the homologous soybean allergen, Gly m 6, in immunoassays. These data indicate that the 4C10 epitope overlaps with a subset of patient IgE binding epitopes on almond prunin and further supports HDX-MS as a valid technique for mapping conformational epitopes.",Molecular immunology,"['D000485', 'D000595', 'D052179', 'D018604', 'D018985', 'D005512', 'D005916', 'D006801', 'D007073', 'D007074', 'D008969', 'D016297', 'D010940', 'D011487', 'D027861', 'D017386']","['Allergens', 'Amino Acid Sequence', 'Antigens, Plant', 'Epitope Mapping', 'Epitopes, B-Lymphocyte', 'Food Hypersensitivity', 'Globulins', 'Humans', 'Immunoglobulin E', 'Immunoglobulin G', 'Molecular Sequence Data', 'Mutagenesis, Site-Directed', 'Plant Proteins', 'Protein Conformation', 'Prunus', 'Sequence Homology, Amino Acid']","Conformational epitope mapping of Pru du 6, a major allergen from almond nut.","['Q000737', None, 'Q000737', 'Q000379', 'Q000276', 'Q000276', 'Q000737', None, 'Q000096', 'Q000096', None, None, 'Q000737', None, 'Q000737', None]","['chemistry', None, 'chemistry', 'methods', 'immunology', 'immunology', 'chemistry', None, 'biosynthesis', 'biosynthesis', None, None, 'chemistry', None, 'chemistry', None]",https://www.ncbi.nlm.nih.gov/pubmed/23498967,2013
23451369,"A colorimetric method for the determination of total antioxidant activity in a variety of foods and beverages was validated in both a single-laboratory validation and a collaborative laboratory validation study. The procedure involved extraction of the antioxidants directly into a methanol-water solution containing a known amount of 2,2'-diphenyl-1-picrylhydrazyl (DPPH), thus promoting the rapid reaction of extracted materials with DPPH. The reaction was monitored by spectrophotometric measurement of the absorbance loss at 517 nm. Antioxidant activity was quantified relative to a dilution series of vitamin E analog standards (Trolox), which were analyzed in parallel simultaneously with the food and beverage samples. The antioxidant activities of the samples ranged from 131 to 131 000 micromole Trolox equivalents/100 g. Statistical analysis of the results showed that nine of the 11 matrixes gave acceptable HorRat values, indicating that the method performed well in these cases. The acceptable matrixes include pomegranate juice, blueberry juice, carrot juice, green tea, wine, rosemary spice, ready-to-eat cereal, and yogurt. Two samples failed the HorRat test: the first was an almond milk that had an antioxidant level below the practical LOQ for the method; the second was a sample of canola oil with added omega-3 fatty acid that was immiscible in the reaction medium.",Journal of AOAC International,"['D000975', 'D001628', 'D001713', 'D002839', 'D005504', 'D005638', 'D007202', 'D010851', 'D027861', 'D012015', 'D015203', 'D013056', 'D017365', 'D013662', 'D014675', 'D014920', 'D015014']","['Antioxidants', 'Beverages', 'Biphenyl Compounds', 'Chromans', 'Food Analysis', 'Fruit', 'Indicators and Reagents', 'Picrates', 'Prunus', 'Reference Standards', 'Reproducibility of Results', 'Spectrophotometry, Ultraviolet', 'Spices', 'Tea', 'Vegetables', 'Wine', 'Yogurt']","Determination of antioxidant activity in foods and beverages by reaction with 2,2'-diphenyl-1-picrylhydrazyl (DPPH): collaborative study First Action 2012.04.","['Q000032', 'Q000032', 'Q000737', None, 'Q000379', 'Q000737', None, 'Q000737', 'Q000737', None, None, None, 'Q000032', 'Q000737', 'Q000737', 'Q000032', 'Q000032']","['analysis', 'analysis', 'chemistry', None, 'methods', 'chemistry', None, 'chemistry', 'chemistry', None, None, None, 'analysis', 'chemistry', 'chemistry', 'analysis', 'analysis']",https://www.ncbi.nlm.nih.gov/pubmed/23451369,2013
23167850,"Extractable and bound proanthocyanidins and hydrolyzable tannins were characterized in Nonpareil, Carmel, and Butte almond varieties from California, with n = 3 samples/variety. Bound proanthocyanidins were recovered from extracted defatted almond residue by hydrolysis with 4 N sodium hydroxide and represented 3-21% of the total proanthocyanidin content among varieties. The bound proanthocyanidins were recovered primarily as monomers and dimers. In contrast, acid hydrolysis of extracted almond residue did not yield bound proanthocyanidins. Hydrolyzable tannins were characterized in aqueous acetone extracts of defatted almond using two-dimensional TLC and further quantitated by HPLC following acid hydrolysis. Almond hydrolyzable tannin content was 54.7 ± 2.3 mg ellagic acid and 27.4 ± 7.3 mg gallic acid per 100 g almond among varieties. The tannin contents of Nonpareil, Carmel, and Butte almond varieties were not significantly different. Thus, bound proanthocyanidins and hydrolyzable tannins significantly contribute to almond polyphenol content.",Journal of agricultural and food chemistry,"['D002140', 'D002851', 'D002855', 'D005504', 'D006868', 'D047348', 'D044945', 'D027861']","['California', 'Chromatography, High Pressure Liquid', 'Chromatography, Thin Layer', 'Food Analysis', 'Hydrolysis', 'Hydrolyzable Tannins', 'Proanthocyanidins', 'Prunus']","Characterization of ellagitannins, gallotannins, and bound proanthocyanidins from California almond (Prunus dulcis) varieties.","[None, None, 'Q000379', 'Q000379', None, 'Q000032', 'Q000032', 'Q000737']","[None, None, 'methods', 'methods', None, 'analysis', 'analysis', 'chemistry']",https://www.ncbi.nlm.nih.gov/pubmed/23167850,2014
23072689,"The objective of this study was to evaluate the presence of fungi and mycotoxins (aflatoxins and cyclopiazonic acid) in Brazil nut samples collected in different states of the Brazilian Amazon region: Acre, Amazonas, Amapá, and Pará. A total of 200 husk samples and 200 almond samples were inoculated onto Aspergillus flavus-parasiticus agar for the detection of fungi. Mycotoxins were analyzed by high-performance liquid chromatography. The mycobiota comprised the following fungi, in decreasing order of frequency: almonds - Phialemonium spp. (54%), Penicillium spp. (16%), Fusarium spp. (13%), Phaeoacremonium spp. (11%), and Aspergillus spp. (4%), husks - Phialemonium spp. (62%), Phaeoacremonium spp. (11%), Penicillium spp. (10%), Fusarium spp. (9%), and Aspergillus spp. A polyphasic approach was used for identification of Aspergillus species. Aflatoxins were detected in 22 (11%) of the 200 almond samples, with 21 samples presenting aflatoxin B(1) levels above 8μg/kg, the limit established by the European Commission for Brazil nuts for further processing. Nineteen (9.5%) of the 200 husk samples contained aflatoxins, but at levels lower than those seen in almonds. Cyclopiazonic acid (CPA) was detected in 44 (22%) almond samples, with levels ranging from 98.65 to 161.2μg/kg. Aspergillus nomius and A. flavus were the most frequent Aspergillus species. The presence of fungi does not necessarily imply mycotoxin contamination, but almonds of the Brazil nut seem to be a good substrate for fungal growth.",International journal of food microbiology,"['D000348', 'D001230', 'D001231', 'D031383', 'D001938', 'D002851', 'D005516', 'D005658', 'D005670', 'D009183', 'D010407', 'D027861']","['Aflatoxins', 'Aspergillus', 'Aspergillus flavus', 'Bertholletia', 'Brazil', 'Chromatography, High Pressure Liquid', 'Food Microbiology', 'Fungi', 'Fusarium', 'Mycotoxins', 'Penicillium', 'Prunus']",Mycobiota and mycotoxins in Brazil nut samples from different states of the Brazilian Amazon region.,"['Q000032', None, None, 'Q000382', None, None, None, None, 'Q000302', 'Q000032', 'Q000302', 'Q000382']","['analysis', None, None, 'microbiology', None, None, None, None, 'isolation & purification', 'analysis', 'isolation & purification', 'microbiology']",https://www.ncbi.nlm.nih.gov/pubmed/23072689,2013
22800988,A chromatographic method using HPAEC-PAD was developed to accurately quantify the major oligosaccharides derived from lichenase degradation of barley β-glucan. This method was further used to follow β-glucosidase degradation and product formation as progress curves. This approach allowed us to compare the kinetic characteristics of β-glucosidase on each exclusive oligosaccharide substrate and their mixtures. Our results show that when determining the kinetic parameters of exohydrolases on oligosaccharides following the progress curve for the substrates is necessary since calculations based only on released monosaccharide products may lead to an error. The catalytic activity of almond β-glucosidase on laminaribiose (G3G) was approximately half that measured against cellobiose (3.15 S(-1)). The enzyme had 12 times and 560 times less catalytic activity on 3-O-β-cellobiosyl-D-glucose (G4G3G) and on 3-O-β-cellotriosyl-d-glucose (G4G4G3G) respectively than on G3G. Our approach offers a useful tool for the determination of the kinetics of enzymatic or chemical modification of various carbohydrate substrates.,Carbohydrate research,"['D002852', 'D006026', 'D001467', 'D007700', 'D009844', 'D047071', 'D001617']","['Chromatography, Ion Exchange', 'Glycoside Hydrolases', 'Hordeum', 'Kinetics', 'Oligosaccharides', 'beta-Glucans', 'beta-Glucosidase']",Application of high-performance anion-exchange chromatography with pulsed amperometric detection to compare the kinetic properties of β-glucosidase on oligosaccharides from lichenase digested barley β-glucan.,"['Q000379', 'Q000378', 'Q000737', None, 'Q000737', 'Q000737', 'Q000378']","['methods', 'metabolism', 'chemistry', None, 'chemistry', 'chemistry', 'metabolism']",https://www.ncbi.nlm.nih.gov/pubmed/22800988,2012
