PMID,abstract,journal,mesh_UIds,mesh_terms,paper,qual_UIds,qual_terms,webpage,year
19397716,"The effect of electron beam irradiation doses from 0 to 30 kGy on extraction yield and phenolic compounds was evaluated in almond skin phenolic extracts (ASPE). Total soluble phenols and distribution of phenolic compounds from acidified methanol ASPE and 52% methanol ASPE were quantified using Folin-Ciocalteau method, liquid chromatography with diode array and fluorescence detection, and negative ion electrospray-mass spectrometry. Electron beam irradiation increased extraction yield by as much as 23%, with the greatest increase observed in the acidified methanol ASPE. Irradiated samples extracted with acidified methanol also exhibited an increase in extractable phenols (Folin-Ciocalteau) and total HPLC-resolved phenolics at all irradiation doses. Samples extracted with 52% methanol exhibited an increase at 10 and 20 kGy, but a 31% decrease at 30 kGy. An increase in aglycones respective to their glycosides was not observed with irradiation. Therefore, the increase in phenolics was attributed to release of phenolics from their cellular matrix.",Journal of food science,"['D002851', 'D005419', 'D005514', 'D005720', 'D006863', 'D000432', 'D008982', 'D010636', 'D027861', 'D012639', 'D021241', 'D017973']","['Chromatography, High Pressure Liquid', 'Flavonoids', 'Food Irradiation', 'Gamma Rays', 'Hydrogen-Ion Concentration', 'Methanol', 'Molybdenum', 'Phenols', 'Prunus', 'Seeds', 'Spectrometry, Mass, Electrospray Ionization', 'Tungsten Compounds']","Extraction, identification, and quantification of flavonoids and phenolic acids in electron beam-irradiated almond skin powder.","[None, 'Q000032', None, None, None, None, None, 'Q000032', 'Q000737', 'Q000737', None, None]","[None, 'analysis', None, None, None, None, None, 'analysis', 'chemistry', 'chemistry', None, None]",https://www.ncbi.nlm.nih.gov/pubmed/19397716,2009
19374443,"Information relating to the resistance of food allergens to thermal and/or chemical denaturation is critical if a reduction in protein allergenicity is to be achieved through food-processing means. This study examined the changes in the secondary structure of an almond allergen, amandin, and its acidic and basic polypeptides as a result of thermal and chemical denaturation. Amandin ( approximately 370 kDa) was purified by cryoprecipitation followed by gel filtration chromatography and subjected to thermal (13-96 degrees C) and chemical (urea and dithiothreitol) treatments. Changes in the secondary structure of the protein were followed using circular dichroism spectroscopy. The secondary structure of the hexameric amandin did not undergo remarkable changes at temperatures up to 90 degrees C, although protein aggregation was observed. In the presence of a reducing agent, irreversible denaturation occurred with the following experimental values: T(m) = 72.53 degrees C (transition temperature), DeltaH = 87.40 kcal/mol (unfolding enthalpy), and C(p) = 2.48 kcal/(mol degrees C) (heat capacity). The concentration of urea needed to achieve 50% denaturation was 2.59 M, and the Gibbs free energy of chemical denaturation was calculated to be DeltaG = 3.82 kcal/mol. The basic and acidic polypeptides of amandin had lower thermal stabilities than the multimeric protein.",Journal of agricultural and food chemistry,"['D052179', 'D010455', 'D027861', 'D013816']","['Antigens, Plant', 'Peptides', 'Prunus', 'Thermodynamics']","Structural stability of Amandin, a major allergen from almond (Prunus dulcis), and its acidic and basic polypeptides.","['Q000737', 'Q000737', 'Q000737', None]","['chemistry', 'chemistry', 'chemistry', None]",https://www.ncbi.nlm.nih.gov/pubmed/19374443,2009
18553996,"The 11S globulins from plant seeds account for a number of major food allergens. Because of the interest in the structural basis underlying the allergenicity of food allergens, we sought to crystallize the main 11S seed storage protein from almond ( Prunus dulcis). Prunin-1 (Pru1) was purified from defatted almond flour by water extraction, cryoprecipitation, followed by sequential anion exchange, hydrophobic interaction, and size exclusion chromatography. Single crystals of Pru1 were obtained in a screening with a crystal screen kit, using the hanging-drop vapor diffusion method. Diffraction quality crystals were grown after optimization. The Pru1 crystals diffracted to at least 3.0 A and belong to the tetragonal space group P4(1)22, with unit cell parameters of a = b = 150.912 A, c = 165.248 A. Self-rotation functions and molecular replacement calculations showed that there are three molecules in the asymmetry unit with water content of 51.41%. The three Pru1 protomers are related by a noncrystallographic 3-fold axis and they form a doughnut-shaped trimer. Two prunin trimers form a homohexamer. Elucidation of prunin structure will allow further characterization of the allergenic features of the 11S protein allergens at the molecular level.",Journal of agricultural and food chemistry,"['D000595', 'D052179', 'D003460', 'D018360', 'D005512', 'D008958', 'D008969', 'D010455', 'D010695', 'D027861', 'D016415']","['Amino Acid Sequence', 'Antigens, Plant', 'Crystallization', 'Crystallography, X-Ray', 'Food Hypersensitivity', 'Models, Molecular', 'Molecular Sequence Data', 'Peptides', 'Phlorhizin', 'Prunus', 'Sequence Alignment']","Purification, crystallization and preliminary X-ray characterization of prunin-1, a major component of the almond (Prunus dulcis) allergen amandin.","[None, 'Q000737', None, None, None, None, None, 'Q000737', 'Q000031', 'Q000737', None]","[None, 'chemistry', None, None, None, None, None, 'chemistry', 'analogs & derivatives', 'chemistry', None]",https://www.ncbi.nlm.nih.gov/pubmed/18553996,2008
18494484,"The oxidative stability of selected tree nut oils was examined. The oils of almond, Brazil nut, hazelnut, pecan, pine nut, pistachio, and walnut were extracted using two solvent extraction systems, namely, hexane and chloroform/methanol. The chloroform/methanol system afforded a higher oil yield for each tree nut type examined (pine nut had the highest oil content, whereas almond had the lowest). The fatty acid compositions of tree nut oils were analyzed using gas chromatography, showing that oleic acid was the predominant fatty acid in all samples except pine nut and walnut oils, which contained high amounts of linoleic acid. The tocopherol compositions were analyzed using high-performance liquid chromatography, showing that alpha- and gamma-tocopherols were the predominant tocopherol homologues present; however delta- and beta-tocopherols were also detected in some samples. The oxidative stability of nonstripped and stripped tree nut oils was examined under two conditions, namely, accelerated autoxidation and photooxidation. Progression of oxidation was monitored using tests for conjugated dienes, peroxide value, p-anisidine value, and headspace volatiles. Primary products of oxidation persisted in the earlier stages of oxidation, whereas secondary oxidation product levels increased dramatically during the later stages of oxidation. Hexanal was the major headspace aldehyde formed in all oxidized samples except walnut oil, which contained primarily propanal. Results showed that chloroform/methanol-extracted oils were more stable than hexane-extracted oils in both the accelerated autoxidation and photooxidation studies. Oils of pecan and pistachio were the most stable, whereas oils of pine nut and walnut were the least stable.",Journal of agricultural and food chemistry,"['D031325', 'D004355', 'D005227', 'D031324', 'D009754', 'D010084', 'D027927', 'D010938', 'D012997', 'D024505']","['Carya', 'Drug Stability', 'Fatty Acids', 'Juglans', 'Nuts', 'Oxidation-Reduction', 'Pistacia', 'Plant Oils', 'Solvents', 'Tocopherols']",Oxidative stability of tree nut oils.,"['Q000737', None, 'Q000032', 'Q000737', 'Q000737', None, 'Q000737', 'Q000737', None, 'Q000032']","['chemistry', None, 'analysis', 'chemistry', 'chemistry', None, 'chemistry', 'chemistry', None, 'analysis']",https://www.ncbi.nlm.nih.gov/pubmed/18494484,2008
18004803,"Almond hulls and grape pomace are residues abundantly generated by agricultural industries, which could be processed to obtain bioactive products. To this purpose, crude ethanol extracts from both agricultural byproducts were attained and subsequently fractionated in order to obtain an organic/water fraction (FOW). Extracts and fractions were analyzed for antioxidant power and their phenolic components tentatively identified by HPLC-MS. Chromatographic peaks of almond hull extracts showed the occurrence of hydroxybenzoic and cinnamic acid derivatives, with minor presence of flavan-3-ols (ECG, EGCG), whereas the FOW fraction offered the additional presence of epicatechin (EC) and glycosylated flavonols. In the composition for extracts of white and red grape pomace several of these compounds were also detected but basically consisted of glycosylated flavonols (quercetin, kaempferol). As a difference between both grape pomaces, myricetin glycosyde was found in that from the red variety, whereas flavan-3-ols (EC, afzelechin) were only identified in white pomace. When their FOW fractions were analyzed, gallic acid and some hydroxybenzoic acids were additionally detected. Antioxidant activity was assessed by DPPH and TBARS assays. Almond hulls showed inhibition percentages lower than 50% in both assays, while the inhibition percentage ranged from 80% to 90% in pomace extracts. Red grape pomace extract was the most efficient antioxidant, with an EC50 value of 0.91 g/L for TBARS and 0.20 g/L for DPPH. Even appearing as two quite different vegetal matrixes, the composition of phenolics in grape pomace and almond hulls is quite similar, the main difference being the major occurrence of flavonols in grape pomace. This fact could presumably explain the lower antiradical activity of hull extracts.",Journal of agricultural and food chemistry,"['D000383', 'D000975', 'D002851', 'D005419', 'D005638', 'D007220', 'D013058', 'D010636', 'D027861', 'D012639', 'D027843']","['Agriculture', 'Antioxidants', 'Chromatography, High Pressure Liquid', 'Flavonoids', 'Fruit', 'Industrial Waste', 'Mass Spectrometry', 'Phenols', 'Prunus', 'Seeds', 'Vitis']",Separation and HPLC-MS identification of phenolic antioxidants from agricultural residues: almond hulls and grape pomace.,"[None, 'Q000032', None, 'Q000032', 'Q000737', 'Q000032', None, 'Q000032', 'Q000737', 'Q000737', 'Q000737']","[None, 'analysis', None, 'analysis', 'chemistry', 'analysis', None, 'analysis', 'chemistry', 'chemistry', 'chemistry']",https://www.ncbi.nlm.nih.gov/pubmed/18004803,2008
17892002,"The fungal population and distribution of aflatoxin-producing fungi in 30 samples of imported almond powder products purchased from retail markets were examined in this study. Total counts of fungi ranged from under 1.0 x 10 colony-forming units (CFU)/g to 8.5 x 10(3) CFU/g as determined with the dilution plating technique. The predominant fungi in the mould-contaminated almond samples were Aspergillus niger, A. flavus and the related species, Penicillium, Cladosporium and Rhizopus. Aflatoxin-producing ability in the isolates of A. flavus and related fungi were tested by thin layer chromatography using 2% yeast extract and 15% sucrose broth culture. Four different aflatoxigenic fungi were detected in the isolates; aflatoxins B1 and B2 were produced by some strains of A. flavus and A. parvisclerotigenus, and aflatoxins B1, B2, G1, G2 were produced by all tested strains of A. parasiticus and A. nomius. Identification of the strains was based on morphological and metabolic characters.",Shokuhin eiseigaku zasshi. Journal of the Food Hygienic Society of Japan,"['D000348', 'D001230', 'D002963', 'D005516', 'D005658', 'D009754', 'D010407', 'D027861', 'D012233']","['Aflatoxins', 'Aspergillus', 'Cladosporium', 'Food Microbiology', 'Fungi', 'Nuts', 'Penicillium', 'Prunus', 'Rhizopus']",[Fungal population and distribution of aflatoxigenic fungi in commercial almond powder products].,"['Q000096', 'Q000302', 'Q000302', None, 'Q000302', 'Q000382', 'Q000302', 'Q000382', 'Q000302']","['biosynthesis', 'isolation & purification', 'isolation & purification', None, 'isolation & purification', 'microbiology', 'isolation & purification', 'microbiology', 'isolation & purification']",https://www.ncbi.nlm.nih.gov/pubmed/17892002,2007
17867638,"An exhaustive study of the phenolic composition of almond ( Prunus dulcis (Mill.) D.A. Webb) skins was carried out in order to evaluate their potential application as a functional food ingredient. Using the HPLC-DAD/ESI-MS technique, a total of 33 compounds corresponding to flavanols, flavonols, dihydroflavonols and flavanones, and other nonflavonoid compounds were identified. Peaks corresponding to another 23 structure-related compounds were also detected. MALDI-TOF MS was applied to characterize almond skin proanthocyanidins, revealing the existence of a series of A- and B-type procyanidins and propelargonidins up to heptamers, and A- and B-type prodelphinidins up to hexamers. Flavanols and flavonol glycosides were the most abundant phenolic compounds in almond skins, representing up to 38-57% and 14-35% of the total quantified phenolics, respectively. Due to their antioxidant properties, measured as oxygen-radical absorbance capacity (ORAC) at 0.398-0.500 mmol Trolox/g, almond skins can be considered as a value-added byproduct for elaborating dietary antioxidant ingredients.",Journal of agricultural and food chemistry,"['D000975', 'D002851', 'D005419', 'D010636', 'D010936', 'D059808', 'D044945', 'D027861', 'D012639', 'D021241', 'D019032']","['Antioxidants', 'Chromatography, High Pressure Liquid', 'Flavonoids', 'Phenols', 'Plant Extracts', 'Polyphenols', 'Proanthocyanidins', 'Prunus', 'Seeds', 'Spectrometry, Mass, Electrospray Ionization', 'Spectrometry, Mass, Matrix-Assisted Laser Desorption-Ionization']",Almond (Prunus dulcis (Mill.) D.A. Webb) skins as a potential source of bioactive polyphenols.,"['Q000494', None, 'Q000032', 'Q000032', 'Q000494', None, 'Q000032', 'Q000737', 'Q000737', None, None]","['pharmacology', None, 'analysis', 'analysis', 'pharmacology', None, 'analysis', 'chemistry', 'chemistry', None, None]",https://www.ncbi.nlm.nih.gov/pubmed/17867638,2007
17580630,"About 100 nations have established regulatory limits for aflatoxin in food and feeds. Because these limits vary widely from one country to another, the Codex Alimentarius Commission, working through the Codex Committee on Food Additives and Contaminants, has initiated work to harmonize aflatoxin limits and sampling plans for almonds, pistachios, hazelnuts, and Brazil nuts. Studies were developed to measure the uncertainty and distribution among test results for replicate samples taken from aflatoxin-contaminated almond shipments. The uncertainty and distribution information was used to develop a model to evaluate the performance of aflatoxin sampling plans so that harmonized sampling plans can be developed for almonds that reduce the misclassifying of lots in the export trade. Twenty lots of shelled almonds were sampled according to an experimental protocol in which sixteen 10 kg samples were taken from each lot. The observed aflatoxin distribution among the 16 sample test results was compared with 3 theoretical distributions. The negative binomial distribution was selected to model aflatoxin distribution among sample test results because it gave acceptable fits across all 20 observed sample distributions. By using the variance and distribution information, operating characteristics curves were developed to predict the effect of sample size and accept/reject limits on the probability of rejecting good lots and accepting bad lots.",Journal of AOAC International,"['D000348', 'D031383', 'D002623', 'D002851', 'D031211', 'D005189', 'D005504', 'D005506', 'D009754', 'D027861', 'D015203', 'D012107', 'D012306', 'D018401']","['Aflatoxins', 'Bertholletia', 'Chemistry Techniques, Analytical', 'Chromatography, High Pressure Liquid', 'Corylus', 'False Positive Reactions', 'Food Analysis', 'Food Contamination', 'Nuts', 'Prunus', 'Reproducibility of Results', 'Research Design', 'Risk', 'Sample Size']","Sampling almonds for aflatoxin, part II: estimating risks associated with various sampling plan designs.","['Q000032', None, 'Q000379', 'Q000379', None, None, 'Q000379', None, None, None, None, None, None, None]","['analysis', None, 'methods', 'methods', None, None, 'methods', None, None, None, None, None, None, None]",https://www.ncbi.nlm.nih.gov/pubmed/17580630,2007
17517711,"Palmero cheese is a fresh smoked cheese from the Isle of Palma (Canary Islands), manufactured with goat's milk. To guarantee its safety, the occurrence of polycyclic aromatic hydrocarbons (PAH) in artisanal Palmero cheese smoked with 2 types of vegetable matter (almond shells and dry prickly pear) was studied. The determination of PAH includes extraction and clean-up steps, followed by separation, identification, and quantification of PAH by gas chromatography-mass spectrometry in selected ion-monitoring mode. The most abundant PAH are those with 2 and 3 aromatic rings. Although the highest total PAH concentrations corresponded to the cheeses smoked with almond shells, the degree of PAH contamination of the cheeses studied was lower than that found in other cheeses smoked in the traditional way. The nature of the vegetable material used for smoking seemed to have an influence on the type of PAH formed, especially on alkylderivatives and some light PAH. However, despite the artisanal, and consequently variable, production process of these cheeses, many similarities have been found among their PAH profiles. In fact, relatively constant relationships are observed between the concentrations of certain pairs of PAH. Benzo(a)pyrene was only present in 2 samples, and in much lower concentrations than the maximum allowed legal limits. Therefore, according to the results obtained, it appears that it is possible to obtain a safe product without renouncing the artisanal character or the sensory properties of this type of cheese.",Journal of dairy science,"['D000818', 'D002611', 'D003257', 'D005506', 'D005511', 'D008401', 'D006041', 'D006801', 'D029747', 'D011084', 'D027861', 'D012906', 'D013030', 'D013649']","['Animals', 'Cheese', 'Consumer Product Safety', 'Food Contamination', 'Food Handling', 'Gas Chromatography-Mass Spectrometry', 'Goats', 'Humans', 'Opuntia', 'Polycyclic Aromatic Hydrocarbons', 'Prunus', 'Smoke', 'Spain', 'Taste']",Occurrence of polycyclic aromatic hydrocarbons in artisanal Palmero cheese smoked with two types of vegetable matter.,"[None, 'Q000032', None, 'Q000032', 'Q000379', 'Q000379', None, None, None, 'Q000032', None, None, None, None]","[None, 'analysis', None, 'analysis', 'methods', 'methods', None, None, None, 'analysis', None, None, None, None]",https://www.ncbi.nlm.nih.gov/pubmed/17517711,2007
17040235,The aim of this research was to investigate the impact of extracellular redox potential (Eh) on amino acid conversion to aroma compounds by Lactococcus lactis that is commonly used as a starter in the cheese industry.,Journal of applied microbiology,"['D000596', 'D002611', 'D002851', 'D005511', 'D005516', 'D013294', 'D016877', 'D010084', 'D019163']","['Amino Acids', 'Cheese', 'Chromatography, High Pressure Liquid', 'Food Handling', 'Food Microbiology', 'Lactococcus lactis', 'Oxidants', 'Oxidation-Reduction', 'Reducing Agents']",Addition of oxidizing or reducing agents to the reaction medium influences amino acid conversion to aroma compounds by Lactococcus lactis.,"['Q000378', 'Q000382', 'Q000379', 'Q000379', None, 'Q000187', 'Q000494', None, 'Q000494']","['metabolism', 'microbiology', 'methods', 'methods', None, 'drug effects', 'pharmacology', None, 'pharmacology']",https://www.ncbi.nlm.nih.gov/pubmed/17040235,2007
16915840,"Domestic and international regulatory limits have been established for aflatoxin in almonds and other tree nuts. It is difficult to obtain an accurate and precise estimate of the true aflatoxin concentration in a bulk lot because of the uncertainty associated with the sampling, sample preparation, and analytical steps of the aflatoxin test procedure. To evaluate the performance of aflatoxin sampling plans, the uncertainty associated with sampling lots of shelled almonds for aflatoxin was investigated. Twenty lots of shelled almonds were sampled for aflatoxin contamination. The total variance associated with measuring B1 and total aflatoxins in bulk almond lots was estimated and partitioned into sampling, sample preparation, and analytical variance components. All variances were found to increase with an increase in aflatoxin concentration (both B1 and total). By using regression analysis, mathematical expressions were developed to predict the relationship between each variance component (total, sampling, sample preparation, and analysis variances) and aflatoxin concentration. Variance estimates were the same for B1 and total aflatoxins. The mathematical relationships can be used to estimate each variance for a given sample size, subsample size, and number of analyses other than that measured in the study. When a lot with total aflatoxins at 15 ng/g was tested by using a 10 kg sample, a vertical cutter mixer type of mill, a 100 g subsample, and high-performance liquid chromatography analysis, the sampling, sample preparation, analytical, and total variances (coefficient of variation, CV) were 394.7 (CV, 132.4%), 14.7 (CV, 25.5%), 0.8 (CV, 6.1%), and 410.2 (CV, 135.0%), respectively. The percentages of the total variance associated with sampling, sample preparation, and analytical steps were 96.2, 3.6, and 0.2, respectively.",Journal of AOAC International,"['D016604', 'D000348', 'D000704', 'D002623', 'D002851', 'D005069', 'D005504', 'D027861', 'D012044', 'D015203', 'D012107', 'D018401']","['Aflatoxin B1', 'Aflatoxins', 'Analysis of Variance', 'Chemistry Techniques, Analytical', 'Chromatography, High Pressure Liquid', 'Evaluation Studies as Topic', 'Food Analysis', 'Prunus', 'Regression Analysis', 'Reproducibility of Results', 'Research Design', 'Sample Size']","Sampling almonds for aflatoxin, part I: estimation of uncertainty associated with sampling, sample preparation, and analysis.","['Q000032', 'Q000032', None, 'Q000379', 'Q000379', None, 'Q000379', 'Q000378', None, None, None, None]","['analysis', 'analysis', None, 'methods', 'methods', None, 'methods', 'metabolism', None, None, None, None]",https://www.ncbi.nlm.nih.gov/pubmed/16915840,2006
16819912,"Limited information is available concerning the qualitative and quantitative composition of polyphenolic compounds, especially flavonoids, in almonds. We determined total phenols, flavonoids, and phenolic acids in California almond (Prunus dulcis) skins and kernels among the principal almond varieties (Butte, Carmel, Fritz, Mission, Monterey, Nonpareil, Padre, and Price) with high-performance liquid chromatography (HPLC)/electrochemical detection and UV detection. Liquid chromatography/tandem mass spectrometry under identical HPLC conditions was utilized to verify identities of the predominant flavonoids and phenolic acids. Total phenols ranged from 127 (Fritz) to 241 (Padre) mg gallic acid equivalents/100 g of fresh weight. The analyses were compiled to produce a data set of 18 flavonoids and three phenolic acids. The predominant flavonoids were isorhamnetin-3-O-rutinoside and isorhamnetin-3-O-glucoside (in combination), catechin, kaempferol-3-O-rutinoside, epicatechin, quercetin-3-O-galactoside, and isorhamnetin-3-O-galactoside at 16.81, 1.93, 1.17, 0.85, 0.83, and 0.50 mg/100 g of fresh weight almonds, respectively. Using the existing approach of calculating only the aglycone form of flavonoids for use in the U.S. Department of Agriculture nutrient database, whole almonds would provide the most prevalent aglycones of isorhamnetin at 11.70 (3.32), kaempferol at 0.60 (0.17), catechin at 1.93 (0.55), quercetin at 0.72 (0.20), and epicatechin at 0.85 (0.24) mg/100 g of fresh weight (mg/oz serving), respectively. These data can lead to a better understanding of the mechanisms of action underlying the relationship between almond consumption and health-related outcomes and provide values for whole and blanched almonds suitable for inclusion in nutrient databases.",Journal of agricultural and food chemistry,"['D002851', 'D005419', 'D010636', 'D059808', 'D027861', 'D012639', 'D019032']","['Chromatography, High Pressure Liquid', 'Flavonoids', 'Phenols', 'Polyphenols', 'Prunus', 'Seeds', 'Spectrometry, Mass, Matrix-Assisted Laser Desorption-Ionization']",Determination of flavonoids and phenolics and their distribution in almonds.,"[None, 'Q000032', 'Q000032', None, 'Q000737', 'Q000737', None]","[None, 'analysis', 'analysis', None, 'chemistry', 'chemistry', None]",https://www.ncbi.nlm.nih.gov/pubmed/16819912,2006
