PMID,abstract,journal,mesh_UIds,mesh_terms,paper,qual_UIds,qual_terms,webpage,year
28349738,"Pesticide residues from the time of application until harvest were analysed for 20, 17 and 18 active insecticidal and fungicidal substances in Chinese cabbage, head cabbage and cauliflower, respectively. In total, 40 mathematical models of residue degradation were developed using a first-order kinetic equation, and from these models it was possible to forecast the action pre-harvest interval for a given action threshold for low-residue production in Brassica vegetables as a percentage of the maximum residue level. Additionally, it was possible to establish an action pre-harvest interval based on an action threshold of 0.01 mg kg","Food additives & contaminants. Part A, Chemistry, analysis, control, exposure & risk assessment","['D001937', 'D002681', 'D002851', 'D005506', 'D005659', 'D010573', 'D053719']","['Brassica', 'China', 'Chromatography, High Pressure Liquid', 'Food Contamination', 'Fungicides, Industrial', 'Pesticide Residues', 'Tandem Mass Spectrometry']","Evaluation of pesticide residue dynamics in Chinese cabbage, head cabbage and cauliflower.","['Q000737', None, None, 'Q000032', 'Q000032', 'Q000032', None]","['chemistry', None, None, 'analysis', 'analysis', 'analysis', None]",https://www.ncbi.nlm.nih.gov/pubmed/28349738,2017
28197590,"The complexity of the metabolic changes in obese individuals still presents a challenge for the understanding of obesity-related metabolic disruptions and for obesity management. In this study, a gas chromatography mass spectrometry (GC-MS) based metabolomics approach targeting urine metabolism has been applied to assess the potential roles of functional foods and exercise for obesity management in rats. Male albino rats diagnosed as obese via histopathology and biochemical assays were administered functional foods in common use for obesity management including pomegranate, grapefruit, and red cabbage juice extracts in parallel with swimming exercise. Urine samples were collected from these rats, and likewise from healthy control animals, for metabolite analysis using (GC-MS) coupled to multivariate data analysis. The results revealed a significant elevation in oxalate and phosphate levels in obese rat urine concurrent with lower lactate levels as compared to the control group. Furthermore, and to pinpoint the bioactive agents in the administered functional foods, ultra performance liquid chromatography (UPLC) coupled to high resolution time-of-flight mass spectrometry (TOF-MS) was employed for secondary metabolite profiling. The different phenolic classes found in the examined functional foods, viz. ellagitannins in pomegranate, flavanones in grapefruit and flavonols in red cabbage, are likely to mediate their anti-obesity effects. The results indicate that these functional foods and exercise were quite effective in reverting obesity-related metabolic disruptions back to normal status, as revealed by orthogonal partial least squares-discriminant analysis (OPLS-DA).",Food & function,"['D000818', 'D001937', 'D032083', 'D005081', 'D000067030', 'D055951', 'D008401', 'D006801', 'D029561', 'D008297', 'D055432', 'D009765', 'D051381', 'D014556']","['Animals', 'Brassica', 'Citrus paradisi', 'Exercise Therapy', 'Fruit and Vegetable Juices', 'Functional Food', 'Gas Chromatography-Mass Spectrometry', 'Humans', 'Lythraceae', 'Male', 'Metabolomics', 'Obesity', 'Rats', 'Urine']",Rats' urinary metabolomes reveal the potential roles of functional foods and exercise in obesity management.,"[None, 'Q000378', 'Q000378', None, 'Q000032', 'Q000032', None, None, 'Q000378', None, None, 'Q000378', None, 'Q000737']","[None, 'metabolism', 'metabolism', None, 'analysis', 'analysis', None, None, 'metabolism', None, None, 'metabolism', None, 'chemistry']",https://www.ncbi.nlm.nih.gov/pubmed/28197590,2017
28118142,"A new solid-phase extraction (SPE) sorbent was introduced based on acidic-modified (AM) activated carbon (AC) prepared from acorn shells of native oak trees in Kurdistan. Hydrochloric acid (15%, w/w) and nitric acid (32.5%, w/w) were used to condition and modify AC. The IR spectra of AC and AM-AC showed that AM lead to the formation of increasing numbers of acidic functional groups on AM-AC. AM-AC was used in the SPE method for the extraction and preconcentration of Ni+2 prior to flame atomic absorption spectrometric determination at ng/mL levels in model and real food samples. Effective parameters of the SPE procedure, such as the pH of the solutions, sorbent dosage, extraction time, sample volume, type of eluent, and matrix ions, were considered and optimized. An enrichment factor of 140 was obtained. The calibration curve was linear with an R2 of 0.997 in the concentration range of 1-220 ng/mL. The RSD was 5.67% (for n = 7), the LOD was 0.352 ng/mL, and relative recoveries in vegetable samples ranged from 96.7 to 103.7%.",Journal of AOAC International,"['D001937', 'D002606', 'D006863', 'D027541', 'D009532', 'D029963', 'D052616', 'D013054', 'D018724', 'D013696']","['Brassica', 'Charcoal', 'Hydrogen-Ion Concentration', 'Mentha', 'Nickel', 'Quercus', 'Solid Phase Extraction', 'Spectrophotometry, Atomic', 'Spinacia oleracea', 'Temperature']",Modified Activated Carbon Prepared from Acorn Shells as a New Solid-Phase Extraction Sorbent for the Preconcentration and Determination of Trace Amounts of Nickel in Food Samples Prior to Flame Atomic Absorption Spectrometry.,"['Q000737', 'Q000737', None, 'Q000737', 'Q000032', None, 'Q000379', None, 'Q000737', None]","['chemistry', 'chemistry', None, 'chemistry', 'analysis', None, 'methods', None, 'chemistry', None]",https://www.ncbi.nlm.nih.gov/pubmed/28118142,2017
27664669,"The aim of this study was scientifically investigate the impact of the sequence of different thermo-mechanical treatments on the volatile profile of differently processed broccoli puree, and to investigate if any relationship persists between detected off-flavour changes and microstructural changes as a function of selected process conditions. Comparison of the headspace GC-MS fingerprinting of the differently processed broccoli purees revealed that an adequate combination of processing steps allows to reduce the level of off-flavour volatiles. Moreover, applying mechanical processing before or after the thermal processing at 90°C determines the pattern of broccoli tissue disruption, resulting into different microstructures and various enzymatic reactions inducing volatile generation. These results may aid the identification of optimal process conditions generating a reduced level of off-flavour in processed broccoli. In this way, broccoli can be incorporated as a food ingredient into mixed food products with limited implications on sensorial consumer acceptance. ",Food chemistry,"['D001937', 'D005511', 'D008401', 'D013649']","['Brassica', 'Food Handling', 'Gas Chromatography-Mass Spectrometry', 'Taste']",Potential of different mechanical and thermal treatments to control off-flavour generation in broccoli puree.,"[None, 'Q000379', 'Q000379', None]","[None, 'methods', 'methods', None]",https://www.ncbi.nlm.nih.gov/pubmed/27664669,2016
27591592,"In this study, an aptamer-based fluorescent sensing platform using triple-helix molecular switch (THMS) was developed for the pesticide screening represented by acetamiprid. The THMS was composed of two tailored DNA probes: a label-free central target specific aptamer sequence flanked by two arm segments acting as a recognition probe; a hairpin-shaped structure oligonucleotide serving as a signal transduction probe (STP), labeled with a fluorophore and a quencher at the 3' and 5'-end, respectively. In the absence of acetamiprid, complementary bindings of two arm segments of the aptamers with the loop sequence of STP enforce the formation of THMS with the ""open"" configuration of STP, and the fluorescence of THMS is on. In the presence of target acetamiprid, the aptamer-target binding results in the formation of a structured aptamer/target complex, which disassembles the THMS and releases the STP. The free STP is folded to a stem loop structure, and the fluorescence is quenched. The quenched fluorescence intensity was proportional to the concentration of acetamiprid in the range from 100 to 1200nM, with the limit of detection (LOD) as low as 9.12nM. In addition, this THMS-based method has been successfully used to test and quantify acetamiprid in Chinese cabbage with satisfactory recoveries, and the results were in full agreement with those from LC-MS. The aptamer-based THMS presents distinct advantages, including high stability, remarkable sensitivity, and preservation of the affinity and specificity of the original aptamer. Most importantly, this strategy is convenient and generalizable by virtue of altering the aptamer sequence without changing the triple-helix structure. So, it is expected that this aptamer-based fluorescent assay could be extensively applied in the field of food safety inspection. ",Talanta,"['D052157', 'D015374', 'D001937', 'D005453', 'D005506', 'D007306', 'D000073943', 'D013050']","['Aptamers, Nucleotide', 'Biosensing Techniques', 'Brassica', 'Fluorescence', 'Food Contamination', 'Insecticides', 'Neonicotinoids', 'Spectrometry, Fluorescence']",Aptamer contained triple-helix molecular switch for rapid fluorescent sensing of acetamiprid.,"['Q000737', None, 'Q000737', None, 'Q000032', 'Q000032', 'Q000032', None]","['chemistry', None, 'chemistry', None, 'analysis', 'analysis', 'analysis', None]",https://www.ncbi.nlm.nih.gov/pubmed/27591592,2018
27451169,"A collaborative trial was conducted to determine the performance characteristics of an analytical method for the quantification of inorganic arsenic (iAs) in food. The method is based on (i) solubilisation of the protein matrix with concentrated hydrochloric acid to denature proteins and allow the release of all arsenic species into solution, and (ii) subsequent extraction of the inorganic arsenic present in the acid medium using chloroform followed by back-extraction to acidic medium. The final detection and quantification is done by flow injection hydride generation atomic absorption spectrometry (FI-HG-AAS). The seven test items used in this exercise were reference materials covering a broad range of matrices: mussels, cabbage, seaweed (hijiki), fish protein, rice, wheat, mushrooms, with concentrations ranging from 0.074 to 7.55mgkg(-1). The relative standard deviation for repeatability (RSDr) ranged from 4.1 to 10.3%, while the relative standard deviation for reproducibility (RSDR) ranged from 6.1 to 22.8%. ",Food chemistry,"['D000363', 'D000818', 'D001151', 'D049872', 'D001937', 'D029941', 'D005504', 'D005506', 'D012275', 'D015203', 'D012624', 'D013054', 'D014908']","['Agaricales', 'Animals', 'Arsenic', 'Bivalvia', 'Brassica', 'Fish Proteins', 'Food Analysis', 'Food Contamination', 'Oryza', 'Reproducibility of Results', 'Seaweed', 'Spectrophotometry, Atomic', 'Triticum']",Accuracy of a method based on atomic absorption spectrometry to determine inorganic arsenic in food: Outcome of the collaborative trial IMEP-41.,"['Q000737', None, 'Q000032', 'Q000737', 'Q000737', 'Q000737', None, 'Q000032', 'Q000737', None, 'Q000737', None, 'Q000737']","['chemistry', None, 'analysis', 'chemistry', 'chemistry', 'chemistry', None, 'analysis', 'chemistry', None, 'chemistry', None, 'chemistry']",https://www.ncbi.nlm.nih.gov/pubmed/27451169,2017
27449646,"An enantioselective method for the simultaneous determination of the chiral pesticide isofenphos-methyl in vegetables, fruits, and soil has been established using high-performance liquid chromatography with UV detection. The complete enantioseparation was conducted by reversed-phase liquid chromatography with a cellulose-tris-(4-methylbenzoate) chiral stationary phase (CSP) (Lux Cellulose-3). The effects of different mobile phase compositions, temperatures, and flow rates on enantioseparation were also investigated. The experimental and calculated electronic circular dichroism spectra indicate that the first peak is (S)-(+)-isofenphos-methyl and the second peak is (R)-(-)-isofenphos-methyl. Alumina-A and Florisil solid-phase extraction (SPE) columns were used to clean up for vegetable, fruit, and soil samples. The mean recoveries of the two enantiomers ranged from 83.2 to 110.9 % with intra-day relative standard deviations (RSDs) from 3.2 to 10.8 % and inter-day RSDs from 3.6 to 10 %. Good linearity (≥0.9992) was obtained for the two enantiomers in all matrix-matched calibration curves in the range of 0.25 to 20 mg L(-1). The limit of detection for two enantiomers in six matrices was in the range of 0.008 to 0.011 mg kg(-1), and the limit of quantification was estimated to range from 0.027 to 0.037 mg kg(-1). The results indicated that this method was a convenient and dependable approach for the simultaneous determination of isofenphos-methyl enantiomers in food and environmental samples. The stereoselective degradation of isofenphos-methyl in pak choi has shown that the (R)-(-)-isofenphos-methyl isomer (half-life t 1/2 = 2.2 days) degraded faster than the (S)-(+)-isomer (t 1/2 = 1.9 days). Graphical Abstract The enantioselective determination and enantioselective degradation of the chiral pesticide isofenphos-methyl. ",Analytical and bioanalytical chemistry,"['D001673', 'D001937', 'D002851', 'D005506', 'D005638', 'D057230', 'D009946', 'D010575', 'D012987', 'D012989', 'D052616', 'D013237', 'D014675']","['Biodegradation, Environmental', 'Brassica', 'Chromatography, High Pressure Liquid', 'Food Contamination', 'Fruit', 'Limit of Detection', 'Organothiophosphorus Compounds', 'Pesticides', 'Soil', 'Soil Pollutants', 'Solid Phase Extraction', 'Stereoisomerism', 'Vegetables']","Enantioselective determination of the chiral pesticide isofenphos-methyl in vegetables, fruits, and soil and its enantioselective degradation in pak choi using HPLC with UV detection.","[None, 'Q000378', 'Q000379', 'Q000032', 'Q000737', None, 'Q000032', 'Q000032', 'Q000737', 'Q000032', 'Q000379', None, 'Q000737']","[None, 'metabolism', 'methods', 'analysis', 'chemistry', None, 'analysis', 'analysis', 'chemistry', 'analysis', 'methods', None, 'chemistry']",https://www.ncbi.nlm.nih.gov/pubmed/27449646,2018
27382721,"A liquid chromatography-tandem mass spectrometry ( LC-MS/MS ) method was developed for the study of dynamic behavior of aldicarb and its metabolite residues in cabbage. Aldicarb was applied onto cultivated cabbages. The pesticides concentrations were measured periodically (between application and harvest) , and modeled to illustrate the dynamic behavior. The results showed that the liner ranges of aldicarb and its metabolites were from 0. 005 to 0. 2 mg/L, and the recoveries ranged from 78. 9% to 108. 5% with the relative standard deviations of 2. 03%- 8. 91% (n = 8). The aldicarb in cabbage increased at first with the first-order kinetic equation model of c = 0. 020(0.136t) with the correlation coefficient (r2) of 0. 888, and then decreased with the equation of c = 0. 65e(-059t) with the r2 of 0. 979 and the half-life of 29. 1 d. The reducing processes of aldicarb-sulfone and aldicarb-sulfoxide both matched the first-order kinetic equations (c = 23. 4e(-0.044t) and c = 4. 54e(-0.027t) with r2 of 0. 916 and 0. 972 respectively. To meet the limitation requirement of 0. 01 mg/kg, 70. 7, 226. 6 and 176. 3 d were respectively necessary for aldicarb, aldicarb-sulfone and aldicarb-sulfoxide. Final residues of aldicarb-sulfone and aldicarb-sulfoxide were still more than the limitation requirements, indicating that aldicarb should not be used in vegetables of growth cycle shorter than 120 d. This study provided theoretical basis for dynamic behavior of aldicarb residue and its safe use in vegetables.",Se pu = Chinese journal of chromatography,"['D000448', 'D001937', 'D002853', 'D005504', 'D007306', 'D010573', 'D053719']","['Aldicarb', 'Brassica', 'Chromatography, Liquid', 'Food Analysis', 'Insecticides', 'Pesticide Residues', 'Tandem Mass Spectrometry']",[Dynamic behavior of aldicarb and its metabolites in cabbage by liquid chromatography-tandem mass spectrometry].,"['Q000737', 'Q000378', None, None, 'Q000737', 'Q000032', None]","['chemistry', 'metabolism', None, None, 'chemistry', 'analysis', None]",https://www.ncbi.nlm.nih.gov/pubmed/27382721,2016
27229457,"To estimate the variability of pesticide residue levels present in cauliflower units, a total of 142 samples were collected from a field trial of a cooperative farmer, and 120 samples were collected from different market places in Thessaloniki, Greece. The collected samples were extracted using the quick, easy, cheap, effective, rugged, and safe (QuEChERS) extraction technique, and the residues were determined by liquid chromatography-tandem mass spectrometry. The developed method was validated by evaluating the accuracy, precision, linearity, limit of detection (LOD), and limit of quantification (LOQ). The average recoveries for all the analytes, derived from the data of control samples fortified at 0.01, 0.05, 0.1, and 0.2 mg/kg, ranged from 74 to 110% with a relative standard deviation of ≤8%. The correlation coefficient (R(2)) was ≥0.997 for all the analytes using matrix-matched calibration standards. The LOD values ranged from 0.001 to 0.003 mg/kg, and the LOQ was determined at 0.01 mg/kg for all the sought analytes. The matrix effect was found to be at a considerable level, especially for cypermethrin and deltamethrin, amounting to +90% and +145%, respectively. For the field samples, the unit-to-unit variability factors (VFs) calculated for cypermethrin and deltamethrin were 2.38 and 2.32, respectively, while the average VF for the market basket samples was 5.11. In the market basket samples, residues of cypermethrin, deltamethrin, chlorpyrifos, and indoxacarb were found at levels ≥LOQ and their respective VFs were 7.12, 5.67, 5.28, and 2.40. ","Journal of environmental science and health. Part. B, Pesticides, food contaminants, and agricultural wastes","['D001937', 'D002853', 'D000072480', 'D005506', 'D005522', 'D006115', 'D007306', 'D057230', 'D010573', 'D053719', 'D014675']","['Brassica', 'Chromatography, Liquid', 'Farms', 'Food Contamination', 'Food Services', 'Greece', 'Insecticides', 'Limit of Detection', 'Pesticide Residues', 'Tandem Mass Spectrometry', 'Vegetables']",Variability of pesticide residues in cauliflower units collected from a field trial and market places in Greece.,"['Q000737', 'Q000379', None, 'Q000032', None, None, 'Q000032', None, 'Q000032', 'Q000379', 'Q000737']","['chemistry', 'methods', None, 'analysis', None, None, 'analysis', None, 'analysis', 'methods', 'chemistry']",https://www.ncbi.nlm.nih.gov/pubmed/27229457,2017
27079470,"To examine the antiamnesic effects of broccoli (Brassica oleracea var. italica) leaves, we performed in vitro and in vivo tests on amyloid beta (Aβ)-induced neurotoxicity. The chloroform fraction from broccoli leaves (CBL) showed a remarkable neuronal cell-protective effect and an inhibition against acetylcholinesterase (AChE). The ameliorating effect of CBL on Aβ1-42-induced learning and memory impairment was evaluated by Y-maze, passive avoidance, and Morris water maze tests. The results indicated improving cognitive function in the CBL group. After the behavioral tests, antioxidant effects were detected by superoxide dismutase (SOD), oxidized glutathione (GSH)/total GSH, and malondialdehyde (MDA) assays, and inhibition against AChE was also presented in the brain. Finally, oxo-dihydroxy-octadecenoic acid (oxo-DHODE) and trihydroxy-octadecenoic acid (THODE) as main compounds were identified by quadrupole time-of-flight ultraperformance liquid chromatography (Q-TOF UPLC-MS) analysis. Therefore, our studies suggest that CBL could be used as a natural resource for ameliorating Aβ1-42-induced learning and memory impairment. ",Journal of agricultural and food chemistry,"['D016229', 'D000818', 'D001937', 'D002853', 'D007859', 'D008297', 'D013058', 'D008569', 'D051379', 'D008813', 'D016716', 'D010446', 'D010936', 'D018515', 'D051381']","['Amyloid beta-Peptides', 'Animals', 'Brassica', 'Chromatography, Liquid', 'Learning Disabilities', 'Male', 'Mass Spectrometry', 'Memory Disorders', 'Mice', 'Mice, Inbred ICR', 'PC12 Cells', 'Peptide Fragments', 'Plant Extracts', 'Plant Leaves', 'Rats']",Antiamnesic Effect of Broccoli (Brassica oleracea var. italica) Leaves on Amyloid Beta (Aβ)1-42-Induced Learning and Memory Impairment.,"['Q000009', None, 'Q000737', None, 'Q000209', None, None, 'Q000209', None, None, None, 'Q000009', 'Q000494', 'Q000737', None]","['adverse effects', None, 'chemistry', None, 'etiology', None, None, 'etiology', None, None, None, 'adverse effects', 'pharmacology', 'chemistry', None]",https://www.ncbi.nlm.nih.gov/pubmed/27079470,2017
26985692,"Bacteriocins are ribosomally synthesized peptides with antimicrobial activity produced by numerous bacteria. A novel bacteriocin-producing strain, Lactobacillus plantarum JLA-9, isolated from Suan-Tsai, a traditional Chinese fermented cabbage, was screened and identified by its physiobiochemical characteristics and 16S rDNA sequence analysis. A new bacteriocin, designated plantaricin JLA-9, was purified using butanol extraction, gel filtration, and reverse-phase high-performance liquid chromatography. The molecular mass of plantaricin JLA-9 was shown to be 1044 Da by MALDI-TOF-MS analyses. The amino acid sequence of plantaricin JLA-9 was predicted to be FWQKMSFA by MALDI-TOF-MS/MS, which was confirmed by Edman degradation. This bacteriocin exhibited broad-spectrum antibacterial activity against Gram-positive and Gram-negative bacteria, especially Bacillus spp., high thermal stability (20 min, 121 °C), and narrow pH stability (pH 2.0-7.0). It was sensitive to α-chymotrypsin, pepsin, alkaline protease, and papain. The mode of action of this bacteriocin responsible for outgrowth inhibition of Bacillus cereus spores was studied. Plantaricin JLA-9 had no detectable effects on germination initiation over 1 h on monitoring the hydration, heat resistance, and 2,6-pyridinedicarboxylic acid (DPA) release of spores. Rather, germination initiation is a prerequisite for the action of plantaricin JLA-9. Plantaricin JLA-9 inhibited growth by preventing the establishment of oxidative metabolism and disrupting membrane integrity in germinating spores within 2 h. The results suggest that plantaricin JLA-9 has potential applications in the control of Bacillus spp. in the food industry. ",Journal of agricultural and food chemistry,"['D000595', 'D000900', 'D001407', 'D001430', 'D001937', 'D056148', 'D002918', 'D005285', 'D006090', 'D006863', 'D007778', 'D048191', 'D008970', 'D010848', 'D011725', 'D019032']","['Amino Acid Sequence', 'Anti-Bacterial Agents', 'Bacillus', 'Bacteriocins', 'Brassica', 'Chromatography, Reverse-Phase', 'Chymotrypsin', 'Fermentation', 'Gram-Negative Bacteria', 'Hydrogen-Ion Concentration', 'Lactobacillus', 'Lactobacillus plantarum', 'Molecular Weight', 'Picolinic Acids', 'Pyridines', 'Spectrometry, Mass, Matrix-Assisted Laser Desorption-Ionization']","Purification and Characterization of Plantaricin JLA-9: A Novel Bacteriocin against Bacillus spp. Produced by Lactobacillus plantarum JLA-9 from Suan-Tsai, a Traditional Chinese Fermented Cabbage.","[None, 'Q000302', 'Q000187', 'Q000494', 'Q000737', None, 'Q000378', None, 'Q000187', None, 'Q000378', 'Q000737', None, None, 'Q000032', None]","[None, 'isolation & purification', 'drug effects', 'pharmacology', 'chemistry', None, 'metabolism', None, 'drug effects', None, 'metabolism', 'chemistry', None, None, 'analysis', None]",https://www.ncbi.nlm.nih.gov/pubmed/26985692,2016
26934111,"Rape and other Brassicaceae family plants can accumulate appreciable amounts of thallium from the soil. Because some species of this family are common crops utilised as food for direct consumption or raw materials for food production, thallium can enter the food chain. A useful method for thallium determination is inductively coupled plasma mass spectrometry. The limit of detection (0.2 pg ml(-1) Tl or 0.02 ng g(-1) Tl, taking in the account dilution during sample decomposition) found in the current study was very low, and the method can be used for ultra-trace analysis. Possible transfer of thallium from rape seed to the rape oil was investigated in two ways. The balance of thallium in rape seed meal (content 140-200 ng g(-1) Tl) and defatted rape seed meal indicated that thallium did not pass into the oil (p < 0.05). Moreover, the analyses of thallium in six kinds of edible rape seed oil and three kinds of margarines showed that the amount of thallium in rape seed oil is negligible.","Food additives & contaminants. Part A, Chemistry, analysis, control, exposure & risk assessment","['D029741', 'D006801', 'D057230', 'D013058', 'D012639', 'D013793']","['Brassica rapa', 'Humans', 'Limit of Detection', 'Mass Spectrometry', 'Seeds', 'Thallium']",Transfer of thallium from rape seed to rape oil is negligible and oil is fit for human consumption.,"['Q000737', None, None, 'Q000379', 'Q000737', 'Q000737']","['chemistry', None, None, 'methods', 'chemistry', 'chemistry']",https://www.ncbi.nlm.nih.gov/pubmed/26934111,2016
