PMID,abstract,journal,mesh_UIds,mesh_terms,paper,qual_UIds,qual_terms,webpage,year
23013011,"Pectin substances were extracted from food plants: sweet pepper Capsicum annuum L., carrot sowing Daucus sativus L., bulb onion Allium cepa L., white cabbage Brassica oleracea L. by two methods with acid solutions similar to gastric environment. The pectins that were extracted were characterized by Monosaccharide composition and quantitative contents of uronic acids, neutral monosaccharides, methoxy groups, protein. The inhibitory effect of all extracted pectin-protein complexes on activity of pharmaceutical drugs of human pancreatic alpha-amylase was detected. It was found that the inhibitory effect of isolated pectin substances was dependent upon the species of plant source, the manner of pectin substance extraction, the chemical composition and acting concentrations. The ability of pectin substances to suppress enzyme activity was found in a range of pectin concentrations from 0.5 up to 1.5 %. It was revealed that extracted pectin substances from bulb onion and white cabbage by acid solution with pepsin had a 2.4-3.4 times greater inhibiting effect on the human pancreatic alpha-amylase activity in comparison with pectin substances extracted by solution without pepsin from the same plant sources in high concentrations.",Rossiiskii fiziologicheskii zhurnal imeni I.M. Sechenova,"['D040761', 'D001937', 'D002212', 'D002851', 'D018552', 'D005750', 'D006801', 'D006851', 'D059627', 'D009005', 'D019697', 'D055292', 'D010368', 'D010434']","['Biomimetic Materials', 'Brassica', 'Capsicum', 'Chromatography, High Pressure Liquid', 'Daucus carota', 'Gastric Juice', 'Humans', 'Hydrochloric Acid', 'Liquid Phase Microextraction', 'Monosaccharides', 'Onions', 'Pancreatic alpha-Amylases', 'Pectins', 'Pepsin A']",[Effect of pectin substances on activity of human pancreatic alpha-amylase in vitro].,"['Q000737', 'Q000737', 'Q000737', None, 'Q000737', 'Q000737', None, 'Q000737', None, 'Q000032', 'Q000737', 'Q000037', 'Q000737', 'Q000378']","['chemistry', 'chemistry', 'chemistry', None, 'chemistry', 'chemistry', None, 'chemistry', None, 'analysis', 'chemistry', 'antagonists & inhibitors', 'chemistry', 'metabolism']",https://www.ncbi.nlm.nih.gov/pubmed/23013011,2012
22983767,"Folates (B vitamins) are essential for the proper function of many bodily processes. Although a rich natural source are vegetables, the literature lacks data on the effect of the pre-treatment and freezing technologies used in vegetable processing and frozen storage time on the folate content in these materials. Moreover, since folates are very unstable nutrients, the amount available in processed and stored foods can be significantly lower than in raw products. In tested vegetables (green beans, yellow beans, peas, cauliflower, broccoli and spinach), one folate form was identified, 5-methyltetrahydrofolate (5-CH₃-H₄folate). It was observed that pre-treatment and freezing technology significantly (p < 0.05) decreased 5-CH₃-H₄folate content only in vegetables with the largest degree of fragmentation (cut and briquetted spinach) and the smallest size (peas). In all analyzed samples, the 5-CH₃-H₄folate content decreased with the time of frozen storage. In frozen cauliflower, the 5-CH₃-H₄folate loss exceeded 95 % compared to the fresh product just after the third month of frozen storage. Meanwhile, in green and yellow beans, significant 5-CH₃-H₄folate losses (at the level of 75 % and 95 %, respectively) were observed no earlier than after the 9th month of frozen storage.","Plant foods for human nutrition (Dordrecht, Netherlands)","['D001937', 'D002851', 'D007887', 'D005492', 'D005511', 'D005519', 'D005615', 'D009753', 'D018532', 'D010936', 'D018724', 'D013763', 'D014675', 'D014803']","['Brassica', 'Chromatography, High Pressure Liquid', 'Fabaceae', 'Folic Acid', 'Food Handling', 'Food Preservation', 'Freezing', 'Nutritive Value', 'Peas', 'Plant Extracts', 'Spinacia oleracea', 'Tetrahydrofolates', 'Vegetables', 'Vitamin B Complex']",Effect of freezing technology and storage conditions on folate content in selected vegetables.,"['Q000737', None, 'Q000737', 'Q000032', 'Q000379', 'Q000379', None, None, 'Q000737', 'Q000032', 'Q000737', 'Q000032', 'Q000737', 'Q000032']","['chemistry', None, 'chemistry', 'analysis', 'methods', 'methods', None, None, 'chemistry', 'analysis', 'chemistry', 'analysis', 'chemistry', 'analysis']",https://www.ncbi.nlm.nih.gov/pubmed/22983767,2014
22983724,"Flubendiamide, which belongs to the new chemical class of phthalic acid diamides, is widely used against lepidopteron pests in a variety of vegetable and rice pests. It provides superior plant protection against a broad range of economically important lepidopterous pests, including Spodoptera exigua and Plutella xylostella. A determination method of flubendiamide in the cabbage was established in this paper. Flubendiamide in the cabbage was extracted with acetonitrile and ultrasonic extraction, and was purified by QuEChERS and analyzed by LC-MS/MS (liquid chromatography-tandem mass spectrometry). The results indicated that the average recovery of flubendiamide in the cabbage was 81.27%-91.45%, the coefficient of variation was 1.79%-4.81%, and the lowest detection concentration was 0.3 μg/kg. The extraction of flubendiamide from the cabbage and its analysis was in accordance with the pesticide residue criterion, i.e., simple, rapid, accurate, reproducible, stable, separatory, and convenient. It identifies and quantifies trace-level flubendiamide residues in the cabbage extracts using LC-MS/MS in the ESI negative mode coupled with the QuEChERS method.",Bulletin of environmental contamination and toxicology,"['D001549', 'D001937', 'D002853', 'D005506', 'D007306', 'D010573', 'D013450', 'D053719']","['Benzamides', 'Brassica', 'Chromatography, Liquid', 'Food Contamination', 'Insecticides', 'Pesticide Residues', 'Sulfones', 'Tandem Mass Spectrometry']",Determination of residual flubendiamide in the cabbage by QuEChERS-liquid chromatography-tandem mass spectrometry.,"['Q000032', 'Q000737', None, 'Q000032', 'Q000032', 'Q000032', 'Q000032', None]","['analysis', 'chemistry', None, 'analysis', 'analysis', 'analysis', 'analysis', None]",https://www.ncbi.nlm.nih.gov/pubmed/22983724,2013
22912893,"Plants release volatiles induced by herbivore feeding that may affect the diversity and composition of plant-associated arthropod communities. However, the specificity and role of plant volatiles induced during the early phase of attack, i.e. egg deposition by herbivorous insects, and their consequences on insects of different trophic levels remain poorly explored. In olfactometer and wind tunnel set-ups, we investigated behavioural responses of a specialist cabbage butterfly (Pieris brassicae) and two of its parasitic wasps (Trichogramma brassicae and Cotesia glomerata) to volatiles of a wild crucifer (Brassica nigra) induced by oviposition of the specialist butterfly and an additional generalist moth (Mamestra brassicae). Gravid butterflies were repelled by volatiles from plants induced by cabbage white butterfly eggs, probably as a means of avoiding competition, whereas both parasitic wasp species were attracted. In contrast, volatiles from plants induced by eggs of the generalist moth did neither repel nor attract any of the tested community members. Analysis of the plant's volatile metabolomic profile by gas chromatography-mass spectrometry and the structure of the plant-egg interface by scanning electron microscopy confirmed that the plant responds differently to egg deposition by the two lepidopteran species. Our findings imply that prior to actual feeding damage, egg deposition can induce specific plant responses that significantly influence various members of higher trophic levels.",PloS one,"['D000818', 'D001937', 'D002080', 'D020285', 'D017753', 'D005247', 'D005260', 'D020387', 'D008401', 'D060434', 'D006790', 'D008855', 'D009036', 'D010058', 'D010063', 'D018515', 'D055549', 'D014863']","['Animals', 'Brassica', 'Butterflies', 'Cryoelectron Microscopy', 'Ecosystem', 'Feeding Behavior', 'Female', 'Food Chain', 'Gas Chromatography-Mass Spectrometry', 'Herbivory', 'Host-Parasite Interactions', 'Microscopy, Electron, Scanning', 'Moths', 'Oviposition', 'Ovum', 'Plant Leaves', 'Volatile Organic Compounds', 'Wasps']",Plant volatiles induced by herbivore egg deposition affect insects of different trophic levels.,"[None, 'Q000737', 'Q000187', None, None, 'Q000187', None, None, None, 'Q000187', None, None, 'Q000187', 'Q000502', 'Q000737', 'Q000737', 'Q000032', 'Q000187']","[None, 'chemistry', 'drug effects', None, None, 'drug effects', None, None, None, 'drug effects', None, None, 'drug effects', 'physiology', 'chemistry', 'chemistry', 'analysis', 'drug effects']",https://www.ncbi.nlm.nih.gov/pubmed/22912893,2013
22886927,"The relationship between the ability to accumulate heavy metals (represented by Cd and Zn) and to synthesize bioactive compounds (represented by glucosinolates [GLS]) was investigated in two cabbage cultivars. Plants were grown in the greenhouse of a phytotron under controlled conditions in soils spiked with two different Zn or Cd concentrations. The measurements of Cd and Zn contents in soil and cabbage (leaf) samples were performed by atomic absorption spectroscopy, whereas GLS levels in cabbage were determined by high-performance liquid chromatography. The ranges of metal contents in soil were 80 to 450 mg/kg dry weight for Zn and 0.3 to 30 mg/kg dry weight for Cd, whereas the levels of accumulated Zn and Cd in cabbage amounted to 15 to 130 and 0.02 to 3 mg/kg dry weight, respectively. After initial symptoms of toxicity, during a later stage of growth, the plants exhibited very good tolerance to both metals. Enhanced biosynthesis of GLS was observed in a dose-dependent manner following exposure to the heavy metals. The GLS content in Zn-exposed cabbage rose from 3.2 to 12 µmol/g dry weight, and the corresponding values for Cd-treated plants were 3.5 to 10 µmol/g dry weight. Thus, the increased soil contamination by metals caused greater accumulation in cabbage, as well as stimulation of GLS biosynthesis. The results obtained point to the high phytoremediation and biofumigation potential of white cabbage.",Environmental toxicology and chemistry,"['D001673', 'D001937', 'D002104', 'D005961', 'D012987', 'D012989', 'D015032']","['Biodegradation, Environmental', 'Brassica', 'Cadmium', 'Glucosinolates', 'Soil', 'Soil Pollutants', 'Zinc']",The dose-dependent influence of zinc and cadmium contamination of soil on their uptake and glucosinolate content in white cabbage (Brassica oleracea var. capitata f. alba).,"[None, 'Q000254', 'Q000493', 'Q000032', 'Q000737', 'Q000493', 'Q000493']","[None, 'growth & development', 'pharmacokinetics', 'analysis', 'chemistry', 'pharmacokinetics', 'pharmacokinetics']",https://www.ncbi.nlm.nih.gov/pubmed/22886927,2013
22827073,"The leaf-level solar-induced fluorescence changes when the typical crops are under Cu stress, which can be considered as a sensitive indicator to estimate the stress level. In the present study, wheat (Triticum aestivum L.), pea (Pisum sativum L.) and Chinese cabbage (Brassica campestris L.) were selected and cultured with copper solutions or copper polluted soil with different Cu stress. The apparent reflectance of leaves was measured by an ASD Fieldspec spectrometer and an integrating sphere. As the apparent reflectance was seldom affected by the fluorescence emission at 580-650 and 800-1000 nm, so the apparent solar-induced fluorescence can be separated from the apparent reflectance based on PROSPECT model. The re-absorption effect of chlorophyll was corrected by three methods, called GM (Gitelson et al.'s model), AM (Agati et al.'s model) and LM (Lagorio et al.'s model). After the re-absorption correction, the solar-induced fluorescence under different Cu stress was obtained, and a positive relationship was found between the height of far RED fluorescence (FRF) and the copper contents in leaves.",Guang pu xue yu guang pu fen xi = Guang pu,"['D001937', 'D002734', 'D003300', 'D018556', 'D005453', 'D018532', 'D018515', 'D013050', 'D014908']","['Brassica', 'Chlorophyll', 'Copper', 'Crops, Agricultural', 'Fluorescence', 'Peas', 'Plant Leaves', 'Spectrometry, Fluorescence', 'Triticum']",[A novel method for extracting leaf-level solar-induced fluorescence of typical crops under Cu stress].,"[None, 'Q000032', 'Q000633', 'Q000737', None, None, None, None, None]","[None, 'analysis', 'toxicity', 'chemistry', None, None, None, None, None]",https://www.ncbi.nlm.nih.gov/pubmed/22827073,2015
22788360,"Up to 2 million tons per year of titanium dioxide (TiO₂) nanoparticles (NP) are produced worldwide. This extensive production is postulated to result in release into the environment with subsequent contamination of soils and plants; however, few studies have examined TiO₂-NP uptake and impact on plants. In this study, wheat and rapeseed plantlets were exposed to 14 nm or 25 nm anatase TiO₂-NP in hydroponics conditions, either through root or leaf exposure. Microparticle-induced x-ray emission (μPIXE) coupled with Rutherford backscattering spectroscopy (RBS) was used to quantify absorbed titanium (Ti). Micro x-ray fluorescence (μXRF) based on synchrotron radiation was used to evaluate Ti distribution in roots and leaves. Our results show that both TiO₂-NP are accumulated in these plantlets upon root exposure and that Ti content is higher in rapeseed than wheat. Ti distribution in root cross sections depended on NP agglomeration state. NP are also accumulated in plantlets upon leaf exposure. Finally, it was found that TiO₂-NP exposure induced increased root elongation but did not affect germination, evapotranspiration, and plant biomass. Taken together, these results confirm that TiO₂-NP may be accumulated in plant crops but may only moderately impact plant development.",Journal of toxicology and environmental health. Part A,"['D000042', 'D000393', 'D001692', 'D029741', 'D018556', 'D004785', 'D005602', 'D018527', 'D053768', 'D017348', 'D009994', 'D010316', 'D018515', 'D018517', 'D013045', 'D013052', 'D014025', 'D014908', 'D014874']","['Absorption', 'Air Pollutants', 'Biological Transport', 'Brassica rapa', 'Crops, Agricultural', 'Environmental Pollutants', 'France', 'Hydroponics', 'Metal Nanoparticles', 'Microscopy, Electron, Scanning Transmission', 'Osmolar Concentration', 'Particle Size', 'Plant Leaves', 'Plant Roots', 'Species Specificity', 'Spectrometry, X-Ray Emission', 'Titanium', 'Triticum', 'Water Pollutants, Chemical']",Comparative uptake and impact of TiO₂ nanoparticles in wheat and rapeseed.,"[None, 'Q000737', None, 'Q000187', 'Q000187', 'Q000737', None, None, 'Q000737', None, None, None, 'Q000187', 'Q000187', None, None, 'Q000737', 'Q000187', 'Q000737']","[None, 'chemistry', None, 'drug effects', 'drug effects', 'chemistry', None, None, 'chemistry', None, None, None, 'drug effects', 'drug effects', None, None, 'chemistry', 'drug effects', 'chemistry']",https://www.ncbi.nlm.nih.gov/pubmed/22788360,2012
22746294,"Roasting of high erucic mustard (HEM) seed has been reported to give a typical flavor and increase the oxidative stability of the extracted oil. A potent radical scavenging compound was successfully isolated from roasted HEM seed oil in a single-step chromatographic separation using an amino solid-phase extraction column. Nuclear magnetic resonance and mass spectrometry spectra revealed the compound as 2,6-dimethoxy-4-vinylphenol (generally known as canolol), and its identity was fully confirmed by chemical synthesis. The formation of canolol during roasting was compared among HEM varieties (Brassica juncea, B. juncea var. oriental, Brassica nigra, and Sinapis alba) together with a low erucic rapeseed variety. HEM varieties were shown to produce less than one-third of canolol compared to rapeseed at similar roasting conditions. This observation was linked to a lower free sinapic acid content together with a lower loss of sinapic acid derivatives in the HEM varieties compared to rapeseed. Around 50% of the canolol formed in the roasted seed was shown to be extracted in the oil. Roasting of HEM seed before oil extraction was found to be a beneficial step to obtain canolol-enriched oil, which could improve the oxidative stability.",Journal of agricultural and food chemistry,"['D029741', 'D002851', 'D002853', 'D005421', 'D005511', 'D016166', 'D009682', 'D013058', 'D009149', 'D009390', 'D010636', 'D010938', 'D012639', 'D017365', 'D014753']","['Brassica rapa', 'Chromatography, High Pressure Liquid', 'Chromatography, Liquid', 'Flavoring Agents', 'Food Handling', 'Free Radical Scavengers', 'Magnetic Resonance Spectroscopy', 'Mass Spectrometry', 'Mustard Plant', 'Nepal', 'Phenols', 'Plant Oils', 'Seeds', 'Spices', 'Vinyl Compounds']",Isolation and identification of a potent radical scavenger (canolol) from roasted high erucic mustard seed oil from Nepal and its formation during roasting.,"[None, None, None, 'Q000032', 'Q000379', 'Q000302', None, None, 'Q000737', None, 'Q000302', 'Q000737', 'Q000737', 'Q000032', 'Q000302']","[None, None, None, 'analysis', 'methods', 'isolation & purification', None, None, 'chemistry', None, 'isolation & purification', 'chemistry', 'chemistry', 'analysis', 'isolation & purification']",https://www.ncbi.nlm.nih.gov/pubmed/22746294,2014
22649941,"A sensitive and accurate method was developed for the determination of streptomycin using HPLC followed by postcolumn derivatization and fluorometric detection. The analyte was extracted, using aqueous solution from cucumber and Chinese cabbage, by a two-step SPE procedure. The extraction, cleanup, and chromatography conditions were optimized, and the performance of the analysis method was evaluated. The conditions of chromatography were as follows: the separation was performed on a C18 column; the isocratic mobile phase consisted of acetonitrile and a mixed solution containing 10 mM sodium 1,2-naphthoquinone-4-sulfonate and 0.4 mM sodium 1-heptanesulfonate (25+75, v/v); and the flow rate was 1 mL/min. The fluorescence detector was set at an excitation wavelength of 263 nm and an emission wavelength of 435 nm. The calibration curve was linear over the range of 50-2000 ng/mL, with a correlation coefficient of 0.9995. The LOD and LOQ were 10 and 30 ng/g, respectively, in both cucumber and Chinese cabbage. The method was validated for selectivity, linearity, precision, and accuracy. The intraday and interday precision and accuracy were within 10%. The mean recoveries from spiked samples were more than 75%, with RSD lower than 10%.",Journal of AOAC International,"['D000890', 'D001937', 'D018553', 'D005470', 'D005504', 'D015203', 'D012680', 'D013307']","['Anti-Infective Agents', 'Brassica', 'Cucumis sativus', 'Fluorometry', 'Food Analysis', 'Reproducibility of Results', 'Sensitivity and Specificity', 'Streptomycin']",Determination of streptomycin residue in cucumber and Chinese cabbage by high-performance liquid chromatography with postcolumn derivatization and fluorometric detection.,"['Q000737', 'Q000737', 'Q000737', 'Q000379', 'Q000379', None, None, 'Q000737']","['chemistry', 'chemistry', 'chemistry', 'methods', 'methods', None, None, 'chemistry']",https://www.ncbi.nlm.nih.gov/pubmed/22649941,2012
22575018,"This study investigated the fatty acid composition of lipid present in breast milk of mothers residing in urban and suburban regions of West Bengal with special emphasis on n-6 and n-3 polyunsaturated fatty acids, which played a crucial role in the growth and development of neonates. Milk samples collected from 135 mothers of middle income group (average monthly income around 'Rs 10,000/-') were analysed by gas liquid chromatography after extraction and transmethylation to determine fatty acid composition. Information about the dietary intake of individual mothers was obtained through food frequency questionnaire. The fractions of n-6 and n-3 polyunsaturated fatty acids available in milk of urban mothers were 13.59 ± 0.94 and 3.65 ± 0.49, respectively, and in suburban mothers 12.74 ± 0.89 and 4.36 ± 0.39, respectively. The green leafy vegetables, fishes and vegetable oils were the major sources of essential fatty acids in the diet of the experimental groups of Bengali mothers. This study revealed a relationship between the alimentary habits of mothers and the concentration of essential fatty acids in breast milk of Bengali mothers.",International journal of food sciences and nutrition,"['D000328', 'D000818', 'D002849', 'D004032', 'D005228', 'D005247', 'D005260', 'D005399', 'D006801', 'D007194', 'D007774', 'D008895', 'D009149', 'D018515', 'D010938', 'D017747', 'D018881', 'D011795', 'D014504', 'D014675', 'D055815']","['Adult', 'Animals', 'Chromatography, Gas', 'Diet', 'Fatty Acids, Essential', 'Feeding Behavior', 'Female', 'Fishes', 'Humans', 'India', 'Lactation', 'Milk, Human', 'Mustard Plant', 'Plant Leaves', 'Plant Oils', 'Seafood', 'Suburban Health', 'Surveys and Questionnaires', 'Urban Health', 'Vegetables', 'Young Adult']","Comparative evaluation of essential fatty acid composition of mothers' milk of some urban and suburban regions of West Bengal, India.","[None, None, None, 'Q000208', 'Q000032', 'Q000208', None, None, None, None, 'Q000378', 'Q000737', None, 'Q000737', 'Q000008', 'Q000032', 'Q000208', None, 'Q000208', 'Q000737', None]","[None, None, None, 'ethnology', 'analysis', 'ethnology', None, None, None, None, 'metabolism', 'chemistry', None, 'chemistry', 'administration & dosage', 'analysis', 'ethnology', None, 'ethnology', 'chemistry', None]",https://www.ncbi.nlm.nih.gov/pubmed/22575018,2013
22394096,"Antioxidant efficacy of 70% ethanol extract (EE), 70% methanol extract (ME), and water extract (WE) produced from pickled and dried mustard (Brassica juncea Coss. var. foliosa Bailey) was evaluated in rapeseed and peanut oils by using the Schaal oven method. The protective effects of aforesaid 3 extracts in stabilizing vegetable oils were tested by measuring their peroxide values, conjugated diene values, and p-anisidine values during storage of 15 d at 60 °C. Results showed that the different solvent extracts produced from pickled and dried mustard, at concentrations of 0.5% and 1.0% (w/w) in vegetable oils, could significantly (P < 0.05) lower the peroxide value, conjugated diene value, and p-anisidine value of oils during storage at 60 °C. However, the extracts at various concentrations showed a less antioxidant effect than butylated hydroxytoluene (BHT) at 200 ppm. The ultraviolet spectra of different extracts exhibited a single maximum absorbance at 268 nm. The qualitative analysis of antioxidants present in the extracts was carried out by reverse phase high performance liquid chromatography (HPLC) using a C18 column. Two phenolic compounds, gallic and protocatechuric acids, were identified. The antioxidant activity of the extracts might be attributed to the presence of these phenolics. These results indicated that the pickled and dried mustard could be used as a potential source of natural antioxidants.",Journal of food science,"['D000975', 'D002851', 'D000431', 'D005229', 'D061353', 'D057141', 'D005707', 'D006358', 'D062385', 'D000432', 'D009149', 'D000074241', 'D010545', 'D010936', 'D010938', 'D000074262', 'D012639', 'D012997', 'D014867']","['Antioxidants', 'Chromatography, High Pressure Liquid', 'Ethanol', 'Fatty Acids, Monounsaturated', 'Food Storage', 'Food, Preserved', 'Gallic Acid', 'Hot Temperature', 'Hydroxybenzoates', 'Methanol', 'Mustard Plant', 'Peanut Oil', 'Peroxides', 'Plant Extracts', 'Plant Oils', 'Rapeseed Oil', 'Seeds', 'Solvents', 'Water']",Antioxidant efficacy of extracts produced from pickled and dried mustard in rapeseed and peanut oils.,"['Q000737', None, 'Q000737', None, None, 'Q000032', 'Q000032', 'Q000009', 'Q000032', 'Q000737', 'Q000737', None, 'Q000032', 'Q000737', 'Q000737', None, 'Q000737', 'Q000737', 'Q000737']","['chemistry', None, 'chemistry', None, None, 'analysis', 'analysis', 'adverse effects', 'analysis', 'chemistry', 'chemistry', None, 'analysis', 'chemistry', 'chemistry', None, 'chemistry', 'chemistry', 'chemistry']",https://www.ncbi.nlm.nih.gov/pubmed/22394096,2012
