PMID,abstract,journal,mesh_UIds,mesh_terms,paper,qual_UIds,qual_terms,webpage,year
21030028,"A bicarbonate buffer-based extraction method for the simultaneous analysis of five nut allergens (Ana o 2, cashew-nut; Cor a 9, hazelnut; Pru 1, almond; Ara h3/4, peanut; Jug r 4, walnut) in cereals and biscuits using liquid chromatography-electrospray-linear ion trap-tandem mass spectrometry (LC-ESI-LIT-MS(2)) was developed and validated. The method was based on our earlier published LC-MS(2)-based method in a research frame aimed at the identification and determination of hidden allergens in foods by using selective biomarker peptides. A C18 particle-packed column and a silica-based C18 monolithic column were compared in terms of chromatographic performances, such as peak shape, resolution, analysis time and selectivity. The C18 particle-packed column exhibited better performances and was further used for method development and validation. By operating under MS(2) selected reaction monitoring (SRM) acquisition mode, linearity, limits of detection (LOD) and quantitation, trueness and precision were evaluated on breakfast samples enriched with a mix of the five nuts. Good linearity of the matrix matched-calibration curves was obtained and detection limit values generally varied from 14 to 55 mg nut/kg matrix. Recoveries were in the 76±4% to 94±3% range with RSD <15%. The capabilities of LIT to perform MS(n) fragmentation was exploited to improve selectivity of the analysis, and the LC-(SRM) MS(2) method was compared in terms of LOD, linearity, precision and accuracy with a LC-(SRM) MS(3) method. Finally, both the LC-MS(2) and LC-MS(3) methods were successfully applied to the analysis of nut traces in commercially available breakfast cereals and biscuits.",Journal of chromatography. A,"['D000485', 'D002853', 'D005504', 'D009754', 'D012822', 'D021241']","['Allergens', 'Chromatography, Liquid', 'Food Analysis', 'Nuts', 'Silicon Dioxide', 'Spectrometry, Mass, Electrospray Ionization']",Particle-packed column versus silica-based monolithic column for liquid chromatography-electrospray-linear ion trap-tandem mass spectrometry multiallergen trace analysis in foods.,"['Q000032', 'Q000295', None, 'Q000737', 'Q000737', 'Q000379']","['analysis', 'instrumentation', None, 'chemistry', 'chemistry', 'methods']",https://www.ncbi.nlm.nih.gov/pubmed/21030028,2011
20961547,"Anacardium occidentale belongs to the family Anacardiaceae and is principally grown in tropical America (Mexico, Peru, Brazil, etc.) and India. Cashew nuts contain low amounts of hydroxy alkyl phenols that come from an oily liquid present in their shell and that is known as cashew-nut shell liquid. This paper reports the alkyl phenols composition of cold pressed raw and roasted cashew nut oil. First of all, cashew nut shell liquid was used for a basic fractionation of the alkyl phenol classes by preparative TLC and definitively identified by GC-MS and GC-FID. Anacardic acids were the major alkylphenols contained in both oils followed by cardol, cardanol and 2-methylcardol compounds, respectively. Raw and roasted oils did not show different compositions except for cardanols. The oil produced from roasted cashew nut reported a higher concentration of cardanols. Furthermore, tocopherols and other minor polar compounds were determined by HPLC-FLD and HPLC-DAD-MS, respectively. Tocopherol content varied in a range of 171.48-29.56mg/100g from raw to roasted cashew nut oil, being β-tocopherol the one which presented a higher decrease (93.68%). Also minor polar compounds in cashew oil decreased after roasting from 346.52 to 262.83mg/kg.",Journal of chromatography. A,"['D031021', 'D002845', 'D005511', 'D009754', 'D010636', 'D010938', 'D024505']","['Anacardium', 'Chromatography', 'Food Handling', 'Nuts', 'Phenols', 'Plant Oils', 'Tocopherols']","Chromatographic techniques for the determination of alkyl-phenols, tocopherols and other minor polar compounds in raw and roasted cold pressed cashew nut oils.","['Q000737', 'Q000379', None, 'Q000737', 'Q000032', 'Q000032', 'Q000032']","['chemistry', 'methods', None, 'chemistry', 'analysis', 'analysis', 'analysis']",https://www.ncbi.nlm.nih.gov/pubmed/20961547,2011
19663479,"The thermal degradation kinetics of the main carotenoids of cashew apple in a juice model system was studied by HPLC and related to the changes of its CIELAB color parameters. Similar isomerization equilibrium constants and activation energies were observed for both all-trans-beta-carotene and all-trans-beta-cryptoxanthin. The curves for the decay of the main carotenoids and color changes showed a biphasic behavior that was best fitted by a biexponential equation. For the same heating conditions (60 or 90 degrees C), similar rate constants for the fast (gamma(1)) and slow (gamma(2)) decays were obtained for both the chemical (carotenoids) and physical (color) parameters monitored in the present research. This fact indicates that color parameters, such as DeltaE*, are good predictors of both all-trans-beta-cryptoxanthin and all-trans-beta-carotene thermal degradation. A mechanism for thermal carotenoid degradation was proposed, involving parallel irreversible and reversible coupled reactions of both the initial all-trans-beta-cryptoxanthin and all-trans-beta-carotene to yield, respectively, degradation compounds and mono-cis isomers.",Journal of agricultural and food chemistry,"['D031021', 'D001628', 'D002338', 'D002851', 'D003116', 'D005638', 'D006358', 'D007700', 'D027845', 'D012639', 'D013816']","['Anacardium', 'Beverages', 'Carotenoids', 'Chromatography, High Pressure Liquid', 'Color', 'Fruit', 'Hot Temperature', 'Kinetics', 'Malus', 'Seeds', 'Thermodynamics']",Thermal degradation kinetics of carotenoids in a cashew apple juice model and its impact on the system color.,"['Q000737', 'Q000032', 'Q000032', None, None, 'Q000737', None, None, 'Q000737', 'Q000737', None]","['chemistry', 'analysis', 'analysis', None, None, 'chemistry', None, None, 'chemistry', 'chemistry', None]",https://www.ncbi.nlm.nih.gov/pubmed/19663479,2009
18155749,"The levels of approximately 70 elements were determined in different culinary nuts (hazelnuts, walnuts, almonds, bitter almonds, pecans, cashews, Brazil nuts, pistachios, pine nuts, peanuts and coconuts) and seeds (pumpkin and sunflower) available on the Swedish market. The study was limited to raw, virtually unprocessed nuts and seeds (both shelled and unshelled) excluding mixed, roasted or salted products. In total, 44 products from different suppliers were analyzed, with the number of samples per nut/seed variety reflecting the availability of unprocessed products in retail outlets, varying from two for bitter almonds and pistachios to six for hazelnuts and walnuts. This selection includes samples from at least 11 different countries of origin. The optimized analytical procedure consists of microwave-assisted sample digestion using a HNO3/HF mixture, followed by multi-elemental analysis by double focusing, sector field inductively coupled plasma mass spectrometry. The analyses were accompanied by rigorous quality control measures including thorough control of potential sample contamination at all analytical stages, participation in inter-laboratory performance assessment schemes, and the analysis of certified reference materials of plant origin. Concentrations thus obtained were compared with data from product labels (where available), food composition tables and other relevant surveys, demonstrating, depending on the elements in question, close agreement as well as considerable differences.",The Science of the total environment,"['D004602', 'D004784', 'D004785', 'D005506', 'D013058', 'D009754', 'D012639', 'D013548']","['Elements', 'Environmental Monitoring', 'Environmental Pollutants', 'Food Contamination', 'Mass Spectrometry', 'Nuts', 'Seeds', 'Sweden']",Levels of inorganic constituents in raw nuts and seeds on the Swedish market.,"[None, None, 'Q000378', 'Q000032', 'Q000379', 'Q000378', 'Q000378', None]","[None, None, 'metabolism', 'analysis', 'methods', 'metabolism', 'metabolism', None]",https://www.ncbi.nlm.nih.gov/pubmed/18155749,2008
16095792,"In this study the content of anacardic acids, cardanols and cardols in cashew apple, nut (raw and roasted) and cashew nut shell liquid (CNSL) were analysed. The higher amounts (353.6 g/kg) of the major alkyl phenols, anacardic acids were detected in CNSL followed by cashew fibre 6.1 g/kg) while the lowest (0.65 g/kg) amounts were detected in roasted cashew nut. Cashew apple and fibre contained anacardic acids exclusively, whereas CNSL also contained an abundance of cardanols and cardols. Cashew nut (raw and roasted) also contained low amounts of hydroxy alkyl phenols. Cashew nut shell liquid was used for a basic fractionation of the alkyl phenol classes and the individual anacardic acids, major cardanols and cardols were purified to homogeneity from these fractions by semi-preparative HPLC and definitively identified by nano-ESI-MS-MS, GC-MS and NMR analyses. The hexane extracts (10 mg/ml) of all cashew products tested plus CNSL, displayed significant antioxidant capacity. Cashew nut shell liquid was the more efficient (inhibition=100%) followed by the hexane extract of cashew fibre (94%) and apple (53%). The antioxidant capacity correlated significantly (P<0.05) with the concentration of alkyl phenols in the extracts. A mixture of anacardic acids (10.0 mg/ml) showed the higher antioxidant capacity (IC50=0.60 mM) compared to cardols and cardanols (IC50>4.0 mM). The data shows that of these substances, anacardic-1 was by far the more potent antioxidant (IC50=0.27 mM) compared to cardol-1 (IC50=1.71 mM) and cardanol-1 (IC50>4.0 mM). The antioxidant capacity of anacardic acid-1 is more related to inhibition of superoxide generation (IC50=0.04 mM) and xanthine oxidase (IC50=0.30 mM) than to scavenging of hydroxyl radicals. At present a substantial amount of cashew fibre is mostly used in formulations of animal or poultry feeds. The data presented in this study, indicates that this waste product along with CNSL, both of which contain high contents of anacardic acids, could be better utilized in functional food formulations and may represent a cheap source of cancer chemopreventive agents.",Food and chemical toxicology : an international journal published for the British Industrial Biological Research Association,"['D048729', 'D031021', 'D000975', 'D002851', 'D003849', 'D004791', 'D008401', 'D007202', 'D009682', 'D010636', 'D012118', 'D021241', 'D013481', 'D014969']","['Anacardic Acids', 'Anacardium', 'Antioxidants', 'Chromatography, High Pressure Liquid', 'Deoxyguanosine', 'Enzyme Inhibitors', 'Gas Chromatography-Mass Spectrometry', 'Indicators and Reagents', 'Magnetic Resonance Spectroscopy', 'Phenols', 'Resorcinols', 'Spectrometry, Mass, Electrospray Ionization', 'Superoxides', 'Xanthine Oxidase']",Characterization of alkyl phenols in cashew (Anacardium occidentale) products and assay of their antioxidant capacity.,"['Q000737', 'Q000737', 'Q000737', None, 'Q000737', 'Q000737', None, None, None, 'Q000737', 'Q000737', None, 'Q000737', 'Q000037']","['chemistry', 'chemistry', 'chemistry', None, 'chemistry', 'chemistry', None, None, None, 'chemistry', 'chemistry', None, 'chemistry', 'antagonists & inhibitors']",https://www.ncbi.nlm.nih.gov/pubmed/16095792,2006
15030196,"In this work the quantitative determination and analytical speciation of arsenic were undertaken in different types of nuts, randomly purchased from local markets. The hardness of the whole nuts and high lipid content made the preparation of this material difficult for analysis. The lack of sample homogeneity caused irreproducible results. To improve the precision of analysis, arsenic was determined separately in nut oil and in the defatted sample. The lipids were extracted from the ground sample with the two portions of a mixture of chloroform and methanol (2:1). The defatted material was dried and ground again, yielding a fine powder. The nut oil was obtained by combining the two organic extracts and by evaporating the solvents. The two nut fractions were microwave digested, and total arsenic was determined by inductively coupled plasma mass spectrometry (ICP-MS). The results obtained for oils from different types of nuts showed element concentration in the range 2.9-16.9 ng g(-)(1). Lower levels of arsenic were found in defatted material (<0.1 ng g(-)(1) with the exception of Brazil nuts purchased with and without shells, 3.0 and 2.8 ng g(-)(1) respectively). For speciation analysis of arsenic in nut oils, elemental species were extracted from 2 g of oil with 12 mL of chloroform/methanol (2:1) and 8 mL of deionized water. The aqueous layer, containing polar arsenic species, was evaporated and the residue dissolved and analyzed by ion chromatography-ICP-MS. The anion exchange chromatography enabled separation of As(III), dimethylarsinic acid (DMAs(V)), monomethylarsonic acid (MMAs(V)), and As(V) within 8 min. Several types of nuts were analyzed, including walnuts, Brazil nuts, almonds, cashews, pine nuts, peanuts, pistachio nuts, and sunflower seeds. The recovery for the speciation procedure was in the range 72.7-90.6%. The primary species found in the oil extracts were As(III) and As(V). The arsenic concentration levels in these two species were 0.7-12.7 and 0.5-4.3 ng g(-)(1), respectively. The contribution of As in DMAs(V) ranged from 0.1 +/- 0.1 ng g(-)(1) in walnuts to 1.3 +/- 0.3 ng g(-)(1) in pine nuts. MMAs(V) was not detected in almonds, peanuts, pine nuts, sunflower seeds, or walnuts, and the highest concentration was found in pistachio nuts (0.5 +/- 0.2 ng g(-)(1)).",Journal of agricultural and food chemistry,"['D001151', 'D002851', 'D013058', 'D009754', 'D010936', 'D010938', 'D012680']","['Arsenic', 'Chromatography, High Pressure Liquid', 'Mass Spectrometry', 'Nuts', 'Plant Extracts', 'Plant Oils', 'Sensitivity and Specificity']",Speciation of arsenic in different types of nuts by ion chromatography-inductively coupled plasma mass spectrometry.,"['Q000032', 'Q000379', 'Q000379', 'Q000737', 'Q000737', 'Q000737', None]","['analysis', 'methods', 'methods', 'chemistry', 'chemistry', 'chemistry', None]",https://www.ncbi.nlm.nih.gov/pubmed/15030196,2004
14647095,"Assessment of vitamin K dietary intakes has been limited by incomplete vitamin K food composition data for the US food supply. The phylloquinone (vitamin K(1)) concentrations of nuts (n=76) and fruits (n=215) were determined by high-performance liquid chromatography. Each sample represented a composite of units obtained from 12 to 24 outlets, which provided geographic representation of the US food supply. With the exception of pine nuts and cashews, which contain 53.9 and 34.8 microg of phylloquinone per 100 g of nut, respectively, nuts are not important dietary sources of vitamin K. Similarly, most fruits are not important sources of vitamin K, with the exception of some berries, green fruits, and prunes. Menu planning for patients on warfarin can include a healthy diet including fruits and nuts without compromising the stability of their oral anticoagulation therapy.",Journal of the American Dietetic Association,"['D000933', 'D002851', 'D004032', 'D005504', 'D005638', 'D006801', 'D018673', 'D009754', 'D014481', 'D014812', 'D010837']","['Antifibrinolytic Agents', 'Chromatography, High Pressure Liquid', 'Diet', 'Food Analysis', 'Fruit', 'Humans', 'Nutrition Policy', 'Nuts', 'United States', 'Vitamin K', 'Vitamin K 1']",Vitamin K content of nuts and fruits in the US diet.,"['Q000008', 'Q000379', None, None, 'Q000737', None, None, 'Q000737', None, 'Q000008', 'Q000008']","['administration & dosage', 'methods', None, None, 'chemistry', None, None, 'chemistry', None, 'administration & dosage', 'administration & dosage']",https://www.ncbi.nlm.nih.gov/pubmed/14647095,2004
14534660,"The spectrophotometric probe, which uses bilirubin as a marker for the detection of duodenoesophagic reflux is subject to interference from strongly colored foods, which can cause erroneously high bilirubin absorbance readings. To overcome this problem it is necessary to ingest a diet that is free from such substances.",Arquivos de gastroenterologia,"['D000042', 'D001663', 'D003116', 'D004383', 'D005511', 'D005518', 'D005764', 'D006801', 'D013053']","['Absorption', 'Bilirubin', 'Color', 'Duodenogastric Reflux', 'Food Handling', 'Food Preferences', 'Gastroesophageal Reflux', 'Humans', 'Spectrophotometry']",[Recommended diet for reflux spectrophotometry].,"[None, 'Q000032', None, 'Q000175', None, None, 'Q000175', None, 'Q000379']","[None, 'analysis', None, 'diagnosis', None, None, 'diagnosis', None, 'methods']",https://www.ncbi.nlm.nih.gov/pubmed/14534660,2004
12172680,"In addition to determination of total selenium in nuts, the element distribution among different fractions (lipid extract, low molecular weight, and protein fractions), and speciation analysis were studied. Improved precision for total selenium determination was observed after elimination of lipids. Because selenium was not detected in any of the lipid extracts obtained from the different types of nuts (ICP-MS), in each determination and/or speciation procedure used in this work lipids were extracted (chloroform-methanol, 2:1) and discarded before analysis. In agreement with previously reported data, high selenium levels were found in Brazil nuts (those purchased without shells contained approximately a quarter the content than those purchased with shells) and significantly lower levels in walnuts, cashews, and pecans nuts. Low-molecular-weight compounds were extracted with perchloric acid (0.4 mol L(-1)) to furnish a fraction containing 3 to 15% of the total selenium in different types of nuts. The proteins were isolated from nut samples by dissolution in 0.1 mol L(-1) sodium hydroxide and subsequent precipitation with acetone. They were then dissolved in phosphate buffer pH 7.5. Analysis of protein fractions focused on selenium in two possible states - weakly and firmly bound to proteins. Results obtained for Brazil nuts by size-exclusion chromatography with on-line ICP-MS detection, in the absence and in the presence of beta-mercaptoethanol, showed that approximately 12% of total selenium was weakly bound to proteins. To obtain information about firmly bound selenium, the protein extracts were hydrolyzed enzymatically with proteinase K. Speciation was performed by means of ion-pairing HPLC-ICP-MS. The primary species found in all types of nuts was Se-methionine (19-25% of total selenium for different types of nuts).",Analytical and bioanalytical chemistry,"['D002851', 'D013058', 'D009754', 'D012643', 'D014131']","['Chromatography, High Pressure Liquid', 'Mass Spectrometry', 'Nuts', 'Selenium', 'Trace Elements']",HPLC-ICP-MS determination of selenium distribution and speciation in different types of nut.,"['Q000379', 'Q000379', 'Q000737', 'Q000032', 'Q000032']","['methods', 'methods', 'chemistry', 'analysis', 'analysis']",https://www.ncbi.nlm.nih.gov/pubmed/12172680,2002
10598070,"Kernel samples of common and dwarf Brazilian cashew nuts were highly contaminated with field and storage fungi in comparison to healthy ones. In general, dwarf cashews were more contaminated than common. A total of 37 fungal species were identified. Aspergillus niger was the dominant species with more colonies being isolated from dwarf kernels. A. flavus was the next most frequently isolated species. Penicillium brevicompactum, and P. glabrum were the most frequently isolated penicillia, with higher contamination recorded from dwarf kernels. Chaetomium globosum was recorded at a high level. Nine species were recorded from cashew kernels for the first time. Multimycotoxin analysis by tlc and hplc were positive for mycotoxins and other secondary metabolites particularly from the infected samples. Hplc was only carried out on dwarf cashews. Aflatoxins were not detected by quantitative high performance thin layer chromatography.",Mycopathologia,"['D000348', 'D001231', 'D001234', 'D001938', 'D002597', 'D002851', 'D002855', 'D005516', 'D009183', 'D009754', 'D010407']","['Aflatoxins', 'Aspergillus flavus', 'Aspergillus niger', 'Brazil', 'Chaetomium', 'Chromatography, High Pressure Liquid', 'Chromatography, Thin Layer', 'Food Microbiology', 'Mycotoxins', 'Nuts', 'Penicillium']",Mycoflora and mycotoxins of Brazilian cashew kernels.,"['Q000032', 'Q000302', 'Q000302', None, 'Q000302', None, None, None, 'Q000032', 'Q000382', 'Q000302']","['analysis', 'isolation & purification', 'isolation & purification', None, 'isolation & purification', None, None, None, 'analysis', 'microbiology', 'isolation & purification']",https://www.ncbi.nlm.nih.gov/pubmed/10598070,2000
9285912,"Native cashew (Semecarpus australiensis) is a well-known food source for aboriginal people of northeastern Queensland and the Northern Territory. It is also well known that contact with the seeds at a certain stage of growth can cause sever dermatitis in susceptible individuals. To prepare the fruits for eating, they are commonly treated by leaching for 2-7 days with water followed by heating in bark, and this treatment apparently produces an edible cashew nut. Recently, attempts have been made to use this valuable source of food by a commercial company. It was necessary to identify the active principle(s) in the seeds to determine the most effective way of rendering the seed suitable for human consumption without altering the flavour. By using solvent extraction and silica-gel chromatography, a fraction containing one major urushiol was obtained. Its structure was confirmed by comparison of its NMR and mass spectral (MS) data with that previously reported. This compound, which is found in high yield, is also found in poison ivy (Toxiodenron radicans) and is responsible for dermatitis in susceptible individuals. A method of removing the active principle from the seed has been suggested.",Natural toxins,"['D002396', 'D003877', 'D006801', 'D009754', 'D010945', 'D010947']","['Catechols', 'Dermatitis, Contact', 'Humans', 'Nuts', 'Plants, Edible', 'Plants, Toxic']",Isolation and characterisation of urushiol components from the Australian native cashew (Semecarpus australiensis).,"['Q000737', 'Q000209', None, 'Q000009', 'Q000737', None]","['chemistry', 'etiology', None, 'adverse effects', 'chemistry', None]",https://www.ncbi.nlm.nih.gov/pubmed/9285912,1997
8159218,"A wide range of moulds representing several genera and species, was recorded in this study from 5 seed samples of each almond, cashew nut, chestnut, hazelnut, pistachio nut and walnut collected from different markets in Ar' Ar, Saudi Arabia. The total counts of fungi were widely fluctuated between 1960-7704 and 1948-7434 colonies/g dry seeds on glucose-Czapek's and glycerol agar media at 28 degrees C, respectively, and represented twenty genera, 53 species and 2 varieties of fungi. The prevalent fungi on the 2 agar media were Aspergillus flavus, A. niger and Penicillium chrysogenum. On glucose-Czapek's agar, Rhizopus stolonifer and Aspergillus flavus var. columnaris were isolated from all 6 kinds of nut, A. parasiticus from 5 kinds and A. fumigatus from 4 kinds with high frequencies. Eurotium species were completely absent on glucose-Czapek's agar but they were isolated in high frequency from all kinds of nut on glycerol agar medium. The different nut samples were analyzed by thin layer chromatography for the presence of aflatoxins B1, B2, G1 & G2, citrinin, ochratoxins, patulin, sterigmatocystin, diacetoxyscirpenol, T-2 toxin and zearalenone. Aflatoxins B1 & G1 were detected in 3 out of the 5 samples tested of chestnut at concentrations ranging between 20 to 60 micrograms/kg. All other samples of almond, cashew nut, hazelnut, pistachio nut, and walnut that were analyzed were mycotoxin free.",Mycopathologia,"['D005516', 'D005658', 'D009183', 'D009754', 'D012529', 'D012639']","['Food Microbiology', 'Fungi', 'Mycotoxins', 'Nuts', 'Saudi Arabia', 'Seeds']",Fungal flora and mycotoxins of six kinds of nut seeds for human consumption in Saudi Arabia.,"[None, 'Q000254', 'Q000032', 'Q000382', None, 'Q000737']","[None, 'growth & development', 'analysis', 'microbiology', None, 'chemistry']",https://www.ncbi.nlm.nih.gov/pubmed/8159218,1994
3391961,"A spectrophotometric method reported for determination of phosphine (PH3) residues in wheat has been extended for determination of these residues in cashew kernels. Unlike the spectrum for wheat, the spectrum of PH3 residue-AgNO3 chromophore from cashew kernels does not show an absorption maximum at 400 nm; nevertheless, reading the absorbance at 400 nm afforded good recoveries of 90-98%. No interference occurred from crop materials, and crop controls showed low absorbance; the method can be applied for determinations as low as 0.01 ppm PH3 residue in cashew kernels.",Journal - Association of Official Analytical Chemists,"['D006863', 'D009754', 'D010573', 'D010720', 'D012835', 'D013053', 'D014908']","['Hydrogen-Ion Concentration', 'Nuts', 'Pesticide Residues', 'Phosphines', 'Silver Nitrate', 'Spectrophotometry', 'Triticum']",Spectrophotometric method for determination of phosphine residues in cashew kernels.,"[None, 'Q000032', 'Q000032', 'Q000032', None, None, 'Q000032']","[None, 'analysis', 'analysis', 'analysis', None, None, 'analysis']",https://www.ncbi.nlm.nih.gov/pubmed/3391961,1988
