PMID,abstract,journal,mesh_UIds,mesh_terms,paper,qual_UIds,qual_terms,webpage,year
18193749,"A new approach has been developed for the extraction and determination of aldehydes such as veratraldehyde, m-nitrobenzaldehyde, cinnamaldehyde, benzaldehyde, and p-chlorobenzaldehyde by using solid-phase microextraction (SPME) and high-performance liquid chromatography with UV detection (HPLC/UV). The method involves adsorption of the aldehydes on polydimethylsiloxane/divinylbenzene-coated fiber, followed by desorption in the desorption chamber of the SPME-HPLC interface, using acetonitrile-water (70 + 30) as the mobile phase; UV detection was at 254 nm. A good separation of 5 aldehydes was obtained on a C18 column. The detection limits of veratraldehyde, m-nitrobenzaldehyde, cinnamaldehyde, benzaldehyde, and p-chlorobenzaldehyde are 25, 41, 13, 12, and 11 pg/mL, respectively, which are about 100 times better than the detection limits for other SPME methods using gas chromatography. The proposed method was validated by determining benzaldehyde in bitter almonds and cinnamaldehyde in cinnamon bark. The recoveries of the 5 analytes were determined by analysis of spiked drinking water.",Journal of AOAC International,"['D000447', 'D002138', 'D002851', 'D002935', 'D007202', 'D024301', 'D027861', 'D012015', 'D012965', 'D013056', 'D014881']","['Aldehydes', 'Calibration', 'Chromatography, High Pressure Liquid', 'Cinnamomum zeylanicum', 'Indicators and Reagents', 'Plant Bark', 'Prunus', 'Reference Standards', 'Sodium Chloride', 'Spectrophotometry, Ultraviolet', 'Water Supply']",Determination of some aldehydes by using solid-phase microextraction and high-performance liquid chromatography with UV detection.,"['Q000032', None, None, 'Q000737', None, 'Q000737', 'Q000737', None, 'Q000032', None, 'Q000032']","['analysis', None, None, 'chemistry', None, 'chemistry', 'chemistry', None, 'analysis', None, 'analysis']",https://www.ncbi.nlm.nih.gov/pubmed/18193749,2008
17966976,"The volatile oil of the bark of Cinnamomum zeylanicum was extracted by means of supercritical CO2 fluid extraction in different conditions of pressure and temperature. Its chemical composition was characterized by GC-MS analysis. Nineteen compounds, which in the supercritical extract represented >95% of the oil, were identified. (E)-Cinnamaldehyde (77.1%), (E)-beta-caryophyllene (6.0%), alpha-terpineol (4.4%), and eugenol (3.0%) were found to be the major constituents. The SFE oil of cinnamon was screened for its biological activity about the formation of melanin in vitro. The extract showed antityrosinase activity and was able to reduce the formation of insoluble flakes of melanin from tyrosine. The oil also delayed the browning effect in apple homogenate. (E)-Cinnamaldehyde and eugenol were found to be mainly responsible of this inhibition effect.",Journal of agricultural and food chemistry,"['D025924', 'D002935', 'D008401', 'D014442', 'D010455', 'D010936', 'D011312', 'D013696', 'D014835']","['Chromatography, Supercritical Fluid', 'Cinnamomum zeylanicum', 'Gas Chromatography-Mass Spectrometry', 'Monophenol Monooxygenase', 'Peptides', 'Plant Extracts', 'Pressure', 'Temperature', 'Volatilization']",Supercritical CO2 extract of Cinnamomum zeylanicum: chemical characterization and antityrosinase activity.,"['Q000379', 'Q000737', None, 'Q000378', 'Q000032', 'Q000032', None, None, None]","['methods', 'chemistry', None, 'metabolism', 'analysis', 'analysis', None, None, None]",https://www.ncbi.nlm.nih.gov/pubmed/17966976,2008
17880148,"The antimicrobial activity in the vapor-phase of laboratory-made flexible films of polypropylene (PP) and polyethylene/ethylene vinyl alcohol copolymer (PE/EVOH) incorporating essential oil of cinnamon ( Cinnamomum zeylanicum), oregano ( Origanum vulgare), clove ( Syzygium aromaticum), or cinnamon fortified with cinnamaldehyde was evaluated against a wide range of microorganisms: the Gram-negative bacteria Escherichia coli, Yersinia enterocolitica, Pseudomonas aeruginosa, and Salmonella choleraesuis; the Gram-positive bacteria Listeria monocytogenes, Staphylococcus aureus, Bacillus cereus, and Enterococcus faecalis; the molds Penicillium islandicum, Penicillium roqueforti, Penicillium nalgiovense, Eurotium repens, and A spergillus flavus and the yeasts Candida albicans, Debaryomyces hansenii, and Zigosaccharomyces rouxii. Films with a nominal concentration of 4% (w/w) of fortified cinnamon or oregano essential oil completely inhibited the growth of the fungi; higher concentrations were required to inhibit the Gram-positive bacteria (8 and 10%, respectively), and higher concentrations still were necessary to inhibit the Gram-negative bacteria. PP films were more effective than PE/EVOH films. The atmospheres generated by the antimicrobial films inside Petri dishes were quantitatively analyzed using headspace-single drop microextraction (HS-SDME) in combination with gas chromatography-mass spectrometry (GC-MS). The analyses showed that the oregano-fortified PP films released higher levels of carvacrol and thymol, and the cinnamon-fortified PP films released higher levels of cinnamaldehyde, during the first 3-6 h of incubation, than the corresponding PE/EVOH films. Shelf-life tests were also performed, demonstrating that the antifungal activities of the films persisted for more than two months after their manufacture. In addition, migration tests (overall and specific) were performed, using both aqueous and fatty simulants, to ensure that the films meet EU regulations regarding food contact materials. Following contact with the tested films, the substances that had migrated into the aqueous simulants were recovered by direct immersion-single drop extraction (DI-SDME) and then analyzed by GC-MS. The fatty stimulant (isooctane) was directly injected into the chromatographic system.",Journal of agricultural and food chemistry,"['D000890', 'D002935', 'D045783', 'D018857', 'D009822', 'D031341', 'D010938', 'D010969']","['Anti-Infective Agents', 'Cinnamomum zeylanicum', 'Clove Oil', 'Food Packaging', 'Oils, Volatile', 'Origanum', 'Plant Oils', 'Plastics']",Development of flexible antimicrobial films using essential oils as active agents.,"['Q000008', 'Q000737', 'Q000737', 'Q000295', 'Q000008', 'Q000737', 'Q000008', None]","['administration & dosage', 'chemistry', 'chemistry', 'instrumentation', 'administration & dosage', 'chemistry', 'administration & dosage', None]",https://www.ncbi.nlm.nih.gov/pubmed/17880148,2007
17853382,"An HPTLC densitometric method for the simultaneous determination of cinnamaldehyde and eugenol as well as trace amounts of piperine in pepper-contaminated cinnamon was developed. The applicability of the method was tested with cinnamon bark powder adulterated with pepper powder, cinnamon oil, clove powder, clove oil and a commercial preparation containing cinnamaldehyde and eugenol. The method was validated for specificity, precision, accuracy and robustness. The method was found to be precise for different concentrations of cinnamaldehyde, eugenol and piperine. The accuracy of the method was checked by conducting a recovery study at three different levels. The linearity was found to be in the ranges 52.54-735.56, 533.2-8531.2 and 50-300 ng/spot, respectively, with correlation coefficients of 0.9985 +/- 0.04, 0.9982 +/- 0.06 and 0.9937 +/- 0.11 for cinnamaldehyde, eugenol and piperine.",Phytochemical analysis : PCA,"['D000171', 'D000470', 'D052117', 'D002212', 'D002855', 'D002935', 'D003720', 'D005054', 'D010880', 'D024301', 'D010938', 'D053284', 'D015203', 'D012680', 'D027842']","['Acrolein', 'Alkaloids', 'Benzodioxoles', 'Capsicum', 'Chromatography, Thin Layer', 'Cinnamomum zeylanicum', 'Densitometry', 'Eugenol', 'Piperidines', 'Plant Bark', 'Plant Oils', 'Polyunsaturated Alkamides', 'Reproducibility of Results', 'Sensitivity and Specificity', 'Syzygium']","Simultaneous determination of cinnamaldehyde, eugenol and piperine by HPTLC densitometric method.","['Q000031', 'Q000032', 'Q000032', None, 'Q000379', None, 'Q000379', 'Q000032', 'Q000032', 'Q000737', None, 'Q000032', None, None, None]","['analogs & derivatives', 'analysis', 'analysis', None, 'methods', None, 'methods', 'analysis', 'analysis', 'chemistry', None, 'analysis', None, None, None]",https://www.ncbi.nlm.nih.gov/pubmed/17853382,2008
17659763,"The objective of this study was to determine the antimicrobial activity of essential oils (EOs) extracted from Cinnamomum osmophloeum leaves and different tissues of Cryptomeria japonica against pathogenic Legionella pneumophila at 42 degrees C. Ten kinds of EOs were extracted by water distillation and their chemical constituents were quantified by gas chromatography-mass spectroscopy (GC-MS). The results showed that cinnamon leaf EO possessed stronger anti-L. pneumophila activity than C. japonica EO. In particular, the highest bactericidal effect was noted in contact with C. osmophloeum leaf EO of cinnamaldehyde type (characterized by its major constituent of cinnamaldehyde accounting for 91.3% of EO), regardless of contacted cell concentration (2 and 4 log CFU ml(-1)) or exposure time (10 and 60 min). Cinnamaldehyde is responsible for anti-L. pneumophila activity based on the results of antimicrobial testing and statistical analysis. Stepwise regression analyses show that EO concentration is the most significant factor affecting the bioactivity of EO. It is concluded that C. osmophloeum leaf oil of cinnamaldehyde type and its major constituent, cinnamaldehyde, possess strong anti-L. pneumophila activities, and have the great potential to be used as an antibacterial agent to control legionellosis associated with hot tubs and spa facilities widely used in homes and resorts.",Water research,"['D000171', 'D000900', 'D027424', 'D015169', 'D032485', 'D006358', 'D016952', 'D007876', 'D009822', 'D024301', 'D018515', 'D010938', 'D018547', 'D014934']","['Acrolein', 'Anti-Bacterial Agents', 'Cinnamomum', 'Colony Count, Microbial', 'Cryptomeria', 'Hot Temperature', 'Legionella pneumophila', 'Legionellosis', 'Oils, Volatile', 'Plant Bark', 'Plant Leaves', 'Plant Oils', 'Plant Stems', 'Wood']",Antibacterial activities of plant essential oils against Legionella pneumophila.,"['Q000031', 'Q000494', 'Q000737', None, 'Q000737', None, 'Q000187', 'Q000517', 'Q000494', 'Q000737', 'Q000737', 'Q000494', 'Q000737', None]","['analogs & derivatives', 'pharmacology', 'chemistry', None, 'chemistry', None, 'drug effects', 'prevention & control', 'pharmacology', 'chemistry', 'chemistry', 'pharmacology', 'chemistry', None]",https://www.ncbi.nlm.nih.gov/pubmed/17659763,2008
17567030,"Cinnamomum burmannii Blume (cinnamon stick) from Indonesia is a little-investigated spice. In this study, the antibacterial activity, minimum inhibitory concentration (MIC), and minimum bactericidal concentration (MBC) of cinnamon stick extract were evaluated against five common foodborne pathogenic bacteria (Bacillus cereus, Listeria monocytogenes, Staphylococcus aureus, Escherichia coli, and Salmonella anatum). Cinnamon stick extract exhibited significant antibacterial properties. Major compounds in cinnamon stick were tentatively identified by gas chromatography-mass spectrometry (GC-MS) and liquid chromatography (LC-MS) as a predominant volatile oil component ((E)-cinnamaldehyde) and several polyphenols (mainly proanthocyanidins and (epi)catechins). Both (E)-cinnamaldehyde and proanthocyanidins significantly contributed to the antibacterial properties. Additionally, scanning electron microscopy was used to observe morphological changes of bacteria treated with the crude extract of cinnamon stick and its major components. This study suggests that cinnamon stick and its bioactive components have potential for application as natural food preservatives.",Journal of agricultural and food chemistry,"['D000900', 'D001409', 'D002935', 'D004926', 'D005516', 'D008089', 'D024301', 'D010936', 'D044945', 'D012475', 'D013211']","['Anti-Bacterial Agents', 'Bacillus cereus', 'Cinnamomum zeylanicum', 'Escherichia coli', 'Food Microbiology', 'Listeria monocytogenes', 'Plant Bark', 'Plant Extracts', 'Proanthocyanidins', 'Salmonella', 'Staphylococcus aureus']",Antibacterial properties and major bioactive components of cinnamon stick (Cinnamomum burmannii): activity against foodborne pathogenic bacteria.,"['Q000494', 'Q000187', 'Q000737', 'Q000187', None, 'Q000187', 'Q000737', 'Q000494', 'Q000494', 'Q000187', 'Q000187']","['pharmacology', 'drug effects', 'chemistry', 'drug effects', None, 'drug effects', 'chemistry', 'pharmacology', 'pharmacology', 'drug effects', 'drug effects']",https://www.ncbi.nlm.nih.gov/pubmed/17567030,2007
17551716,"The aim of this work is the optimization and application of a group of analytical and microbiological techniques in the study of the activity of essential oils (EOs) incorporated in a new antimicrobial packaging material and the research in depth of the interaction between the microbial cells and the individual compounds present in the active material. For this purpose the antimicrobial activity of the active packaging containing cinnamon or oregano was evaluated against E. coli and S. aureus. The vapour phase activity and the direct contact between the antimicrobial agents themselves, or once incorporated in the packaging material, and the microbial cells have been studied. The direct contact was studied using a broth dilution method. The vapour phase was evaluated by using a new method which involves the use of a filter disk containing the EOs. Furthermore, the kill time assay was used to determine the exposure time for the maximum efficiency in packaging, and transmission electron microscopy was used to investigate the antimicrobial activity and the possible mechanism of action against E. coli and S. aureus. Finally, the compounds absorbed by cells were identified. The results showed that the techniques used provide relevant information about the antibacterial activity of cinnamon and oregano in direct contact as well as in the vapour phase. The antimicrobial packaging showed a fast efficiency which supports its likely application as a food packaging material. Bacteria treated with EOs exhibit a wide range of significant abnormalities; these include formation of blebs, coagulation of cytoplasmatic constituents, collapse of the cell structure and lack of cytoplasmatic material. Some of these observations are correlated to the ability of some of these substances to disrupt envelop structure, especially the inner membrane. After an extraction from dead cells, cinnamaldehyde was detected by GC-MS in E. coli exposed to the active packaging containing cinnamon.",Analytical and bioanalytical chemistry,"['D000890', 'D002623', 'D002935', 'D004926', 'D005516', 'D005519', 'D005524', 'D008401', 'D008828', 'D046529', 'D008956', 'D009822', 'D031341', 'D013211', 'D013997']","['Anti-Infective Agents', 'Chemistry Techniques, Analytical', 'Cinnamomum zeylanicum', 'Escherichia coli', 'Food Microbiology', 'Food Preservation', 'Food Technology', 'Gas Chromatography-Mass Spectrometry', 'Microbiological Techniques', 'Microscopy, Electron, Transmission', 'Models, Chemical', 'Oils, Volatile', 'Origanum', 'Staphylococcus aureus', 'Time Factors']",Combination of analytical and microbiological techniques to study the antimicrobial activity of a new active food packaging containing cinnamon or oregano against E. coli and S. aureus.,"['Q000494', 'Q000379', 'Q000737', 'Q000378', None, 'Q000379', None, None, None, None, None, 'Q000737', 'Q000737', 'Q000378', None]","['pharmacology', 'methods', 'chemistry', 'metabolism', None, 'methods', None, None, None, None, None, 'chemistry', 'chemistry', 'metabolism', None]",https://www.ncbi.nlm.nih.gov/pubmed/17551716,2007
17488023,"The aim of the study presented here was to gain knowledge about the vapor-phase antimicrobial activity of selected essential oils and their major putatively active constituents against a range of foodborne bacterial and fungal strains. In a first step, the vapor-phase antimicrobial activities of three commercially available essential oils (EOs)-cinnamon (Cinnamomum zeylanicum), thyme (Thymus vulgaris), and oregano (Origanum vulgare)-were evaluated against a wide range of microorganisms, including Gram-negative bacteria (Escherichia coli, Yersinia enterocolitica, Pseudomonas aeruginosa, and Salmonella choleraesuis), Gram-positive bacteria (Listeria monocytogenes, Staphylococcus aureus, Bacillus cereus, and Enterococcus faecalis), molds (Penicillium islandicum and Aspergillus flavus), and a yeast (Candida albicans). The minimum inhibitory concentrations (MICs) were generally lower for oregano EO than for the thyme and cinnamon EOs, especially against the relatively resistant Gram-negative. The persistence of the EOs' antimicrobial activities over time was assessed, and changes in the composition of the atmosphere they generated over time were determined using single-drop microextraction (SDME) in combination with gas chromatography-mass spectrometry (GC-MS) and subsequent analysis of the data by principal component analysis (PCA). More relevant chemicals were selected. In addition, the vapor-phase activities of putatively key constituents of the oils were screened against representative Gram-positive (L. monocytogenes) and Gram-negative (S. choleraesuis) bacteria, a mold (A. flavus), and a yeast (C. albicans). Of the tested compounds, cinnamaldehyde, thymol, and carvacrol showed the strongest antimicrobial effectiveness, so their MICs, defined as the minimum vapor concentrations that completely inhibited detectable growth of the microorganisms, were calculated. To check for possible interactions between components present in the EOs, cinnamon EO was fortified with cinnamaldehyde and thyme EO with thymol, and then the antimicrobial activities of the fortified oils were compared to those of the respective unfortified EOs using fractional inhibitory concentration (FIC) indices and by plotting inhibition curves as functions of the vapor-phase concentrations. Synergistic effects were detected for cinnamaldehyde on A. flavus and for thymol on L. monocytogenes, S. choleraesuis, and A. flavus. In all other cases the fortification had additive effects, except for cinnamaldehyde's activity against S. choleraesuis, for which the effect was antagonistic. Finally, various microorganisms were found to cause slight changes over time to the atmospheres generated by all of the EOs (fortified and unfortified) except the fortified cinnamon EO.",Journal of agricultural and food chemistry,"['D000171', 'D000081007', 'D005516', 'D005658', 'D008401', 'D006090', 'D006094', 'D008826', 'D039821', 'D009822', 'D025341', 'D013943']","['Acrolein', 'Cymenes', 'Food Microbiology', 'Fungi', 'Gas Chromatography-Mass Spectrometry', 'Gram-Negative Bacteria', 'Gram-Positive Bacteria', 'Microbial Sensitivity Tests', 'Monoterpenes', 'Oils, Volatile', 'Principal Component Analysis', 'Thymol']","Vapor-phase activities of cinnamon, thyme, and oregano essential oils and key constituents against foodborne microorganisms.","['Q000031', None, None, 'Q000187', None, 'Q000187', 'Q000187', None, 'Q000494', 'Q000494', None, 'Q000494']","['analogs & derivatives', None, None, 'drug effects', None, 'drug effects', 'drug effects', None, 'pharmacology', 'pharmacology', None, 'pharmacology']",https://www.ncbi.nlm.nih.gov/pubmed/17488023,2007
17408833,"The antioxidant, antifungal and antibacterial potentials of volatile oils and oleoresin of Cinnamomum zeylanicum Blume (leaf and bark) were investigated in the present study. The oleoresins have shown excellent activity for the inhibition of primary and secondary oxidation products in mustard oil added at the concentration of 0.02% which were evaluated using peroxide, thiobarbituric acid, p-anisidine and carbonyl values. Moreover, it was further supported by other complementary antioxidant assays such as ferric thiocyanate method in linoleic acid system, reducing power, chelating and scavenging effects on 1,1'-diphenyl-2-picrylhydrazyl (DPPH) and hydroxyl radicals. In antimicrobial investigations, using inverted petriplate and food poison techniques, the leaf and bark volatile oils has been found to be highly effective against all the tested fungi except Aspergillus ochraceus. However, leaf oleoresin has shown inhibition only for Penicillium citrinum whereas bark oleoresin has caused complete mycelial zone inhibition for Aspergillus flavus and A. ochraceus along with Aspergillus niger, Aspergillus terreus, P. citrinum and Penicillium viridicatum at 6 microL. Using agar well diffusion method, leaf volatile oil and oleoresin have shown better results in comparison with bark volatile oil, oleoresin and commercial bactericide, i.e., ampicillin. Gas chromatographic-mass spectroscopy studies on leaf volatile oil and oleoresin resulted in the identification of 19 and 25 components, which accounts for the 99.4% and 97.1%, respectively of the total amount and the major component was eugenol with 87.3% and 87.2%, respectively. The analysis of cinnamon bark volatile oil showed the presence of 13 components accounting for 100% of the total amount. (E)-cinnamaldehyde was found as the major component along with delta-cadinene (0.9%), whereas its bark oleoresin showed the presence of 17 components accounting for 92.3% of the total amount. The major components were (E)-cinnamaldehyde (49.9%), along with several other components.",Food and chemical toxicology : an international journal published for the British Industrial Biological Research Association,"['D000900', 'D000935', 'D000975', 'D001230', 'D001419', 'D004305', 'D005054', 'D005519', 'D005520', 'D008401', 'D008826', 'D009822', 'D010407', 'D010936', 'D013045', 'D013997']","['Anti-Bacterial Agents', 'Antifungal Agents', 'Antioxidants', 'Aspergillus', 'Bacteria', 'Dose-Response Relationship, Drug', 'Eugenol', 'Food Preservation', 'Food Preservatives', 'Gas Chromatography-Mass Spectrometry', 'Microbial Sensitivity Tests', 'Oils, Volatile', 'Penicillium', 'Plant Extracts', 'Species Specificity', 'Time Factors']","A comparison of chemical, antioxidant and antimicrobial studies of cinnamon leaf and bark volatile oils, oleoresins and their constituents.","['Q000494', 'Q000494', 'Q000494', 'Q000187', 'Q000187', None, None, 'Q000379', 'Q000494', 'Q000379', None, 'Q000032', 'Q000187', 'Q000032', None, None]","['pharmacology', 'pharmacology', 'pharmacology', 'drug effects', 'drug effects', None, None, 'methods', 'pharmacology', 'methods', None, 'analysis', 'drug effects', 'analysis', None, None]",https://www.ncbi.nlm.nih.gov/pubmed/17408833,2007
16710900,"Both Cinnamomum verum J.S. Presl. and Cinnamomum cassia Blume are collectively called Cortex Cinnamonmi for their medicinal cinnamon bark. Cinnamomum verum is more popular elsewhere in the world, whereas C. cassia is a well known traditional Chinese medicine. An analysis of hydro-distilled Chinese cinnamon oil and pure cinnamaldehyde by gas chromatography/mass spectrometry revealed that cinnamaldehyde is the major component comprising 85% in the essential oil and the purity of cinnamaldehyde in use is high (> 98%). Both oil and pure cinnamaldehyde of C. cassia were equally effective in inhibiting the growth of various isolates of bacteria including Gram-positive (1 isolate, Staphylococcus aureus), and Gram-negative (7 isolates, E. coli, Enterobacter aerogenes, Proteus vulgaris, Pseudomonas aeruginosa, Vibrio cholerae, Vibrio parahaemolyticus and Samonella typhymurium), and fungi including yeasts (four species of Candida, C. albicans, C. tropicalis, C. glabrata, and C. krusei), filamentous molds (4 isolates, three Aspergillus spp. and one Fusarium sp.) and dermatophytes (three isolates, Microsporum gypseum, Trichophyton rubrum and T. mentagraphytes). Their minimum inhibition concentrations (MIC) as determined by agar dilution method varied only slightly. The MICs of both oil and cinnamaldehyde for bacteria ranged from 75 microg/ml to 600 microg/ml, for yeasts from 100 microg/ml to 450 microg/ml, for filamentous fungi from 75 microg/ml to 150 microg/ml, and for dermatophytes from 18.8 microg/ml to 37.5 microg/ml. The antimicrobial effectiveness of C. cassia oil and its major constituent is comparable and almost equivalent, which suggests that the broad-spectrum antibiotic activities of C. cassia oil are due to cinnamaldehyde. The relationship between structure and function of the main components of cinnamon oil is also discussed.",The American journal of Chinese medicine,"['D000171', 'D000890', 'D001419', 'D032904', 'D005658', 'D008401', 'D008826', 'D010938', 'D013045', 'D013329']","['Acrolein', 'Anti-Infective Agents', 'Bacteria', 'Cinnamomum aromaticum', 'Fungi', 'Gas Chromatography-Mass Spectrometry', 'Microbial Sensitivity Tests', 'Plant Oils', 'Species Specificity', 'Structure-Activity Relationship']",Antimicrobial activities of cinnamon oil and cinnamaldehyde from the Chinese medicinal herb Cinnamomum cassia Blume.,"['Q000031', 'Q000494', 'Q000187', 'Q000737', 'Q000187', None, None, 'Q000737', None, None]","['analogs & derivatives', 'pharmacology', 'drug effects', 'chemistry', 'drug effects', None, None, 'chemistry', None, None]",https://www.ncbi.nlm.nih.gov/pubmed/16710900,2006
