PMID,abstract,journal,mesh_UIds,mesh_terms,paper,qual_UIds,qual_terms,webpage,year
28899452,"Semolina pasta represents one of the most important dishes in Italian cuisine worldwide. Italy is the leader in its production and, recently, the worldwide diffusion of its production has begun to grow tremendously. The perceived quality of a food product, such as pasta, is a key feature that allows a company to increase and maintain the competitive advantage of a specific brand. The overall flavor perception of the consumer, therefore, has become as important as other key quality factors such as texture and color; thus, the food industry needs to meet consumer expectations and needs the tools to objectively ""measure"" the quality of food products. Untargeted fingerprinting by means of coupling LC with high-resolution MS (HRMS) has been well received within the analytical community, and different studies exploiting this approach for the characterization of high-value food products have recently been reported in the literature. In the present work, a tentative application of the sensomics approach to cluster analysis of semolina pasta obtained using different production conditions was developed to objectively define target molecules that correlate with consumer overall liking of an industrial standard product. Principal component analysis of chemical and physical testing, GC-MS, LC-HRMS, and sensory data were performed with the aim of identifying the main parameters to discern similarities and differences among samples and clustering them according to these features. The correlation between analytical data and compounds related to sensory data was further investigated, and lastly, a partial least-squares regression model for the prediction of consumer overall liking was reported.",Journal of AOAC International,"['D002853', 'D005504', 'D005511', 'D063427', 'D008401', 'D016018', 'D015999', 'D025341', 'D013649', 'D055697', 'D014908']","['Chromatography, Liquid', 'Food Analysis', 'Food Handling', 'Food Quality', 'Gas Chromatography-Mass Spectrometry', 'Least-Squares Analysis', 'Multivariate Analysis', 'Principal Component Analysis', 'Taste', 'Taste Perception', 'Triticum']",LC-HRMS for Characterizing Durum Wheat Pasta Production Variability and Consumer Overall Liking.,"['Q000379', None, None, None, 'Q000379', None, None, None, None, None, 'Q000737']","['methods', None, None, None, 'methods', None, None, None, None, None, 'chemistry']",https://www.ncbi.nlm.nih.gov/pubmed/28899452,2018
28791630,"A straightforward analytical method was developed and validated to determine the mycotoxin moniliformin in cereal-based foods. Moniliformin is extracted with water and quantified with liquid chromatography tandem mass spectrometry, and its presence confirmed with liquid chromatography-Orbitrap-high-resolution mass spectrometry. The method was validated for flour, bread, pasta and maize samples in terms of linearity, matrix effect, recovery, repeatability and limit of quantification. Quantification was conducted by matrix-matched calibration. Positive samples were confirmed by standard addition. Recovery ranged from 77 to 114% and repeatability from 1 to 14%. The limit of quantification, defined as the lowest concentration tested at which the validation criteria of recovery and repeatability were fulfilled, was 10 μg/kg. The method was applied to 102 cereal-based food samples collected in the Netherlands and Germany. Moniliformin was not detected in bread samples. One of 22 flour samples contained moniliformin at 10.6 μg/kg. Moniliformin occurred in seven out of 25 pasta samples at levels around 10 μg/kg. Moniliformin (MON) was present in eight out of 23 maize products at levels ranging from 12 to 207 μg/kg.",Mycotoxin research,"['D001939', 'D002853', 'D003503', 'D002523', 'D005506', 'D005858', 'D009183', 'D011795', 'D053719', 'D014908', 'D003313']","['Bread', 'Chromatography, Liquid', 'Cyclobutanes', 'Edible Grain', 'Food Contamination', 'Germany', 'Mycotoxins', 'Surveys and Questionnaires', 'Tandem Mass Spectrometry', 'Triticum', 'Zea mays']",Survey of moniliformin in wheat- and corn-based products using a straightforward analytical method.,"['Q000032', 'Q000379', 'Q000032', 'Q000737', 'Q000032', None, 'Q000032', None, 'Q000379', 'Q000737', 'Q000737']","['analysis', 'methods', 'analysis', 'chemistry', 'analysis', None, 'analysis', None, 'methods', 'chemistry', 'chemistry']",https://www.ncbi.nlm.nih.gov/pubmed/28791630,2018
28478307,"Durum wheat (Triticum turgidum ssp. durum (Desf.) Husn.) is an economically important crop used for the production of semolina, which is the basis of pasta and other food products. Its grains provide proteins and starch for human consumption. Grain development is a key process in wheat physiology; it is highly affected by a number of enzymes that control the metabolic processes governing accumulation of starch and storage proteins and ultimately grain weight. Most of these enzymes are present in the albumin/globulin grain fraction, which represents about a quarter of total seed proteins. With the aim to describe the dynamic profile of the albumin/globulin fraction during durum wheat grain development, we performed a proteomic analysis of this subproteome using a two-dimensional differential gel electrophoresis (2D-DIGE)-based approach and compared six developmental stages. A total of 285 differentially (237 over- and 48 under-) represented spots was identified by nanoLC-ESI-LIT-MS/MS, which were associated with 217 non-redundant Triticum sequence entries. Quantitative protein dynamics demonstrated that carbon metabolism, energy, protein destination/storage, disease/defense and cell growth/division functional categories were highly affected during grain development, concomitantly with progressive grain size increase and starch/protein reserve accumulation. Bioinformatic interaction prediction revealed a complex network of differentially represented proteins mainly centered at enzymes involved in carbon and protein metabolism. A description of 18 proteins associated with wheat flour human allergies was also obtained; these components showed augmented levels at the last developmental stages. By providing a comprehensive understanding of the molecular basis of durum wheat grain development, yield and quality formation, this study provides the foundation and reveals potential biomarkers for further investigations of durum wheat breeding and semolina quality.",Journal of proteomics,"['D000418', 'D019295', 'D002523', 'D015180', 'D018507', 'D018506', 'D005916', 'D010940', 'D020543', 'D053719', 'D014908']","['Albumins', 'Computational Biology', 'Edible Grain', 'Electrophoresis, Gel, Two-Dimensional', 'Gene Expression Regulation, Developmental', 'Gene Expression Regulation, Plant', 'Globulins', 'Plant Proteins', 'Proteome', 'Tandem Mass Spectrometry', 'Triticum']",Differential representation of albumins and globulins during grain development in durum wheat and its possible functional consequences.,"['Q000032', None, 'Q000737', None, None, None, 'Q000032', 'Q000032', 'Q000032', None, 'Q000378']","['analysis', None, 'chemistry', None, None, None, 'analysis', 'analysis', 'analysis', None, 'metabolism']",https://www.ncbi.nlm.nih.gov/pubmed/28478307,2018
28347138,"The time course of biosynthesis and accumulation of storage proteins in developing grains of durum wheat (Triticum turgidum ssp. durum (Desf.) Husn.) pasta-quality reference cv. Svevo was investigated at the protein level for the first time. Seeds were harvested at key kernel developmental stages, namely, 3 (seed increase 3-fold in size), 5 (kernel development, water-ripe stage), 11 (kernel development, water-ripe stage), 16 (kernel full development, water-ripe stage), 21 (milk-ripe stage), and 30 (dough stage) days postanthesis (dpa). Gliadins and glutenins were fractionated according to their different solubility and individually analyzed after fractionation by reversed-phase high performance liquid chromatography and sodium dodecyl sulfate-polyacrylamide gel electrophoresis. Proteins were identified by liquid chromatography-tandem mass spectrometry of proteolytic peptides. The α- and γ-gliadin were already detected at 3 dpa. The biosynthesis of high molecular mass glutenin Bx7 was slightly delayed (11 dpa). Most of the gluten proteins accumulated rapidly between 11 and 21 dpa, with a minor further increase up to 30 dpa. The expression pattern of gluten proteins in Triticum durum at the early stages of synthesis provides reference data sets for future applications in crop breeding and growth monitoring.",Journal of agricultural and food chemistry,"['D004591', 'D005983', 'D008970', 'D012639', 'D014908']","['Electrophoresis, Polyacrylamide Gel', 'Glutens', 'Molecular Weight', 'Seeds', 'Triticum']",Identification of Early Represented Gluten Proteins during Durum Wheat Grain Development.,"[None, 'Q000737', None, 'Q000737', 'Q000737']","[None, 'chemistry', None, 'chemistry', 'chemistry']",https://www.ncbi.nlm.nih.gov/pubmed/28347138,2017
28121432,"Gluten is a protein composite found in wheat and related grains including barley, rye, oat, and all their species and hybrids. Gluten matrix is a biomolecular network of gliadins and glutenins that contribute to the texture of pastries, breads, and pasta. Gliadins are mainly responsible for celiac disease, one of the most widespread food-related pathologies in Western world. In view of the importance of gliadin proteins, by combining the quartz crystal microbalance technology, a cheap and robust piezoelectric transducer, with the so-called photonic immobilization technique, an effective surface functionalization method that provides spatially oriented antibodies on gold substrates, we realized a sensitive and reliable biosensor for quantifying these analytes extracted from real samples in a very short time. The resulting immunosensor has a limit of detection of about 4 ppm and, more remarkably, shows excellent sensitivity in the range 7.5-15 ppm. This feature makes our device reliable and effective for practical applications since it is able to keep low the influence of false positives.",Journal of agricultural and food chemistry,"['D015374', 'D015153', 'D002851', 'D004591', 'D004797', 'D005504', 'D005903', 'D057230', 'D058525', 'D012680', 'D014466']","['Biosensing Techniques', 'Blotting, Western', 'Chromatography, High Pressure Liquid', 'Electrophoresis, Polyacrylamide Gel', 'Enzyme-Linked Immunosorbent Assay', 'Food Analysis', 'Gliadin', 'Limit of Detection', 'Quartz Crystal Microbalance Techniques', 'Sensitivity and Specificity', 'Ultraviolet Rays']",Label-Free Detection of Gliadin in Food by Quartz Crystal Microbalance-Based Immunosensor.,"['Q000295', None, 'Q000379', None, 'Q000379', 'Q000295', 'Q000032', None, 'Q000295', None, None]","['instrumentation', None, 'methods', None, 'methods', 'instrumentation', 'analysis', None, 'instrumentation', None, None]",https://www.ncbi.nlm.nih.gov/pubmed/28121432,2017
27776774,"Rapid and accurate UPLC-MS/MS methods for the simultaneous determination of beauvericin and the related enniatins (A, A1, B, B1), together with cereulide were successfully developed and validated in cereal and cereal-based food matrices such as wheat, maize, rice and pasta. Although these emerging foodborne toxins are of different microbial origin, the similar structural, toxicological and food safety features provided rationale for their concurrent detection in relevant food matrices. A Waters Acquity UPLC system coupled to a Waters Quattro Premier XE™ Mass Spectrometer operating in ESI+ mode was employed. Sample pretreatment involved a fast and simple liquid extraction of the target toxins without any further clean-up step. For all toxins the sample preparation resulted in acceptable extraction recoveries with values of 85-105% for wheat, 87-106% for maize, 84-106% for rice and 85-105% for pasta. The efficient extraction protocol, together with a fast chromatographic separation of 7min allowed substantial saving costs and time showing its robustness and performance. The validation of the developed method was performed based on Commission Decision 2002/657/EC. The obtained limits of detection ranged from 0.1 to 1.0μgkg",Journal of chromatography. A,"['D002851', 'D047630', 'D002523', 'D005433', 'D005506', 'D057230', 'D012275', 'D006109', 'D053719', 'D014118', 'D014908', 'D003313']","['Chromatography, High Pressure Liquid', 'Depsipeptides', 'Edible Grain', 'Flour', 'Food Contamination', 'Limit of Detection', 'Oryza', 'Poaceae', 'Tandem Mass Spectrometry', 'Toxins, Biological', 'Triticum', 'Zea mays']","Development and validation of ultra-high-performance liquid chromatography-tandem mass spectrometry methods for the simultaneous determination of beauvericin, enniatins (A, A1, B, B1) and cereulide in maize, wheat, pasta and rice.","[None, 'Q000032', 'Q000737', None, 'Q000032', None, 'Q000737', 'Q000737', 'Q000379', 'Q000032', 'Q000737', 'Q000737']","[None, 'analysis', 'chemistry', None, 'analysis', None, 'chemistry', 'chemistry', 'methods', 'analysis', 'chemistry', 'chemistry']",https://www.ncbi.nlm.nih.gov/pubmed/27776774,2017
27451245,"The fate of deoxynivalenol and enniatins was studied during cooking of commercially available dry pasta in the Netherlands in 2014. Five samples containing relatively high levels of deoxynivalenol and/or enniatins were selected for the cooking experiment. Cooking was performed in duplicate on different days, under standardised conditions, simulating house-hold preparation. Samples were extracted with a mixture of acetonitrile/water followed by salt-induced partitioning. The extracts were analysed by LC-MS/MS. The method limits of detection were 8μg/kg for deoxynivalenol, 10μg/kg for enniatin A1 and 5μg/kg for enniatins A, B and B1. During the cooking of the five dry pasta samples, 60% of the deoxynivalenol and 83-100% of the enniatins were retained in the cooked pasta. It is recommended to study food processing fate of mycotoxins through naturally contaminated materials (incurred materials). ",Food chemistry,"['D002853', 'D003296', 'D047630', 'D005504', 'D005506', 'D005516', 'D009183', 'D053719', 'D014255', 'D014908']","['Chromatography, Liquid', 'Cooking', 'Depsipeptides', 'Food Analysis', 'Food Contamination', 'Food Microbiology', 'Mycotoxins', 'Tandem Mass Spectrometry', 'Trichothecenes', 'Triticum']",Fate of enniatins and deoxynivalenol during pasta cooking.,"[None, None, 'Q000032', None, 'Q000032', None, 'Q000032', None, 'Q000032', 'Q000737']","[None, None, 'analysis', None, 'analysis', None, 'analysis', None, 'analysis', 'chemistry']",https://www.ncbi.nlm.nih.gov/pubmed/27451245,2017
27211625,"An optimized flow injection hydride generation atomic absorption spectroscopy (FI-HGAAS) method was used to determine total arsenic in selected food samples (beef, chicken, fish, milk, cheese, egg, rice, rice-based products, wheat flour, corn flour, oats, breakfast cereals, legumes and potatoes) and to estimate their contributions to inorganic arsenic dietary intake. The limit of detection (LOD) and limit of quantification (LOQ) values obtained were 6μgkg(-)(1) and 18μgkg(-)(1), respectively. The mean recovery range obtained for all food at a fortification level of 200μgkg(-)(1) was 85-110%. Accuracy was evaluated using dogfish liver certified reference material (DOLT-3 NRC) for trace metals. The highest total arsenic concentrations (in μgkg(-)(1)) were found in fish (152-439), rice (87-316) and rice-based products (52-201). The contribution to inorganic arsenic (i-As) intake was calculated from the mean i-As content of each food (calculated by applying conversion factors to total arsenic data) and the mean consumption per day. The primary contributors to inorganic arsenic intake were wheat flour, including its proportion in wheat flour-based products (breads, pasta and cookies), followed by rice; both foods account for close to 53% and 17% of the intake, respectively. The i-As dietary intake, estimated as 10.7μgday(-)(1), was significantly lower than that from drinking water in vast regions of Argentina. ",Food chemistry,"['D000818', 'D001118', 'D001151', 'D002417', 'D002645', 'D060766', 'D005399', 'D005433', 'D005506', 'D008460', 'D008892', 'D012275', 'D013054']","['Animals', 'Argentina', 'Arsenic', 'Cattle', 'Chickens', 'Drinking Water', 'Fishes', 'Flour', 'Food Contamination', 'Meat', 'Milk', 'Oryza', 'Spectrophotometry, Atomic']",Total arsenic in selected food samples from Argentina: Estimation of their contribution to inorganic arsenic dietary intake.,"[None, None, 'Q000032', None, None, 'Q000032', None, 'Q000032', 'Q000032', 'Q000032', 'Q000737', 'Q000737', 'Q000379']","[None, None, 'analysis', None, None, 'analysis', None, 'analysis', 'analysis', 'analysis', 'chemistry', 'chemistry', 'methods']",https://www.ncbi.nlm.nih.gov/pubmed/27211625,2017
26592621,"In this work, a simplified extraction and short time of analysis method for the simultaneous determination of natamycin, nisin and sorbic acid in cheeses and cream by reverse phase liquid chromatography-electrospray-tandem mass spectrometry was developed. Full validation was performed according to the Commission Decision 2002/657/EC criteria and method applicability was checked on several samples, aiming to inspect their compliance with regulatory limits. The method was linear in the concentration ranges of 0-10mg kg(-1) (natamycin), 0-25mg kg(-1) (nisin) and 0 20mg kg(-1) (sorbic acid). Samples of the three most consumed types of cheese (fresh, pasta filata and ripened) in Brazil and cream (ultra high temperature and pasteurized, 20-30% fat content) were assessed. A surprising rate of non-compliance was observed, especially among ripened grated cheeses, since 80% of samples were above the maximum limit for sorbic acid with an average concentration of 2766.3±10.8mg kg(-1). Moreover, a major non-compliance for the cream samples was observed. The proposed method can be applied as an efficient tool for the inspection of preservatives in cheeses and cream.",Talanta,"['D002611', 'D002853', 'D005504', 'D005520', 'D057230', 'D016014', 'D015203', 'D021241', 'D053719', 'D013997', 'D035501']","['Cheese', 'Chromatography, Liquid', 'Food Analysis', 'Food Preservatives', 'Limit of Detection', 'Linear Models', 'Reproducibility of Results', 'Spectrometry, Mass, Electrospray Ionization', 'Tandem Mass Spectrometry', 'Time Factors', 'Uncertainty']",A simple and fast method for the inspection of preservatives in cheeses and cream by liquid chromatography- electrospray tandem mass spectrometry.,"['Q000032', None, 'Q000379', 'Q000032', None, None, None, None, None, None, None]","['analysis', None, 'methods', 'analysis', None, None, None, None, None, None, None]",https://www.ncbi.nlm.nih.gov/pubmed/26592621,2016
26483187,"Engineered silver nanoparticles (AgNPs) are implemented in food contact materials due to their powerful antimicrobial properties and so may enter the human food chain. Hence, it is desirable to develop easy, sensitive and fast analytical screening methods for the determination of AgNPs in complex biological matrices. This study describes such a method using solid sampling high-resolution continuum source graphite furnace atomic absorption spectrometry (GFAAS). A recently reported novel evaluation strategy uses the atomization delay of the respective GFAAS signal as significant indicator for AgNPs and thereby allows discrimination of AgNPs from ionic silver (Ag(+)) in the samples without elaborate sample pre-treatment. This approach was further developed and applied to a variety of biological samples. Its suitability was approved by investigation of eight different food samples (parsley, apple, pepper, cheese, onion, pasta, maize meal and wheat flour) spiked with ionic silver or AgNPs. Furthermore, the migration of AgNPs from silver-impregnated polypropylene food storage boxes to fresh pepper was observed and a mussel sample obtained from a laboratory exposure study with silver was investigated. The differences in the atomization delays (Δt(ad)) between silver ions and 20-nm AgNPs vary in a range from -2.01 ± 1.38 s for maize meal to +2.06 ± 1.08 s for mussel tissue. However, the differences were significant in all investigated matrices and so indicative of the presence/absence of AgNPs. Moreover, investigation of model matrices (cellulose, gelatine and water) gives the first indication of matrix-dependent trends. Reproducibility and homogeneity tests confirm the applicability of the method.",Analytical and bioanalytical chemistry,"['D000818', 'D049872', 'D002417', 'D002611', 'D003257', 'D005506', 'D006801', 'D053768', 'D012758', 'D012834', 'D013054', 'D014675']","['Animals', 'Bivalvia', 'Cattle', 'Cheese', 'Consumer Product Safety', 'Food Contamination', 'Humans', 'Metal Nanoparticles', 'Shellfish', 'Silver', 'Spectrophotometry, Atomic', 'Vegetables']",A direct solid sampling analysis method for the detection of silver nanoparticles in biological matrices.,"[None, 'Q000737', None, 'Q000032', None, 'Q000032', None, 'Q000032', 'Q000032', 'Q000032', 'Q000379', 'Q000737']","[None, 'chemistry', None, 'analysis', None, 'analysis', None, 'analysis', 'analysis', 'analysis', 'methods', 'chemistry']",https://www.ncbi.nlm.nih.gov/pubmed/26483187,2016
26403803,"Several studies have demonstrated that metabolomics has a definite place in food quality, nutritional value, and safety issues. The aim of the present study was to determine and compare the metabolites in different pasta samples with fibre, and to investigate the modifications induced in these different kinds of pasta during cooking, using a gas chromatography-mass spectrometry-based metabolomics approach.",Journal of the science of food and agriculture,"['D000596', 'D018554', 'D003296', 'D004043', 'D005511', 'D005513', 'D005527', 'D057141', 'D001467', 'D006801', 'D007444', 'D007558', 'D055432', 'D009753', 'D025341', 'D012995', 'D013265', 'D024505', 'D014908', 'D000067348']","['Amino Acids', 'Avena', 'Cooking', 'Dietary Fiber', 'Food Handling', 'Food Inspection', 'Food, Fortified', 'Food, Preserved', 'Hordeum', 'Humans', 'Inulin', 'Italy', 'Metabolomics', 'Nutritive Value', 'Principal Component Analysis', 'Solubility', 'Stigmasterol', 'Tocopherols', 'Triticum', 'Whole Grains']",Metabolomic analysis can detect the composition of pasta enriched with fibre after cooking.,"['Q000032', 'Q000737', None, 'Q000008', None, 'Q000379', 'Q000032', 'Q000032', 'Q000737', None, 'Q000008', None, 'Q000379', None, None, None, 'Q000032', 'Q000032', 'Q000737', 'Q000737']","['analysis', 'chemistry', None, 'administration & dosage', None, 'methods', 'analysis', 'analysis', 'chemistry', None, 'administration & dosage', None, 'methods', None, None, None, 'analysis', 'analysis', 'chemistry', 'chemistry']",https://www.ncbi.nlm.nih.gov/pubmed/26403803,2017
26386056,"In this study, we compared the fecal microbiota and metabolomes of 26 healthy subjects before (HS) and after (HSB) 2 months of diet intervention based on the administration of durum wheat flour and whole-grain barley pasta containing the minimum recommended daily intake (3 g) of barley β-glucans. Metabolically active bacteria were analyzed through pyrosequencing of the 16S rRNA gene and community-level catabolic profiles. Pyrosequencing data showed that levels of Clostridiaceae (Clostridium orbiscindens and Clostridium sp.), Roseburia hominis, and Ruminococcus sp. increased, while levels of other Firmicutes and Fusobacteria decreased, from the HSB samples to the HS fecal samples. Community-level catabolic profiles were lower in HSB samples. Compared to the results for HS samples, cultivable lactobacilli increased in HSB fecal samples, while the numbers of Enterobacteriaceae, total coliforms, and Bacteroides, Porphyromonas, Prevotella, Pseudomonas, Alcaligenes, and Aeromonas bacteria decreased. Metabolome analyses were performed using an amino acid analyzer and gas chromatography-mass spectrometry solid-phase microextraction. A marked increase in short-chain fatty acids (SCFA), such as 2-methyl-propanoic, acetic, butyric, and propionic acids, was found in HSB samples with respect to the HS fecal samples. Durum wheat flour and whole-grain barley pasta containing 3% barley β-glucans appeared to be effective in modulating the composition and metabolic pathways of the intestinal microbiota, leading to an increased level of SCFA in the HSB samples. ",Applied and environmental microbiology,"['D000328', 'D001419', 'D004032', 'D005243', 'D005260', 'D008401', 'D001467', 'D006801', 'D007558', 'D008297', 'D055442', 'D064307', 'D008875', 'D010802', 'D012336', 'D017422', 'D052617', 'D014908']","['Adult', 'Bacteria', 'Diet', 'Feces', 'Female', 'Gas Chromatography-Mass Spectrometry', 'Hordeum', 'Humans', 'Italy', 'Male', 'Metabolome', 'Microbiota', 'Middle Aged', 'Phylogeny', 'RNA, Ribosomal, 16S', 'Sequence Analysis, DNA', 'Solid Phase Microextraction', 'Triticum']",Effect of Whole-Grain Barley on the Human Fecal Microbiota and Metabolome.,"[None, 'Q000145', None, 'Q000382', None, None, 'Q000737', None, None, None, None, None, None, None, 'Q000235', None, None, 'Q000737']","[None, 'classification', None, 'microbiology', None, None, 'chemistry', None, None, None, None, None, None, None, 'genetics', None, None, 'chemistry']",https://www.ncbi.nlm.nih.gov/pubmed/26386056,2016
