PMID,abstract,journal,mesh_UIds,mesh_terms,paper,qual_UIds,qual_terms,webpage,year
23772758,"A fast and simple high-performance liquid chromatography method suitable for determining furosine level in heat-treated food samples was developed. The analysis of furosine was performed by a novel mixed-mode column that provides multiple and simultaneous retention mechanisms including cation-exchange, anion-exchange, reversed-phase, or hydrophilic interaction. Each retention mechanism could be independently controlled by setting chromatographic conditions. Adequate retention and selectivity of polar charged furosine were achieved by adjusting mobile phase pH, buffer concentration, organic content, and ionic strength. The optimized method was successfully applied to determinate furosine in durum wheat semolina pasta samples. Furosine level in pasta may be used as a reliable marker of health and nutritional damage occurring during pasta manufacture. Indeed, a low content of furosine is generally related to high nutritional quality of food and application of mild heat treatments. A wide range of dry pasta samples, collected from both supermarkets (large-scale retail trade) and shops selling local products, were analyzed. Variable amounts of furosine, ranging from 107 to 506 mg/100 g of protein, were found in pasta samples. The proposed method allows to discriminate products submitted to different time-temperature conditions during the drying process. At the same time, it may be used to highlight potential label fraud. ",Journal of food science,"['D002138', 'D002851', 'D005511', 'D006863', 'D008239', 'D009753', 'D009994', 'D015203', 'D013696', 'D014908']","['Calibration', 'Chromatography, High Pressure Liquid', 'Food Handling', 'Hydrogen-Ion Concentration', 'Lysine', 'Nutritive Value', 'Osmolar Concentration', 'Reproducibility of Results', 'Temperature', 'Triticum']",Furosine as a pasta quality marker: evaluation by an innovative and fast chromatographic approach.,"[None, 'Q000379', None, None, 'Q000031', None, None, None, None, 'Q000737']","[None, 'methods', None, None, 'analogs & derivatives', None, None, None, None, 'chemistry']",https://www.ncbi.nlm.nih.gov/pubmed/23772758,2014
23692763,"In this study, 48 multicereal baby foods samples including 25 of pasta and 23 of multicereal baby foods from supermarkets of Campania region (Italy) were analysed for evaluating the presence of beauvericin (BEA) and enniatins (ENs) A, A1, B, B1 and B4. Subsequently to evaluate the risk exposure of Italian population and infant population over the consumption of pasta or multicereal baby food, was, respectively, evaluated. For the above mentioned evaluation, a method developed in our laboratory by liquid chromatography tandem mass spectrometry was used. A liquid phase dispersion procedure was optimised for the simultaneous extraction of BEA and the five ENs from multicereal baby food samples and pasta. The main parameters affecting extraction yield and selectivity, extraction solvent were evaluated. The method was validated by analysis for pasta and multicereal baby food samples fortified at different concentration levels (from 0.5 to 20μg/kg). Average recoveries (n=5) ranged from 85% to 99% with relative standard deviation lower than 13%. Limits of quantification (LQs) for both matrices ranged from 1 to 10μg/kg. Analytical results showed that the occurrence of BEA, ENA, ENA1, ENB, ENB1 and ENB4 in analysed pasta and multicereal baby food samples were below 68% and 74%, respectively. ENB was the mycotoxin most found and levels in pasta and baby food ranged from <LQ to 106 and from <LQ to 1100μg/kg, respectively. It was observed a high incidence (70.3%) and high contamination levels (<1100μg/kg) of these mycotoxins in multicereal baby food and its intakes could represent a risk for the infant population (estimated daily intake <7.23μg/kgbw/day).",Food chemistry,"['D002851', 'D047630', 'D002523', 'D005506', 'D005670', 'D007225', 'D007558', 'D009183', 'D053719']","['Chromatography, High Pressure Liquid', 'Depsipeptides', 'Edible Grain', 'Food Contamination', 'Fusarium', 'Infant Food', 'Italy', 'Mycotoxins', 'Tandem Mass Spectrometry']",Evaluation of beauvericin and enniatins in Italian cereal products and multicereal food by liquid chromatography coupled to triple quadrupole mass spectrometry.,"['Q000379', 'Q000032', 'Q000737', 'Q000032', 'Q000378', 'Q000032', None, 'Q000032', 'Q000379']","['methods', 'analysis', 'chemistry', 'analysis', 'metabolism', 'analysis', None, 'analysis', 'methods']",https://www.ncbi.nlm.nih.gov/pubmed/23692763,2013
23442641,"An optimised FI-HGAAS method was applied to determine the total selenium concentrations in selected high consumption food (fish, beef, chicken, milk, rice, wheat flour, egg) and to estimate their contribution to the Argentinean dietary intake, whose information is scarce nowadays. Through several optimisation steps a suitable method was achieved showing satisfactory figures of merit for all matrices. Average recovery was 96%, RSD<5%, LODs ranged 2.0-7.0 μg kg(-1) and the accuracy was assessed using DOLT-3 NRC certified reference material. Meat and eggs showed the highest values (in μg kg(-1), beef: 42-153; chicken: 62-205; fish: 94-314; canned tuna: 272-282; eggs: 134-217), minor values were found for wheat flour (22-42), rice: (<22), pasta (47-64) and milk (<7-9). An estimated intake of 32 and 24 μg day(-1) for adult men and women, respectively, suggested a deficient Se intake, leading to further comprehensive surveys of Se occurrence in Argentina.",Food chemistry,"['D000818', 'D001118', 'D002417', 'D002645', 'D002523', 'D005260', 'D005399', 'D005504', 'D006801', 'D008460', 'D008892', 'D012643', 'D013054']","['Animals', 'Argentina', 'Cattle', 'Chickens', 'Edible Grain', 'Female', 'Fishes', 'Food Analysis', 'Humans', 'Meat', 'Milk', 'Selenium', 'Spectrophotometry, Atomic']",Determination of selenium in selected food samples from Argentina and estimation of their contribution to the Se dietary intake.,"[None, None, None, None, 'Q000737', None, None, 'Q000379', None, 'Q000032', 'Q000737', 'Q000032', 'Q000379']","[None, None, None, None, 'chemistry', None, None, 'methods', None, 'analysis', 'chemistry', 'analysis', 'methods']",https://www.ncbi.nlm.nih.gov/pubmed/23442641,2013
23403254,"Wheat kernel albumins/globulins (A/G) and gluten proteins are responsible for baker's asthma and food allergy in atopic subjects. Although no commercial genetically modified wheats are currently being grown, they are under study and the allergenicity of GM products is a major concern. In order to establish the expected and unexpected effects of genetic transformation on allergenicity and also to carry out a safety assessment of genetic transformation, two GM wheat lines (bread and pasta wheat) transformed with endogenous genes were compared to their untransformed counterparts (wt), first by an allergenomic approach, and second, using ELISA with sera from patients suffering from food allergy to wheat and baker's asthma. The 2D immunoblots performed on sera from patients suffering from food allergy and baker's asthma on the A/G fraction of the four lines (two GM and two wt) revealed comparable IgE-binding profiles. A total of 109 IgE-binding spots were analyzed by mass spectrometry, and most of the proteins identified had already been described as allergens or potential allergens. Only two IgE-binding proteins were specific to one GM line. The concentration of specific IgE against the A/G fractions of GM wheat lines and their wt genotypes differed for some sera.",Journal of proteomics,"['D000418', 'D000485', 'D001249', 'D018014', 'D005916', 'D005983', 'D006801', 'D009784', 'D030821', 'D014908', 'D021182']","['Albumins', 'Allergens', 'Asthma', 'Gene Transfer Techniques', 'Globulins', 'Glutens', 'Humans', 'Occupational Diseases', 'Plants, Genetically Modified', 'Triticum', 'Wheat Hypersensitivity']",How much does transgenesis affect wheat allergenicity?: Assessment in two GM lines over-expressing endogenous genes.,"['Q000276', 'Q000737', 'Q000276', None, 'Q000276', None, None, 'Q000276', 'Q000276', 'Q000276', 'Q000276']","['immunology', 'chemistry', 'immunology', None, 'immunology', None, None, 'immunology', 'immunology', 'immunology', 'immunology']",https://www.ncbi.nlm.nih.gov/pubmed/23403254,2013
23330715,"Starch has unique physicochemical characteristics among food carbohydrates. Starch contributes to the physicochemical attributes of food products made from roots, legumes, cereals, and fruits. It occurs naturally as distinct particles, called granules. Most starch granules are a mixture of 2 sugar polymers: a highly branched polysaccharide named amylopectin and a basically linear polysaccharide named amylose. The starch contained in food products undergoes changes during processing, which causes changes in the starch molecular weight and amylose to amylopectin ratio. The objective of this study was to develop a new, simple, 1-step, and accurate method for simultaneous determination of amylose and amylopectin ratio as well as weight-averaged molecular weights of starch in food products. Starch from bread flour, canned peas, corn flake cereal, snack crackers, canned kidney beans, pasta, potato chips, and white bread was extracted by dissolving in KOH, urea, and precipitation with ethanol. Starch samples were solubilized and analyzed on a high-performance size exclusion chromatography (HPSEC) system. To verify the identity of the peaks, fractions were collected and soluble starch and beta-glucan assays were performed additional to gas chromatography analysis. We found that all the fractions contain only glucose and soluble starch assay is correlated to the HPSEC fractionation. This new method can be used to determine amylose amylopectin ratio and weight-averaged molecular weight of starch from various food products using as low as 25 mg dry samples.",Journal of food science,"['D000687', 'D000688', 'D001939', 'D002850', 'D003208', 'D002523', 'D007887', 'D005433', 'D005504', 'D005511', 'D008970', 'D013213', 'D047071']","['Amylopectin', 'Amylose', 'Bread', 'Chromatography, Gel', 'Concanavalin A', 'Edible Grain', 'Fabaceae', 'Flour', 'Food Analysis', 'Food Handling', 'Molecular Weight', 'Starch', 'beta-Glucans']",Analysis of starch in food systems by high-performance size exclusion chromatography.,"['Q000032', 'Q000032', 'Q000032', 'Q000379', 'Q000032', 'Q000737', 'Q000737', 'Q000032', 'Q000379', None, None, 'Q000032', 'Q000032']","['analysis', 'analysis', 'analysis', 'methods', 'analysis', 'chemistry', 'chemistry', 'analysis', 'methods', None, None, 'analysis', 'analysis']",https://www.ncbi.nlm.nih.gov/pubmed/23330715,2013
23161067,"This investigation focused on direct comparison of two popular multidimensional liquid-gas chromatography (LC-GC) systems, the Y-interface (retention gap approach) and the syringe-based interface (programmed temperature vaporizer approach). Such transfer devices are structurally very different, and could potentially have a substantial effect on the outcome of a specific application. In this work the application was a topic of much current interest, determination of mineral oil saturated hydrocarbon (MOSH) contamination of a series of food products (rice, pasta, icing sugar, olive oil); the final results were then compared. The two LC-GC methods developed were validated for linearity over the calibration range, analyte discrimination, precision, accuracy, and limits of detection and quantification. No significant differences were found between the two approaches.",Analytical and bioanalytical chemistry,"['D002849', 'D005506', 'D006838', 'D057230', 'D008899']","['Chromatography, Gas', 'Food Contamination', 'Hydrocarbons', 'Limit of Detection', 'Mineral Oil']",Comparison of two different multidimensional liquid-gas chromatography interfaces for determination of mineral oil saturated hydrocarbons in foodstuffs.,"['Q000295', 'Q000032', 'Q000032', None, 'Q000032']","['instrumentation', 'analysis', 'analysis', None, 'analysis']",https://www.ncbi.nlm.nih.gov/pubmed/23161067,2013
23063671,"One of the main sources of emerging Fusarium mycotoxins in human nutrition is the cereals and cereal products. In this study, an analytical method to determine enniatins A, A1, B and B1 (ENs), beauvericin (BEA) and fusaproliferin (FUS) based on Ultra-Turrax extraction followed by liquid chromatography coupled to triple quadrupole mass spectrometer detector (MS/MS QqQ), was applied for the analysis of pasta. For this purpose, 114 commercial samples of pasta were acquired from supermarkets located in Valencia. The results showed higher frequencies of contamination in organic pasta than in conventional pasta, while the concentration levels were variable for both types of pasta. In positive samples, BEA levels varied from 0.10 to 20.96μg/kg and FUS levels varied from 0.05 to 8.02μg/kg. ENs levels ranged from 0.25 to 979.56μg/kg, though the majority of the values were below 25μg/kg. Besides, it was observed the simultaneous presence of two or more mycotoxins in a high percentage of the samples. Finally, an evaluation of the dietary exposure of the emerging Fusarium mycotoxins was performed in the Spanish population. The prevalence of ENs, BEA and FUS in cereal products suggests that the toxins may pose a health risk to Spanish population.",Food and chemical toxicology : an international journal published for the British Industrial Biological Research Association,"['D002853', 'D047630', 'D002523', 'D005506', 'D005670', 'D006801', 'D009183', 'D058871', 'D011634', 'D015203', 'D013030', 'D053719', 'D013729']","['Chromatography, Liquid', 'Depsipeptides', 'Edible Grain', 'Food Contamination', 'Fusarium', 'Humans', 'Mycotoxins', 'Organic Agriculture', 'Public Health', 'Reproducibility of Results', 'Spain', 'Tandem Mass Spectrometry', 'Terpenes']",Emerging Fusarium mycotoxins in organic and conventional pasta collected in Spain.,"['Q000379', 'Q000032', 'Q000737', 'Q000032', 'Q000737', None, 'Q000032', None, None, None, None, 'Q000295', 'Q000032']","['methods', 'analysis', 'chemistry', 'analysis', 'chemistry', None, 'analysis', None, None, None, None, 'instrumentation', 'analysis']",https://www.ncbi.nlm.nih.gov/pubmed/23063671,2013
22959825,"The incorrect use of preservatives in cheeses may compromise food safety and damage consumers. According to the law, more than one preservative may be contemporarily used in cheeses. So a method for their contemporary detection may be useful for both manufacturers and control agencies quality control. In this research a liquid chromatography-tandem mass spectrometric with electrospray ionization method for the multi-determination of seven preservatives (benzoic acid, citric acid, hexamethylenetetramine, lysozyme, natamycin, nisin and sorbic acid) in cheese was developed. The preservatives were contemporarily extracted from cheese by a single procedure, and analyzed by RP-LC/ESI-MS/MS (Ion Trap) in positive ionization mode, with single reaction monitoring (SRM) acquisition. Three sample types (hard, pasta filata and fresh cheese) were used for method evaluation. Recoveries were mostly higher than 90%; MDLs ranged from 0.02 to 0.26 mgkg(-1), and MQLs were included between 0.07 and 0.88 mgkg(-1). Due to matrix effect, quantitation was performed by referring to a matrix matched calibration curve, for each cheese typology. This method was also applied to commercial cheese samples, with good results. It appears fast, reliable and suitable for both screening and confirmation of the presence and quantitation of the preservatives in a single, multi-detection analysis.","Journal of chromatography. B, Analytical technologies in the biomedical and life sciences","['D002611', 'D002851', 'D056148', 'D005520', 'D007558', 'D057230', 'D016014', 'D015203', 'D053719']","['Cheese', 'Chromatography, High Pressure Liquid', 'Chromatography, Reverse-Phase', 'Food Preservatives', 'Italy', 'Limit of Detection', 'Linear Models', 'Reproducibility of Results', 'Tandem Mass Spectrometry']",Multi-detection of preservatives in cheeses by liquid chromatography-tandem mass spectrometry.,"['Q000032', 'Q000379', 'Q000379', 'Q000032', None, None, None, None, 'Q000379']","['analysis', 'methods', 'methods', 'analysis', None, None, None, None, 'methods']",https://www.ncbi.nlm.nih.gov/pubmed/22959825,2013
22887159,"A new method for qualitative and quantitative analysis of furosine in food products by capillary electrophoresis coupled to tandem mass spectrometry (CE-MS(2) ) has been optimized and validated. In analytical conditions, the pH value of the run buffer was similar to that of the hydrolyzed samples, which helps in avoiding interactions of the analyte with silanol groups of the inner wall of the fused silica capillary. In all previous CE methods proposed in literature, no SPE treatment has been used. The method has been applied to the analysis of food products, such as flour, having low amounts of furosine. Flour samples of different origin (wheat, chestnut, lupin, einkorn, chickpeas) have been investigated. Different food products such as pasta, milk, and tigelle bread (a typical Italian unleavened bread) were also analyzed. Some of the samples have also been analyzed by reversed-phase HPLC, and when compared to CE-MS, data obtained showed good agreement. CE-MS, in comparison to HPLC, showed advantages in terms of time of analysis and cost. The validation procedure provided good values for LOD and LOQ (respectively 0.07 and 0.25 mg L(-1) ), recovery (77 and 97%), and precision investigated in terms of intraday repeatability (RSD%: 4-6% for peak areas; 1-2% for migration times) and intermediate precision (below 16% for peak areas, and below 7% for migration times). Therefore, the technique reported can be proposed as a powerful analytical method and a valid alternative to common traditional analytical techniques.",Electrophoresis,"['D000818', 'D019075', 'D005433', 'D005504', 'D008239', 'D008892', 'D015203', 'D012680', 'D053719']","['Animals', 'Electrophoresis, Capillary', 'Flour', 'Food Analysis', 'Lysine', 'Milk', 'Reproducibility of Results', 'Sensitivity and Specificity', 'Tandem Mass Spectrometry']",Determination of furosine in food products by capillary zone electrophoresis-tandem mass spectrometry.,"[None, 'Q000379', 'Q000032', 'Q000379', 'Q000031', 'Q000737', None, None, 'Q000379']","[None, 'methods', 'analysis', 'methods', 'analogs & derivatives', 'chemistry', None, None, 'methods']",https://www.ncbi.nlm.nih.gov/pubmed/22887159,2012
22868109,"The contents of 14 mycotoxins were studied in samples of different cereals and cereal products from four countries of the Mediterranean region. Two hundred and sixty-five samples from Spain, Italy, Morocco and Tunisia were analysed. Samples were extracted with matrix solid-phase dispersion (MSPD) and determined by liquid chromatography-tandem mass spectrometry with a triple quadrupole mass analyser. The percentage of total samples contaminated was 53%. The frequency of contaminated samples from Spain, Italy, Tunisia and Morocco was 33%, 52%, 96% and 50%, respectively. Nivalenol and beauvericin were the most predominant mycotoxins. This is the first international report to study the presence of several mycotoxins in different types of cereal (rice, wheat, maize, rye, barley, oat, spelt and sorghum) and cereal products (snacks, pasta, soup, biscuits and flour) from the Mediterranean area, estimate the intake of mycotoxins and evaluate the risk assessment.",Food chemistry,"['D002523', 'D005504', 'D005506', 'D006801', 'D019083', 'D009183', 'D018570']","['Edible Grain', 'Food Analysis', 'Food Contamination', 'Humans', 'Mediterranean Region', 'Mycotoxins', 'Risk Assessment']",Co-occurrence and risk assessment of mycotoxins in food and diet from Mediterranean area.,"['Q000737', None, 'Q000032', None, None, 'Q000032', None]","['chemistry', None, 'analysis', None, None, 'analysis', None]",https://www.ncbi.nlm.nih.gov/pubmed/22868109,2012
22724891,"1,2-Dicarbonyl compounds, formed from carbohydrates during thermal processing in the course of caramelization and Maillard reactions, are intensively discussed as precursors for advanced glycation endproducts in foods and in vivo. To obtain information about the uptake of individual compounds with commonly consumed foods, a comprehensive analysis of the content of 3-deoxyglucosone (3-DG), 3-deoxygalactosone (3-DGal), and methylglyoxal (MGO) together with 5-hydroxymethylfurfural (HMF) in 173 food items like bakery products, pasta, nonalcoholic and alcoholic beverages, sweet spreads, and condiments was performed. Following suitable cleanup procedures, 1,2-dicarbonyl compounds were quantitated after derivatization with o-phenylenediamine via RP-HPLC with UV detection. 3-DG proved to be the predominant 1,2-dicarbonyl compound with concentrations up to 410 mg/L in fruit juices, 2622 mg/L in balsamic vinegars, and 385 mg/kg in cookies, thus exceeding the corresponding concentrations of HMF. 3-DGal was found to be of relevance in many foods even in the absence of galactose. MGO was only of minor quantitative importance in all foods studied, except for manuka honey. Dietary intake was estimated to range between 20 and 160 mg/day for 3-DG and 5 and 20 mg/day for MGO, respectively.",Journal of agricultural and food chemistry,"['D002851', 'D003847', 'D004032', 'D005504', 'D005662', 'D005690', 'D011765']","['Chromatography, High Pressure Liquid', 'Deoxyglucose', 'Diet', 'Food Analysis', 'Furaldehyde', 'Galactose', 'Pyruvaldehyde']","1,2-dicarbonyl compounds in commonly consumed foods.","[None, 'Q000031', None, None, 'Q000031', 'Q000031', 'Q000032']","[None, 'analogs & derivatives', None, None, 'analogs & derivatives', 'analogs & derivatives', 'analysis']",https://www.ncbi.nlm.nih.gov/pubmed/22724891,2012
22632631,"Young, old, pregnant and immuno-compromised persons are of great concern for risk assessors as they represent the sub-populations most at risk. The present paper focuses on risk assessment linked to furan exposure in children. Only the Belgian population was considered because individual contamination and consumption data that are required for accurate risk assessment were available for Belgian children only. Two risk assessment approaches, the so-called deterministic and probabilistic, were applied and the results were compared for the estimation of daily intake. A significant difference between the average Estimated Daily Intake (EDI) was underlined between the deterministic (419 ng kg⁻¹ body weight (bw) day⁻¹) and the probabilistic (583 ng kg⁻¹ bw day⁻¹) approaches, which results from the mathematical treatment of the null consumption and contamination data. The risk was characterised by two ways: (1) the classical approach by comparison of the EDI to a reference dose (RfD(chronic-oral)) and (2) the most recent approach, namely the Margin of Exposure (MoE) approach. Both reached similar conclusions: the risk level is not of a major concern, but is neither negligible. In the first approach, only 2.7 or 6.6% (respectively in the deterministic and in the probabilistic way) of the studied population presented an EDI above the RfD(chronic-oral). In the second approach, the percentage of children displaying a MoE above 10,000 and below 100 is 3-0% and 20-0.01% in the deterministic and probabilistic modes, respectively. In addition, children were compared to adults and significant differences between the contamination patterns were highlighted. While major contamination was linked to coffee consumption in adults (55%), no item predominantly contributed to the contamination in children. The most important were soups (19%), dairy products (17%), pasta and rice (11%), fruit and potatoes (9% each).","Food additives & contaminants. Part A, Chemistry, analysis, control, exposure & risk assessment","['D001530', 'D002273', 'D002648', 'D002675', 'D003611', 'D004034', 'D057140', 'D005506', 'D005523', 'D005663', 'D008401', 'D006801', 'D057230', 'D018570', 'D052617']","['Belgium', 'Carcinogens', 'Child', 'Child, Preschool', 'Dairy Products', 'Diet Surveys', 'Fast Foods', 'Food Contamination', 'Food Supply', 'Furans', 'Gas Chromatography-Mass Spectrometry', 'Humans', 'Limit of Detection', 'Risk Assessment', 'Solid Phase Microextraction']",Risk assessment for furan contamination through the food chain in Belgian children.,"[None, 'Q000008', None, None, 'Q000009', None, 'Q000009', None, None, 'Q000008', None, None, None, 'Q000379', None]","[None, 'administration & dosage', None, None, 'adverse effects', None, 'adverse effects', None, None, 'administration & dosage', None, None, None, 'methods', None]",https://www.ncbi.nlm.nih.gov/pubmed/22632631,2012
