PMID,abstract,journal,mesh_UIds,mesh_terms,paper,qual_UIds,qual_terms,webpage,year
29030041,"In this study, an effective and sensitive chiral analytical method was developed to detect zoxamide enantiomers in vegetables, fruits and environmental matrices using ultra-high-performance liquid chromatography-tandem mass spectrometry. Optimal separation conditions were achieved with Lux Amylose-2 chiral column using acetonitrile/water (70:30v/v) as mobile phase with a flow rate and column temperature of 0.5mL/min and 25°C. The absolute configuration, optical rotation and elution order were confirmed for the first time. The average recoveries in all matrices at four spiking levels (0.5, 5, 50, 250μg/kg) ranged from 89.7 to 117.4%, with relative standard deviations being less than 10.9% for two enantiomers. The enantioselective dissipation of zoxamide in tomato showed that (-)-R-zoxamide was preferentially degraded leading to an enrichment of (+)-S-isomer, with half-lives of 3.80 d and 5.17 d, respectively. Inversely, (+)-S-zoxamide degraded faster than (-)-R-zoxamide in pepper (1.95day and 2.28day, respectively) and grape (2.03day and 2.87day). No significant enantioselectivity was observed in cucumber. The results of this study could help facilitate more accurate risk assessments of zoxamide in the future.",Journal of chromatography. A,"['D000097', 'D000577', 'D002851', 'D018556', 'D018553', 'D005504', 'D005638', 'D005659', 'D018551', 'D012989', 'D013237', 'D053719', 'D014675']","['Acetonitriles', 'Amides', 'Chromatography, High Pressure Liquid', 'Crops, Agricultural', 'Cucumis sativus', 'Food Analysis', 'Fruit', 'Fungicides, Industrial', 'Lycopersicon esculentum', 'Soil Pollutants', 'Stereoisomerism', 'Tandem Mass Spectrometry', 'Vegetables']",The application of chiral ultra-high-performance liquid chromatography tandem mass spectrometry to the separation of the zoxamide enantiomers and the study of enantioselective degradation process in agricultural plants.,"['Q000737', 'Q000032', None, 'Q000737', 'Q000737', 'Q000379', 'Q000737', 'Q000032', 'Q000737', 'Q000032', None, None, 'Q000737']","['chemistry', 'analysis', None, 'chemistry', 'chemistry', 'methods', 'chemistry', 'analysis', 'chemistry', 'analysis', None, None, 'chemistry']",https://www.ncbi.nlm.nih.gov/pubmed/29030041,2017
29022832,"This study describes a novel electrochemical method to determine the herbicide trifluralin in samples of water, fruit juice, and vegetable extracts in the presence of surfactants, using a glassy carbon electrode (GCE). In acidic media, trifluralin was irreversible on the glassy carbon electrode surface at -0.5 V vs. Ag/AgCl. Surfactant presence on the electrode-solution interface modified current intensities and shifted the reduction peak potential of trifluralin. Different types of surfactant and their concentrations were investigated. The anionic surfactant significantly enhanced the peak current intensity of trifluralin. Under optimal analytical conditions, an analytical curve was obtained in the concentration range of 0.48-32.20 µM. The limits of detection and quantification were estimated at 0.031 and 0.104 µM, respectively. The method was successfully applied to quantify trifluralin in samples of water, orange and tomato juice, and green pepper, carrot, and onion extracts, with recovery rates of 97.9-102.1%. The results were in good agreement with those obtained using high-performance liquid chromatography, indicating that the proposed electrochemical method can be employed to quantify trifluralin in various types foods, with sensitivity, specificity, selectivity and reproducibility.","Journal of environmental science and health. Part. B, Pesticides, food contaminants, and agricultural wastes","['D002244', 'D002851', 'D032084', 'D055664', 'D004566', 'D005506', 'D000067030', 'D010575', 'D015203', 'D012680', 'D013501', 'D014274', 'D014675', 'D014867', 'D014874']","['Carbon', 'Chromatography, High Pressure Liquid', 'Citrus sinensis', 'Electrochemical Techniques', 'Electrodes', 'Food Contamination', 'Fruit and Vegetable Juices', 'Pesticides', 'Reproducibility of Results', 'Sensitivity and Specificity', 'Surface-Active Agents', 'Trifluralin', 'Vegetables', 'Water', 'Water Pollutants, Chemical']","Voltammetric detection of trifluralin in tap water, fruit juice, and vegetable extracts in the presence of surfactants.","['Q000737', None, None, 'Q000295', None, 'Q000032', 'Q000032', 'Q000032', None, None, None, 'Q000032', None, 'Q000032', 'Q000032']","['chemistry', None, None, 'instrumentation', None, 'analysis', 'analysis', 'analysis', None, None, None, 'analysis', None, 'analysis', 'analysis']",https://www.ncbi.nlm.nih.gov/pubmed/29022832,2018
28933794,"The effects of various levels of chili pepper, Sichuan pepper, and black pepper on the amounts of 17 heterocyclic amines (HAs) from seven categories of both free and protein-bound states in roast beef patties were assessed by ultra-performance liquid chromatography-tandem mass spectrometry combined with principal component analysis. Three groups of HA, including imidazopyridines (DMIP), imidazoquinoxalines (MeIQx and 4,8-MeIQx), and β-carbolines (norharman and harman), were detected and quantified in both their free and protein-bound states, whereas PhIP was detected only in its free state, and imidazoquinolines (IQ, IQ[4,5-b], and MeIQ), α-carbolines (AαC and MeAαC), and phenylpyridines (Phe-P-1) were detected only in their protein-bound states. The results demonstrate that the peppers at all three levels had significant inhibitory effects on free PhIP, DMIP, MeIQx, and 4,8-DiMeIQx and could promote free norharman. Harman was significantly suppressed by chili pepper and black pepper, but enhanced by Sichuan pepper. All 11 protein-bound HAs, with the exception of IQ, IQ[4,5-b], and MeIQx with added chili pepper, were significantly reduced by the three peppers. The total amounts of the free and protein-bound states of all 11 HAs (1692.4 ± 78.9 ng g",Food & function,"['D000588', 'D000818', 'D002417', 'D002851', 'D002853', 'D006571', 'D008461', 'D017365', 'D053719']","['Amines', 'Animals', 'Cattle', 'Chromatography, High Pressure Liquid', 'Chromatography, Liquid', 'Heterocyclic Compounds', 'Meat Products', 'Spices', 'Tandem Mass Spectrometry']",Inhibitory profiles of spices against free and protein-bound heterocyclic amines of roast beef patties as revealed by ultra-performance liquid chromatography-tandem mass spectrometry and principal component analysis.,"['Q000032', None, None, None, None, 'Q000032', 'Q000032', 'Q000032', None]","['analysis', None, None, None, None, 'analysis', 'analysis', 'analysis', None]",https://www.ncbi.nlm.nih.gov/pubmed/28933794,2018
28873738,"Here we characterised the aroma of smoked, oven-dried, and sun-dried paprikas by sensorial evaluation and analysis of their volatile profiles. The sensorial panel defined smoked paprikas as having an intense, persistent, smoked odour and flavour and the highest acceptability. The oven-dried paprikas had a fruity odour and flavour related with aroma notes to fresh peppers. The sun-dried paprikas were associated with straw aromas and the worse valued. The chemical classes of volatile compounds also defined the paprika types. The smoked paprikas were richer in alcohols, phenols, pyrroles, and pyranones, whereas the oven-dried samples were characterised by their aldehydes and terpenes. The sun-dried paprikas had significantly lower amounts of odorant substances than the smoked and oven-dried paprikas. The intensity, persistence and smokiness descriptors (associated with smoked paprika) were positively associated with phenols and alcohols. Aldehydes were positively correlated with a fruity descriptor, which defined oven-dried paprikas, and negatively correlated with intensity, persistence, smokiness, toasted, and dried pepper descriptors. The descriptor straw, which defined sun-dried paprikas, was negatively correlated with alcohols, phenols, furans, and pyrroles.","Food research international (Ottawa, Ont.)","['D002212', 'D005511', 'D008401', 'D009812', 'D025341', 'D052617', 'D055549']","['Capsicum', 'Food Handling', 'Gas Chromatography-Mass Spectrometry', 'Odorants', 'Principal Component Analysis', 'Solid Phase Microextraction', 'Volatile Organic Compounds']",Impact of volatile composition on the sensorial attributes of dried paprikas.,"['Q000737', None, None, 'Q000032', None, None, 'Q000032']","['chemistry', None, None, 'analysis', None, None, 'analysis']",https://www.ncbi.nlm.nih.gov/pubmed/28873738,2019
28863259,"Pyrisoxazole is a chiral fungicide with high sterilizing activity to the plant pathogenic bacteria and thus can be used for protecting the vegetables from gray mold, powdery mildew, and brown rot. The present work aimed to explore its stereoselective degradation in cabbage, pakchoi, and pepper samples. The enantioseparation and analysis on chiral column Lux Cellulose-3 based on liquid chromatography tandem mass spectrometry was developed coupled to the QuEChERS method. The recoveries of the stereoisomers in various vegetables ranged from 72.6 to 124% with RSD lower than 5.0%. Enantioselective dissipation of pyrisoxazole in vegetables displayed that (-)-A-pyrisoxazole was preferentially degraded versus (+)-A-pyrisoxazole in all the vegetables. (+)-B-pyrisoxazole was preferentially degraded in cabbage, while there was no obvious enantioselectivity in pakchoi and pepper. Meanwhile, stereoselectivity analysis demonstrated that (±)-A-pyrisoxazole was degraded faster than (±)-B-pyrisoxazole in pakchoi and pepper, while there was no stereoselective degradation in cabbages.",Journal of agricultural and food chemistry,"['D001937', 'D002851', 'D005506', 'D005659', 'D029222', 'D013237', 'D053719', 'D014230', 'D014675']","['Brassica', 'Chromatography, High Pressure Liquid', 'Food Contamination', 'Fungicides, Industrial', 'Piper nigrum', 'Stereoisomerism', 'Tandem Mass Spectrometry', 'Triazoles', 'Vegetables']","Stereoselective Analysis and Degradation of Pyrisoxazole in Cabbage, Pakchoi, and Pepper by Liquid Chromatography Tandem Mass Spectrometry.","['Q000737', None, 'Q000032', 'Q000737', 'Q000737', None, None, 'Q000737', 'Q000737']","['chemistry', None, 'analysis', 'chemistry', 'chemistry', None, None, 'chemistry', 'chemistry']",https://www.ncbi.nlm.nih.gov/pubmed/28863259,2017
28764063,"A new analytical procedure, based on liquid chromatography with diode array and fluorescence detection, has been proposed for the determination of bioactive compounds in vegetables and spices after hard cap espresso extraction. This novel extraction system has been tested for the determination of capsaicin and dihydrocapsaicin from fresh chilli and sweet pepper, piperine from ground pepper, curcumin from turmeric and curry, and myristicin from nutmeg. Extraction efficiency was evaluated by using acetonitrile:water and ethanol:water mixtures. The proposed method allows the extraction of samples with 100mL of 60% (v/v) ethanol in water. The obtained limits of quantification for the proposed procedure ranged from 0.07 to 0.30mgg",Food chemistry,"['D002212', 'D002853', 'D026323', 'D017365', 'D014675']","['Capsicum', 'Chromatography, Liquid', 'Myristica', 'Spices', 'Vegetables']",Hard cap espresso extraction and liquid chromatography determination of bioactive compounds in vegetables and spices.,"[None, None, None, None, None]","[None, None, None, None, None]",https://www.ncbi.nlm.nih.gov/pubmed/28764063,2017
28744561,"The recent detection of nuts (including peanut) in spices across the globe has led to enormous recalls of several spices and food products in the last two years. The lack of validated detection methods specific for spices makes it difficult to assess allergen presence at trace levels. Because of the urgent need for confirmation of possible peanut presence in chili peppers, an LC-MS/MS method was optimized and developed for this particular food matrix. Although several studies optimized LC-MS detection strategies specific for peanuts, the presence of complex components in the spices (e.g., phenolic components) makes method optimization and validation necessarily. Focus was laid on validation of the method with real incurred chili peppers (whereby a known amount of peanut is added) at low concentrations, to deal with possible matrix interferences. LC-MS/MS proves to be a good alternative to the currently most applied methods (ELISA and RT-PCR) and can be used as a complementary method of analysis when results are unclear. Peanut marker peptides were selected based on their abundancy in digested incurred chili peppers. The limit of detection was determined to be 24 ppm (mg peanut/kg), a level whereby the risk for potential allergic reactions is zero, considering the typical portion size of spices. The chili pepper powder under investigation proved to contain low levels of peanuts after LC-MS/MS, ELISA, and RT-PCR testing. Graphical abstract Standard curve of the detected peanuts in chili pepper samples using the novel LC-MS/MS method.",Analytical and bioanalytical chemistry,"['D000485', 'D010367', 'D002212', 'D002853', 'D004797', 'D005504', 'D005506', 'D057230', 'D010455', 'D016133', 'D053719']","['Allergens', 'Arachis', 'Capsicum', 'Chromatography, Liquid', 'Enzyme-Linked Immunosorbent Assay', 'Food Analysis', 'Food Contamination', 'Limit of Detection', 'Peptides', 'Polymerase Chain Reaction', 'Tandem Mass Spectrometry']",Development of an LC-MS/MS method for the detection of traces of peanut allergens in chili pepper.,"['Q000032', 'Q000737', 'Q000737', None, None, 'Q000379', 'Q000032', None, 'Q000032', None, None]","['analysis', 'chemistry', 'chemistry', None, None, 'methods', 'analysis', None, 'analysis', None, None]",https://www.ncbi.nlm.nih.gov/pubmed/28744561,2018
28722197,"A liquid chromatography-electrospray ionization tandem mass spectrometry method was developed for simple and accurate detection of the fungicides difenoconazole, propiconazole and pyraclostrobin in peppers and soil. Three fungicides residues were extracted from samples by acetonitrile and cleaned up by dispersive solid-phase extraction before instrumental analysis. The accuracy and precision of the method were evaluated by conducting an intra- and inter-day recovery experiment. The limits of quantification and detection of difenoconazole, propiconazole and pyraclostrobin in pepper and soil were 0.005 and 0.0015 mg/kg, respectively. The recoveries were investigated by spiking pepper and soil at three levels, and were found to be in the ranges 79.62-103.15% for difenoconazole, 85.94-103.35% for propiconazole and 80.14-97.69% for pyraclostrobin, with relative standard deviations <6.5%. Field experiments were conducted in three locations in China. The half-lives of difenoconazole, propiconazole and pyraclostrobin were 5.3-11.5 days in peppers and 6.1-32.5 days in soil. At harvest, pepper samples were found to contain difenoconazole, propiconazole and pyraclostrobin well below the maximum residue limits of European Union at the interval of 21 days after last application following the recommended dosage.",Biomedical chromatography : BMC,"['D002212', 'D002681', 'D002853', 'D004148', 'D005659', 'D057230', 'D016014', 'D010573', 'D015203', 'D012987', 'D000073739', 'D053719', 'D014230']","['Capsicum', 'China', 'Chromatography, Liquid', 'Dioxolanes', 'Fungicides, Industrial', 'Limit of Detection', 'Linear Models', 'Pesticide Residues', 'Reproducibility of Results', 'Soil', 'Strobilurins', 'Tandem Mass Spectrometry', 'Triazoles']","Simultaneous determination and method validation of difenoconazole, propiconazole and pyraclostrobin in pepper and soil by LC-MS/MS in field trial samples from three provinces, China.","['Q000737', None, 'Q000379', 'Q000032', 'Q000032', None, None, 'Q000032', None, 'Q000737', 'Q000032', 'Q000379', 'Q000032']","['chemistry', None, 'methods', 'analysis', 'analysis', None, None, 'analysis', None, 'chemistry', 'analysis', 'methods', 'analysis']",https://www.ncbi.nlm.nih.gov/pubmed/28722197,2018
28708032,"In this study, we aimed to establish a method for determination of multiple mycotoxins such as aflatoxins, ochratoxin A, and zearalenone in red pepper powder samples based on the quick, easy, cheap, effective, rugged, and safe (QuEChERS) approach for extraction and cleanup, with detection and quantification by high-performance liquid chromatography coupled with tandem mass spectrometry (LC-MS/MS) in both positive- and negative-ion modes. The developed LC-MS/MS analytical method was compared with an enzyme-linked immunosorbent assay (ELISA) to improve the reliability of our developed method. The linearity, precision, and accuracy were validated for the LC-MS/MS methods. The results obtained with the LC-MS/MS were linear, with a correlation coefficient (R",Journal of food protection,"['D002212', 'D002851', 'D002853', 'D004797', 'D009183', 'D015203', 'D056910', 'D053719']","['Capsicum', 'Chromatography, High Pressure Liquid', 'Chromatography, Liquid', 'Enzyme-Linked Immunosorbent Assay', 'Mycotoxins', 'Reproducibility of Results', 'Republic of Korea', 'Tandem Mass Spectrometry']",Comparison of a Newly Developed Liquid Chromatography with Tandem Mass Spectrometry Method and Enzyme-Linked Immunosorbent Assay for Detection of Multiple Mycotoxins in Red Pepper Powder.,"['Q000737', None, 'Q000379', 'Q000379', 'Q000302', None, None, 'Q000379']","['chemistry', None, 'methods', 'methods', 'isolation & purification', None, None, 'methods']",https://www.ncbi.nlm.nih.gov/pubmed/28708032,2017
28678344,"The objective of this study was to investigate prebiotic potential, chemical composition, and antioxidant capacity of spice extracts. Seven culinary spices including black pepper, cayenne pepper, cinnamon, ginger, Mediterranean oregano, rosemary, and turmeric were extracted with boiling water. Major chemical constituents were characterized by RP-HPLC-DAD method and antioxidant capacity was determined by measuring colorimetrically the extent to scavenge ABTS radical cations. Effects of spice extracts on the viability of 88 anaerobic and facultative isolates from intestinal microbiota were determined by using Brucella agar plates containing serial dilutions of extracts. A total of 14 phenolic compounds, a piperine, cinnamic acid, and cinnamaldehyde were identified and quantitated. Spice extracts exhibited high antioxidant capacity that correlated with the total amount of major chemicals. All spice extracts, with the exception of turmeric, enhanced the growth of Bifidobacterium spp. and Lactobacillus spp. All spices exhibited inhibitory activity against selected Ruminococcus species. Cinnamon, oregano, and rosemary were active against selected Fusobacterium strains and cinnamon, rosemary, and turmeric were active against selected Clostridium spp. Some spices displayed prebiotic-like activity by promoting the growth of beneficial bacteria and suppressing the growth of pathogenic bacteria, suggesting their potential role in the regulation of intestinal microbiota and the enhancement of gastrointestinal health. The identification and quantification of spice-specific phytochemicals provided insight into the potential influence of these chemicals on the gut microbial communities and activities. Future research on the connections between spice-induced changes in gut microbiota and host metabolism and disease preventive effect in animal models and humans is needed.",Journal of food science,"['D000818', 'D000975', 'D002212', 'D002851', 'D002935', 'D030024', 'D006801', 'D007777', 'D031341', 'D010636', 'D010936', 'D056692', 'D017365']","['Animals', 'Antioxidants', 'Capsicum', 'Chromatography, High Pressure Liquid', 'Cinnamomum zeylanicum', 'Curcuma', 'Humans', 'Lactobacillaceae', 'Origanum', 'Phenols', 'Plant Extracts', 'Prebiotics', 'Spices']",Prebiotic Potential and Chemical Composition of Seven Culinary Spice Extracts.,"[None, 'Q000737', 'Q000737', None, 'Q000737', 'Q000737', None, 'Q000187', 'Q000737', 'Q000032', 'Q000737', 'Q000032', 'Q000032']","[None, 'chemistry', 'chemistry', None, 'chemistry', 'chemistry', None, 'drug effects', 'chemistry', 'analysis', 'chemistry', 'analysis', 'analysis']",https://www.ncbi.nlm.nih.gov/pubmed/28678344,2018
28432760,"A method validation study for the determination of ochratoxin A in black and white pepper (Piper spp.), nutmeg (Myristica fragrans), spice mix (blend of ginger, turmeric, pepper, nutmeg, and chili), cocoa powder, and drinking chocolate was conducted according to the International Harmonized Protocol of the International Union of Pure and Applied Chemistry. The method is based on the extraction of samples with aqueous methanol, followed by a cleanup of the extract with an immunoaffinity column. The determination is carried out by reversed-phase LC coupled with a fluorescence detector. The study involved 25 participants representing a cross-section of research, private, and official control laboratories from 12 European Union (EU) Member States, together with Turkey and Macedonia. Mean recoveries ranged from 71 to 85% for spices and from 85 to 88% for cocoa and drinking chocolate. The RSDr values ranged from 5.6 to 16.7% for spices and from 4.5 to 18.7% for cocoa and drinking chocolate. The RSDR values ranged from 9.5 to 22.6% for spices and from 13.7 to 30.7% for cocoa and drinking chocolate. The resulting Horwitz ratios ranged from 0.4 to 1 for spices and from 0.6 to 1.4 for cocoa and drinking chocolate according to the Horwitz function modified by Thompson. The method showed acceptable within-laboratory and between-laboratory precision for each matrix, and it conforms to requirements set by current EU legislation.",Journal of AOAC International,"['D000069956', 'D002851', 'D005506', 'D026323', 'D009793', 'D029222', 'D017365']","['Chocolate', 'Chromatography, High Pressure Liquid', 'Food Contamination', 'Myristica', 'Ochratoxins', 'Piper nigrum', 'Spices']","Determination of Ochratoxin A in Black and White Pepper, Nutmeg, Spice Mix, Cocoa, and Drinking Chocolate by High-Performance Liquid Chromatography Coupled with Fluorescence Detection: Collaborative Study.","['Q000032', None, None, 'Q000737', 'Q000032', 'Q000737', 'Q000032']","['analysis', None, None, 'chemistry', 'analysis', 'chemistry', 'analysis']",https://www.ncbi.nlm.nih.gov/pubmed/28432760,2017
28060498,"The aromatic descriptor ""green"", reflecting grape unripeness in French red wines, is frequently associated with the levels of 3-alkyl-2-methoxypyrazines, particularly 3-isobutyl-2-methoxypyrazine (IBMP), which has bell pepper nuances. Nevertheless, not all green aromatic expressions in red wines correlate with 3-alkyl-2-methoxypyrazine concentrations. This study considered sensory and chemical approaches using Cabernet Sauvignon wines obtained from grapes harvested at one-month intervals during the 2014 and 2015 vintages to investigate other volatile odoriferous compounds. Semipreparative HPLC fractionation of wine extracts revealed a fraction with specific green aromas in the early harvest wines. Its sensory impact was confirmed by omission and reconstitution tests. Then, multidimensional gas chromatography coupled with olfactometry and mass spectrometry (MDGC-O-MS/TOF) was used for molecular characterization of the aroma compounds associated with the green aromas. Surprisingly, eucalyptol (1,8-cineole), with menthol odor was highlighted and assayed at concentrations sometimes above its olfactory detection threshold in Cabernet Sauvignon and Fer Servadou wines. Sensory tests confirmed its impact at several concentrations detected in French red wines (up to 2.61 ± 0.03 μg/L) on the menthol nuance and overall green perception, particularly via an additive effect with IBMP. Quantitation of 1,8-cineole in Cabernet Sauvignon and Merlot grapes during berry development in 2015 revealed its varietal origin with abundant concentrations in unripe berries and decrease during grape maturation. Moreover, the implication of an invasive plant (Artemisia verlotiorum) growing in certain vineyards was shown to be responsible for increased 1,8-cineole concentrations in some wines.",Journal of agricultural and food chemistry,"['D019306', 'D002851', 'D003511', 'D000077591', 'D005504', 'D005602', 'D006801', 'D058865', 'D013058', 'D039821', 'D009812', 'D064367', 'D011719', 'D027843', 'D055549', 'D014920']","['Artemisia', 'Chromatography, High Pressure Liquid', 'Cyclohexanols', 'Eucalyptol', 'Food Analysis', 'France', 'Humans', 'Introduced Species', 'Mass Spectrometry', 'Monoterpenes', 'Odorants', 'Olfactometry', 'Pyrazines', 'Vitis', 'Volatile Organic Compounds', 'Wine']","1,8-Cineole in French Red Wines: Evidence for a Contribution Related to Its Various Origins.","[None, None, 'Q000032', None, 'Q000379', None, None, None, 'Q000379', 'Q000032', 'Q000032', 'Q000379', 'Q000032', 'Q000737', 'Q000032', 'Q000032']","[None, None, 'analysis', None, 'methods', None, None, None, 'methods', 'analysis', 'analysis', 'methods', 'analysis', 'chemistry', 'analysis', 'analysis']",https://www.ncbi.nlm.nih.gov/pubmed/28060498,2017
