PMID,abstract,journal,mesh_UIds,mesh_terms,paper,qual_UIds,qual_terms,webpage,year
17117787,"An HPLC method has been developed for the analysis of extracts of fresh peppers containing capsaicinoids and of both capsaicinoids and piperines in pepper-containing foods produced and sold in Korea. The HPLC method was optimized by defining how composition of the mobile phase affected retention times. Both identification and quantification were based on retention times and the following criteria: linearity of the UV response at 280 nm in HPLC, recoveries from spiked samples, and observed individual molecular ions in the mass spectra of the extracts determined by liquid chromatography-mass spectrometry. This method, with a limit of detection of approximately 15-30 ng, was used to quantify the distribution of capsaicinoids in 11 Korean whole peppers and in 12 commercial pepper-containing foods. Total capsaicinoid levels of whole peppers ranged from 1.21 microg/g for the PR Gang ja variety to 121.1 microg/g for the Chung yang variety. The levels in food extracts, four of which also included two piperines, ranged from 11.0 microg/g for radish kimuchi to 3752 microg/g for capsaicin sauce. The results demonstrate (a) the usefulness of the HPLC method for the simultaneous analysis of capsaicinoids derived from red peppers and piperines derived from black and white peppers extracted from complex food matrices and (b) the wide-ranging spread of levels of pungent pepper compounds in fresh peppers and in pepper-containing foods consumed in Korea.",Journal of agricultural and food chemistry,"['D002211', 'D002212', 'D002851', 'D005504', 'D006801', 'D007723', 'D013058', 'D009812']","['Capsaicin', 'Capsicum', 'Chromatography, High Pressure Liquid', 'Food Analysis', 'Humans', 'Korea', 'Mass Spectrometry', 'Odorants']",Analysis of the contents of pungent compounds in fresh Korean red peppers and in pepper-containing foods.,"['Q000737', 'Q000737', None, 'Q000379', None, None, None, None]","['chemistry', 'chemistry', None, 'methods', None, None, None, None]",https://www.ncbi.nlm.nih.gov/pubmed/17117787,2007
17098784,"We report a comprehensive proteome analysis of chromoplasts from bell pepper (Capsicum annuum L.). The combination of a novel strategy for database-independent detection of proteins from tandem mass spectrometry (MS/MS) data with standard database searches allowed us to identify 151 proteins with a high level of confidence. These include several well-known plastid proteins but also novel proteins that were not previously reported from other plastid proteome studies. The majority of the identified proteins are active in plastid carbohydrate and amino acid metabolism. Among the most abundant individual proteins are capsanthin/capsorubin synthase and fibrillin, which are involved in the synthesis and storage of carotenoids that accumulate to high levels in chromoplasts. The relative abundances of the identified chromoplast proteins differ remarkably compared with their abundances in other plastid types, suggesting a chromoplast-specific metabolic network. Our results provide an overview of the major metabolic pathways active in chromoplasts and extend existing knowledge about prevalent metabolic activities of different plastid types.",Plant & cell physiology,"['D000595', 'D002212', 'D000071837', 'D018745', 'D008840', 'D008969', 'D010940', 'D018087', 'D020543', 'D024341']","['Amino Acid Sequence', 'Capsicum', 'Fibrillins', 'Genome, Plant', 'Microfilament Proteins', 'Molecular Sequence Data', 'Plant Proteins', 'Plastids', 'Proteome', 'Xanthophylls']",Proteome analysis of bell pepper (Capsicum annuum L.) chromoplasts.,"[None, 'Q000378', None, None, 'Q000378', None, 'Q000032', 'Q000378', 'Q000032', 'Q000378']","[None, 'metabolism', None, None, 'metabolism', None, 'analysis', 'metabolism', 'analysis', 'metabolism']",https://www.ncbi.nlm.nih.gov/pubmed/17098784,2007
17070775,"Two-dimensional gel electrophoresis (2-DE) was applied for the screening of Tobacco mosaic virus (TMV)-induced hot pepper (Capsicum annuum cv. Bugang) nuclear proteins. From differentially expressed protein spots, we acquired the matched peptide mass fingerprint (PMF) data, analyzed by MALDI-TOF MS, from the non-redundant hot pepper EST protein FASTA database using the VEMS 2.0 software. Among six identified nuclear proteins, the hot pepper 26S proteasome subunit RPN7 (CaRPN7) was subjected to further study. The level of CaRPN7 mRNA was specifically increased during incompatible TMV-P(0) interaction, but not during compatible TMV-P(1.2) interaction. When CaRPN7::GFP fusion protein was targeted in onion cells, the nuclei had been broken into pieces. In the hot pepper leaves, cell death was exacerbated and genomic DNA laddering was induced by Agrobacterium-mediated transient overexpression of CaPRN7. Thus, this report presents that the TMV-induced CaRPN7 may be involved in programmed cell death (PCD) in the hot pepper plant.",Biochemical and biophysical research communications,"['D000595', 'D017209', 'D002212', 'D002467', 'D015180', 'D018506', 'D008969', 'D019697', 'D018515', 'D010940', 'D046988', 'D021122', 'D020543', 'D012231', 'D019032', 'D014027']","['Amino Acid Sequence', 'Apoptosis', 'Capsicum', 'Cell Nucleus', 'Electrophoresis, Gel, Two-Dimensional', 'Gene Expression Regulation, Plant', 'Molecular Sequence Data', 'Onions', 'Plant Leaves', 'Plant Proteins', 'Proteasome Endopeptidase Complex', 'Protein Subunits', 'Proteome', 'Rhizobium', 'Spectrometry, Mass, Matrix-Assisted Laser Desorption-Ionization', 'Tobacco Mosaic Virus']",Functional study of hot pepper 26S proteasome subunit RPN7 induced by Tobacco mosaic virus from nuclear proteome analysis.,"[None, None, 'Q000378', 'Q000378', None, None, None, 'Q000378', 'Q000378', 'Q000378', 'Q000096', 'Q000378', 'Q000378', 'Q000235', None, 'Q000502']","[None, None, 'metabolism', 'metabolism', None, None, None, 'metabolism', 'metabolism', 'metabolism', 'biosynthesis', 'metabolism', 'metabolism', 'genetics', None, 'physiology']",https://www.ncbi.nlm.nih.gov/pubmed/17070775,2007
17048188,"The present study focused on vitamin A and carotenoids (alpha-and beta-carotene, lutein and zeaxanthin, beta-cryptoxanthin, lycopene) daily intake from the Italian total diet. The input of some food groups (cereals, vegetables, fruits, milk and dairy, meat and meat products, fish) most responsible for major and minor contributions to the daily intake of these molecules was evaluated. Furthermore the contribution to the dietary intake of beta-carotene and lutein of the most consumed vegetables in the market basket of the Italian total diet (beets, brassica vegetables, carrots, chicory, courgette (zucchini), green beans, lettuce, peas, pepper, spinach, tomatoes) was also investigated. Vitamin A daily intake was 855 mg/person/day. The vegetables food group made the greatest contribution (37%), followed by the meat and meat products food group (23%). The Italian total diet provided 14.3 mg/person/day of carotenoids; lycopene was the highest (7.4 mg/day), followed by lutein + zeaxanthin (4 mg/day), beta-carotene (2.6 mg/day), alpha-carotene (0.15 mg/day), and beta-cryptoxanthin (0.17 mg/day). Carrots and tomatoes were the main sources of beta-carotene in the diet, otherwise the daily consumption of leafy vegetables (spinach, beets, lettuce) made the main contribution to lutein + zeaxanthin daily intake.",International journal for vitamin and nutrition research. Internationale Zeitschrift fur Vitamin- und Ernahrungsforschung. Journal international de vitaminologie et de nutrition,"['D016588', 'D000975', 'D002338', 'D002851', 'D065366', 'D004034', 'D005504', 'D006801', 'D007558', 'D014975', 'D000077276', 'D015995', 'D014675', 'D014801', 'D024341', 'D065146', 'D019207']","['Anticarcinogenic Agents', 'Antioxidants', 'Carotenoids', 'Chromatography, High Pressure Liquid', 'Cryptoxanthins', 'Diet Surveys', 'Food Analysis', 'Humans', 'Italy', 'Lutein', 'Lycopene', 'Prevalence', 'Vegetables', 'Vitamin A', 'Xanthophylls', 'Zeaxanthins', 'beta Carotene']",Intake of vitamin A and carotenoids from the Italian population--results of an Italian total diet study.,"['Q000008', 'Q000008', 'Q000008', None, None, None, None, None, 'Q000453', 'Q000008', None, None, None, 'Q000008', 'Q000008', None, 'Q000008']","['administration & dosage', 'administration & dosage', 'administration & dosage', None, None, None, None, None, 'epidemiology', 'administration & dosage', None, None, None, 'administration & dosage', 'administration & dosage', None, 'administration & dosage']",https://www.ncbi.nlm.nih.gov/pubmed/17048188,2007
17041029,"The U-box motif is a conserved domain found in the diverse isoforms of E3 ubiquitin ligase in eukaryotes. From water-stressed hot pepper (Capsicum annuum L. cv Pukang) plants, we isolated C. annuum putative U-box protein 1 (CaPUB1), which encodes a protein containing a single U-box motif in its N-terminal region. In vitro ubiquitination and site-directed mutagenesis assays revealed that CaPUB1 possessed E3 ubiquitin ligase activity and that the U-box motif was indeed essential for its enzyme activity. RNA gel-blot analysis showed that CaPUB1 mRNA was induced rapidly by a broad spectrum of abiotic stresses, including drought, high salinity, cold temperature, and mechanical wounding, but not in response to ethylene, abscisic acid, or a bacterial pathogen, suggesting its role in the early events in the abiotic-related defense response. Because transgenic work was extremely difficult in hot pepper, in this study we overexpressed CaPUB1 in Arabidopsis (Arabidopsis thaliana) to provide cellular information on the function of this gene in the development and plant responses to abiotic stresses. Transgenic Arabidopsis plants that constitutively expressed the CaPUB1 gene under the control of the cauliflower mosaic virus 35S promoter had markedly longer hypocotyls and roots and grew more rapidly than the wild type, leading to an early bolting phenotype. Microscopic analysis showed that 35S::CaPUB1 roots had increased numbers of small-sized cells, resulting in disordered, highly populated cell layers in the cortex, endodermis, and stele. In addition, CaPUB1-overexpressing plants displayed increased sensitivity to water stress and mild salinity. These results indicate that CaPUB1 is functional in Arabidopsis cells, thereby effectively altering cell and tissue growth and also the response to abiotic stresses. Comparative proteomic analysis showed that the level of RPN6 protein, a non-ATPase subunit of the 26S proteasome complex, was significantly reduced in 35SCaPUB1 seedlings as compared to the wild type. Pull-down and ubiquitination assays demonstrated that RPN6 interacted physically with CaPUB1 and was ubiquitinated in a CaPUB1-dependent manner in vitro. Although the physiological function of CaPUB1 is not yet clear, there are several possibilities for its involvement in a subset of physiological responses to counteract dehydration and high-salinity stresses in transgenic Arabidopsis seedlings.",Plant physiology,"['D020816', 'D000595', 'D017360', 'D002212', 'D049109', 'D018076', 'D015180', 'D010450', 'D004926', 'D008969', 'D010641', 'D010940', 'D030821', 'D040901', 'D012441', 'D029701', 'D016415', 'D019032', 'D044767']","['Amino Acid Motifs', 'Amino Acid Sequence', 'Arabidopsis', 'Capsicum', 'Cell Proliferation', 'DNA, Complementary', 'Electrophoresis, Gel, Two-Dimensional', 'Endopeptidases', 'Escherichia coli', 'Molecular Sequence Data', 'Phenotype', 'Plant Proteins', 'Plants, Genetically Modified', 'Proteomics', 'Saccharomyces cerevisiae', 'Saccharomyces cerevisiae Proteins', 'Sequence Alignment', 'Spectrometry, Mass, Matrix-Assisted Laser Desorption-Ionization', 'Ubiquitin-Protein Ligases']",Heterologous expression and molecular and cellular characterization of CaPUB1 encoding a hot pepper U-Box E3 ubiquitin ligase homolog.,"[None, None, 'Q000235', 'Q000201', None, 'Q000737', None, 'Q000378', 'Q000235', None, None, 'Q000737', 'Q000166', None, 'Q000378', 'Q000378', None, None, 'Q000737']","[None, None, 'genetics', 'enzymology', None, 'chemistry', None, 'metabolism', 'genetics', None, None, 'chemistry', 'cytology', None, 'metabolism', 'metabolism', None, None, 'chemistry']",https://www.ncbi.nlm.nih.gov/pubmed/17041029,2007
17031752,"The influence of soil contamination by inorganic and organic arsenic compounds on uptake, accumulation, and transformation of arsenic in pepper (Capsicum annum L.) was investigated in greenhouse pot experiments under controlled conditions. Pepper plants were cultivated in substrate amended by aqueous solutions of arsenite, arsenate, methylarsonic acid (MA), and dimethylarsinic acid (DMA) applied individually into cultivation substrate at concentrations of 15 mg As per kg of substrate. The plant availability of the arsenicals increased in the order arsenite = arsenate < MA < DMA. The highest arsenic concentrations were found in roots followed by stems, leaves, and fruits regardless of arsenic compound applied. In the control samples of pepper fruits, As(III), As(V), and DMA were present (25%, 37%, and 39% of the water-extractable arsenic). In control stems + leaves and roots, As(V) was the major compound (63% and 53% in a phosphate buffer extract) followed by As(III) representing 33% and 42%. Additionally, low concentrations (not exceeding 5%) of DMA and MA were detected as well. In all the soils analyzed after the first harvest of pepper fruits, arsenate was the dominating compound followed by arsenite. Methylarsonic acid, methylarsonous acid, and DMA were present at varying concentrations depending on the individual soil treatments. In the treated plants, the arsenic compounds in plant tissues reflected predominantly the extractable portions of arsenic compounds present in soil after amendment, and this pattern was more significant in the first part of vegetation period. The results confirmed the ability of generative parts of plants to accumulate preferably organic arsenic compounds, whereas in the roots and aboveground biomass, mainly inorganic arsenic species are present. Evidently, the source of soil arsenic contamination affects significantly the extractable portions of arsenic compounds in soil and subsequently the distribution of arsenic compounds within the plants.",Archives of environmental contamination and toxicology,"['D001149', 'D001151', 'D001152', 'D018053', 'D002101', 'D002212', 'D002851', 'D018514', 'D012989', 'D021241']","['Arsenates', 'Arsenic', 'Arsenicals', 'Arsenites', 'Cacodylic Acid', 'Capsicum', 'Chromatography, High Pressure Liquid', 'Plant Structures', 'Soil Pollutants', 'Spectrometry, Mass, Electrospray Ionization']",Response of pepper plants (Capsicum annum L.) on soil amendment by inorganic and organic compounds of arsenic.,"['Q000493', 'Q000032', 'Q000032', 'Q000493', 'Q000493', 'Q000378', None, 'Q000187', 'Q000032', None]","['pharmacokinetics', 'analysis', 'analysis', 'pharmacokinetics', 'pharmacokinetics', 'metabolism', None, 'drug effects', 'analysis', None]",https://www.ncbi.nlm.nih.gov/pubmed/17031752,2007
17002415,"Four new acyclic diterpene glycosides named capsianosides (1-4), together with 12 known compounds, were isolated from the fresh sweet pepper fruits of Capsicum annuum L., a plant used as a vegetable food, spice, and external medicine. The chemical structures of new natural compounds, as well as their absolute configurations, were established by means of spectroscopic data including infrared, high-resolution mass spectrometry, and one- and two-dimensional nuclear magnetic resonance and by chemical derivatization. The known capsidiol (11) showed bacteriostatic properties in vitro against Helicobacter pylori with a minimum inhibitory concentration (MIC) of 200 microg/mL when compared with the commercial drug metronidazole (MIC, 250 microg/mL). Some purified components were also tested for their antioxidant activities.",Journal of agricultural and food chemistry,"['D000900', 'D000975', 'D002212', 'D004224', 'D005638', 'D006027', 'D016480', 'D009682', 'D009844']","['Anti-Bacterial Agents', 'Antioxidants', 'Capsicum', 'Diterpenes', 'Fruit', 'Glycosides', 'Helicobacter pylori', 'Magnetic Resonance Spectroscopy', 'Oligosaccharides']",New constituents of sweet Capsicum annuum L. fruits and evaluation of their biological activity.,"['Q000494', 'Q000494', 'Q000737', 'Q000032', 'Q000737', 'Q000032', 'Q000187', None, None]","['pharmacology', 'pharmacology', 'chemistry', 'analysis', 'chemistry', 'analysis', 'drug effects', None, None]",https://www.ncbi.nlm.nih.gov/pubmed/17002415,2006
16989312,"Acetone extracts from eggplant (Solanum melongena L.) and violet pepper (Capsicum annuum L.) peels both belonging to the Solanaceae plant family were characterized with respect to their anthocyanin profiles, colour qualities and antioxidant capacities. According to HPLC-DAD-MS3 analyses the major anthocyanin in eggplant was delphinidin-3-rutinoside, while the predominant pigment in violet pepper was assigned to delphinidin-3-trans-coumaroylrutinoside-5-glucoside. Since virtually all anthocyanins were delphinidin-based, the effect of acylation and glycosylation patterns on colour stability and antioxidant capacity could be assessed. Application of two in vitro-assays for antioxidant capacity assessment revealed that eggplant generally exhibited higher values compared to violet pepper which was ascribed to 3,5-diglycosylated structures predominating in the latter. The higher extent of acylation in violet pepper was reflected by a more purplish colour shade of the extracts, but did not translate into a higher stability against fading which again was attributed to additional glycosyl substitution at C5. These findings support the relevance of structure-related activities of anthocyanins both for understanding food colour and their particular nutritional value.","Zeitschrift fur Naturforschung. C, Journal of biosciences","['D000872', 'D000975', 'D002212', 'D002851', 'D003116', 'D004355', 'D005638', 'D013058', 'D032323']","['Anthocyanins', 'Antioxidants', 'Capsicum', 'Chromatography, High Pressure Liquid', 'Color', 'Drug Stability', 'Fruit', 'Mass Spectrometry', 'Solanum melongena']","Anthocyanins, colour and antioxidant properties of eggplant (Solanum melongena L.) and violet pepper (Capsicum annuum L.) peel extracts.","['Q000737', 'Q000737', 'Q000737', None, None, None, None, None, 'Q000737']","['chemistry', 'chemistry', 'chemistry', None, None, None, None, None, 'chemistry']",https://www.ncbi.nlm.nih.gov/pubmed/16989312,2006
16923603,"The U.S. Department of Agriculture (USDA) pepper (Capsicum spp.) germplasm collection contains several thousand members or accessions. Many of these species and cultivars have not been analyzed for their concentrations of ascorbic acid, capsaicin, and total phenolic compounds, which are important antioxidants having a number of benefits for human health. The objective of this investigation was to select candidate accessions of hot pepper having high concentrations of ascorbic acid, capsaicin, free sugars, and total phenols for use as parents in breeding for these compounds. Seventeen accessions of pepper from the core Capsicum germplasm collection (four accessions of Capsicum chinense; five accessions of C. baccatum; six accessions of C. annuum; and two of C. frutescens) were field grown and their mature fruits were analyzed for their antioxidant composition. Concentrations of these compounds tended to be higher in C. chinense and C. baccatum, than in C. annuum and C. frutescens. Across all accessions the concentration of total phenols was correlated with ascorbic acid (r = 0.97) and free sugars (r = 0.80). Concentrations of total phenols (1.4, 1.3, and 1.3 mg g-1 fruit) and ascorbic acid (1.6, 1.2, and 1.3 mg g-1 fruit) were significantly greater in PI-633757, PI-387833, and PI-633754, respectively, compared to other accessions analyzed. Total capsaicinoids concentrations were greatest (1.3 mg g-1 fruit) in PI-438622 and lowest (0.002 mg g-1 fruit) in Grif-9320. The great variability within and among Capsicum species for these phytochemicals suggests that these selected accessions may be useful as parents in hybridization programs to produce fruits with value-added traits.","Journal of environmental science and health. Part. B, Pesticides, food contaminants, and agricultural wastes","['D000975', 'D001205', 'D002211', 'D002212', 'D005504', 'D013058', 'D010636', 'D010802', 'D010936', 'D013045']","['Antioxidants', 'Ascorbic Acid', 'Capsaicin', 'Capsicum', 'Food Analysis', 'Mass Spectrometry', 'Phenols', 'Phylogeny', 'Plant Extracts', 'Species Specificity']",Antioxidants in hot pepper: variation among accessions.,"['Q000032', 'Q000032', 'Q000032', 'Q000737', 'Q000379', 'Q000379', 'Q000032', None, 'Q000032', None]","['analysis', 'analysis', 'analysis', 'chemistry', 'methods', 'methods', 'analysis', None, 'analysis', None]",https://www.ncbi.nlm.nih.gov/pubmed/16923603,2006
16921567,"A new analytical procedure using a hollow fiber supported liquid membrane (HFSLM) has been developed for the simultaneous determination of pesticide residues in vegetables by liquid chromatography (LC) coupled with electrospray mass spectrometry (MS). The extraction technique requires minimal sample preparation and solvent consumption. Optimum extraction conditions have been evaluated with respect to sample pH, ionic strength, liquid membrane composition, extraction time, stirring rate and acceptor composition. The extraction method has been validated for matrices such as cucumber, tomato and pepper, indicating that cucumber can be selected as representative matrix for routine analysis of these food commodities. Linear ranges of pesticides in vegetable samples were 10 to 200 microg/kg, and the repeatability of the method was less than 20% for the lowest calibration point. The limits of detection ranged from 0.06 to 2.7 microg/kg and the limits of quantification from 0.2 to 9.0 microg/kg, which were low enough to determine the pesticide residues at concentrations below or equal to the maximum residue levels (MRLs) specified by European Union. The method was finally applied to the determination of more than 20 pesticides in market vegetable samples and the concentrations found in these samples were always lower than the MRLs. This new approach can be considered as a powerful alternative to the traditional extraction techniques.",Rapid communications in mass spectrometry : RCM,"['D002851', 'D005506', 'D010573', 'D015203', 'D021241', 'D014675']","['Chromatography, High Pressure Liquid', 'Food Contamination', 'Pesticide Residues', 'Reproducibility of Results', 'Spectrometry, Mass, Electrospray Ionization', 'Vegetables']",Application of hollow fiber supported liquid membrane extraction to the simultaneous determination of pesticide residues in vegetables by liquid chromatography/mass spectrometry.,"['Q000295', 'Q000032', 'Q000032', None, 'Q000295', 'Q000737']","['instrumentation', 'analysis', 'analysis', None, 'instrumentation', 'chemistry']",https://www.ncbi.nlm.nih.gov/pubmed/16921567,2007
16919285,"The determination of four Sudan dyes by means of high-performance liquid chromatography (HPLC) with chemiluminescence (CL) detection was proposed. The method was based on the enhancement effect of Sudan dyes on the chemiluminescence reaction between luminol and BrO-, which was on-line electrogenerated by constant current electrolysis. The separation was carried out on Nucleosil RP-C18 column (250 mm x 4.6 mm i.d., 5 microm, pore size, 100 A) at 35 degrees C. The mobile phase consisted of a V (methanol): V (0.2% aqueous formic acid) = 90:10 solution. At a flow-rate of 1.0 ml min(-1), the total run time was 25 min. The effects of several parameters on the HPLC resolution and CL emission were studied systematically. For the four Sudan dyes, the limits of detection (LOD) at a signal-to-noise of 3 ranged from 4 to 8 microg kg(-1) and the limits of quantification (LOQ) at a signal-to-noise of 10 ranged from 13 to 27 microg kg(-1). The relative standard deviations (RSD) of intra-and inter-day precision were below 4.4%. The average recoveries for all four Sudan dyes (spiked at the levels of 1.0 and 1.5 mg kg(-1)) in chilli tomato sauce and hot chilli pepper ranged from 94% to 105%, and the relative standard deviations of the quantitative results were from 2.5 to 4.2%. The proposed method had been successfully applied to the determination of four Sudan dyes in hot chilli products.",Journal of chromatography. A,"['D001391', 'D002212', 'D002851', 'D004396', 'D005504', 'D008163', 'D009284', 'D015203']","['Azo Compounds', 'Capsicum', 'Chromatography, High Pressure Liquid', 'Coloring Agents', 'Food Analysis', 'Luminescent Measurements', 'Naphthols', 'Reproducibility of Results']",Development and optimization of an analytical method for the determination of Sudan dyes in hot chilli pepper by high-performance liquid chromatography with on-line electrogenerated BrO- -luminol chemiluminescence detection.,"['Q000032', 'Q000737', 'Q000379', 'Q000032', 'Q000379', 'Q000379', 'Q000032', None]","['analysis', 'chemistry', 'methods', 'analysis', 'methods', 'methods', 'analysis', None]",https://www.ncbi.nlm.nih.gov/pubmed/16919285,2006
