PMID,abstract,journal,mesh_UIds,mesh_terms,paper,qual_UIds,qual_terms,webpage,year
23244129,"Chilean red chili peppers contaminated with aflatoxins were reported in a previous study. If the development of gallbladder cancer (GBC) in Chile is associated with a high level of consumption of aflatoxin-contaminated red chili peppers, such peppers from other countries having a high GBC incidence rate may also be contaminated with aflatoxins. We aimed to determine whether this might be the case for red chili peppers from Bolivia and Peru. A total of 7 samples (3 from Bolivia, 4 from Peru) and 3 controls (2 from China, 1 from Japan) were evaluated. Aflatoxins were extracted with acetonitrile:water (9:1, v/v) and eluted through an immuno-affinity column. The concentrations of aflatoxins B1, B2, G1, and G2 were measured using high-performance liquid chromatography (HPLC), and then the detected aflatoxins were identified using HPLC-mass spectrometry. In some but not all of the samples from Bolivia and Peru, aflatoxin B1 or aflatoxins B1 and B2 were detected. In particular, aflatoxin B1 or total aflatoxin concentrations in a Bolivian samples were above the maximum levels for aflatoxins in spices proposed by the European Commission. Red chili peppers from Bolivia and Peru consumed by populations having high GBC incidence rates would appear to be contaminated with aflatoxins. These data suggest the possibility that a high level of consumption of aflatoxin-contaminated red chili peppers is related to the development of GBC, and the association between the two should be confirmed by a case-control study.",Asian Pacific journal of cancer prevention : APJCP,"['D000348', 'D001838', 'D002212', 'D002677', 'D002681', 'D002851', 'D005506', 'D005706', 'D006801', 'D015994', 'D007564', 'D010568', 'D011042', 'D011379', 'D012307']","['Aflatoxins', 'Bolivia', 'Capsicum', 'Chile', 'China', 'Chromatography, High Pressure Liquid', 'Food Contamination', 'Gallbladder Neoplasms', 'Humans', 'Incidence', 'Japan', 'Peru', 'Poisons', 'Prognosis', 'Risk Factors']","Aflatoxin contamination of red chili pepper from Bolivia and Peru, countries with high gallbladder cancer incidence rates.","['Q000009', None, 'Q000009', None, None, None, 'Q000032', 'Q000209', None, None, None, None, 'Q000009', None, None]","['adverse effects', None, 'adverse effects', None, None, None, 'analysis', 'etiology', None, None, None, None, 'adverse effects', None, None]",https://www.ncbi.nlm.nih.gov/pubmed/23244129,2013
23238236,"Capsicum annuum L. is reported to be the most widely cultivated species. Recently, waste of vegetable processing, like seeds, has been the subject of many studies as an attempt to find new, alternative and cheap resources of bioactive compounds with application in several industries. Despite their chemical, biological and ecological importance, C. annuum seeds are still poorly studied. To improve the knowledge on the metabolic profile of this matrix, a targeted metabolite analysis was performed in ""sweet Italian"" and ""Reus long pairal"" pepper seeds. Sterols, triterpenes, organic acids, fatty acids and volatile compounds were determined by different chromatographic methods. The antioxidant activity was assessed against DPPH(·), superoxide and nitric oxide radicals. A concentration-dependent activity was noticed against all radicals. Acetylcholinesterase inhibitory capacity was also evaluated, but no effect was found. Data provide evidence of great similarities between ""sweet Italian"" and ""Reus long pairal"" pepper seeds. The present study indicates that C. annuum seeds are a potential source of valuable bioactive compounds that could be used in food industry.",Food and chemical toxicology : an international journal published for the British Industrial Biological Research Association,"['D000975', 'D002212', 'D002800', 'D002851', 'D010936', 'D012639', 'D014675', 'D055549']","['Antioxidants', 'Capsicum', 'Cholinesterase Inhibitors', 'Chromatography, High Pressure Liquid', 'Plant Extracts', 'Seeds', 'Vegetables', 'Volatile Organic Compounds']",Chemical assessment and antioxidant capacity of pepper (Capsicum annuum L.) seeds.,"['Q000032', 'Q000737', 'Q000032', None, 'Q000032', 'Q000737', 'Q000737', 'Q000032']","['analysis', 'chemistry', 'analysis', None, 'analysis', 'chemistry', 'chemistry', 'analysis']",https://www.ncbi.nlm.nih.gov/pubmed/23238236,2013
23208697,"With the aim of expanding the applicability of a kit-based enzyme-linked immunosorbent assay (ELISA) for the neonicotinoid insecticide thiamethoxam, the ELISA was newly applied to three kinds of agricultural samples (green pepper, eggplant and spinach). To offer the ELISA as a screening analysis for thiamethoxam residues, a rapid and simple method of extraction by hand-shaking was used, and speed-up and simplification of the sample treatment before the ELISA analysis were examined. Finally, the validity of the ELISA combined with the proposed extraction method was verified against a reference high-performance liquid chromatography (HPLC) method using real-world agricultural samples.",Journal of the science of food and agriculture,"['D018556', 'D004797', 'D005506', 'D007306', 'D000073943', 'D009574', 'D010078', 'D010573', 'D000077922', 'D013844']","['Crops, Agricultural', 'Enzyme-Linked Immunosorbent Assay', 'Food Contamination', 'Insecticides', 'Neonicotinoids', 'Nitro Compounds', 'Oxazines', 'Pesticide Residues', 'Thiamethoxam', 'Thiazoles']",Rapid and simple immunochemical screening combined with hand-shaking extraction for thiamethoxam residue in agricultural products.,"['Q000737', None, 'Q000032', 'Q000737', None, 'Q000737', 'Q000737', 'Q000737', None, 'Q000737']","['chemistry', None, 'analysis', 'chemistry', None, 'chemistry', 'chemistry', 'chemistry', None, 'chemistry']",https://www.ncbi.nlm.nih.gov/pubmed/23208697,2013
23175966,"The application of HPLC-diode array detector (DAD) after SPE for identification and quantitative analysis of pesticides in red and green pepper samples is demonstrated. An HPLC procedure on an RP column (C18) was developed for analysis of selected pesticides from different chemical groups: metamitron, metalaxyl, linuron, and prometryn. Average recoveries for C18 Polar Plus cartridges and solvents by the proposed RP-HPLC-DAD method after SPE are presented. Average recoveries from the spiked samples and the SDs were 22.5 +/- 2.2, 138.0 +/- 4.1, 78.6 +/- 2.8, and 109.2 +/- 2.3% for metamitron, metalaxyl, linuron, and prometryn, respectively, at concentrations of 7 microg/g in the plant material. The efficiency of the SPE procedure was evaluated using real food samples. The quantities of prometryn, linuron, metalaxyl, and metamitron determined were in the ranges of 0.02-2.24 microg/g (n = 24), 0.08-1.01 microg/g (n = 9), 1.61-2.28 microg/g (n=4), and 0.05-1.07 microg/g (n = 3), respectively, in plant material sampled in 2011. The method was validated for precision, repeatability, and accuracy.",Journal of AOAC International,"['D002212', 'D002851', 'D056148', 'D005506', 'D015394', 'D010573', 'D010575', 'D015203', 'D012680', 'D052616']","['Capsicum', 'Chromatography, High Pressure Liquid', 'Chromatography, Reverse-Phase', 'Food Contamination', 'Molecular Structure', 'Pesticide Residues', 'Pesticides', 'Reproducibility of Results', 'Sensitivity and Specificity', 'Solid Phase Extraction']",Application of RP-HPLC-diode array detector after SPE to the determination of pesticides in pepper samples.,"['Q000737', 'Q000379', 'Q000379', None, None, 'Q000737', 'Q000737', None, None, None]","['chemistry', 'methods', 'methods', None, None, 'chemistry', 'chemistry', None, None, None]",https://www.ncbi.nlm.nih.gov/pubmed/23175966,2012
23150126,"Red pepper spice (RP) and turmeric (TM) are used as flavorings in foods and for medicinal purposes. Utilizing a randomized, doubled-blinded, placebo-controlled, crossover design (2-week washout), 4-week supplementation with RP (1 g/d) or TM (2.8 g/d) was tested for influences on inflammation and oxidative stress in 62 overweight/obese (body mass index ≥ 27 kg/m²) females (40-75 years) with systemic inflammation (C-reactive protein, CRP ≥ 2 mg/l). Overnight, fasted blood samples were collected pre- and post-supplementation, and analyzed for oxidative stress (F₂-isoprostanes, oxidized low density lipoprotein), inflammation (CRP and seven inflammatory cytokines), and metabolic profiles using gas chromatography-mass spectrometry with multivariate partial least square discriminant analysis (PLS-DA). Pre- to post-supplementation measures of inflammation and oxidative stress for both RP and TM did not differ when compared to placebo (all interaction effects, P > 0.05), and global metabolic difference scores calculated through PLS-DA were non-significant (both spices, Q²Y < 0.40). These data indicate that 4-week supplementation with RP or TM at culinary levels does not alter oxidative stress or inflammation in overweight/obese females with systemic inflammation, or cause a significant shift in the global metabolic profile.","Plant foods for human nutrition (Dordrecht, Netherlands)","['D000328', 'D000368', 'D015415', 'D001794', 'D001823', 'D015992', 'D002097', 'D002212', 'D018592', 'D030024', 'D016207', 'D019587', 'D004311', 'D028441', 'D005260', 'D006801', 'D007249', 'D008077', 'D055432', 'D008875', 'D050177', 'D018384', 'D010936', 'D017365']","['Adult', 'Aged', 'Biomarkers', 'Blood Pressure', 'Body Composition', 'Body Mass Index', 'C-Reactive Protein', 'Capsicum', 'Cross-Over Studies', 'Curcuma', 'Cytokines', 'Dietary Supplements', 'Double-Blind Method', 'F2-Isoprostanes', 'Female', 'Humans', 'Inflammation', 'Lipoproteins, LDL', 'Metabolomics', 'Middle Aged', 'Overweight', 'Oxidative Stress', 'Plant Extracts', 'Spices']",Influence of red pepper spice and turmeric on inflammation and oxidative stress biomarkers in overweight females: a metabolomics approach.,"[None, None, 'Q000097', None, 'Q000187', None, 'Q000378', 'Q000737', None, 'Q000737', 'Q000097', None, None, 'Q000097', None, None, 'Q000517', 'Q000097', 'Q000379', None, 'Q000097', 'Q000187', 'Q000737', None]","[None, None, 'blood', None, 'drug effects', None, 'metabolism', 'chemistry', None, 'chemistry', 'blood', None, None, 'blood', None, None, 'prevention & control', 'blood', 'methods', None, 'blood', 'drug effects', 'chemistry', None]",https://www.ncbi.nlm.nih.gov/pubmed/23150126,2014
23124390,"Pepper fruit is typically red, but green, orange and yellow cultivars are gaining consumer acceptance. This color variation is mainly due to variations in carotenoid composition. Orange color in pepper can result from a number of carotenoid profiles, but its genetic basis is only partly known. We identified an EMS-induced orange-fruited mutant using the wild-type blocky red-fruited cultivar 'Maor' as progenitor. This mutant accumulates mainly β-carotene in its fruit, instead of the complex pattern of red and yellow carotenoids in 'Maor'. We identified an A(709) to G transition in the cDNA of β-CAROTENE HYDROXYLASE2 in the orange pepper and complete co-segregation of this single-nucleotide polymorphism with the mutated phenotype. We therefore hypothesized that β-CAROTENE HYDROXYLASE2 controls the orange mutation in pepper. Interestingly, the expression of β-CAROTENE HYDROXYLASE2 and additional carotenogenesis genes was elevated in the orange fruit compared with the red fruit, indicating possible feedback regulation of genes in the pathway. Because carotenoids serve as precursors for volatile compounds, we compared the volatile profiles of the two parents. The orange pepper contained more volatile compounds than 'Maor', with predominant elevation of norisoprenoids derived from β-carotene degradation, while sesquiterpenes predominated in the red fruit. Because of the importance of β-carotene as a provitamin A precursor in the human diet, the orange-fruited mutant might serve as a natural source for pepper fruit biofortification. Moreover, the change in volatile profile may result in a fruit flavor that differs from other pepper cultivars.",TAG. Theoretical and applied genetics. Theoretische und angewandte Genetik,"['D002212', 'D005638', 'D008401', 'D018506', 'D017343', 'D005819', 'D006899', 'D009154', 'D045792', 'D010641', 'D010858', 'D017422', 'D055549', 'D019207']","['Capsicum', 'Fruit', 'Gas Chromatography-Mass Spectrometry', 'Gene Expression Regulation, Plant', 'Genes, Plant', 'Genetic Markers', 'Mixed Function Oxygenases', 'Mutation', 'Norisoprenoids', 'Phenotype', 'Pigmentation', 'Sequence Analysis, DNA', 'Volatile Organic Compounds', 'beta Carotene']",Induced mutation in β-CAROTENE HYDROXYLASE results in accumulation of β-carotene and conversion of red to orange color in pepper fruit.,"['Q000737', 'Q000737', None, None, None, None, 'Q000235', None, 'Q000032', None, None, None, 'Q000032', 'Q000096']","['chemistry', 'chemistry', None, None, None, None, 'genetics', None, 'analysis', None, None, None, 'analysis', 'biosynthesis']",https://www.ncbi.nlm.nih.gov/pubmed/23124390,2013
23075786,"A strain of Streptomyces cavourensis subsp. cavourensis (coded as SY224) antagonistic to Colletotrichum gloeosporioides infecting pepper plants was isolated. SY224 produced lytic enzymes such as chitinase, beta-1,3-glucanase, lipase, and protease in respective assays. To examine for antifungal activity, the treatments amended with the nonsterilized supernatant resulted in the highest growth inhibition rate of about 92.9% and 87.4% at concentrations of 30&percnt; and 10&percnt;, respectively. However, the sterilized treatments (autoclaved or chloroform treated) gave a lowered but significant inhibitory effect of about 63.4% and 62.6% for the 10% supernatant concentration, and 75.2% and 74.8% for the of 30% supernatant concentration in the PDA agar medium, respectively, indicative of the role of a nonprotein, heat stable compound on the overall effect. This antifungal compound, which inhibited spore germination and altered hyphal morphology, was extracted by EtOAc and purified by ODS, silica gel, Sephadex LH-20 column, and HPLC, where an active fraction was confirmed to be 2-furancarboxaldehyde by GS-CI MS techniques. These results suggested that SY224 had a high potential in the biocontrol of anthracnose in pepper, mainly due to a combined effect of lytic enzymes and a non-protein, heatstable antifungal compound, 2-furancarboxaldehyde.",Journal of microbiology and biotechnology,"['D000935', 'D001426', 'D061046', 'D002212', 'D002686', 'D002688', 'D002725', 'D002851', 'D020231', 'D004789', 'D005663', 'D008401', 'D043326', 'D025301', 'D008049', 'D008826', 'D010935', 'D058428', 'D013172', 'D013302']","['Antifungal Agents', 'Bacterial Proteins', 'Biological Control Agents', 'Capsicum', 'Chitin', 'Chitinases', 'Chloroform', 'Chromatography, High Pressure Liquid', 'Colletotrichum', 'Enzyme Activation', 'Furans', 'Gas Chromatography-Mass Spectrometry', 'Glucan 1,3-beta-Glucosidase', 'Hyphae', 'Lipase', 'Microbial Sensitivity Tests', 'Plant Diseases', 'Silica Gel', 'Spores, Fungal', 'Streptomyces']","Biocontrol of anthracnose in pepper using chitinase, beta-1,3 glucanase, and 2-furancarboxaldehyde produced by Streptomyces cavourensis SY224.","['Q000737', 'Q000737', None, 'Q000382', 'Q000737', 'Q000737', 'Q000494', None, 'Q000187', None, 'Q000737', 'Q000379', 'Q000737', 'Q000187', 'Q000737', None, 'Q000382', 'Q000737', 'Q000187', 'Q000737']","['chemistry', 'chemistry', None, 'microbiology', 'chemistry', 'chemistry', 'pharmacology', None, 'drug effects', None, 'chemistry', 'methods', 'chemistry', 'drug effects', 'chemistry', None, 'microbiology', 'chemistry', 'drug effects', 'chemistry']",https://www.ncbi.nlm.nih.gov/pubmed/23075786,2013
23050605,"Raw and heat-processed jalapeño peppers (green and red) were evaluated for their pigment profile and antioxidant capacity. Sixty-seven pigments were separated and characterized by HPLC-DAD-MS, including carotenoids (isomers and esters), chlorophylls, and pheophytins. The distinctive characteristics of this pepper genotype were the presence of antheraxanthin monoesters, zeaxanthin monoesters, mutatoxanthin diesters, and a higher content of free capsanthin relative to the mono- and diesterified forms. Chlorophyll a and free all-trans-lutein were the major pigments in raw green peppers, whereas free all-trans-capsanthin was the most abundant pigment in raw red peppers. Twelve compounds were generated by the heat treatments, mainly pheophytins and cis isomers of carotenoids. Heat treatments affected differentially the concentration of individual pigments. Red peppers showed a higher antioxidant capacity than green fruits. Heating caused minor changes in the antioxidant capacity of peppers.",Journal of agricultural and food chemistry,"['D000975', 'D002212', 'D002851', 'D003296', 'D005638', 'D006358', 'D013058', 'D010860', 'D013237']","['Antioxidants', 'Capsicum', 'Chromatography, High Pressure Liquid', 'Cooking', 'Fruit', 'Hot Temperature', 'Mass Spectrometry', 'Pigments, Biological', 'Stereoisomerism']",Effect of heat processing on the profile of pigments and antioxidant capacity of green and red jalapeño peppers.,"['Q000737', 'Q000737', None, None, 'Q000737', None, None, 'Q000737', None]","['chemistry', 'chemistry', None, None, 'chemistry', None, None, 'chemistry', None]",https://www.ncbi.nlm.nih.gov/pubmed/23050605,2013
23046858,"The main objective of this study was to assess the exposure of Catalonian (Spain) population to AFs. Thus, two sub-objectives were considered: (1) to assess the occurrence of AFs in food marketed in Catalonia, and (2) to assess the consumption of those foods susceptible to AFs contamination by Catalonian population. AFs were analysed in a total of 603 samples considering special commodities as free-gluten, ethnic or baby foods. Analytical method consisted of an extraction and clean-up of aflatoxins step using immunoaffinity columns, and determination by HPLC with post-column photochemical derivatization and fluorescence detection. Food dietary intake was assessed using a food frequency questionnaire, administered to 1387 individuals by trained interviewers. Contamination and consumption raw datasets were combined by means of a direct method and a stochastic method, building the pseudo-parametric bootstrap confidence intervals of the main outputs. Margins of exposure (MoE) and cancer incidence were estimated for the different collectives. The highest percentages of positive samples were found in red pepper, pistachios and peanuts. Considering our results, the most exposed group was the celiac sufferer collective followed by the adolescents; however health concern should not be expected in the population groups.",Food and chemical toxicology : an international journal published for the British Industrial Biological Research Association,"['D000293', 'D000328', 'D000348', 'D000368', 'D002648', 'D002675', 'D002851', 'D004032', 'D004781', 'D005260', 'D005506', 'D006801', 'D007223', 'D007225', 'D008297', 'D008875', 'D018570', 'D013030', 'D011795', 'D055815']","['Adolescent', 'Adult', 'Aflatoxins', 'Aged', 'Child', 'Child, Preschool', 'Chromatography, High Pressure Liquid', 'Diet', 'Environmental Exposure', 'Female', 'Food Contamination', 'Humans', 'Infant', 'Infant Food', 'Male', 'Middle Aged', 'Risk Assessment', 'Spain', 'Surveys and Questionnaires', 'Young Adult']",Occurrence and exposure assessment of aflatoxins in Catalonia (Spain).,"[None, None, 'Q000032', None, None, None, 'Q000379', None, None, None, 'Q000032', None, None, None, None, None, None, None, None, None]","[None, None, 'analysis', None, None, None, 'methods', None, None, None, 'analysis', None, None, None, None, None, None, None, None, None]",https://www.ncbi.nlm.nih.gov/pubmed/23046858,2013
23013011,"Pectin substances were extracted from food plants: sweet pepper Capsicum annuum L., carrot sowing Daucus sativus L., bulb onion Allium cepa L., white cabbage Brassica oleracea L. by two methods with acid solutions similar to gastric environment. The pectins that were extracted were characterized by Monosaccharide composition and quantitative contents of uronic acids, neutral monosaccharides, methoxy groups, protein. The inhibitory effect of all extracted pectin-protein complexes on activity of pharmaceutical drugs of human pancreatic alpha-amylase was detected. It was found that the inhibitory effect of isolated pectin substances was dependent upon the species of plant source, the manner of pectin substance extraction, the chemical composition and acting concentrations. The ability of pectin substances to suppress enzyme activity was found in a range of pectin concentrations from 0.5 up to 1.5 %. It was revealed that extracted pectin substances from bulb onion and white cabbage by acid solution with pepsin had a 2.4-3.4 times greater inhibiting effect on the human pancreatic alpha-amylase activity in comparison with pectin substances extracted by solution without pepsin from the same plant sources in high concentrations.",Rossiiskii fiziologicheskii zhurnal imeni I.M. Sechenova,"['D040761', 'D001937', 'D002212', 'D002851', 'D018552', 'D005750', 'D006801', 'D006851', 'D059627', 'D009005', 'D019697', 'D055292', 'D010368', 'D010434']","['Biomimetic Materials', 'Brassica', 'Capsicum', 'Chromatography, High Pressure Liquid', 'Daucus carota', 'Gastric Juice', 'Humans', 'Hydrochloric Acid', 'Liquid Phase Microextraction', 'Monosaccharides', 'Onions', 'Pancreatic alpha-Amylases', 'Pectins', 'Pepsin A']",[Effect of pectin substances on activity of human pancreatic alpha-amylase in vitro].,"['Q000737', 'Q000737', 'Q000737', None, 'Q000737', 'Q000737', None, 'Q000737', None, 'Q000032', 'Q000737', 'Q000037', 'Q000737', 'Q000378']","['chemistry', 'chemistry', 'chemistry', None, 'chemistry', 'chemistry', None, 'chemistry', None, 'analysis', 'chemistry', 'antagonists & inhibitors', 'chemistry', 'metabolism']",https://www.ncbi.nlm.nih.gov/pubmed/23013011,2012
22964046,"This paper reports on the development and optimization of a modified Quick, Easy, Cheap Effective, Rugged and Safe (QuEChERS) based extraction technique coupled with a clean-up dispersive-solid phase extraction (dSPE) as a new, reliable and powerful strategy to enhance the extraction efficiency of free low molecular-weight polyphenols in selected species of dietary vegetables. The process involves two simple steps. First, the homogenized samples are extracted and partitioned using an organic solvent and salt solution. Then, the supernatant is further extracted and cleaned using a dSPE technique. Final clear extracts of vegetables were concentrated under vacuum to near dryness and taken up into initial mobile phase (0.1% formic acid and 20% methanol). The separation and quantification of free low molecular weight polyphenols from the vegetable extracts was achieved by ultrahigh pressure liquid chromatography (UHPLC) equipped with a phodiode array (PDA) detection system and a Trifunctional High Strength Silica capillary analytical column (HSS T3), specially designed for polar compounds. The performance of the method was assessed by studying the selectivity, linear dynamic range, the limit of detection (LOD) and limit of quantification (LOQ), precision, trueness, and matrix effects. The validation parameters of the method showed satisfactory figures of merit. Good linearity (Rvalues2>0.954; (+)-catechin in carrot samples) was achieved at the studied concentration range. Reproducibility was better than 3%. Consistent recoveries of polyphenols ranging from 78.4 to 99.9% were observed when all target vegetable samples were spiked at two concentration levels, with relative standard deviations (RSDs, n=5) lower than 2.9%. The LODs and the LOQs ranged from 0.005 μg mL(-1) (trans-resveratrol, carrot) to 0.62 μg mL(-1) (syringic acid, garlic) and from 0.016 μg mL(-1) (trans-resveratrol, carrot) to 0.87 μg mL(-1) ((+)-catechin, carrot) depending on the compound. The method was applied for studying the occurrence of free low molecular weight polyphenols in eight selected dietary vegetables (broccoli, tomato, carrot, garlic, onion, red pepper, green pepper and beetroot), providing a valuable and promising tool for food quality evaluation.",Journal of chromatography. A,"['D000097', 'D000704', 'D002851', 'D016018', 'D057230', 'D008278', 'D008970', 'D059808', 'D015203', 'D012965', 'D052616', 'D014675']","['Acetonitriles', 'Analysis of Variance', 'Chromatography, High Pressure Liquid', 'Least-Squares Analysis', 'Limit of Detection', 'Magnesium Sulfate', 'Molecular Weight', 'Polyphenols', 'Reproducibility of Results', 'Sodium Chloride', 'Solid Phase Extraction', 'Vegetables']",A new and improved strategy combining a dispersive-solid phase extraction-based multiclass method with ultra high pressure liquid chromatography for analysis of low molecular weight polyphenols in vegetables.,"['Q000737', None, 'Q000379', None, None, 'Q000737', None, 'Q000032', None, 'Q000737', 'Q000379', 'Q000737']","['chemistry', None, 'methods', None, None, 'chemistry', None, 'analysis', None, 'chemistry', 'methods', 'chemistry']",https://www.ncbi.nlm.nih.gov/pubmed/22964046,2013
