PMID,abstract,journal,mesh_UIds,mesh_terms,paper,qual_UIds,qual_terms,webpage,year
27328902,"The analysis of citrinin in various cereals (wheat, oats, maize, rice, and rye and multigrain breakfast cereal), red yeast rice (dietary supplement and traditional medicine), distillers dried grain with solubles, and barley (animal feed) was carried out using a citrinin immunoaffinity column (IAC) for sample cleanup before LC analysis with fluorescence detection (LC-fluorescence). To establish method performance characteristics, wheat was spiked with citrinin at levels of 10-200 μg/kg, whereas red yeast rice was spiked at levels of 100-3000 μg/kg. Methanol-water (75 + 25, v/v) was used for the extraction of cereals and animal feed, and extraction was with 100% methanol for red yeast rice. Cleanup used a commercial citrinin IAC, followed by LC-fluorescence (λex, 330 nm; λem, 500 nm). Recoveries ranged from 80 to 110%, with r from 0.7 to 4.3%. The LOQ for citrinin in both wheat and red yeast rice was 10 μg/kg, with an LOD of 3 μg/kg. Satisfactory performance was demonstrated in a proficiency testing exercise for a sample of maize contaminated with both citrinin and ochratoxin A. It was concluded that the commercial citrinin IAC was capable of providing an efficient and effective cleanup of complex food and feed matrixes to enable citrinin to be reliably determined with the specific LC-fluorescence system used. ",Journal of AOAC International,"['D000821', 'D000818', 'D001688', 'D002846', 'D002853', 'D002953', 'D019587', 'D002523', 'D013050']","['Animal Feed', 'Animals', 'Biological Products', 'Chromatography, Affinity', 'Chromatography, Liquid', 'Citrinin', 'Dietary Supplements', 'Edible Grain', 'Spectrometry, Fluorescence']","Analysis of Citrinin in Cereals, Red Yeast Rice Dietary Supplement, and Animal Feed by Immunoaffinity Column Cleanup and LC with Fluorescence Detection.","['Q000032', None, 'Q000737', None, None, 'Q000032', 'Q000032', 'Q000737', None]","['analysis', None, 'chemistry', None, None, 'analysis', 'analysis', 'chemistry', None]",https://www.ncbi.nlm.nih.gov/pubmed/27328902,2017
27188907,"Our pilot study examined the potential of exhaled breath analysis in studying the metabolic effects of dietary fiber (DF). We hypothesized that a high-fiber diet (HFD) containing whole grain rye changes volatile organic compound (VOC) levels in exhaled breath and that consuming a single meal affects these levels. Seven healthy men followed a week-long low-fiber diet (17 g/d) and HFD (44 g/d) in a randomized crossover design. A test meal containing 50 g of the available carbohydrates from wheat bread was served as breakfast after each week. Alveolar exhaled breath samples were analyzed at fasting state and 30, 60, and 120 minutes after this meal parallel to plasma glucose, insulin, and serum lipids. We used solid-phase microextraction and gas chromatography-mass spectrometry for detecting changes in 15 VOCs. These VOCs were acetone, ethanol, 1-propanol, 2-propanol, 1-butanol, acetic acid, propionic acid, butyric acid, valeric acid, isovaleric acid, 2-methylbutyric acid, hexanoic acid, acetoin, diacetyl, and phenol. Exhaled breath 2-methylbutyric acid in the fasting state and 1-propanol at 120 minutes decreased (P = .091 for both) after an HFD. Ingestion of the test meal increased ethanol, 1-propanol, acetoin, propionic acid, and butyric acid levels while reducing acetone, 1-butanol, diacetyl, and phenol levels. Both DF diet content and having a single meal affected breathVOCs. Exploring exhaled breath further could help to develop tools for monitoring the metabolic effects of DF.","Nutrition research (New York, N.Y.)","['D000328', 'D001786', 'D001944', 'D002784', 'D018592', 'D004032', 'D004040', 'D004043', 'D004734', 'D015444', 'D005215', 'D008401', 'D006801', 'D007328', 'D008297', 'D008875', 'D010865', 'D019518', 'D012434', 'D014280', 'D014908', 'D055549', 'D000067348']","['Adult', 'Blood Glucose', 'Breath Tests', 'Cholesterol', 'Cross-Over Studies', 'Diet', 'Dietary Carbohydrates', 'Dietary Fiber', 'Energy Metabolism', 'Exercise', 'Fasting', 'Gas Chromatography-Mass Spectrometry', 'Humans', 'Insulin', 'Male', 'Middle Aged', 'Pilot Projects', 'Postprandial Period', 'Secale', 'Triglycerides', 'Triticum', 'Volatile Organic Compounds', 'Whole Grains']",Fiber content of diet affects exhaled breath volatiles in fasting and postprandial state in a pilot crossover study.,"[None, 'Q000378', None, 'Q000097', None, None, 'Q000008', 'Q000008', None, None, None, None, None, 'Q000097', None, None, None, None, 'Q000737', 'Q000097', 'Q000737', 'Q000032', 'Q000737']","[None, 'metabolism', None, 'blood', None, None, 'administration & dosage', 'administration & dosage', None, None, None, None, None, 'blood', None, None, None, None, 'chemistry', 'blood', 'chemistry', 'analysis', 'chemistry']",https://www.ncbi.nlm.nih.gov/pubmed/27188907,2018
27068799,"Consumers, especially those with allergies and/or intolerances, should have confidence in two critical areas of food safety: foods should be correctly labelled and free from contamination. To this end, global proteomic analysis employing LC-MS/MS of gluten-enriched extracts derived from 12 barley cultivars was undertaken, providing a foundation for the development of MS-based quantitative methodologies that would enable the detection of barley contamination in foods. Subsequently, a number of candidate barley-specific peptide markers were evaluated by multiple-reaction monitoring MS. From an initial panel of 26, 9 peptide markers were unique to barley, yet present in a wide range of barley varieties. The analytical method was then used to examine a range of breakfast cereals and was able to detect barley in a barley-based breakfast cereal and a muesli, but additionally allowed detection of contamination of cereals that were comprised of ancient grains and in commercially-sourced flours, including amaranth, chia, buckwheat, millet, rice, corn, oats, rye, spelt and green wheat (0.01-0.08%). LC-MS/MS provides an alternative to ELISA approaches to monitor food safety and the identification of robust and sensitive cereal-specific peptide markers is the first step toward the adoption of this technology.",Journal of proteomics,"['D015415', 'D002446', 'D002853', 'D002523', 'D005506', 'D001467', 'D014674', 'D040901', 'D013045', 'D053719']","['Biomarkers', 'Celiac Disease', 'Chromatography, Liquid', 'Edible Grain', 'Food Contamination', 'Hordeum', 'Plant Proteins, Dietary', 'Proteomics', 'Species Specificity', 'Tandem Mass Spectrometry']",Identification of barley-specific peptide markers that persist in processed foods and are capable of detecting barley contamination by LC-MS/MS.,"['Q000032', 'Q000517', None, 'Q000737', 'Q000032', 'Q000737', 'Q000032', 'Q000379', None, None]","['analysis', 'prevention & control', None, 'chemistry', 'analysis', 'chemistry', 'analysis', 'methods', None, None]",https://www.ncbi.nlm.nih.gov/pubmed/27068799,2017
27019314,"Commercial preparations of 6-phytase A alone and in combination with phytase B were used in rye breadmaking. Determination of bioavailability of myo-inositol phosphates from bread was performed by an in vitro digestion method followed by the measurement of an uptake by Caco-2 cells in culture. In bread supplemented with a combination of 6-phytase A and phytase B, a significant reduction in phytate content was observed from 3.62 μmol/g in the control to 0.7 μmol/g. Bioavailability of phytate estimated by an in vitro method simulating digestion in the human alimentary tract was 9% in the bread supplemented with phytase B, 7% (6-phytase A) and 50% in the control bread. In cell culture, the bioaccessibilities of inositol triphosphates from bread baked with the addition of 6-phytase A was higher by 36% as compared to the samples baked with phytase B and by 32% in breads baked with combination of both phytases. ",International journal of food sciences and nutrition,"['D010832', 'D000837', 'D001939', 'D018938', 'D002851', 'D004043', 'D004063', 'D005433', 'D005503', 'D006801', 'D015544', 'D007295', 'D007408', 'D007527', 'D008954', 'D009753', 'D010766', 'D010833', 'D011044', 'D012434']","['6-Phytase', 'Anion Exchange Resins', 'Bread', 'Caco-2 Cells', 'Chromatography, High Pressure Liquid', 'Dietary Fiber', 'Digestion', 'Flour', 'Food Additives', 'Humans', 'Inositol 1,4,5-Trisphosphate', 'Inositol Phosphates', 'Intestinal Absorption', 'Isoenzymes', 'Models, Biological', 'Nutritive Value', 'Phosphorylation', 'Phytic Acid', 'Poland', 'Secale']",Profile and bioavailability analysis of myo-inositol phosphates in rye bread supplemented with phytases: a study using an in vitro method and Caco-2 monolayers.,"['Q000378', None, 'Q000032', None, None, 'Q000032', None, 'Q000032', 'Q000378', None, 'Q000032', 'Q000032', None, None, None, None, None, 'Q000032', None, 'Q000737']","['metabolism', None, 'analysis', None, None, 'analysis', None, 'analysis', 'metabolism', None, 'analysis', 'analysis', None, None, None, None, None, 'analysis', None, 'chemistry']",https://www.ncbi.nlm.nih.gov/pubmed/27019314,2017
26994601,"Accurate, reliable and sensitive detection methods for gluten are required to support current EU regulations. The enforcement of legislative levels requires that measurement results are comparable over time and between methods. This is not a trivial task for gluten which comprises a large number of protein targets. This paper describes a strategy for defining a set of specific analytical targets for wheat gluten. A comprehensive proteomic approach was applied by fractionating wheat gluten using RP-HPLC (reversed phase high performance liquid chromatography) followed by a multi-enzymatic digestion (LysC, trypsin and chymotrypsin) with subsequent mass spectrometric analysis. This approach identified 434 peptide sequences from gluten. Peptides were grouped based on two criteria: unique to a single gluten protein sequence; contained known immunogenic and toxic sequences in the context of coeliac disease. An LC-MS/MS method based on selected reaction monitoring (SRM) was developed on a triple quadrupole mass spectrometer for the specific detection of the target peptides. The SRM based screening approach was applied to gluten containing cereals (wheat, rye, barley and oats) and non-gluten containing flours (corn, soy and rice). A unique set of wheat gluten marker peptides were identified and are proposed as wheat specific markers.",Journal of proteomics,"['D015415', 'D002446', 'D002851', 'D005983', 'D040901', 'D013045', 'D053719', 'D014908']","['Biomarkers', 'Celiac Disease', 'Chromatography, High Pressure Liquid', 'Glutens', 'Proteomics', 'Species Specificity', 'Tandem Mass Spectrometry', 'Triticum']",Defining the wheat gluten peptide fingerprint via a discovery and targeted proteomics approach.,"['Q000032', 'Q000209', None, 'Q000032', 'Q000379', None, None, 'Q000737']","['analysis', 'etiology', None, 'analysis', 'methods', None, None, 'chemistry']",https://www.ncbi.nlm.nih.gov/pubmed/26994601,2017
26988518,"Phenolic compounds in beer have received considerable interest. Besides the more typical phenolic acids and flavonoids, beer contains also lesser-known compounds, such as hordatines, their agmatine precursors and other phenolamines. Current work shows that beers brewed from wheat or rye malts, in addition to barley malts, contain benzoxazinoids, a group of nitrogen containing secondary metabolites typical to wheat and rye. In this work, HPLC-DAD was used for the quantification of major benzoxazinoids in 32 wheat and four rye beers. Of the wheat beers 22 samples and all of the rye beers contained benzoxazinoids, or their breakdown products. Concentrations of DIBOA (2,4-dihydroxy-1,4-benzoxazin-3-one) (as aglycon) varied from 1.7 to 21.9mg/l in wheat beers and from 5.6 to 31.6mg/l in rye beers. Breakdown products BOA (benzoxazolin-2-one), found in 15 beers, and MBOA (6-methoxy-benzoxazolin-2-one), found in two beers, were measured at concentrations ranging from 2.4 to 10.7mg/l and 8.4 to 10.5mg/l, respectively. Identification of benzoxazinoids by UPLC-QTOF MS was done on selected beers. Benzoxazinoid profiles varied greatly between different wheat beers, and compared to rye beers the chemical diversity of benzoxazinoids was higher. As far as the authors know, this is the first time that other benzoxazinoids, rather than just the decomposition products BOA or MBOA, have been reported in beer. The results also show that benzoxazinoids can be present in beer glycosylated with three or four hexose units.",Food chemistry,"['D001515', 'D048588', 'D001583', 'D002851', 'D062385', 'D013058', 'D010936', 'D012434', 'D014908']","['Beer', 'Benzoxazines', 'Benzoxazoles', 'Chromatography, High Pressure Liquid', 'Hydroxybenzoates', 'Mass Spectrometry', 'Plant Extracts', 'Secale', 'Triticum']",Determination of benzoxazinoids in wheat and rye beers by HPLC-DAD and UPLC-QTOF MS.,"['Q000032', 'Q000737', 'Q000032', 'Q000379', 'Q000032', 'Q000379', 'Q000737', 'Q000737', 'Q000737']","['analysis', 'chemistry', 'analysis', 'methods', 'analysis', 'methods', 'chemistry', 'chemistry', 'chemistry']",https://www.ncbi.nlm.nih.gov/pubmed/26988518,2016
26947163,"The analysis of ergot alkaloids is generally performed by high-performance liquid chromatography (HPLC) coupled to fluorescence detection (FLD) or mass selective detection. As for monitoring only the sum of ergot alkaloids is relevant, a fast and easy screening method for the determination of the total alkaloid content was developed using planar solid phase extraction (pSPE). Applying pSPE, recently introduced for pesticide residue analysis in fruits and vegetables (Oellig and Schwack, 2011) and tea (Oellig and Schwack, 2012), all ergot alkaloids are concentrated in a target zone followed by detection as the sum. The herein presented method includes an ammonium acetate buffered extraction step, followed by a fast liquid-liquid partitioning pre-cleaning before pSPE is performed on high-performance thin-layer chromatography (HPTLC) amino plates with a single methanol development to separate the ergot alkaloids from the remaining matrix and to collect them in a single zone. For quantitation, the native fluorescence was used after dipping the plate in n-hexane/paraffin solution for fluorescence enhancement. Limits of detection and quantitation of 0.07 and 0.24 mg/kg rye, respectively, expressed as ergocristine, were well below the currently applied quality criterion limit for rye. Near-100% recoveries were obtained at relevant spiking levels for different rye flour samples. Hence, the fast pSPE-FLD is an efficient and reliable method to screen for the total ergot alkaloid content in rye and a rapid alternative to the HPLC determination of individual alkaloids and to summing them up. HPTLC-MS additionally enables the identification of the ergot alkaloid composition by a single mass spectrum, when utilized as a fingerprint, offering an easy differentiation of Secale cornutum from different origins.",Journal of chromatography. A,"['D002851', 'D002855', 'D004873', 'D004876', 'D005433', 'D005453', 'D013058', 'D012434', 'D052616']","['Chromatography, High Pressure Liquid', 'Chromatography, Thin Layer', 'Ergolines', 'Ergot Alkaloids', 'Flour', 'Fluorescence', 'Mass Spectrometry', 'Secale', 'Solid Phase Extraction']",Screening for total ergot alkaloids in rye flour by planar solid phase extraction-fluorescence detection and mass spectrometry.,"[None, None, 'Q000032', 'Q000032', 'Q000032', None, None, 'Q000737', None]","[None, None, 'analysis', 'analysis', 'analysis', None, None, 'chemistry', None]",https://www.ncbi.nlm.nih.gov/pubmed/26947163,2016
26834763,"Graminaceous arabinoxylans are distinguished by decoration with feruloylated monosaccharidic and oligosaccharidic side-chains. Although it is hypothesized that structural complexity and abundance of these feruloylated arabinoxylan side-chains may contribute, among other factors, to resistance of plant cell walls to enzymatic degradation, quantitative profiling approaches for these structural units in plant cell wall materials have not been described yet. Here we report the development and application of a rapid and robust method enabling the quantitative comparison of feruloylated side-chain profiles in cell wall materials following mildly acidic hydrolysis, C18-solid phase extraction (SPE), reduction under aprotic conditions, and liquid chromatography with diode-array detection/mass spectrometry (LC-DAD/MS) separation and detection. The method was applied to the insoluble fiber/cell wall materials isolated from 12 whole grains: wild rice (Zizania aquatica L.), long-grain brown rice (Oryza sativa L.), rye (Secale cereale L.), kamut (Triticum turanicum Jakubz.), wheat (Triticum aestivum L.), spelt (Triticum spelta L.), intermediate wheatgrass (Thinopyrum intermedium), maize (Zea mays L.), popcorn (Zea mays L. var. everta), oat (Avena sativa L.) (dehulled), barley (Hordeum vulgare L.) (dehulled), and proso millet (Panicum miliaceum L.). Between 51 and 96% of the total esterified monomeric ferulates were represented in the quantified compounds captured in the feruloylated side-chain profiles, which confirms the significance of these structures to the global arabinoxylan structure in terms of quantity. The method provided new structural insights into cereal grain arabinoxylans, in particular, that the structural moiety α-l-galactopyranosyl-(1→2)-β-d-xylopyranosyl-(1→2)-5-O-trans-feruloyl-l-arabinofuranose (FAXG), which had previously only been described in maize, is ubiquitous to cereal grains. ",Frontiers in plant science,[],[],Quantitative Profiling of Feruloylated Arabinoxylan Side-Chains from Graminaceous Cell Walls.,[],[],https://www.ncbi.nlm.nih.gov/pubmed/26834763,2016
26700312,"This paper investigated the possibility of leaving out the traditional clean-up step in the QuEChERS procedure and analysing non-cleaned extracts from fruit, vegetables and cereals with a combination of gas chromatography-tandem mass spectrometry (GC-MS/MS), back-flush technology and large-volume injection. By using calibration standards in cucumber matrix, recovery and precision were calculated in lettuce, orange and wheat for 109 pesticides at 0.01 and 0.1 mg kg(-1) in two sets of samples: one with and one without clean-up. For both spiking levels, 80-82% of the pesticides in the non-cleaned extracts and 80-84% of the pesticides in the cleaned extracts were within the acceptable recovery range of 70-120%. Precision data for both levels showed that 95% of the pesticides in the non-cleaned extracts and 93-95% of the pesticides in the cleaned extracts had RSDs below 20%. Recovery and precision data were determined using a two tailed t-test (p = 0.05). By using calibration standards in the respective matrix, we studied if the non-cleaned calibration standards gave an extra matrix effect compared with the cleaned standards by using the slope from calibration graphs and plotting the calculated extra matrix effect minus 100 for each compound. The results showed that for 79% of the pesticides, the extra matrix effect minus 100 was within the acceptable range of -20% to 20%. Five European Union proficiency tests on rye, mandarin, rice, pear and barley, respectively, from 2010 to 2012 were reanalysed omitting the clean-up step and showed satisfactory results. At least 70 injections of non-cleaned extracts were made without detecting any increased need for maintenance during the experimental period. Analysing non-cleaned QuEChERS extracts of lettuce, orange and wheat are possible under the conditions described in this paper because recovery, precision and specificity showed satisfactory results compared with samples subjected to traditional dispersive clean-up. ","Food additives & contaminants. Part A, Chemistry, analysis, control, exposure & risk assessment","['D002849', 'D002523', 'D005506', 'D005638', 'D010573', 'D053719', 'D014675']","['Chromatography, Gas', 'Edible Grain', 'Food Contamination', 'Fruit', 'Pesticide Residues', 'Tandem Mass Spectrometry', 'Vegetables']","Analysis of non-cleaned QuEChERS extracts for the determination of pesticide residues in fruit, vegetables and cereals by gas chromatography-tandem mass spectrometry.","[None, 'Q000737', 'Q000032', 'Q000737', 'Q000032', None, 'Q000737']","[None, 'chemistry', 'analysis', 'chemistry', 'analysis', None, 'chemistry']",https://www.ncbi.nlm.nih.gov/pubmed/26700312,2016
26515281,"A method is reported for the analysis of sterigmatocystin in various food and feed matrices using a commercial sterigmatocystin immunoaffinity column (IAC) for sample clean-up prior to HPLC analysis by UV with mass spectrometric detection (LC-MS/MS). Cereals (wheat, oats, rye, maize and rice), sunflower seeds and animal feed were spiked with sterigmatocystin at levels from 0.75 to 50 µg kg(-1) to establish method performance. Using acetonitrile/water extraction followed by IAC clean-up, and analysis by HPLC with detection at 325 nm, recoveries ranged from 68% to 106%, with repeatability from 4.2% to 17.5%. The limit of quantification with UV detection in these matrices was 1.5 µg kg(-1). For the analysis of beer and cheese the sample preparation prior to IAC clean-up was changed to accommodate the different properties of the matrix, prior to analysis by LC-MS/MS. For beer and cheese spiked at 5.0 µg kg(-1) the recoveries were 94% and 104%, and precision (RSDs) were 1.9% and 2.9% respectively. The limits of quantification by LC-MS/MS in beer and cheese were 0.02 and 0.6 µg kg(-1) respectively. The sterigmatocystin IAC was demonstrated to provide an efficient clean-up of various matrices to enable this mycotoxin to be determined by either HPLC with UV detection or LC-MS/MS.","Food additives & contaminants. Part A, Chemistry, analysis, control, exposure & risk assessment","['D000821', 'D000818', 'D001515', 'D002611', 'D002846', 'D002851', 'D002523', 'D005506', 'D006801', 'D057230', 'D009183', 'D015203', 'D013241', 'D053719']","['Animal Feed', 'Animals', 'Beer', 'Cheese', 'Chromatography, Affinity', 'Chromatography, High Pressure Liquid', 'Edible Grain', 'Food Contamination', 'Humans', 'Limit of Detection', 'Mycotoxins', 'Reproducibility of Results', 'Sterigmatocystin', 'Tandem Mass Spectrometry']","Analysis of sterigmatocystin in cereals, animal feed, seeds, beer and cheese by immunoaffinity column clean-up and HPLC and LC-MS/MS quantification.","['Q000032', None, 'Q000032', 'Q000032', None, None, 'Q000737', 'Q000032', None, None, 'Q000302', None, 'Q000302', None]","['analysis', None, 'analysis', 'analysis', None, None, 'chemistry', 'analysis', None, None, 'isolation & purification', None, 'isolation & purification', None]",https://www.ncbi.nlm.nih.gov/pubmed/26515281,2016
26455400,"Oat (Avena sativa L.) seed extracts exhibited a high degree of catalytic activity including amylase activities. Proteins in the oat seed extracts were optimized for their amylolytic activities. Oat extract with amylolytic activity was separated by SDS-PAGE and a major protein band with an apparent molecular mass of 53 kDa was subjected to tryptic digestion. The generated amino acid sequences were analyzed by liquid chromatography–tandem mass spectrometry (LC/ESI/MS/MS) and database searches. These sequences were used to identify a partial cDNA from expressed sequence tags (ESTs) of A. sativa L. Based upon EST sequences, a predicted full-length gene was identified, with an open reading frame of 1464 bp encoding a protein of 488 amino acid residues (AsBAMY), with a theoretical molecular mass of 55 kDa identified as a β-amylase belonging to the plant β-amylase family. Primary structure of oat β-amylase (AsBAMY) protein indicated high similarity with other β-amylase from other cereals such as wheat (Triticum aestivum), barley (Hordeum vulgare), and rye (Secale cereale) with two conserved Glu residues (E184 and E378) assigned as the “putative” catalytic residues which would act as an acid and base pair in the catalytic process. In addition, a 3D-model of AsBAMY was built from known X-ray structures and sequence alignments. A similar core (β/α)8-barrel architecture was found in AsBAMY like the other cereal β-amylases with a specific location of the active site in a pocket-like cavity structure made at one end of this core (β/α)8-barrel domain suggesting an accessibility of the non-reducing end of the substrate and thus confirming the results of AsBAMY exo-acting hydrolase.",Biochimica et biophysica acta,"['D000595', 'D018554', 'D001483', 'D002853', 'D018360', 'D018076', 'D004591', 'D008958', 'D008969', 'D010802', 'D010940', 'D017433', 'D017434', 'D040901', 'D012639', 'D017422', 'D017386', 'D053719', 'D001614']","['Amino Acid Sequence', 'Avena', 'Base Sequence', 'Chromatography, Liquid', 'Crystallography, X-Ray', 'DNA, Complementary', 'Electrophoresis, Polyacrylamide Gel', 'Models, Molecular', 'Molecular Sequence Data', 'Phylogeny', 'Plant Proteins', 'Protein Structure, Secondary', 'Protein Structure, Tertiary', 'Proteomics', 'Seeds', 'Sequence Analysis, DNA', 'Sequence Homology, Amino Acid', 'Tandem Mass Spectrometry', 'beta-Amylase']",Identification of a new oat β-amylase by functional proteomics.,"[None, 'Q000201', None, None, None, 'Q000737', None, None, None, None, 'Q000737', None, None, 'Q000379', 'Q000201', None, None, None, 'Q000737']","[None, 'enzymology', None, None, None, 'chemistry', None, None, None, None, 'chemistry', None, None, 'methods', 'enzymology', None, None, None, 'chemistry']",https://www.ncbi.nlm.nih.gov/pubmed/26455400,2016
