PMID,abstract,journal,mesh_UIds,mesh_terms,paper,qual_UIds,qual_terms,webpage,year
11939111,"The present study was conducted to investigate the precaecal digestibility of vitamin B6 from selected food sources including eggs, bananas, white cabbage, corn, milk powder, fish, barley, soybeans, brown rice, wheat bran, brewer's yeast, rye and soybean meal. These foods were chosen for their relevance in human and animal nutrition and prepared as they are usually eaten by humans. As confirmed by further investigations the precaecal digestibility is a valuable measure for determining the availability of native B-vitamins. Therefore, pigs were fitted with an end-to-end ileo-rectal anastomosis for digesta passing straight from ileum to rectum, thus avoiding endogenous vitamin synthesis by the colon. Three weeks after surgery the digestibility experiments were carried out during which the animals were fed various experimental diets for a period of 12 days and digesta were collected quantitatively twice a day during the final 5 days of this period. The concentration of vitamin B6 in foods and chyme was determined by high pressure liquid chromatography. Precaecal digestibility of vitamin B6 from all tested food sources ranged from 51 to 91% in the following order: cabbage diet > banana diet > fish diet > milk powder diet > brewer's yeast diet > soybeans diet > soybean meal diet > egg diet/corn diet > barley diet > wheat bran diet > rye diet. Only boiled brown rice had a very low vitamin B6 availability of 16%. The digestibility of vitamin B6 from plant products (excluding the rice) was on average 10% lower when compared with animal products (71 versus 79%).",International journal of food sciences and nutrition,"['D000824', 'D000818', 'D001682', 'D004032', 'D004063', 'D005766', 'D006801', 'D008297', 'D009747', 'D013552', 'D025101']","['Animal Nutritional Physiological Phenomena', 'Animals', 'Biological Availability', 'Diet', 'Digestion', 'Gastrointestinal Contents', 'Humans', 'Male', 'Nutritional Physiological Phenomena', 'Swine', 'Vitamin B 6']",Availability of vitamin B6 from different food sources.,"[None, None, None, None, None, 'Q000737', None, None, None, None, 'Q000032']","[None, None, None, None, None, 'chemistry', None, None, None, None, 'analysis']",https://www.ncbi.nlm.nih.gov/pubmed/11939111,2002
11911490,"Epidemiological studies have indicated that the exposure to carcinogenic components formed during the cooking of food might be associated with lung cancer risk of Chinese women. Previous studies have confirmed that cooking oil fumes from frying fish (COF) contained relatively high amount of benzo[a]pyrene, 2-methyl-3,8-dimethylimidazo[4,5-f] qunoxaline, benzene, and 1,3-butadiene, reported in fumes from heated soybean oil. Thus, we consider that oxidative stress induced by COF may play a role in lung cancer development among Chinese women. To verify whether the oxidative DNA damage was induced by COF, high-performance liquid chromatography (HPLC) analysis data showed that the levels of 8-hydroxydeoxyguanine (8-OH dG) were increased in a dose-dependent manner when calf thymus DNA reacted with various concentrations of COF. Since human 8-oxoguanine DNA glycosylase 1 (hOGG1) was a repair enzyme for removing 8- OH dG from damaged DNA, we hypothesized that hOGG1 mRNA may be used to assess the risk of oxidative damage induced by the exposure of COF. The results from reverse-transcription polymerase chain reaction showed that the hOGG1 mRNA expression was induced by hydrogen peroxide (H2O2) and COF in human lung adenocarcinoma CL-3 cells. To elucidate whether hOGG1 mRNA expression was an exposure biomarker of COF, a cross-sectional study of 238 subjects including 94 professional cooks, 43 housewives, and 101 COF-nonexposed control subjects was conducted. The hOGG1 mRNA expression frequencies of COF-exposed cooks (27 of 94, 28.7%) and housewives (6 of 43, 14%) were significantly higher than those of control subjects (4 of 101, 4%). After adjusting for age, sex, and smoking and drinking status, the odds risks (ORs) of housewives versus control and cooks versus control were 3.94 (95% confidence interval [CI] = 0.95-16.62) and 10.12 (95% CI = 2.83-36.15), respectively. These results indicated that hOGG1 may be adequate to act as an exposure biomarker to assess the oxidative DNA damage induced by COF. This also suggests that oxidative stress induced by COF may play a role in lung cancer development among Chinese women.",Journal of toxicology and environmental health. Part A,"['D000230', 'D000328', 'D000818', 'D015415', 'D002273', 'D002417', 'D002851', 'D003296', 'D003430', 'D004249', 'D017931', 'D043382', 'D004305', 'D005260', 'D006801', 'D008175', 'D009699', 'D016017', 'D018384', 'D010938', 'D012333', 'D013950']","['Adenocarcinoma', 'Adult', 'Animals', 'Biomarkers', 'Carcinogens', 'Cattle', 'Chromatography, High Pressure Liquid', 'Cooking', 'Cross-Sectional Studies', 'DNA Damage', 'DNA Primers', 'DNA-Formamidopyrimidine Glycosylase', 'Dose-Response Relationship, Drug', 'Female', 'Humans', 'Lung Neoplasms', 'N-Glycosyl Hydrolases', 'Odds Ratio', 'Oxidative Stress', 'Plant Oils', 'RNA, Messenger', 'Thymus Gland']",Human 8-oxoguanine DNA glycosylase 1 mRNA expression as an oxidative stress exposure biomarker of cooking oil fumes.,"['Q000209', None, None, 'Q000032', 'Q000009', None, None, None, None, None, None, None, None, None, None, 'Q000209', 'Q000096', None, None, 'Q000009', 'Q000096', None]","['etiology', None, None, 'analysis', 'adverse effects', None, None, None, None, None, None, None, None, None, None, 'etiology', 'biosynthesis', None, None, 'adverse effects', 'biosynthesis', None]",https://www.ncbi.nlm.nih.gov/pubmed/11911490,2002
11836067,"Phytoestrogens, plant-derived nonsteroidal estrogens found in high abundance in most soy food products, have been studied for their potential beneficial effects against hormone-dependent cancers and age-related diseases. However, little is known about the influence of phytoestrogens on the brain or behavior. This brief review describes mainly our own studies in rodents that have examined the influence of dietary soy isoflavones on certain aspects of brain structure, learning, memory and anxiety along with the brain androgen-metabolizing enzyme, aromatase. These studies used a commercially available diet rich in phytoestrogens (Phyto-rich) vs. a custom diet relatively free of phytoestrogens (Phyto-free). The phytoestrogen content of each diet was determined by high-performance liquid chromatography analysis, circulating plasma phytoestrogen levels were quantified by gas chromatography mass spectroscopy and concentrations of phytoestrogens in specific brain regions were measured by time-resolved fluoroimmunoassay (TR-FIA). Our studies showed that brain aromatase levels were not significantly altered by phytoestrogen diet treatments in perinatal, maternal or adult rats. However, volumes of the sexually dimorphic nucleus of the preoptic area (SDN-POA) were significantly affected by the Phyto-free diet treatment in male rats during adulthood, where SDN-POA volumes were smaller compared to Phyto-rich male values. Additionally, the Phyto-rich diet fed to adult male and female rats produced anxiolytic effects as assessed in the elevated plus maze vs. Phyto-free fed animals. Finally, when learning and memory parameters were examined in a radial arm maze testing visual-spatial memory (VSM), the diet treatments significantly changed the typical sexually dimorphic pattern of VSM. Specifically, adult Phyto-rich fed females outperformed Phyto-free fed females, while in males on the same diets, the opposite pattern of maze performance was observed. When female vs. male performance was compared, Phyto-rich females executed the VSM task in a manner similar to that of Phyto-free fed males, while Phyto-free fed female's VSM was comparable to Phyto-rich males. These results indicate that consumption of dietary phytoestrogens resulting in very high plasma isoflavone levels (in many cases over a relatively short interval of consumption in adulthood) can significantly alter sexually dimorphic brain regions, anxiety, learning and memory. The findings of these studies identify the biological actions of phytoestrogens, specifically isoflavones and their metabolites, found in animal soy-containing diets on brain and behavior and implicate the importance of phytoestrogens given the recognized significance of estrogens in brain and neural disorders, such as Alzheimer's disease, especially in women.",Neurotoxicology and teratology,"['D000818', 'D001522', 'D001921', 'D004968', 'D005260', 'D007529', 'D008297', 'D048789', 'D028321', 'D051381', 'D020318', 'D017207', 'D013025']","['Animals', 'Behavior, Animal', 'Brain', 'Estrogens, Non-Steroidal', 'Female', 'Isoflavones', 'Male', 'Phytoestrogens', 'Plant Preparations', 'Rats', 'Rats, Long-Evans', 'Rats, Sprague-Dawley', 'Soybeans']",Neurobehavioral effects of dietary soy phytoestrogens.,"[None, 'Q000187', 'Q000187', 'Q000494', None, None, None, None, None, None, None, None, None]","[None, 'drug effects', 'drug effects', 'pharmacology', None, None, None, None, None, None, None, None, None]",https://www.ncbi.nlm.nih.gov/pubmed/11836067,2002
11822903,"Immobilized metal affinity chromatography (IMAC) is a widely used technique for bioseparation of proteins in general and recombinant proteins with polyhistidine fusion tags in particular. An expensive and critical step in this process is coupling of a chelating ligand to the chromatographic matrix. This chelating ligand coordinates metal ions such as Cu(2+), Zn(2+), and Ni(2+), which in turn bind proteins. The toxicity of chemicals required for coupling and their slow release during the separation process are of considerable concern. This is an important issue in the context of purification of proteins/enzymes which are used in food processing or pharmaceutical purposes. In this work, a simpler IMAC design is described which should lead to a paradigm shift in the application of IMAC in separation. It is shown that zinc alginate beads (formed by chelating alginate with Zn(2+) directly) can be used for IMAC. As ""proof of concept"", soybean trypsin inhibitor was purified 18-fold from its crude extract with 90% recovery of biological activity. The dynamic binding capacity of the packed bed was 3919 U mL(-1), as determined by frontal analysis. The media could be regenerated with 8 M urea and reused five times without any appreciable loss in its binding capacity.",Biotechnology progress,"['D000464', 'D002614', 'D002846', 'D004340', 'D017743', 'D005506', 'D020723', 'D006603', 'D008670', 'D010940', 'D030262', 'D014361', 'D015032', 'D000516']","['Alginates', 'Chelating Agents', 'Chromatography, Affinity', 'Drug Contamination', 'Equipment Reuse', 'Food Contamination', 'Glucuronic Acid', 'Hexuronic Acids', 'Metals', 'Plant Proteins', 'Soybean Proteins', 'Trypsin Inhibitors', 'Zinc', 'alpha-Amylases']",Immobilized metal affinity chromatography without chelating ligands: purification of soybean trypsin inhibitor on zinc alginate beads.,"[None, 'Q000633', 'Q000379', 'Q000517', None, 'Q000517', None, None, 'Q000737', 'Q000302', 'Q000302', None, None, 'Q000037']","[None, 'toxicity', 'methods', 'prevention & control', None, 'prevention & control', None, None, 'chemistry', 'isolation & purification', 'isolation & purification', None, None, 'antagonists & inhibitors']",https://www.ncbi.nlm.nih.gov/pubmed/11822903,2003
11551550,"Myrothecium verrucaria was found to be an effective pathogen against kudzu grown in the greenhouse and the field. M. verrucaria produced large amounts of macrocyclic trichothecenes when cultured on solid rice medium, including epiroridin E (16.8 mg/g crude extract), epiisororidin E (1 mg/g), roridin E (8.7 mg/g), roridin H (31.3 mg/g), trichoverrin A (0.6 mg/g), trichoverrin B (0.1 mg/g), verrucarin A (37.4 mg/g), and verrucarin J (2.2 mg/g). Most of these toxins were also isolated from M. verrucaria spores and mycelia grown on potato dextrose agar medium, including epiroridin E (32.3 mg/g), epiisororidin E (28.6 mg/g), roridin E (0 mg/g), roridin H (60 mg/g), trichoverrin A (1.3 mg/g), trichoverrin B (1.8 mg/g), verrucarin A (13.8 mg/g), and verrucarin J (131 mg/g). When M. verrucaria was cultured on liquid media, the numbers but not the amounts of toxins decreased. Only epiroridin E (28.3 mg/g), epiisororidin E (29.6 mg/g), verrucarin B (195 mg/g) and verrucarin J (52.6 mg/g) were measured when the fungus was cultured on cornsteep medium. On soyflour-cornmeal broth M. verrucaria produced several toxins, including epiroridin E (58.1 mg/g), epiisororidin E (5.8 mg/g), verrucarin B (29.9 mg/g) and verrucarin J (32 mg/g). In contrast, no macrocyclic trichothecenes were detected by HPLC analysis of plant tissues of kudzu, sicklepod, and soybean treated with aqueous suspensions of M. verrucaria spores formulated with a surfactant. Chloroform-methanol extracts of kudzu leaves and stems treated with M. verrucaria spores were less cytotoxic to four cultured mammalian cell lines than the corresponding extracts from control plants. Purified macrocyclic trichothecenes (verrucarin A and T-2 toxin) were very cytotoxic to the same cell lines (< or = 2 ng/ml). These results show that neither intact macrocyclic trichothecenes nor toxic metabolites could be detected in plant tissues after treatment with M. verrucaria spores. These results argue for both safety and efficacy for the use of M. verrucaria in biological control of kudzu and other noxious weeds, and support proceeding to animal feeding trials for further evaluation of safety.",Phytochemistry,"['D001203', 'D002460', 'D002851', 'D010572', 'D029908', 'D014255']","['Ascomycota', 'Cell Line', 'Chromatography, High Pressure Liquid', 'Pest Control, Biological', 'Pueraria', 'Trichothecenes']",Macrocyclic trichothecenes are undetectable in kudzu (Pueraria montana) plants treated with a high-producing isolate of Myrothecium verrucaria.,"['Q000472', None, None, None, 'Q000737', 'Q000737']","['pathogenicity', None, None, None, 'chemistry', 'chemistry']",https://www.ncbi.nlm.nih.gov/pubmed/11551550,2001
11524239,"Nutritional factors, especially phytoestrogens, have been extensively studied for their potential beneficial effects against hormone-dependent and age-related diseases. The present study describes the short-term effects of dietary phytoestrogens on regulatory behaviors (food/water intake, locomotor activity and body weight), prostate weight, prostate 5alpha-reductase enzyme activity, reproductive hormone levels, and testicular steroidogenic acute regulatory peptide (StAR) levels in adult Sprague-Dawley rats. Animals were fed either a phytoestrogen-rich diet containing approximately 600 microg/g isoflavones (as determined by HPLC) or a phytoestrogen-free diet. After 5 weeks of consuming these diets, plasma phytoestrogen levels were 35 times higher in animals fed the phytoestrogen-rich vs phytoestrogen-free diets. Body and prostate weights were significantly decreased in animals fed the phytoestrogen-rich diet vs the phytoestrogen-free fed animals; however, no significant change in prostate 5alpha-reductase enzyme activity was observed between the treatment groups. Locomotor activity levels were higher in the phytoestrogen-rich vs the phytoestrogen-free animals during the course of the treatment interval. Plasma testosterone and androstenedione levels were significantly lower in the animals fed the phytoestrogen-rich diet compared with animals fed the phytoestrogen-free diet. However, there were no significant differences in plasma LH or estradiol levels between the diet groups. Testicular StAR levels were not significantly different between the phytoestrogen-rich vs the phytoestrogen-free fed animals. These results indicated that consumption of dietary phytoestrogens resulting in very high plasma isoflavone levels over a relatively short period can significantly alter body and prostate weight and plasma androgen hormone levels without affecting gonadotropin or testicular StAR levels. The findings of this study identify the biological actions of phytoestrogens on male reproductive endocrinology and provide insights into the protective effects these estrogen mimics exert in male reproductive disorders such as benign prostatic hyperplasia and prostate cancer.",The Journal of endocrinology,"['D000818', 'D042944', 'D002851', 'D004968', 'D007529', 'D007986', 'D008297', 'D009929', 'D010088', 'D010750', 'D048789', 'D028321', 'D011467', 'D051381', 'D017207', 'D013025', 'D013737', 'D013739']","['Animals', 'Cholestenone 5 alpha-Reductase', 'Chromatography, High Pressure Liquid', 'Estrogens, Non-Steroidal', 'Isoflavones', 'Luteinizing Hormone', 'Male', 'Organ Size', 'Oxidoreductases', 'Phosphoproteins', 'Phytoestrogens', 'Plant Preparations', 'Prostate', 'Rats', 'Rats, Sprague-Dawley', 'Soybeans', 'Testis', 'Testosterone']","Dietary soy-phytoestrogens decrease testosterone levels and prostate weight without altering LH, prostate 5alpha-reductase or testicular steroidogenic acute regulatory peptide levels in adult male Sprague-Dawley rats.","[None, None, None, 'Q000097', None, 'Q000097', None, 'Q000187', 'Q000378', 'Q000378', None, None, 'Q000033', None, None, None, 'Q000378', 'Q000097']","[None, None, None, 'blood', None, 'blood', None, 'drug effects', 'metabolism', 'metabolism', None, None, 'anatomy & histology', None, None, None, 'metabolism', 'blood']",https://www.ncbi.nlm.nih.gov/pubmed/11524239,2001
11506804,"Commercial processing wastes or by-products of crops were found to be sources of antimutagens and human tumor cell growth suppressors. We developed a microplate method to measure genomic DNA damage in Chinese hamster ovary cells with a modified single cell gel electrophoresis (SCGE) assay. This allowed us to measure the repression of 2-acetoxyacetylaminofluorene (2AAAF)-induced DNA damage by very small amounts of complex mixtures, fractions or individual chemicals isolated from agricultural by-products. We previously demonstrated that PCC, an ethanol extract of a commercial soybean processing by-product, repressed induced genomic DNA damage in mammalian cells. PCC was separated into a series of chemically defined fractions and two fractions (PCC70 and PCC100) repressed mutagen-induced damage. Of the isoflavones isolated from soybean fraction PCC70, daidzein expressed antigenotoxic activity, however, genistin and genistein enhanced DNA damage. An antigenotoxic response also was observed with a fraction isolated from corn distillate solids (CDS40). We developed a microplate assay to measure the suppression of the growth rate of human cancer cells in which the cytostatic/cytotoxic status at each concentration of the test sample was quantitatively determined. Genistein, genistin, daidzein and daidzin isolated from soybean fraction PCC70 expressed a wide range of growth suppression of HT-29 human colon cancer cells. The biological assays were integrated with, and directed, the separation and analytical chemistry component of this project. Compounds were purified from biologically active fractions and the structure of individual chemicals was determined with analytical HPLC and LC-mass spectroscopy (LC-MS). This research may lead to the isolation of novel chemoprotectants from agronomic commercial processing products and by-products.",Mutation research,"['D000818', 'D016587', 'D000970', 'D016466', 'D002455', 'D005591', 'D002851', 'D003110', 'D006224', 'D004249', 'D004354', 'D019833', 'D019073', 'D006801', 'D007529', 'D013058', 'D009152', 'D010936', 'D013025', 'D003313']","['Animals', 'Antimutagenic Agents', 'Antineoplastic Agents', 'CHO Cells', 'Cell Division', 'Chemical Fractionation', 'Chromatography, High Pressure Liquid', 'Colonic Neoplasms', 'Cricetinae', 'DNA Damage', 'Drug Screening Assays, Antitumor', 'Genistein', 'HT29 Cells', 'Humans', 'Isoflavones', 'Mass Spectrometry', 'Mutagenicity Tests', 'Plant Extracts', 'Soybeans', 'Zea mays']",Isolating antigenotoxic components and cancer cell growth suppressors from agricultural by-products.,"[None, 'Q000302', 'Q000302', None, 'Q000187', None, None, 'Q000188', None, 'Q000187', None, 'Q000302', None, None, 'Q000302', None, None, 'Q000302', 'Q000737', 'Q000737']","[None, 'isolation & purification', 'isolation & purification', None, 'drug effects', None, None, 'drug therapy', None, 'drug effects', None, 'isolation & purification', None, None, 'isolation & purification', None, None, 'isolation & purification', 'chemistry', 'chemistry']",https://www.ncbi.nlm.nih.gov/pubmed/11506804,2001
11445894,"The measurement of the carbon isotope composition of starch and cellulose still relies on chemical isolation of these water-insoluble plant constituents and subsequent elemental analysis by isotope ratio mass spectrometry (EA/IRMS) of the purified fractions, while delta(13)C values of low-molecular-weight organic compounds are now routinely measured by gas chromatography/combustion/isotope ratio mass spectrometry (GC/C/IRMS). Here we report a simple and reliable method for processing milligram quantities of dried plant material for the analysis of the carbon isotope composition of lipids, soluble sugars, starch and cellulose from the same sample. We evaluated three different starch preparation methods, namely (1) enzymatic hydrolysis by alpha-amylase, (2) solubilization by dimethyl sulfoxide (DMSO) followed by precipitation with ethanol, and (3) partial hydrolysis by HCl followed by precipitation of the resulting dextrins by ethanol. Starch recovery for three commercially available native starches (from potato, rice and wheat) varied from 48 to 81% for the techniques based on precipitation, whereas the enzymatic technique exhibited yields between 99 and 105%. In addition, the DMSO and HCl techniques introduced a significant (13)C fractionation of up to 1.9 per thousand, while the carbon isotope composition of native starches analyzed after enzymatic digestion did not show any significant difference from that of untreated samples. The enzymatic starch preparation method was then incorporated into a protocol for determination of delta(13)C signatures of lipids, soluble carbohydrates, starch and crude cellulose. The procedure is based on methanol/chloroform/water extraction of dried and ground leaf material. After recovery of the chloroform phase (lipid fraction), the methanol/water phase was deionized by ion exchange (soluble carbohydrate fraction) and the pellet treated with heat-stable alpha-amylase (starch fraction). The remaining insoluble material was subjected to solvolysis by diglyme (cellulose fraction). The method was shown to be applicable to foliar tissues of a variety of different plant species (spruce, erect brome, maize and soybean).",Rapid communications in mass spectrometry : RCM,"['D002244', 'D002247', 'D002482', 'D004121', 'D006851', 'D006868', 'D008055', 'D013058', 'D018515', 'D013213', 'D000516']","['Carbon', 'Carbon Isotopes', 'Cellulose', 'Dimethyl Sulfoxide', 'Hydrochloric Acid', 'Hydrolysis', 'Lipids', 'Mass Spectrometry', 'Plant Leaves', 'Starch', 'alpha-Amylases']",Preparation of starch and other carbon fractions from higher plant leaves for stable carbon isotope analysis.,"['Q000032', 'Q000032', 'Q000032', 'Q000737', 'Q000737', None, 'Q000032', 'Q000379', 'Q000737', 'Q000737', 'Q000378']","['analysis', 'analysis', 'analysis', 'chemistry', 'chemistry', None, 'analysis', 'methods', 'chemistry', 'chemistry', 'metabolism']",https://www.ncbi.nlm.nih.gov/pubmed/11445894,2001
11429513,Intestinal gas is thought to be the cause abdominal discomfort in infants. Little is known about the type and amount of gas produced by the infant's colonic microflora and whether diet influences gas formation.,Journal of pediatric gastroenterology and nutrition,"['D002245', 'D002849', 'D004032', 'D005243', 'D005260', 'D006801', 'D006859', 'D006862', 'D007223', 'D007225', 'D007231', 'D007408', 'D008137', 'D008297', 'D008697', 'D008895', 'D013025', 'D013438', 'D013455', 'D013463']","['Carbon Dioxide', 'Chromatography, Gas', 'Diet', 'Feces', 'Female', 'Humans', 'Hydrogen', 'Hydrogen Sulfide', 'Infant', 'Infant Food', 'Infant, Newborn', 'Intestinal Absorption', 'Longitudinal Studies', 'Male', 'Methane', 'Milk, Human', 'Soybeans', 'Sulfhydryl Compounds', 'Sulfur', 'Sulfuric Acid Esters']",Gas production by feces of infants.,"['Q000032', 'Q000379', None, 'Q000737', None, None, 'Q000032', 'Q000032', None, None, None, None, None, None, 'Q000032', 'Q000378', 'Q000378', 'Q000032', 'Q000032', 'Q000032']","['analysis', 'methods', None, 'chemistry', None, None, 'analysis', 'analysis', None, None, None, None, None, None, 'analysis', 'metabolism', 'metabolism', 'analysis', 'analysis', 'analysis']",https://www.ncbi.nlm.nih.gov/pubmed/11429513,2001
