PMID,abstract,journal,mesh_UIds,mesh_terms,paper,qual_UIds,qual_terms,webpage,year
15506244,"Dietary oils--tuna, salmon, cod liver, soybean, olive, and corn oils--were treated with accelerated storage conditions (60 degrees C for 3 and 7 d) and a cooking condition (200 degrees C for 1 h). Genotoxic malonaldehyde (MA), glyoxal, and methylglyoxal formed in the oils were analyzed by GC. Salmon oil produced the greatest amount of MA (1070+/-77.0 ppm of oil) when it was heated at 60 degrees C for 7 d. The highest formation of glyoxal was obtained from salmon oil heated at 60 degrees C for 3 d. More glyoxal was found from salmon and cod liver oils when they were heated for 3 d (12.8+/-1.10 and 7.07+/-0.19 ppm, respectively) than for 7 d (6.70+/-0.08 and 5.94+/-0.38 ppm, respectively), suggesting that glyoxal underwent secondary reactions during a prolonged time. The amount of methyglyoxal formed ranged from 2.03+/-0.13 (cod liver oil) to 2.89+/-0.11 ppm (tuna oil) in the fish oils heated at 60 degrees C for 7 d. Among vegetable oils, only olive oil yielded methylglyoxal (0.61+/-0.03 ppm) under accelerated storage conditions. When oils were treated under cooking conditions, the aldehydes formed were comparable to those formed under accelerated storage conditions. Fish oils produced more MA, glyoxal, and methylglyoxal than did vegetable oils because the fish oils contained higher levels of long-chain PUFA, such as EPA and DHA, than did the vegetable oils. A statistically significant correlation (P < 0.05) between the alpha-tocopherol content and the oxidation parameters was obtained from only MA and fish oils heated at 60 degrees C for 3 d.",Lipids,"['D000447', 'D002849', 'D004042', 'D019649', 'D006037', 'D008315', 'D009153', 'D010084', 'D011765']","['Aldehydes', 'Chromatography, Gas', 'Dietary Fats, Unsaturated', 'Food Industry', 'Glyoxal', 'Malondialdehyde', 'Mutagens', 'Oxidation-Reduction', 'Pyruvaldehyde']",Formation of genotoxic dicarbonyl compounds in dietary oils upon oxidation.,"['Q000737', None, 'Q000032', None, 'Q000737', 'Q000737', 'Q000737', None, 'Q000737']","['chemistry', None, 'analysis', None, 'chemistry', 'chemistry', 'chemistry', None, 'chemistry']",https://www.ncbi.nlm.nih.gov/pubmed/15506244,2005
15135153,"Clinical studies have demonstrated that consumption of phytosterol esters in lipid-based foods decreases serum concentrations of total and LDL cholesterol. These substances represent minimal potential for adverse effects when consumed orally because of their low bioavailability. However, some studies have reported estrogenic and other effects in laboratory animals treated parenterally with phytosterols, demonstrating that these substances may have the potential to cause adverse effects if absorbed. Water-soluble phytosterols have been prepared by formulation with emulsifiers to expand delivery options to include non-lipid-based foods. However, emulsifiers are used as excipients in the formulation of lipophilic pharmaceuticals to increase solubility, thereby increasing their absorption. Therefore, oral consumption of emulsified water-soluble phytosterols could potentially increase their absorption. In the current study, absorption of phytosterols prepared as water-soluble emulsified micelles with two different food-grade emulsifiers was evaluated in Sprague-Dawley rats and compared with absorption of non-micellar free phytosterols and esterified phytosterol mixtures dissolved in a lipophilic vehicle (soybean oil). Rats were dosed via gavage with 42 mg/kg of formulated phytosterol preparations. Blood was collected at 8, 16, 24, and 32 hours, extracted with hexane, derivatized with benzoyl chloride, and analyzed by high-performance liquid chromatography to determine concentrations of beta-sitosterol, and campesterol. Plasma concentrations and AUC(0-32 hours) [microg/mL/h] of beta-sitosterol and campesterol were lower in plasma obtained from rats treated with emulsified phytosterol preparations than in animals treated with free phytosterols dissolved in soybean oil. Because the pharmacokinetic profile of water-soluble phytosterols is similar to that of phytosterols administered in a lipid vehicle, the safety profile is likely to be the same as that of phytosterols and phytosterol esters in currently used applications.",The Journal of nutritional biochemistry,"['D000042', 'D000818', 'D002784', 'D002851', 'D004032', 'D004655', 'D004951', 'D007700', 'D008823', 'D009055', 'D010713', 'D010840', 'D051381', 'D017207', 'D012855', 'D012995', 'D014867']","['Absorption', 'Animals', 'Cholesterol', 'Chromatography, High Pressure Liquid', 'Diet', 'Emulsions', 'Esterification', 'Kinetics', 'Micelles', 'Mouth', 'Phosphatidylcholines', 'Phytosterols', 'Rats', 'Rats, Sprague-Dawley', 'Sitosterols', 'Solubility', 'Water']",Oral absorption of phytosterols and emulsified phytosterols by Sprague-Dawley rats.,"[None, None, 'Q000031', None, None, 'Q000493', None, None, None, 'Q000378', None, 'Q000008', None, None, 'Q000097', None, None]","[None, None, 'analogs & derivatives', None, None, 'pharmacokinetics', None, None, None, 'metabolism', None, 'administration & dosage', None, None, 'blood', None, None]",https://www.ncbi.nlm.nih.gov/pubmed/15135153,2004
15080648,"Sardine oil was obtained by centrifugation of surimi wastewater without heating or chemical refining. This oil (CE) showed light yellow color and the peroxide value was less than 1.0 meq/kg. The main lipid class of CE was triacylglycerol (TG) (>99%). These features indicate that CE can be directly used as food materials without further purification. Commercial sardine oil (CO) is usually prepared via some kind of refining process with high temperature (250 degrees C) and chemical treatment. The comparative study on the physiological effects of these sardine oils (CE and CO) revealed that the dietary sardine oils were more effective in reducing abdominal fat pads, plasma total cholesterol, and TG levels of rats than was a soybean oil diet (control). Furthermore, these effects were greater in CE than CO, although there was little difference in the fatty acid composition of both oils. Although the main lipid class of CE was TG (>99%), CE was prepared by centrifugation from surimi waste and directly used as dietary fat without further purification. Therefore, CE may contain some kinds of minor components, which could be attributed to the higher physiological activity of CE. To reveal the involvement of the minor compounds in CE, we prepared TG from CE by column chromatography and measured its effect on lipid metabolism of rats. TG from CE also showed the reducing effects on abdominal fad pads and plasma lipid levels. The effect of TG from CE was almost the same as that of original CE, suggesting that the higher nutritional activity of CE than CO may not be due to the minor compounds in CE.",Journal of agricultural and food chemistry,"['D000818', 'D004042', 'D005395', 'D005396', 'D006358', 'D008055', 'D008297', 'D051381', 'D017208']","['Animals', 'Dietary Fats, Unsaturated', 'Fish Oils', 'Fish Products', 'Hot Temperature', 'Lipids', 'Male', 'Rats', 'Rats, Wistar']",Separation of sardine oil without heating from surimi waste and its effect on lipid metabolism in rats.,"[None, 'Q000494', 'Q000302', 'Q000032', None, 'Q000097', None, None, None]","[None, 'pharmacology', 'isolation & purification', 'analysis', None, 'blood', None, None, None]",https://www.ncbi.nlm.nih.gov/pubmed/15080648,2004
14755853,"The four edible oils purchased on Warsaw marked in the years 1996-2002 were investigated. We confirmed that investigated oils contained relatively small amount of saturated fatty acids (7.0-13.4%) and only traces of trans isomers. In the same time they were characterized with high content unsaturated fatty acids, both mono- and polyunsaturated. The highest content of monounsaturated acids (65%) characterized rapeseed oil, whereas polyunsaturated ones--sunflower oil (68%). Polyunsaturated acids were represented mainly by linoleic acid (C18:2). The results of investigation show that oils available on the market despite of their different manufacturers ha got the good health value.",Roczniki Panstwowego Zakladu Higieny,"['D002851', 'D003257', 'D003314', 'D005227', 'D005229', 'D005231', 'D005504', 'D006801', 'D010938', 'D011044', 'D000074262', 'D013024', 'D000074242']","['Chromatography, High Pressure Liquid', 'Consumer Product Safety', 'Corn Oil', 'Fatty Acids', 'Fatty Acids, Monounsaturated', 'Fatty Acids, Unsaturated', 'Food Analysis', 'Humans', 'Plant Oils', 'Poland', 'Rapeseed Oil', 'Soybean Oil', 'Sunflower Oil']",[Fatty acids content in selected edible oils].,"['Q000379', None, 'Q000032', 'Q000032', 'Q000032', 'Q000032', None, None, 'Q000032', None, None, 'Q000032', None]","['methods', None, 'analysis', 'analysis', 'analysis', 'analysis', None, None, 'analysis', None, None, 'analysis', None]",https://www.ncbi.nlm.nih.gov/pubmed/14755853,2004
14705891,"The evolution of oxidized triglycerides (ox-TG) during industrial refining was studied in soybean, sunflower, peanut, and corn oils. The analytical techniques used were silica gel column chromatography and high-performance size exclusion chromatography. The decrease in ox-TG during refining (42.3% on average) was accompanied by an increase in triglyceride oligopolymers (TGP). The inverse correlation between the two lipid groups suggests that the decrease in ox-TG during refining was due in part to the occurrence of polymerization reactions. An inverse correlation was also found between the percentage sum of ox-TG + TGP and percent TGP, indicating that a part of the ox-TG also underwent degradation or transformation reactions. On average, almost 58% of the ox-TG remained unchanged during refining and, of the rest, about half was involved in polymerization reactions and half in degradation or transformation reactions.",Journal of agricultural and food chemistry,"['D003314', 'D005511', 'D010084', 'D000074241', 'D010938', 'D011108', 'D012639', 'D013024', 'D000074242', 'D014280']","['Corn Oil', 'Food Handling', 'Oxidation-Reduction', 'Peanut Oil', 'Plant Oils', 'Polymers', 'Seeds', 'Soybean Oil', 'Sunflower Oil', 'Triglycerides']",Fate of oxidized triglycerides during refining of seed oils.,"['Q000737', 'Q000379', None, None, 'Q000737', 'Q000032', 'Q000737', 'Q000737', None, 'Q000032']","['chemistry', 'methods', None, None, 'chemistry', 'analysis', 'chemistry', 'chemistry', None, 'analysis']",https://www.ncbi.nlm.nih.gov/pubmed/14705891,2005
14558129,"The distribution of fatty acids in a triacylglycerol is of great importance from nutritional, biochemical, quality and technological points of view. The ratio of triacylglycerol positional isomers containing two linoleic acid (18:2) and one oleic acid (18:1) moieties--namely, 1(3),2-dilinoleoyl-3(1)-oleoyl glycerol (LLO) and 1,3-dilinoleoyl-2-oleoyl glycerol (LOL)--were quantified in grape seed, olive, pumpkin seed, soybean, sunflower and wheat germ oils by high-performance liquid chromatography/atmospheric pressure chemical ionization mass spectrometry (HPLC/APCI-MS) in selected ion monitoring (SIM) mode. Relative LOL contents (LOL/(LLO+LOL)) of the oils were calculated from the mass abundances of the [LL]+ and [LO]+ diacylglycerol fragment ions ([M+H-RCOOH]+) using a calibration curve. The calibration curve of the relative diacylglycerol mass abundances was measured in SIM mode. The relative LOL contents were found to be relatively consistent for each oil variety. The relative LOL content in grape seed, sunflower, pumpkin seed, soybean and wheat germ oils accounted for 44.2 +/- 2.6, 26.8 +/- 3.2, 16.7 +/- 4.6, 15.9 +/- 2.9 and 13.9 +/- 4.3%, respectively. Only olive oils contained practically 100% of the LLO isomer. These results indicate that the unsaturated fatty acids such as linoleic and oleic acids have 'non-random' distribution patterns in various oils.",Rapid communications in mass spectrometry : RCM,"['D028464', 'D005990', 'D007536', 'D013058', 'D019906', 'D019301', 'D000069463', 'D010938', 'D012015', 'D012639', 'D013024', 'D000074242', 'D027843']","['Cucurbita', 'Glycerol', 'Isomerism', 'Mass Spectrometry', 'Nuclear Magnetic Resonance, Biomolecular', 'Oleic Acid', 'Olive Oil', 'Plant Oils', 'Reference Standards', 'Seeds', 'Soybean Oil', 'Sunflower Oil', 'Vitis']",Quantification of the ratio of positional isomer dilinoleoyl-oleoyl glycerols in vegetable oils.,"['Q000737', 'Q000031', None, None, None, None, None, 'Q000737', None, 'Q000737', 'Q000737', None, 'Q000737']","['chemistry', 'analogs & derivatives', None, None, None, None, None, 'chemistry', None, 'chemistry', 'chemistry', None, 'chemistry']",https://www.ncbi.nlm.nih.gov/pubmed/14558129,2004
12458717,,Analytical sciences : the international journal of the Japan Society for Analytical Chemistry,"['D003300', 'D003314', 'D007854', 'D010879', 'D010938', 'D011190', 'D013024', 'D013054', 'D000074242']","['Copper', 'Corn Oil', 'Lead', 'Piperazines', 'Plant Oils', 'Potassium Cyanide', 'Soybean Oil', 'Spectrophotometry, Atomic', 'Sunflower Oil']",Determination of copper in edible oils by atomic absorption spectrometry after lead piperazinedithiocarbamate solid-phase extraction and potassium cyanide back-extraction.,"['Q000032', 'Q000737', 'Q000737', 'Q000737', 'Q000737', 'Q000737', 'Q000737', 'Q000379', None]","['analysis', 'chemistry', 'chemistry', 'chemistry', 'chemistry', 'chemistry', 'chemistry', 'methods', None]",https://www.ncbi.nlm.nih.gov/pubmed/12458717,2003
11911490,"Epidemiological studies have indicated that the exposure to carcinogenic components formed during the cooking of food might be associated with lung cancer risk of Chinese women. Previous studies have confirmed that cooking oil fumes from frying fish (COF) contained relatively high amount of benzo[a]pyrene, 2-methyl-3,8-dimethylimidazo[4,5-f] qunoxaline, benzene, and 1,3-butadiene, reported in fumes from heated soybean oil. Thus, we consider that oxidative stress induced by COF may play a role in lung cancer development among Chinese women. To verify whether the oxidative DNA damage was induced by COF, high-performance liquid chromatography (HPLC) analysis data showed that the levels of 8-hydroxydeoxyguanine (8-OH dG) were increased in a dose-dependent manner when calf thymus DNA reacted with various concentrations of COF. Since human 8-oxoguanine DNA glycosylase 1 (hOGG1) was a repair enzyme for removing 8- OH dG from damaged DNA, we hypothesized that hOGG1 mRNA may be used to assess the risk of oxidative damage induced by the exposure of COF. The results from reverse-transcription polymerase chain reaction showed that the hOGG1 mRNA expression was induced by hydrogen peroxide (H2O2) and COF in human lung adenocarcinoma CL-3 cells. To elucidate whether hOGG1 mRNA expression was an exposure biomarker of COF, a cross-sectional study of 238 subjects including 94 professional cooks, 43 housewives, and 101 COF-nonexposed control subjects was conducted. The hOGG1 mRNA expression frequencies of COF-exposed cooks (27 of 94, 28.7%) and housewives (6 of 43, 14%) were significantly higher than those of control subjects (4 of 101, 4%). After adjusting for age, sex, and smoking and drinking status, the odds risks (ORs) of housewives versus control and cooks versus control were 3.94 (95% confidence interval [CI] = 0.95-16.62) and 10.12 (95% CI = 2.83-36.15), respectively. These results indicated that hOGG1 may be adequate to act as an exposure biomarker to assess the oxidative DNA damage induced by COF. This also suggests that oxidative stress induced by COF may play a role in lung cancer development among Chinese women.",Journal of toxicology and environmental health. Part A,"['D000230', 'D000328', 'D000818', 'D015415', 'D002273', 'D002417', 'D002851', 'D003296', 'D003430', 'D004249', 'D017931', 'D043382', 'D004305', 'D005260', 'D006801', 'D008175', 'D009699', 'D016017', 'D018384', 'D010938', 'D012333', 'D013950']","['Adenocarcinoma', 'Adult', 'Animals', 'Biomarkers', 'Carcinogens', 'Cattle', 'Chromatography, High Pressure Liquid', 'Cooking', 'Cross-Sectional Studies', 'DNA Damage', 'DNA Primers', 'DNA-Formamidopyrimidine Glycosylase', 'Dose-Response Relationship, Drug', 'Female', 'Humans', 'Lung Neoplasms', 'N-Glycosyl Hydrolases', 'Odds Ratio', 'Oxidative Stress', 'Plant Oils', 'RNA, Messenger', 'Thymus Gland']",Human 8-oxoguanine DNA glycosylase 1 mRNA expression as an oxidative stress exposure biomarker of cooking oil fumes.,"['Q000209', None, None, 'Q000032', 'Q000009', None, None, None, None, None, None, None, None, None, None, 'Q000209', 'Q000096', None, None, 'Q000009', 'Q000096', None]","['etiology', None, None, 'analysis', 'adverse effects', None, None, None, None, None, None, None, None, None, None, 'etiology', 'biosynthesis', None, None, 'adverse effects', 'biosynthesis', None]",https://www.ncbi.nlm.nih.gov/pubmed/11911490,2002
11588904,"The tocopherols, the major vitamers of vitamin E, are believed to play a role in the prevention of human aging-related diseases such as cancer and heart disease, yet little is known concerning determinants of their plasma concentrations. Evidence from animal studies suggests that the dietary source of gamma-tocopherol can significantly affect plasma levels of this tocopherol as well as its functional vitamin E activity. To determine whether plasma levels of tocopherols in humans are similarly altered, a study was undertaken in which subjects (n = 9) were fed muffins containing equivalent amounts of gamma-tocopherol from sesame seeds, walnuts, or soy oil. We observed that consumption of as little as 5 mg of gamma-tocopherol per day over a three-day period from sesame seeds, but not from walnuts or soy oil, significantly elevated serum gamma-tocopherol levels (19.1% increase, p = 0.03) and depressed plasma beta-tocopherol (34% decrease, p = 0.01). No significant changes in baseline or postintervention plasma levels of cholesterol, triglycerides, or carotenoids were seen for any of the intervention groups. All subjects consuming sesame seed-containing muffins had detectable levels of the sesame lignan sesamolin in their plasma. Consumption of moderate amounts of sesame seeds appears to significantly increase plasma gamma-tocopherol and alter plasma tocopherol ratios in humans and is consistent with the effects of dietary sesame seeds observed in rats leading to elevated plasma gamma-tocopherol and enhanced vitamin E bioactivity.",Nutrition and cancer,"['D000328', 'D000375', 'D000975', 'D001939', 'D002851', 'D004149', 'D005260', 'D005504', 'D006801', 'D017705', 'D008297', 'D008875', 'D009754', 'D012639', 'D012715', 'D013024', 'D024505', 'D024504']","['Adult', 'Aging', 'Antioxidants', 'Bread', 'Chromatography, High Pressure Liquid', 'Dioxoles', 'Female', 'Food Analysis', 'Humans', 'Lignans', 'Male', 'Middle Aged', 'Nuts', 'Seeds', 'Sesame Oil', 'Soybean Oil', 'Tocopherols', 'gamma-Tocopherol']",Effects of dietary sesame seeds on plasma tocopherol levels.,"[None, 'Q000378', 'Q000008', None, None, None, None, None, None, None, None, None, 'Q000737', 'Q000737', 'Q000494', 'Q000737', 'Q000097', 'Q000008']","[None, 'metabolism', 'administration & dosage', None, None, None, None, None, None, None, None, None, 'chemistry', 'chemistry', 'pharmacology', 'chemistry', 'blood', 'administration & dosage']",https://www.ncbi.nlm.nih.gov/pubmed/11588904,2002
11318065,"Individual triglyceride (TG) species of olive oil and several seed oils (corn, cottonseed, palm, peanut, soybean, and sunflower) are baseline separated on a WCOT TAP CB fused-silica capillary column by capillary gas chromatography (CGC) with a flame-ionization detector (FID) and either cold on-column or split injection. An adulteration of olive oil with a low content (< 5%) of these seed oils (except peanut oil) can be verified by the detection of the increasing levels of trilinolein or tripalmitin in olive oil in which these TG species are normally absent or present at very low levels (< 0.5%). An adulteration with over 20% peanut oil can be detected by the increasing levels of palmitodilinolein. TG species that can be coeluted with trilinolein in the reversed-phase high-performance liquid chromatographic (RP-HPLC) mode are baseline separated by the CGC technique, and their structures are identified by selective ion monitoring mass spectrometry. The following comparisons--the CGC-FID and RP-HPLC methods for detection of adulteration, cold on-column and split-injection modes for CGC-FID, and silylation or thin-layer chromatography pretreatment and simple dilution of one or more of the oil samples--are also presented. The normalized percentage area of the TG species is sufficient for the method limits used in this study. Mixtures of virgin olive oil with refined or residue olive oil could not be distinguished from the virgin type by the method used in this study.",Journal of chromatographic science,"['D002849', 'D002851', 'D002855', 'D005506', 'D000069463', 'D010938', 'D015203', 'D012639', 'D014280']","['Chromatography, Gas', 'Chromatography, High Pressure Liquid', 'Chromatography, Thin Layer', 'Food Contamination', 'Olive Oil', 'Plant Oils', 'Reproducibility of Results', 'Seeds', 'Triglycerides']",Analysis of olive oil and seed oil triglycerides by capillary gas chromatography as a tool for the detection of the adulteration of olive oil.,"['Q000379', 'Q000379', 'Q000379', None, None, 'Q000737', None, 'Q000737', 'Q000032']","['methods', 'methods', 'methods', None, None, 'chemistry', None, 'chemistry', 'analysis']",https://www.ncbi.nlm.nih.gov/pubmed/11318065,2001
11170612,"Several margarine base stock candidates have previously been prepared for the purpose of finding better, more oxidatively stable food components: high-saturate vegetable oils, randomized vegetable oils, vegetable oil-hard stock blends, and interesterified vegetable oil-hard stock blends. Here are reported the triacylglycerol compositions of these products, determined using reverse-phase high-performance liquid chromatography (HPLC) coupled with a flame ionization detector or a quadrupole mass spectrometer with an atmospheric pressure chemical ionization source. Triacylglycerol percent composition results for samples of known composition (randomized and interesterified samples) exhibited less average error by HPLC coupled with a quadrupole mass spectrometer with an atmospheric pressure chemical ionization source, after application of response factors, than the results by HPLC coupled with a flame ionization detector. The fatty acid compositions calculated from the mass spectrometric data exhibited less average error than the fatty acid compositions resulting from the flame ionization detector data. The average error of the fatty acid compositions by the mass spectrometer was lowest for interesterified blend samples, next lowest for randomized samples, then followed by high-saturated fatty acid oils, normal oils, and blends. Analysis of the vegetable oil-hard stock blends by mass spectrometer required special treatment for calculation of response factors.",Journal of agricultural and food chemistry,"['D002851', 'D003314', 'D005227', 'D005229', 'D008383', 'D013058', 'D010938', 'D000074262', 'D013024', 'D013229', 'D014280']","['Chromatography, High Pressure Liquid', 'Corn Oil', 'Fatty Acids', 'Fatty Acids, Monounsaturated', 'Margarine', 'Mass Spectrometry', 'Plant Oils', 'Rapeseed Oil', 'Soybean Oil', 'Stearic Acids', 'Triglycerides']",Triacylglycerol analysis of potential margarine base stocks by high-performance liquid chromatography with atmospheric pressure chemical ionization mass spectrometry and flame ionization detection.,"['Q000379', 'Q000032', 'Q000032', 'Q000032', 'Q000032', 'Q000379', 'Q000737', None, 'Q000032', 'Q000032', 'Q000032']","['methods', 'analysis', 'analysis', 'analysis', 'analysis', 'methods', 'chemistry', None, 'analysis', 'analysis', 'analysis']",https://www.ncbi.nlm.nih.gov/pubmed/11170612,2001
11041143,"The formation of heterocyclic amines (HAs) in fried fish fiber during processing and storage was studied. Fried fish fiber was prepared by boiling of raw fish, followed by eviscerating, pressing, chopping, and then the fish meat was subjected to frying, during which the various additives such as sugar, soybean sauce, and edible oil were added. The various HAs in fried fish fiber were analyzed by high-performance liquid chromatography with photodiode-array detection. Only four HAs, Norharman, Harman, 2-amino-9H-pyrido[2,3-b]indole, and 2-amino-3-methyl-9H-pyrido[2,3-b]indole were detected in fried fish fiber. The amount of HAs increased with increasing frying temperature. Amino acids might play a more important role for HA formation than reducing sugar during processing of fried fish fiber. During storage, the HAs increased with increasing storage temperature when the fried fish fiber was packed in an aluminum foil bag. However, the relationship between storage temperature and HAs formation was not consistent when the fried fish fiber was packed in a plastic bag.",Journal of food protection,"['D000588', 'D000818', 'D002851', 'D003296', 'D005396', 'D005399', 'D005511', 'D018857', 'D005519', 'D006571', 'D006358', 'D009153', 'D010084']","['Amines', 'Animals', 'Chromatography, High Pressure Liquid', 'Cooking', 'Fish Products', 'Fishes', 'Food Handling', 'Food Packaging', 'Food Preservation', 'Heterocyclic Compounds', 'Hot Temperature', 'Mutagens', 'Oxidation-Reduction']",Formation of heterocyclic amines in fried fish fiber during processing and storage.,"['Q000032', None, None, None, 'Q000009', None, None, None, None, 'Q000032', None, 'Q000032', None]","['analysis', None, None, None, 'adverse effects', None, None, None, None, 'analysis', None, 'analysis', None]",https://www.ncbi.nlm.nih.gov/pubmed/11041143,2001
