PMID,abstract,journal,mesh_UIds,mesh_terms,paper,qual_UIds,qual_terms,webpage,year
23605240,"Eighty-two samples of dried food commodities from Cameroon were screened and quantified for different mycotoxins, including fumonisin B1 (FB1), zearalenone (ZEA), deoxynivalenol (DON), aflatoxin (AF) and ochratoxin A (OTA), by thin-layer chromatography (TLC) and high-performance liquid chromatography (HPLC), respectively. The percentage of positive samples was as follows: FB1 41%, AF 51%, ZEA 57%, DON 65% and OTA 3%. High FB1 contents were found in maize, averaging 3,684 µg/kg (range: 37-24,225 µg/kg), whereas the highest average ZEA level was found in peanuts (70 µg/kg), followed by maize (69 µg/kg), rice (67 µg/kg) and beans (48 µg/kg) with no ZEA was detected in soybeans. DON contents were low, ranging from 13 to 273 µg/kg, and for AF the average content was 2.6 µg/kg with peanuts and maize as principal substrates. The incidence of OTA was low, with a mean level of 6.4 µg/kg recorded. The majority (79%) of samples contained more than one mycotoxin and the most frequent co-occurrence found was FB1 + ZEA + DON, detected in 21% of samples (mainly maize) analysed. Co-contamination with FB1 + ZEA + DON + AF was found in 11% of the samples. Although a large proportion of samples had fairly low levels of individual mycotoxins, this should be of concern as the co-occurrence of mycotoxins may generate additive or synergistic effect in humans, especially if the respective commodities are consumed almost on a daily basis.",Mycotoxin research,[],[],Simultaneous occurrence of mycotoxins in human food commodities from Cameroon.,[],[],https://www.ncbi.nlm.nih.gov/pubmed/23605240,2013
19998385,"Sterigmatocystin (STC) is a mycotoxin produced by fungi of many different Aspergillus species. Other species such as Bipolaris, Chaetomium, Emiricella are also able to produce STC. STC producing fungi were frequently isolated from different foodstuffs, while STC was regularly detected in grains, corn, bread, cheese, spices, coffee beans, soybeans, pistachio nuts, animal feed and silage. STC shows different toxicological, mutagenic and carcinogenic effects in animals and has been recognized as a 2B carcinogen (possible human carcinogen) by International Agency for Research on Cancer. There are more than 775 publications available in Scopus (and more than 505 in PubMed) mentioning STC, but there is no summary information available about STC occurrence and analysis in food. This review presents an overview of the worldwide information on the occurrence of STC in different foodstuffs during the last 40 years, and describes the progress made in analytical methodology for the determination of STC in food.",Molecular nutrition & food research,"['D000818', 'D002273', 'D002849', 'D002851', 'D002855', 'D004797', 'D005502', 'D005504', 'D005506', 'D006801', 'D013241', 'D053719']","['Animals', 'Carcinogens', 'Chromatography, Gas', 'Chromatography, High Pressure Liquid', 'Chromatography, Thin Layer', 'Enzyme-Linked Immunosorbent Assay', 'Food', 'Food Analysis', 'Food Contamination', 'Humans', 'Sterigmatocystin', 'Tandem Mass Spectrometry']",Sterigmatocystin: occurrence in foodstuffs and analytical methods--an overview.,"[None, 'Q000032', 'Q000379', 'Q000379', 'Q000379', 'Q000379', 'Q000592', 'Q000379', 'Q000331', None, 'Q000032', None]","[None, 'analysis', 'methods', 'methods', 'methods', 'methods', 'standards', 'methods', 'legislation & jurisprudence', None, 'analysis', None]",https://www.ncbi.nlm.nih.gov/pubmed/19998385,2010
19772728,"The estimation of the dietary intake of gamma-aminobutyric acid (GABA) is dependent upon the knowledge of its concentration values in food matrices. To this end, an isotope dilution liquid chromatography-mass spectrometry method has been developed employing the hydrophilic interaction chromatography technique for analyte separation. This approach enabled accurate quantification of GABA in apple, potato, soybeans, and orange juice without the need of a pre- or post-column derivatization reaction. A selective and precise analytical measurement has been obtained with a triple quadrupole mass spectrometer operating in multiple reaction monitoring using the method of standard additions and GABA-d(6) as an internal standard. The concentrations of GABA found in the matrices tested are 7 microg/g of apple, 342 microg/g of potatoes, 211 microg/g of soybeans, and 344 microg/mL of orange juice.",Journal of chromatographic science,"['D001628', 'D002853', 'D032084', 'D004032', 'D005504', 'D006801', 'D027845', 'D011198', 'D013025', 'D021241', 'D005680']","['Beverages', 'Chromatography, Liquid', 'Citrus sinensis', 'Diet', 'Food Analysis', 'Humans', 'Malus', 'Solanum tuberosum', 'Soybeans', 'Spectrometry, Mass, Electrospray Ionization', 'gamma-Aminobutyric Acid']",Determination of gamma-aminobutyric acid in food matrices by isotope dilution hydrophilic interaction chromatography coupled to mass spectrometry.,"['Q000032', 'Q000379', 'Q000737', None, 'Q000379', None, 'Q000737', 'Q000737', 'Q000737', 'Q000379', 'Q000032']","['analysis', 'methods', 'chemistry', None, 'methods', None, 'chemistry', 'chemistry', 'chemistry', 'methods', 'analysis']",https://www.ncbi.nlm.nih.gov/pubmed/19772728,2009
19768985,"The growing clinical interest and use of soybean-based food products and extracts to increase dietary phytoestrogen intake have led to medical interest in the precise determination of the phytoestrogen composition of soybean products. We have analyzed the composition of these compounds in 20 domestic and introduced varieties of genetically non-modified soybean genotypes grown under the same agroecological conditions. The isoflavone content of soybeans cultivated in this region of Serbia has not been previously reported. The assays were performed, after extraction with methanol-water (8:2, v/v), by C18 reversed phase high-performance liquid chromatography coupled with photodiode array detection. The total phytoestrogen concentration was found to be between 2.24 and 3.79 mg g(-1) dry bean weight. The total concentration of daidzein and its derivatives ranged from 0.96 to 1.82 mg g(-1), total glyciteines from 0.34-0.53 mg g(-1), and all genistein derivatives from 0.86-1.67 mg g(-1) dry bean weight. Given the high biological potency of phytoestrogens and their metabolic conversion products, our data suggest that phytoestrogen content screening could be a useful tool in the selection of soybean genotypes with improved health promoting characteristics.",Natural product communications,"['D002851', 'D004463', 'D005260', 'D005838', 'D006801', 'D007529', 'D000432', 'D048789', 'D010936', 'D017698', 'D055771', 'D013025', 'D014867']","['Chromatography, High Pressure Liquid', 'Ecology', 'Female', 'Genotype', 'Humans', 'Isoflavones', 'Methanol', 'Phytoestrogens', 'Plant Extracts', 'Postmenopause', 'Serbia', 'Soybeans', 'Water']",Determination of phytoestrogen composition in soybean cultivars in Serbia.,"[None, None, None, None, None, 'Q000302', None, 'Q000737', 'Q000302', 'Q000187', None, 'Q000737', None]","[None, None, None, None, None, 'isolation & purification', None, 'chemistry', 'isolation & purification', 'drug effects', None, 'chemistry', None]",https://www.ncbi.nlm.nih.gov/pubmed/19768985,2010
19691963,"In recent years, increasing knowledge of the positive health effects of food polyphenols has prompted the need to develop new separation techniques for their extraction, fractionation and analysis. This article provides an updated and exhaustive review of the application of counter-current chromatography, high performance liquid chromatography, capillary electrophoresis, and their hyphenation with mass spectrometry to the study of food polyphenols. Flavonoids constitute the largest class of polyphenols, widely spread in the plant kingdom and common in human diet which has been the most widely studied with respect to their antioxidant and biological activities. The main subgroups are anthocyanins, catechins, isoflavones, flavonols and flavones. They are reported to exhibit antioxidant, anti-carcinogenic, anti-inflammatory, anti-atherogenic, anti-thrombotic, and immune modulating functions, among others. Since red fruit anthocyanins, soy isoflavones and flavanols from grapes and teas are currently the most used phenolic compounds for producing new nutraceuticals and functional foods, this review is focused on these three flavonoid groups.",Journal of chromatography. A,"['D000872', 'D002845', 'D002851', 'D019075', 'D005419', 'D044948', 'D005504', 'D005638', 'D007529', 'D013058', 'D010636', 'D059808', 'D013025', 'D027843']","['Anthocyanins', 'Chromatography', 'Chromatography, High Pressure Liquid', 'Electrophoresis, Capillary', 'Flavonoids', 'Flavonols', 'Food Analysis', 'Fruit', 'Isoflavones', 'Mass Spectrometry', 'Phenols', 'Polyphenols', 'Soybeans', 'Vitis']","Advanced separation methods of food anthocyanins, isoflavones and flavanols.","['Q000737', 'Q000379', 'Q000379', 'Q000379', 'Q000032', 'Q000737', 'Q000379', 'Q000737', 'Q000737', 'Q000379', 'Q000032', None, 'Q000737', 'Q000737']","['chemistry', 'methods', 'methods', 'methods', 'analysis', 'chemistry', 'methods', 'chemistry', 'chemistry', 'methods', 'analysis', None, 'chemistry', 'chemistry']",https://www.ncbi.nlm.nih.gov/pubmed/19691963,2010
22519677,"Soybean is an important Brazilian agricultural commodity that contains a high concentration of isoflavones. Many studies showed that isoflavones are active in the prevention of many human diseases. However, the correct processing techniques used to prepare the soy foodstuffs are important to maintain the active forms. The objective of this study was to evaluate the effect of gamma irradiation on the isoflavone contents of the defatted soybean flour when compared with soybean molasses, a derivative from the soybean food production. After extracting phenolic compounds with methanol aqueous solution (80%), isoflavones were detected by reverse-phase high-performance liquid chromatography/diode-array detector. The radiation doses of 2 and 5 kGy presented a small effect on the isoflavones content of defatted soy flour. Samples irradiated at 50 kGy showed lower isoflavone contents. The observed reduction in the concentration of isoflavones-daidzein, glycitein and genistein-induced by gamma radiation in soy molasses was not significant in defatted soy flour, thus suggesting that isoflavones in defatted soy flour were not eliminated by gamma radiation at rates up to 50 kGy.",International journal of food sciences and nutrition,"['D002851', 'D004032', 'D005433', 'D005511', 'D005720', 'D019833', 'D006801', 'D007529', 'D012639', 'D045730', 'D013025']","['Chromatography, High Pressure Liquid', 'Diet', 'Flour', 'Food Handling', 'Gamma Rays', 'Genistein', 'Humans', 'Isoflavones', 'Seeds', 'Soy Foods', 'Soybeans']",Changes in isoflavone profiles of soybean treated with gamma irradiation.,"[None, None, None, 'Q000379', None, 'Q000032', None, 'Q000032', 'Q000737', 'Q000032', 'Q000737']","[None, None, None, 'methods', None, 'analysis', None, 'analysis', 'chemistry', 'analysis', 'chemistry']",https://www.ncbi.nlm.nih.gov/pubmed/22519677,2013
19626844,"A method was developed for the determination of 20 kinds of pesticide residues in soybeans and corn with the technique of offline disperse solid-phase extraction and gas chromatography-negative chemical ionization mass spectrometry (GC-NCI/MS). The pesticides interested were extracted twice from the samples with acetonitrile. The combined extract was concentrated to dryness and redissolved in acetonitrile, then cleaned up by dispersive solid-phase extraction with sorbents of N-propyl ethylene diamine (PSA), graphited carbon black, and C18, and determined and confirmed by GC-NCI/MS. The recoveries of all pesticides were in the range of 70%-130% at three spiked levels (5, 10 and 20 microg/kg), and the relative standard deviations were below than 17%. The linearity of the method was good in the concentration range of 20-400 microg/L, and limits of quantification (LOQs) were no more than 2 microg/kg. The method is selective well with no interference and suitable for the confirmatory of pesticide residues in soybeans and corn.",Se pu = Chinese journal of chromatography,"['D005506', 'D008401', 'D010573', 'D052616', 'D013025', 'D003313']","['Food Contamination', 'Gas Chromatography-Mass Spectrometry', 'Pesticide Residues', 'Solid Phase Extraction', 'Soybeans', 'Zea mays']",[Determination of 20 kinds of pesticide residues in soybeans and corn using gas chromatography-negative chemical ionization mass spectrometry coupled with offline disperse solid-phase extraction].,"['Q000032', 'Q000379', 'Q000032', 'Q000379', 'Q000737', 'Q000737']","['analysis', 'methods', 'analysis', 'methods', 'chemistry', 'chemistry']",https://www.ncbi.nlm.nih.gov/pubmed/19626844,2010
19618241,"The aim of this study was to investigate potential differences in liver protein expression of Atlantic salmon fed genetically modified (GM) Roundup Ready soy at a high inclusion level (25% inclusion, constituting 21% of crude protein in the diet) for 7 months or a compositionally similar non-GM diet. The liver was selected as the target organ due to its importance in the general metabolism, and 2D gel electrophoresis used as a screening tool. Samples from 12 individual fish from each diet group were evaluated. Of a total of 781 analysed protein spots, only 36 were significantly different by ANOVA (p < 0.05) in abundance between the diet groups. All these spots had low fold differences (1.2-1.6) and high false discovery rate (q = 0.44), indicating minor differences in liver protein synthesis between fish fed GM and non-GM soy. Additionally, low fold differences were observed. Four protein spots were analyzed by liquid chromatography tandem mass spectrometry and identified using a combination of online searches in NCBI and searches in an inhouse database containing salmonid expressed sequence tags and contigs. Follow-up on these proteins by real-time polymerase chain reaction did not identify differences at the transcriptional level.","Marine biotechnology (New York, N.Y.)","['D000821', 'D000824', 'D000818', 'D004032', 'D002149', 'D030841', 'D005786', 'D030821', 'D040901', 'D020317', 'D013025']","['Animal Feed', 'Animal Nutritional Physiological Phenomena', 'Animals', 'Diet', 'Energy Intake', 'Food, Genetically Modified', 'Gene Expression Regulation', 'Plants, Genetically Modified', 'Proteomics', 'Salmo salar', 'Soybeans']",Proteomic profiling of liver from Atlantic salmon (Salmo salar) fed genetically modified soy compared to the near-isogenic non-GM line.,"['Q000032', None, None, 'Q000662', None, None, 'Q000187', None, None, 'Q000378', 'Q000235']","['analysis', None, None, 'veterinary', None, None, 'drug effects', None, None, 'metabolism', 'genetics']",https://www.ncbi.nlm.nih.gov/pubmed/19618241,2010
19585533,"Extracellular peroxygenase from the agaric fungus Agrocybe aegerita is a versatile biocatalyst that oxygenates various substrates by means of hydrogen peroxide. The enzyme is routinely produced in suspensions of soybean meal and has until now been purified by several steps of fast protein liquid chromatography (FPLC) using different ion exchangers. The final protein fraction had a molecular mass of 46 kDa but still consisted of several incompletely separated proteins with slightly differing isoelectric points (pI 5.2, 5.6, 6.1), probably representing differently glycosylated isoforms. This made it difficult to further purify the individual protein forms. Since homogeneous protein fractions are a pre-requisite for X-ray crystallography and specific structure-function studies, an appropriate FPLC procedure was developed starting with pre-purification of crude peroxygenase on SP Sepharose followed by chromatofocusing on a Mono P column and elution with a pH gradient. Three sufficiently separated main protein peaks were eluted from the Mono P column and confirmed to be distinct forms of aromatic peroxygenase with different pIs. All A. aegerita peroxygenase forms oxygenated toluene and naphthalene and no catalytic differences were observed between them. We tested also two devices for preparative isoelectric focusing (Rotofor, IsoPrime systems) for peroxygenase separation but resolution and protein recovery were not sufficient.",Biotechnology journal,"['D055362', 'D002852', 'D005656', 'D007525', 'D006899', 'D009281', 'D020033', 'D018892', 'D014050']","['Agrocybe', 'Chromatography, Ion Exchange', 'Fungal Proteins', 'Isoelectric Focusing', 'Mixed Function Oxygenases', 'Naphthalenes', 'Protein Isoforms', 'Proton-Motive Force', 'Toluene']",Purification of homogeneous forms of fungal peroxygenase.,"['Q000737', None, 'Q000737', None, 'Q000737', 'Q000378', None, None, 'Q000378']","['chemistry', None, 'chemistry', None, 'chemistry', 'metabolism', None, None, 'metabolism']",https://www.ncbi.nlm.nih.gov/pubmed/19585533,2010
19476361,"The potential of individual glycolipid classes from lecithins (soybean, rapeseed, and sunflower) in breadmaking was determined in comparison to classical surfactants such as diacetyltartaric acid esters of mono- and diacylglycerides (DATEM), monoacylglycerides, sodium stearoyl-2-lactylate (SSL), and two synthetic glycolipids by means of rheological and baking tests on a microscale. A highly glycolipid-enriched sample containing the entire glycolipid moiety of the lecithin was obtained using an optimized batch procedure with silica gel. This sample was subsequently used to gain individual glycolipid classes through column chromatography on silica gel. The major glycolipid classes in the lecithins, digalactosyl diacylglycerides (1), sterol glucosides (2), acylated sterol glucosides (3), and cerebrosides (4), were identified and characterized. All isolated glycolipid classes displayed excellent baking performance. A better baking activity than that of the classical surfactants was displayed by 1, 3, and 4 and an equivalent baking activity by 2. The same glycolipid classes, except 3, of different lecithin origin showed only slight differences in their baking activities, due to different fatty acid compositions. Furthermore, the glycolipid classes influenced the crumb structure significantly by improving the crumb softness and grain. Interestingly, none of the glycolipid classes showed significant antistaling effect. A direct effect on the overall rheological behavior of the dough was only found for the commercial surfactants. However, the rheological effect seen on gluten isolated from surfactant-containing dough revealed that the surfactants could be divided into two main groups, one of them directly forming and stabilizing liquid film lamellae through adsorption to interfaces and the other indirectly increasing the surface activity of the endogenous lipids in the flour. The results suggest that in wheat dough, glycolipids seem to have an impact on the dough liquor rather than on the gluten-starch matrix.",Journal of agricultural and food chemistry,"['D000215', 'D005433', 'D019649', 'D006017', 'D054709', 'D015394', 'D013501', 'D014908']","['Acylation', 'Flour', 'Food Industry', 'Glycolipids', 'Lecithins', 'Molecular Structure', 'Surface-Active Agents', 'Triticum']",Molecular structure and baking performance of individual glycolipid classes from lecithins.,"[None, 'Q000032', None, 'Q000737', 'Q000737', None, 'Q000737', 'Q000737']","[None, 'analysis', None, 'chemistry', 'chemistry', None, 'chemistry', 'chemistry']",https://www.ncbi.nlm.nih.gov/pubmed/19476361,2009
19389458,"This paper studied the possible effect of folic acid in fortified Baladi bread on the prevention of colon cancer development in rats. Wheat flour samples (82% extraction rate) and soy bean flour were analyzed to determine their folic acid contents using the High Performance Liquid Chromatography (HPLC). Unfortified and folic acid fortified Baladi breads were prepared. Samples from each step of bread preparation were analyzed for folic acid concentration. Protein, fat, ash, fibers and carbohydrates percentages were also determined. Rats were divided into five groups, four of them were injected subcutaneously with dimethylhydrazine (DMH). After 15 weeks, the rats were sacrificed for pathological examination. Results showed that the folic acid content in wheat flour (82% extraction rate) was found to be highly significantly lower than that in soybean flour. After baking, folic acid content in all breads was found to decrease significantly. The highest protein and fat contents were found in soybean flour fortified Baladi bread. The colons of rats of groups 3 (fed 5% soy flour fortified Baladi bread) and 5 (fed Baladi bread fortified with 5% soy flour+8 mg folic acid/kg wheat flour) were the mostly affected by DMH injection as premalignant changes were observed.",Food and chemical toxicology : an international journal published for the British Industrial Biological Research Association,"['D000818', 'D001835', 'D001939', 'D002273', 'D002851', 'D003110', 'D003296', 'D004032', 'D004127', 'D004355', 'D004435', 'D005433', 'D005492', 'D005527', 'D006813', 'D007413', 'D051381', 'D013025', 'D014908']","['Animals', 'Body Weight', 'Bread', 'Carcinogens', 'Chromatography, High Pressure Liquid', 'Colonic Neoplasms', 'Cooking', 'Diet', 'Dimethylhydrazines', 'Drug Stability', 'Eating', 'Flour', 'Folic Acid', 'Food, Fortified', 'Humidity', 'Intestinal Mucosa', 'Rats', 'Soybeans', 'Triticum']",Effect of processing on folic acid fortified Baladi bread and its possible effect on the prevention of colon cancer.,"[None, 'Q000187', 'Q000032', None, None, 'Q000139', None, None, None, None, 'Q000187', 'Q000032', 'Q000032', None, None, 'Q000033', None, 'Q000737', 'Q000737']","[None, 'drug effects', 'analysis', None, None, 'chemically induced', None, None, None, None, 'drug effects', 'analysis', 'analysis', None, None, 'anatomy & histology', None, 'chemistry', 'chemistry']",https://www.ncbi.nlm.nih.gov/pubmed/19389458,2009
19301324,"A nontargeted protein identification method was developed to screen for adulterations in skimmed-milk powder (SMP). There are indications of falsified SMP content due to the addition of plant proteins. To demonstrate the reliability and accuracy of the developed comparative LC-MS method using a quadrupole TOF MS instrument, adulterated SMP samples were prepared by the addition of protein isolates of soy and pea to skimmed-milk before pasteurisation and evaporation. The comparative LC-MS approach enabled unequivocal discrimination of those SMP samples containing soy and pea protein from nonadulterated SMP. To identify the source of (plant) proteins present in the adulterated SMP, data-dependent LC-MS/MS was used in combination with an include list of differential peptides. Numerous peptides originating from the major seed proteins of soy (glycinin, beta-conglycin) and pea (legumin, vicilin) could be identified in this way.",Journal of separation science,"['D000818', 'D002853', 'D005504', 'D005506', 'D013058', 'D008892', 'D008969', 'D018532', 'D010455', 'D010940', 'D011208', 'D013025']","['Animals', 'Chromatography, Liquid', 'Food Analysis', 'Food Contamination', 'Mass Spectrometry', 'Milk', 'Molecular Sequence Data', 'Peas', 'Peptides', 'Plant Proteins', 'Powders', 'Soybeans']",Untargeted LC-Q-TOF mass spectrometry method for the detection of adulterations in skimmed-milk powder.,"[None, 'Q000295', 'Q000295', 'Q000032', 'Q000295', 'Q000737', None, 'Q000737', 'Q000032', 'Q000032', 'Q000737', 'Q000737']","[None, 'instrumentation', 'instrumentation', 'analysis', 'instrumentation', 'chemistry', None, 'chemistry', 'analysis', 'analysis', 'chemistry', 'chemistry']",https://www.ncbi.nlm.nih.gov/pubmed/19301324,2009
19231859,"2-Furanmethanethiol, a compound contained in many kinds of food, was identified for the first time in five types of miso fermented soybean paste (red salty rice miso, thin-colored salty rice miso, weak salty rice miso, barley miso, and soy miso) by specific extraction of volatile thiols using p-hydroxymercuribenzoate. In the triangle test with red salty rice miso, which included a higher concentration of 2-furanmethanethiol, and thin-colored salty rice miso, which included a lower concentration of 2-furanmethanethiol, it was shown that the aroma of thin-colored salty rice miso was similar to that of red salty rice miso by adding 2-furanmethanethiol into thin-colored salty rice miso. In addition, a quantitative descriptive analysis (QDA) clearly shows that 2-furanmethanethiol contributed to the intensity of three odor qualities ""thick, complex"", ""sweet"", and ""pleasant aroma like coffee beans"" in six odor qualities and was a very important component of miso aroma.",Journal of agricultural and food chemistry,"['D000328', 'D005260', 'D005285', 'D005663', 'D008401', 'D006801', 'D008297', 'D009812', 'D012903', 'D045730', 'D013438']","['Adult', 'Female', 'Fermentation', 'Furans', 'Gas Chromatography-Mass Spectrometry', 'Humans', 'Male', 'Odorants', 'Smell', 'Soy Foods', 'Sulfhydryl Compounds']",Quantification and odor contribution of 2-furanmethanethiol in different types of fermented soybean paste miso.,"[None, None, None, 'Q000032', None, None, None, 'Q000032', None, 'Q000032', 'Q000032']","[None, None, None, 'analysis', None, None, None, 'analysis', None, 'analysis', 'analysis']",https://www.ncbi.nlm.nih.gov/pubmed/19231859,2009
