PMID,abstract,journal,mesh_UIds,mesh_terms,paper,qual_UIds,qual_terms,webpage,year
24130014,"Direct infusion electrospray ionization mass spectrometry in the positive ion mode [ESI(+)-MS] is used to obtain fingerprints of aqueous-methanolic extracts of two types of olive oils, extra virgin (EV) and ordinary (OR), as well as of samples of EV olive oil adulterated by the addition of OR olive oil and other edible oils: corn (CO), sunflower (SF), soybean (SO) and canola (CA). The MS data is treated by the partial least squares discriminant analysis (PLS-DA) protocol aiming at discriminating the above-mentioned classes formed by the genuine olive oils, EV (1) and OR (2), as well as the EV adulterated samples, i.e. EV/SO (3), EV/CO (4), EV/SF (5), EV/CA (6) and EV/OR (7). The PLS-DA model employed is built with 190 and 70 samples for the training and test sets, respectively. For all classes (1-7), EV and OR olive oils as well as the adulterated samples (in a proportion varying from 0.5 to 20.0% w/w) are properly classified. The developed methodology required no ions identification and demonstrated to be fast, as each measurement lasted about 3 min including the extraction step and MS analysis, and reliable, because high sensitivities (rate of true positives) and specificities (rate of true negatives) were achieved. Finally, it can be envisaged that this approach has potential to be applied in quality control of EV olive oils.",Journal of mass spectrometry : JMS,"['D016002', 'D005506', 'D016018', 'D000069463', 'D010938', 'D011786', 'D021241']","['Discriminant Analysis', 'Food Contamination', 'Least-Squares Analysis', 'Olive Oil', 'Plant Oils', 'Quality Control', 'Spectrometry, Mass, Electrospray Ionization']",Electrospray ionization mass spectrometry and partial least squares discriminant analysis applied to the quality control of olive oil.,"[None, 'Q000032', None, None, 'Q000737', None, 'Q000379']","[None, 'analysis', None, None, 'chemistry', None, 'methods']",https://www.ncbi.nlm.nih.gov/pubmed/24130014,2014
24016262,"With the wide application of plastics, the contamination of plasticizers migrating from plastic materials in the environment is becoming ubiquitous. The presence of phthalates, the major group of plasticizers, in edible items has gained increasingly more concern due to their endocrine disrupting property. In this study, 15 plasticizers in 21 edible vegetable oils purchased from a U.S. retail market were analyzed using gas chromatograph-mass spectrometry. Di(2-ethylhexyl) phthalate (DEHP) and diisobutyl phthalate (DiBP) were detected in all oil samples. Benzylbutyl phthalate (BzBP), dibutyl phthalate (DBP), and diethyl phthalate (DEP) were detected at a rate of 95.2, 90.5, and 90.5%, respectively. The detection rates for all other plasticizers ranged from 0 to 57.1%. The content of total plasticizers in oil samples was determined to be 210-7558 μg/kg, which was comparable to the content range in oil marketed in Italy. Although no significant difference (p = 0.05) in the total content of plasticizer was observed among oil species (soybean, canola, corn, and olive), the wider range and higher average of total content of plasticizers in olive oil than other oil species indicated the inconsistence of plasticizer contamination in olive oil and a possible priority for quality monitoring. No significant difference (p = 0.05) in the total content of plasticizers was found among glass-bottle (n = 4), plastic-bottle (n = 14), and metal-can (n = 3) packaging, implying that oil packaging is not the major cause of plasticizer contamination. The daily intake amount of plasticizers contained in edible oil on this U.S. retail market constituted only a minimum percentage of reference dose established by US EPA, thus no obvious toxicological effect might be caused. However, the fact that DEHP content in two olive oils exceeded relevant special migration limits (SMLs) of Europe and China might need attention. ",Journal of agricultural and food chemistry,"['D003691', 'D004041', 'D004058', 'D052244', 'D005506', 'D005513', 'D018857', 'D057230', 'D000069463', 'D010795', 'D010938', 'D010968', 'D012995']","['Delaware', 'Dietary Fats', 'Diffusion', 'Endocrine Disruptors', 'Food Contamination', 'Food Inspection', 'Food Packaging', 'Limit of Detection', 'Olive Oil', 'Phthalic Acids', 'Plant Oils', 'Plasticizers', 'Solubility']",Plasticizer contamination in edible vegetable oil in a U.S. retail market.,"[None, 'Q000032', None, 'Q000032', None, 'Q000379', None, None, None, 'Q000032', 'Q000737', 'Q000032', None]","[None, 'analysis', None, 'analysis', None, 'methods', None, None, None, 'analysis', 'chemistry', 'analysis', None]",https://www.ncbi.nlm.nih.gov/pubmed/24016262,2014
23675783,"Rice, the staple food of south and east Asian counties, is considered to be hypoallergenic. However, several clinical studies have documented rice-induced allergy in sensitive patients. Rice proteins with molecular weights of 14-16, 26, 33, and 56 kDa have been identified as allergens. Recently, it was documented that the 56 kDa rice allergen was responsible for rice-induced anaphylaxis. The 14-16 kDa allergens have been identified as α-amylase inhibitors; the 26 kDa protein has been identified as α-globulin; and the 33 kDa protein has been identified as glyoxalase I. However, the identity of the 56 kDa rice allergen has not yet been determined. In this study, we demonstrate that serum from patients allergic to maize shows IgE binding to a 56 kDa protein that was present in both maize and rice but not in the oil seeds soybean and peanut. The 56 kDa IgE-binding protein was abundant in the rice endosperm. We have purified this protein from rice endosperm and demonstrated its reactivity to IgE antibodies from the serum of maize-allergic patients. The purified protein was subjected to matrix-assisted laser desorption ionization-time of flight-tandem mass spectrometry analysis, resulting in identification of this rice allergen as granule-bound starch synthase, a product of the Waxy gene. Immunoblot analysis using protein extracts from a waxy mutant of rice revealed the absence of the 56 kDa IgE-binding protein. Our results demonstrate that the 56 kDa rice allergen is granule-bound starch synthase and raise the possibility of using waxy mutants of rice as a potential source of the hypoallergenic diet for patients sensitized to the 56 kDa rice allergen. ",Journal of agricultural and food chemistry,"['D000485', 'D000918', 'D052179', 'D056625', 'D005512', 'D006801', 'D007073', 'D008970', 'D009154', 'D012275', 'D010940', 'D012639', 'D013214', 'D014481', 'D003313']","['Allergens', 'Antibody Specificity', 'Antigens, Plant', 'Endosperm', 'Food Hypersensitivity', 'Humans', 'Immunoglobulin E', 'Molecular Weight', 'Mutation', 'Oryza', 'Plant Proteins', 'Seeds', 'Starch Synthase', 'United States', 'Zea mays']",Identification of an abundant 56 kDa protein implicated in food allergy as granule-bound starch synthase.,"['Q000009', None, 'Q000009', 'Q000009', 'Q000097', None, 'Q000032', None, None, 'Q000009', 'Q000009', 'Q000009', 'Q000009', None, 'Q000009']","['adverse effects', None, 'adverse effects', 'adverse effects', 'blood', None, 'analysis', None, None, 'adverse effects', 'adverse effects', 'adverse effects', 'adverse effects', None, 'adverse effects']",https://www.ncbi.nlm.nih.gov/pubmed/23675783,2014
22969785,"Soybean (Glycinemax) is a hugely valuable soft commodity that generates tens of billions of dollars annually. This value is due in part to the balanced composition of the seed which is roughly 1:2:2 oil, starch, and protein by weight. In turn, the seeds have many uses with various derivatives appearing broadly in processed food products. As is true with many edible seeds, soybeans contain proteins that are anti-nutritional factors and allergens. Soybean, along with milk, eggs, fish, crustacean shellfish, tree nuts, peanuts, and wheat, elicit a majority of food allergy reactions in the United States. Soybean seed composition can be affected by breeding, and environmental conditions (e.g., temperature, moisture, insect/pathogen load, and/or soil nutrient levels). The objective of this study was to evaluate the influence of genotype and environment on allergen and anti-nutritional proteins in soybean. To address genetic and environmental effects, four varieties of non-GM soybeans were grown in six geographically distinct regions of North America (Georgia, Iowa, Kansas, Nebraska, Ontario, and Pennsylvania). Absolute quantification of proteins by mass spectrometry can be achieved with a technique called multiple reaction monitoring (MRM), during which signals from an endogenous protein are compared to those from a synthetic heavy-labeled internal standard. Using MRM, eight allergens were absolutely quantified for each variety in each environment. Statistical analyses show that for most allergens, the effects of environment far outweigh the differences between varieties brought about by breeding.",Frontiers in plant science,[],[],Environmental effects on allergen levels in commercially grown non-genetically modified soybeans: assessing variation across north america.,[],[],https://www.ncbi.nlm.nih.gov/pubmed/22969785,2012
22761142,"In this paper, we describe the development of an oil-absorbing matrix solid-phase dispersion extraction with comprehensive two-dimensional gas chromatography time-of-flight mass spectrometry suitable for screening of 68 pesticide residues (PRs) in peanut, soybean, rape seed, sesame, and sunflower seed. The 68 PRs include 27 kinds of organophosphorus, 23 organic chlorines, 11 synthetic pyrethroids, and 7 carbamates. Heptachlor epoxide was used as the internal standard. Aminopropyl silica was chosen as the dispersion sorbent of the oil-absorbing matrix solid-phase dispersion extraction and was applied to capture hydrophobic components from high oil samples. A 35-min orthogonal separation was performed by using comprehensive two-dimensional gas chromatography time-of-flight mass spectrometry with a nonpolar-polar column set. Identification of 68 PRs in the extract was finished by using the time-of-flight mass spectrometry in the assistance of an automated peak-find and spectral deconvolution software. A screening based on control design was introduced and explained. This screening method considerably reduced the cost for the quantitative and confirmatory analyses. The quality of present screening method was evaluated by the Document No. SANCO/10684/2009. The false positive rate and false negative rate provide a useful tool for the evaluation of screening performance.",Journal of separation science,"['D005506', 'D008401', 'D019684', 'D010573', 'D012639', 'D052616']","['Food Contamination', 'Gas Chromatography-Mass Spectrometry', 'Magnoliopsida', 'Pesticide Residues', 'Seeds', 'Solid Phase Extraction']",Screening for pesticide residues in oil seeds using solid-phase dispersion extraction and comprehensive two-dimensional gas chromatography time-of-flight mass spectrometry.,"['Q000032', 'Q000295', 'Q000737', 'Q000032', 'Q000737', 'Q000379']","['analysis', 'instrumentation', 'chemistry', 'analysis', 'chemistry', 'methods']",https://www.ncbi.nlm.nih.gov/pubmed/22761142,2012
22417487,"Reportedly policosanols (PCs) have various beneficial functionalities on health. A gas chromatography-tandem mass spectrometry (GC-MS/MS) with a low limit of detection (LOD), and high specificity, recovery, and precision was successfully established for the PC analysis in vegetable oils. The LODs for the PCs were in the range of 0.002 to 0.016 μg/mL. The relative standard deviation (RSD) for the repeated analysis of PCs was less than 3.356%. The mean recoveries for spiked heptacosanol and octacosanol in vegetable oil were 102.3% and 106.3%, respectively. The total PC contents in the vegetable oils varied from 3.01 to 427.83 mg/kg oil. Perilla seed, grape seed, and rice bran oils were found to be highly rich sources of PCs, containing 427.83, 245.15, and 171.17 mg PCs/kg oil, respectively. Corn, sesame, and soybean oils contained only a negligible quantity of PCs. The PC composition in vegetable oils was greatly source dependent. In perilla seed oil, octacosanol was the single most predominant component, representing 55.93% of the total PC. In grape seed oil, however, hexacosanol is the most abundant PC, followed by octacosanol, tetracosanol, and triacontanol in a decreasing order. The major PCs in rice bran oil were triacontanol, octacosanol, hexacosanol, and tetracosanol, which constituted over 87.3% of the total PC. This represents the 1st report on the composition and contents of PC in most vegetable oils analyzed here.",Journal of food science,"['D053000', 'D002855', 'D004032', 'D005233', 'D005504', 'D008401', 'D007723', 'D057230', 'D012275', 'D031343', 'D010938', 'D015203', 'D000073879', 'D012639', 'D053719', 'D027843', 'D017962']","['Analytic Sample Preparation Methods', 'Chromatography, Thin Layer', 'Diet', 'Fatty Alcohols', 'Food Analysis', 'Gas Chromatography-Mass Spectrometry', 'Korea', 'Limit of Detection', 'Oryza', 'Perilla', 'Plant Oils', 'Reproducibility of Results', 'Rice Bran Oil', 'Seeds', 'Tandem Mass Spectrometry', 'Vitis', 'alpha-Linolenic Acid']",A gas chromatography-tandem quadrupole mass spectrometric analysis of policosanols in commercial vegetable oils.,"[None, None, 'Q000208', 'Q000032', 'Q000379', None, None, None, 'Q000737', 'Q000737', 'Q000737', None, None, 'Q000737', None, 'Q000737', 'Q000737']","[None, None, 'ethnology', 'analysis', 'methods', None, None, None, 'chemistry', 'chemistry', 'chemistry', None, None, 'chemistry', None, 'chemistry', 'chemistry']",https://www.ncbi.nlm.nih.gov/pubmed/22417487,2012
22229859,"A novel screening method using an automated flow injection electrospray ionization tandem mass spectrometry system is proposed for the simultaneous determination of five nonprotein amino acids (β-alanine, alloisoleucine, ornithine, citrulline, pyroglutamic acid) and three betaines (glycine betaine, trigonelline, proline betaine) after derivatization with butanolic HCl. MS/MS experiments were carried out in a triple-quadrupole instrument using multiple reaction monitoring mode in <2 min. The proposed method provided high fingerprinting power to identify the presence of five of the studied compounds in different types of vegetable oils (soybean, sunflower, corn, olive) with LODs at parts per billion levels. The method was validated, and different mixtures of extra virgin olive oil with seed oils were analyzed, achieving the typification for the detection of adulterations in extra virgin olive oils up to 2% w/w. The nonprotein amino acid ornithine was confirmed as a marker for adulteration in the olive oils analyzed.",Journal of agricultural and food chemistry,"['D000596', 'D001622', 'D017022', 'D005506', 'D000069463', 'D010938', 'D015203', 'D053719']","['Amino Acids', 'Betaine', 'Flow Injection Analysis', 'Food Contamination', 'Olive Oil', 'Plant Oils', 'Reproducibility of Results', 'Tandem Mass Spectrometry']",Determination of nonprotein amino acids and betaines in vegetable oils by flow injection triple-quadrupole tandem mass spectrometry: a screening method for the detection of adulterations of olive oils.,"['Q000032', 'Q000032', 'Q000379', 'Q000032', None, 'Q000737', None, 'Q000379']","['analysis', 'analysis', 'methods', 'analysis', None, 'chemistry', None, 'methods']",https://www.ncbi.nlm.nih.gov/pubmed/22229859,2012
24786246,"Analysis of aflatoxin B1 (AFB1), B2 (AFB2), G1 (AFG1) and G2 (AFG2) in 76 edible oil samples (peanut oil, soybean oil, corn embryo oil and blended oil) was performed by liquid chromatography-tandem mass spectrometry (LC-MS/MS). The oils were sampled from three areas (Shijiazhuang, Baoding and Tangshan) of Hebei Province of China. AFB1 was detected in 22 samples representing 28.9%, followed by AFB2 (7.89%) and AFG1 (3.95%), while no AFG2 contamination was detected in any samples. AFB1 levels in oil samples ranged 0.14-2.72 µg kg(-1) and AFB2 ranged 0.15-0.36 µg kg(-1), while lower levels of 0.01-0.02 µg kg(-1) for AFG1 were recorded. The paper is part of an on-going investigation of aflatoxin contamination in Chinese edible oils.","Food additives & contaminants. Part B, Surveillance","['D000348', 'D002681', 'D002853', 'D004042', 'D005506', 'D011786', 'D053719']","['Aflatoxins', 'China', 'Chromatography, Liquid', 'Dietary Fats, Unsaturated', 'Food Contamination', 'Quality Control', 'Tandem Mass Spectrometry']",Determination of aflatoxins in edible oil from markets in Hebei Province of China by liquid chromatography-tandem mass spectrometry.,"['Q000032', None, 'Q000379', 'Q000032', 'Q000032', None, 'Q000379']","['analysis', None, 'methods', 'analysis', 'analysis', None, 'methods']",https://www.ncbi.nlm.nih.gov/pubmed/24786246,2014
21738671,"The allergenicity of Ricinus communis L. (castor bean, Euphorbiaceae) is associated with components of its seeds and pollen. Castor bean allergy has been described not only in laboratory workers, but also in personnel working in oil processing mills, fertilizer retail, the upholstery industry and other industrial fields. In the present study, we describe the critical amino acids in the IgE-binding epitopes in Ric c 1 and Ric c 3, two major allergens of R. communis. In addition, we also investigate the cross-reactivity between castor bean and some air and food allergen extracts commonly used in allergy diagnosis.",PloS one,"['D000485', 'D000818', 'D002367', 'D002478', 'D002846', 'D000939', 'D018698', 'D006801', 'D007073', 'D010940', 'D051381']","['Allergens', 'Animals', 'Castor Bean', 'Cells, Cultured', 'Chromatography, Affinity', 'Epitopes', 'Glutamic Acid', 'Humans', 'Immunoglobulin E', 'Plant Proteins', 'Rats']",Identification of critical amino acids in the IgE epitopes of Ric c 1 and Ric c 3 and the application of glutamic acid as an IgE blocker.,"['Q000276', None, 'Q000276', None, None, 'Q000276', 'Q000494', None, 'Q000187', 'Q000276', None]","['immunology', None, 'immunology', None, None, 'immunology', 'pharmacology', None, 'drug effects', 'immunology', None]",https://www.ncbi.nlm.nih.gov/pubmed/21738671,2011
21675932,"Over the years, there has been concern about the changes taking place in heated oils and the effects on individuals consuming them. The present study investigated the effects of a diet containing thermally oxidized soybean oil (TO) or TO supplemented with probiotic Bifidobacteria (TO+Pro) on the serum lipid profile and oxidative stress biomarkers of male rats. The data showed several indicators of oil deterioration after thermal processing, including high levels of % free fatty acid (FFA; 15-fold), acid value (AV; 14-fold), peroxide value (8-fold), p-anisidine value (AnV; 39-fold), total oxidation value (TOTOX; 19-fold), thiobarbituric acid-reactive substances (TBARS) value (8.5-fold), and trans-FA (TFA) isomers (2.5-fold) compared to the control. The rats that were fed a diet containing TO showed a significant (p < 0.05) decrease in body weight gain, food efficiency values, and liver weight. Furthermore, the total cholesterol and low-density lipoprotein (LDL) levels were increased, while the high-density lipoprotein (HDL) level was decreased in blood serum samples. High levels of TBARS, superoxide dismutase (SOD), and glutathione reductase (GR) activities were also detected in the livers, kidneys, testes, and brains of rats. Interestingly, a diet containing TO+Pro restored all biological parameters to their control values. The present data suggested that Bifidobacteria may ameliorate the serum lipid profile and oxidative stress biomarkers that are generated in animals that are fed a TO diet.","Biomarkers : biochemical indicators of exposure, response, and susceptibility to chemicals","['D000818', 'D001644', 'D015415', 'D001835', 'D003296', 'D005227', 'D005247', 'D008055', 'D008297', 'D018384', 'D051381', 'D017207', 'D013024', 'D013055']","['Animals', 'Bifidobacterium', 'Biomarkers', 'Body Weight', 'Cooking', 'Fatty Acids', 'Feeding Behavior', 'Lipids', 'Male', 'Oxidative Stress', 'Rats', 'Rats, Sprague-Dawley', 'Soybean Oil', 'Spectrophotometry, Infrared']",The effects of Bifidobacteria on the lipid profile and oxidative stress biomarkers of male rats fed thermally oxidized soybean oil.,"[None, 'Q000502', 'Q000378', None, None, 'Q000032', None, 'Q000097', None, None, None, None, 'Q000008', None]","[None, 'physiology', 'metabolism', None, None, 'analysis', None, 'blood', None, None, None, None, 'administration & dosage', None]",https://www.ncbi.nlm.nih.gov/pubmed/21675932,2011
24785726,"In this study the 13 polycyclic aromatic hydrocarbons (PAHs) identified as being genotoxic and carcinogenic by the Joint FAO/WHO Expert Committee on Food Additives (JECFA) were determined in different brands of soybean oils available on the Brazilian market, totalling 42 samples. A solid-phase extraction (SPE) method for sample clean-up with a C18 cartridge, followed by reversed-phase HPLC with fluorescence detection, was used for determination. The method showed good recoveries for most PAHs studied with values between 74% and 111%. Good intra- and inter-day precisions (0.5 < RSD < 11.9) and high correlation coefficients (r(2)> 0.999) were obtained. The presence of PAHs was detected in all 42 samples with mean summed PAH levels ranging from 10.4 to 112.0 µg kg(-1). The mean and maximum dietary exposures for total PAHs were estimated as 12.4 and 19.1 ng kg bw(-1) day(-1), respectively.","Food additives & contaminants. Part B, Surveillance","['D001938', 'D002851', 'D004032', 'D004781', 'D005506', 'D057230', 'D011084', 'D013024']","['Brazil', 'Chromatography, High Pressure Liquid', 'Diet', 'Environmental Exposure', 'Food Contamination', 'Limit of Detection', 'Polycyclic Aromatic Hydrocarbons', 'Soybean Oil']",Polycyclic aromatic hydrocarbons in Brazilian commercial soybean oils and dietary exposure.,"[None, None, None, None, 'Q000032', None, 'Q000032', 'Q000737']","[None, None, None, None, 'analysis', None, 'analysis', 'chemistry']",https://www.ncbi.nlm.nih.gov/pubmed/24785726,2014
21388127,"A prototype multiresidue method based on fast extraction and dilution of samples followed by flow injection mass spectrometric analysis is proposed here for high-throughput chemical screening in complex matrices. The method was tested for sulfonylurea herbicides (triflusulfuron methyl, azimsulfuron, chlorimuron ethyl, sulfometuron methyl, chlorsulfuron, and flupyrsulfuron methyl), carbamate insecticides (oxamyl and methomyl), pyrimidine carboxylic acid herbicides (aminocyclopyrachlor and aminocyclopyrachlor methyl), and anthranilic diamide insecticides (chlorantraniliprole and cyantraniliprole). Lemon and pecan were used as representative high-water and low-water content matrices, respectively, and a sample extraction procedure was designed for each commodity type. Matrix-matched external standards were used for calibration, yielding linear responses with correlation coefficients (r) consistently >0.99. The limits of detection (LOD) were estimated to be between 0.01 and 0.03 mg/kg for all analytes, allowing execution of recovery tests with samples fortified at ≥0.05 mg/kg. Average analyte recoveries obtained during method validation for lemon and pecan ranged from 75 to 118% with standard deviations between 3 and 21%. Representative food processed fractions were also tested, that is, soybean oil and corn meal, yielding individual analyte average recoveries ranging from 62 to 114% with standard deviations between 4 and 18%. An intralaboratory blind test was also performed; the method excelled with 0 false positives and 0 false negatives in 240 residue measurements (20 samples × 12 analytes). The daily throughput of the fast extraction and dilution (FED) procedure is estimated at 72 samples/chemist, whereas the flow injection mass spectrometry (FI-MS) throughput could be as high as 4.3 sample injections/min, making very efficient use of mass spectrometers with negligible instrumental analysis time compared to the sample homogenization, preparation, and data processing steps.",Journal of agricultural and food chemistry,"['D017022', 'D005504', 'D005506', 'D013058', 'D010573', 'D010575']","['Flow Injection Analysis', 'Food Analysis', 'Food Contamination', 'Mass Spectrometry', 'Pesticide Residues', 'Pesticides']",Fast extraction and dilution flow injection mass spectrometry method for quantitative chemical residue screening in food.,"['Q000379', 'Q000379', 'Q000032', 'Q000379', 'Q000032', 'Q000032']","['methods', 'methods', 'analysis', 'methods', 'analysis', 'analysis']",https://www.ncbi.nlm.nih.gov/pubmed/21388127,2011
19699483,"In this work, the main developments and applications of multidimensional chromatographic techniques in food analysis are reviewed. Different aspects related to the existing couplings involving chromatographic techniques are examined. These couplings include multidimensional GC, multidimensional LC, multidimensional SFC as well as all their possible combinations. Main advantages and drawbacks of each coupling are critically discussed and their key applications in food analysis described.",Journal of chromatography. A,"['D002338', 'D002849', 'D002853', 'D003314', 'D005504', 'D005916', 'D013058', 'D008899', 'D030262']","['Carotenoids', 'Chromatography, Gas', 'Chromatography, Liquid', 'Corn Oil', 'Food Analysis', 'Globulins', 'Mass Spectrometry', 'Mineral Oil', 'Soybean Proteins']",Multidimensional chromatography in food analysis.,"['Q000032', 'Q000379', 'Q000379', 'Q000032', 'Q000379', 'Q000032', 'Q000379', 'Q000032', 'Q000032']","['analysis', 'methods', 'methods', 'analysis', 'methods', 'analysis', 'methods', 'analysis', 'analysis']",https://www.ncbi.nlm.nih.gov/pubmed/19699483,2010
