PMID,abstract,journal,mesh_UIds,mesh_terms,paper,qual_UIds,qual_terms,webpage,year
26483890,"Trans fat is a unsaturated fatty acid with trans configuration and separated double bonds. Analytical methods have been introduced to analyze trans fat content in foods including infrared (IR) spectroscopy, gas chromatography (GC), Fourier transform-infrared (FT-IR) spectroscopy, reverses-phase silver ion high performance liquid chromatography, and silver nitrate thin layer chromatography. Currently, FT-IR spectroscopy and GC are mostly used methods. Trans fat content in 6 vegetable oils were analyzed and processing effects including baking, stir-frying, pan-frying, and frying on the formation of trans fat in corn oil was evaluated by GC. Among tested vegetable oils, corn oil has 0.25 g trans fat/100 g, whereas other oils including rapeseed, soybean, olive, perilla, and sesame oils did not have detectable amount of trans fat content. Among cooking methods, stir-frying increased trans fat in corn oil whereas baking, pan-frying, and frying procedures did not make changes in trans fat content compared to untreated corn oils. However, the trans fat content was so low and food label can be declared as '0' trans based on the regulation of Ministry of Food ad Drug Safety (MFDS) (< 2 g/100 g edible oil). ",Toxicological research,[],[],Analysis of Trans Fat in Edible Oils with Cooking Process.,[],[],https://www.ncbi.nlm.nih.gov/pubmed/26483890,2015
26276066,"Ionic liquid matrix (ILM) is found to be a very versatile substance for analysis of broad range of organic molecules in matrix-assisted laser desorption/ionization mass spectrometry (MALDI-MS) due to good solubility for a variety of analytes, formation of homogenous crystals and high vacuum stability of the matrix. In the present work, an ILM, cyno-4-hydroxycinnamic acid-butylamine (CHCAB) was employed in dispersive liquid-liquid microextraction (DLLME) as sample probe and matrix for extraction and ionization of phospholipids from food samples (soybean) prior to MALDI-MS analysis. With the employed technique, 8-125 fold improvement in signal intensity and limit of detection were achieved for the analysis of phospholipids. The best extraction efficiency of phospholipids in ILM-DLLME was obtained with 5min extraction time in presence 30mg/mL CHCAB and 1.2% NaCl using chloroform as an extracting solvent and methanol as a dispersing solvent. Further, the developed ILM-DLLME procedure has been successfully applied for the analysis of phospholipids in soybean samples in MALDI-MS. ","Journal of chromatography. B, Analytical technologies in the biomedical and life sciences","['D052578', 'D059627', 'D010743', 'D013025', 'D019032']","['Ionic Liquids', 'Liquid Phase Microextraction', 'Phospholipids', 'Soybeans', 'Spectrometry, Mass, Matrix-Assisted Laser Desorption-Ionization']",Ionic liquid matrix-based dispersive liquid-liquid microextraction for enhanced MALDI-MS analysis of phospholipids in soybean.,"['Q000737', 'Q000379', 'Q000032', 'Q000737', 'Q000379']","['chemistry', 'methods', 'analysis', 'chemistry', 'methods']",https://www.ncbi.nlm.nih.gov/pubmed/26276066,2016
26149112,"The probe electrospray ionization (PESI) is an ESI-based ionization technique that generates electrospray from the tip of a solid metal needle. In the present work, we describe the PESI mass spectra obtained by in situ measurement of soybeans and several nuts (peanuts, walnuts, cashew nuts, macadamia nuts and almonds) using different solid needles as sampling probes. It was found that PESI-MS is a valuable approach for in situ lipid analysis of these seeds. The phospholipid and triacylglycerol PESI spectra of different nuts and soybean were compared by principal component analysis (PCA). PCA shows significant differences among the data of each family of seeds. Methanolic extracts of nuts and soybean were exposed to air and sunlight for several days. PESI mass spectra were recorded before and after the treatment. Along the aging of the oil (rancidification), the formation of oxidated species with variable number of hydroperoxide groups could be observed in the PESI spectra. The relative intensity of oxidated triacylglycerols signals increased with days of exposition. Monitoring sensitivity of PESI-MS was high. This method provides a fast, simple and sensitive technique for the analysis (detection and characterization) of lipids in seed tissue and degree of oxidation of the oil samples.",Journal of mass spectrometry : JMS,"['D010367', 'D031324', 'D039106', 'D009754', 'D010743', 'D025341', 'D013025', 'D021241', 'D014280']","['Arachis', 'Juglans', 'Macadamia', 'Nuts', 'Phospholipids', 'Principal Component Analysis', 'Soybeans', 'Spectrometry, Mass, Electrospray Ionization', 'Triglycerides']",In situ analysis of soybeans and nuts by probe electrospray ionization mass spectrometry.,"['Q000737', 'Q000737', 'Q000737', 'Q000737', 'Q000032', None, 'Q000737', 'Q000295', 'Q000032']","['chemistry', 'chemistry', 'chemistry', 'chemistry', 'analysis', None, 'chemistry', 'instrumentation', 'analysis']",https://www.ncbi.nlm.nih.gov/pubmed/26149112,2016
26070817,"In this investigation, off-line comprehensive two-dimensional liquid chromatography-atmospheric pressure chemical ionization mass spectrometry using a single column has been applied for the identification and quantification of triacylglycerols in edible oils. A novel mixed-mode phenyl-hexyl chromatographic column was employed in this off-line two-dimensional separation system. The phenyl-hexyl column combined the features of traditional C18 and silver-ion columns, which could provide hydrophobic interactions with triacylglycerols under acetonitrile conditions and can offer π-π interactions with triacylglycerols under methanol conditions. When compared with traditional off-line comprehensive two-dimensional liquid chromatography employing two different chromatographic columns (C18 and silver-ion column) and using elution solvents comprised of two phases (reversed-phase/normal-phase) for triacylglycerols separation, the novel off-line comprehensive two-dimensional liquid chromatography using a single column can be achieved by simply altering the mobile phase between acetonitrile and methanol, which exhibited a much higher selectivity for the separation of triacylglycerols with great efficiency and rapid speed. In addition, an approach based on the use of response factor with atmospheric pressure chemical ionization mass spectrometry has been developed for triacylglycerols quantification. Due to the differences between saturated and unsaturated acyl chains, the use of response factors significantly improves the quantitation of triacylglycerols. This two-dimensional liquid chromatography-mass spectrometry system was successfully applied for the profiling of triacylglycerols in soybean oils, peanut oils and lord oils. A total of 68 triacylglycerols including 40 triacylglycerols in soybean oils, 50 triacylglycerols in peanut oils and 44 triacylglycerols in lord oils have been identified and quantified. The liquid chromatography-mass spectrometry data were analyzed using principal component analysis. The results of the principal component analysis enabled a clear identification of different plant oils. By using this two-dimensional liquid chromatography-mass spectrometry system coupled with principal component analysis, adulterated soybean oils with 5% added lord oil and peanut oils with 5% added soybean oil can be clearly identified. ",Journal of chromatography. A,"['D001274', 'D002853', 'D004042', 'D005504', 'D057927', 'D013058', 'D000074241', 'D010938', 'D025341', 'D013024', 'D014280']","['Atmospheric Pressure', 'Chromatography, Liquid', 'Dietary Fats, Unsaturated', 'Food Analysis', 'Hydrophobic and Hydrophilic Interactions', 'Mass Spectrometry', 'Peanut Oil', 'Plant Oils', 'Principal Component Analysis', 'Soybean Oil', 'Triglycerides']",Quantitation of triacylglycerols in edible oils by off-line comprehensive two-dimensional liquid chromatography-atmospheric pressure chemical ionization mass spectrometry using a single column.,"[None, None, 'Q000032', 'Q000295', None, None, None, 'Q000737', None, 'Q000737', 'Q000032']","[None, None, 'analysis', 'instrumentation', None, None, None, 'chemistry', None, 'chemistry', 'analysis']",https://www.ncbi.nlm.nih.gov/pubmed/26070817,2015
26066859,"Cooking fumes are an important indoor source of polycyclic aromatic hydrocarbons (PAHs). Because indoor pollution has a more substantial impact on human health than outdoor pollution, PAHs from cooking fumes have drawn considerable attention. In this study, 16 PAHs emitted through deep-frying and frying methods using rapeseed, soybean, peanut, and olive oil were examined under a laboratory fume hood. Controlled experiments were conducted to collect gas- and particulate-phase PAHs emitted from the cooking oil fumes, and PAH concentrations were quantified via high-performance liquid chromatography (HPLC). The results show that deep-frying methods generate more PAHs and benzo[a]pyrene (B[a]P) (1.3 and 10.9 times, respectively) because they consume greater volumes of edible oil and involve higher oil temperatures relative to those of frying methods. In addition, the total B[a]Peq concentration of deep-frying is 2.2-fold larger than that of frying. Regarding the four types of edible oils studied, rapeseed oil produced more PAH emission than the other three oil varieties. For all of the cooking tests, three- and four-ringed PAHs were the main PAH components regardless of the food and oil used. Concerning the PAH partition between gas and particulate phase, the gaseous compounds accounted for 59-96 % of the total. Meanwhile, the particulate fraction was richer of high molecular weight PAHs (five-six rings). Deep-frying and frying were confirmed as important sources of PAH pollution in internal environments. The results of this study provide additional insights into the polluting features of PAHs produced via cooking activities in indoor environments.",Environmental science and pollution research international,"['D001564', 'D003296', 'D005229', 'D005740', 'D015386', 'D006358', 'D006801', 'D010938', 'D011084', 'D000074262']","['Benzo(a)pyrene', 'Cooking', 'Fatty Acids, Monounsaturated', 'Gases', 'Hazardous Substances', 'Hot Temperature', 'Humans', 'Plant Oils', 'Polycyclic Aromatic Hydrocarbons', 'Rapeseed Oil']",Characteristics of PAHs from deep-frying and frying cooking fumes.,"['Q000032', None, None, 'Q000032', 'Q000032', None, None, None, 'Q000032', None]","['analysis', None, None, 'analysis', 'analysis', None, None, None, 'analysis', None]",https://www.ncbi.nlm.nih.gov/pubmed/26066859,2016
25977042,"A rapid method for the determination of 14 types of isoflavones in food using ultra-high performance liquid chromatography (UHPLC) was validated in terms of precision, accuracy, sensitivity and linearity. The UHPLC separation was performed on a reverse-phase C18 column (particle size 2 μm, i.d. 2 mm, length 100 mm) using a photo diode array detector that was fixed to 260 nm. The limits of detection and quantification of the UHPLC analyses ranged from 0.03 to 0.33 mg kg(-1). The intra-day and inter-day precision of the individual isoflavones were less than 11.77% and calibration curves exhibited good linearity (r(2) = 0.99) within the tested ranges. These results suggest that the rapid method used in this study could be available to determine of 14 types of isoflavones in a variety of food such as soy bean, black bean, red bean and soybean paste.",Food chemistry,"['D002851', 'D005504', 'D007529', 'D057230', 'D015203', 'D045730', 'D013025', 'D013997']","['Chromatography, High Pressure Liquid', 'Food Analysis', 'Isoflavones', 'Limit of Detection', 'Reproducibility of Results', 'Soy Foods', 'Soybeans', 'Time Factors']",Rapid method for the determination of 14 isoflavones in food using UHPLC coupled to photo diode array detection.,"['Q000379', 'Q000379', 'Q000032', None, None, 'Q000032', 'Q000737', None]","['methods', 'methods', 'analysis', None, None, 'analysis', 'chemistry', None]",https://www.ncbi.nlm.nih.gov/pubmed/25977042,2016
25892640,"The impact of the matrix effect in GC-MS quantification of pesticides in food using the corresponding isotope-labeled internal standards was evaluated. A spike-and-recovery study of nine target pesticides was first conducted using paste samples of corn, green soybean, carrot, and pumpkin. The observed analytical values using isotope-labeled internal standards were more accurate for most target pesticides than that obtained using the external calibration method, but were still biased from the spiked concentrations when a matrix-free calibration solution was used for calibration. The respective calibration curves for each target pesticide were also prepared using matrix-free calibration solutions and matrix-matched calibration solutions with blank soybean extract. The intensity ratio of the peaks of most target pesticides to that of the corresponding isotope-labeled internal standards was influenced by the presence of the matrix in the calibration solution; therefore, the observed slope varied. The ratio was also influenced by the type of injection method (splitless or on-column). These results indicated that matrix-matching of the calibration solution is required for very accurate quantification, even if isotope-labeled internal standards were used for calibration. ",Journal of chromatography. A,"['D002138', 'D005504', 'D008401', 'D007553', 'D010573', 'D014675']","['Calibration', 'Food Analysis', 'Gas Chromatography-Mass Spectrometry', 'Isotope Labeling', 'Pesticide Residues', 'Vegetables']",Evaluation of the impact of matrix effect on quantification of pesticides in foods by gas chromatography-mass spectrometry using isotope-labeled internal standards.,"[None, 'Q000379', 'Q000379', None, 'Q000032', 'Q000737']","[None, 'methods', 'methods', None, 'analysis', 'chemistry']",https://www.ncbi.nlm.nih.gov/pubmed/25892640,2015
25818139,"A novel method for the UHPLC-MS/MS analysis of (E)-4-hydroxynonenal (4-HNE) is described. The method is based on derivatization of 4-HNE with pentafluorophenylhydrazine (1) or 4-trifluoromethylphenylhydrazine (2) in acetonitrile in the presence of trifluoroacetic acid as catalyst at room temperature and allows complete analysis of one sample of vegetable oil in only 21 min, including sample preparation and chromatography. The method involving hydrazine 1, implemented in an ion trap instrument with analysis of the transition m/z 337→154 showed LOD=10.9 nM, average accuracy of 101% and precision ranging 2.5-4.0% RSD intra-day (2.7-4.1% RSD inter-day), with 4-HNE standard solutions. Average recovery from lipid matrices was 96.3% from vaseline oil, 91.3% from sweet almond oil and 105.3% from olive oil. The method was tested on the assessment of safety and oxidative degradation of seven samples of dietary oil (soybean, mixed seeds, corn, peanut, sunflower, olive) and six cosmetic-grade oils (avocado, blackcurrant, apricot kernel, echium, sesame, wheat germ) and effectively detected increased 4-HNE levels in response to chemical (Fenton reaction), photochemical, or thermal stress and aging, aimed at mimicking typical oxidation associated with storage or industrial processing. The method is a convenient, cost-effective and reliable tool to assess quality and safety of vegetable oils.",Analytica chimica acta,"['D000447', 'D002851', 'D005506', 'D059022', 'D006835', 'D010084', 'D055668', 'D010938', 'D015203', 'D053719', 'D013696']","['Aldehydes', 'Chromatography, High Pressure Liquid', 'Food Contamination', 'Food Safety', 'Hydrazones', 'Oxidation-Reduction', 'Photochemical Processes', 'Plant Oils', 'Reproducibility of Results', 'Tandem Mass Spectrometry', 'Temperature']",Rapid liquid chromatography-tandem mass spectrometry analysis of 4-hydroxynonenal for the assessment of oxidative degradation and safety of vegetable oils.,"['Q000032', 'Q000379', 'Q000032', None, 'Q000737', None, None, 'Q000737', None, 'Q000379', None]","['analysis', 'methods', 'analysis', None, 'chemistry', None, None, 'chemistry', None, 'methods', None]",https://www.ncbi.nlm.nih.gov/pubmed/25818139,2015
25794716,"Fourier transform infrared (FTIR) and fluorescence spectroscopy combined with soft independent modeling of class analogies (SIMCA) and partial least square (PLS) were used to detect the authenticity of walnut oil and adulteration amount of soybean oil in walnut oil. A SIMCA model of FTIR spectra could differentiate walnut oil and other oils into separate categories; the classification limit of soybean oil in walnut oil was 10%. Fluorescence spectroscopy could differentiate oil composition by the peak position and intensity of emission spectrum without multivariate analysis. The classification limit of soybean oil adulterated in walnut oil by fluorescence spectroscopy was below 5%. The deviation of the prediction model for fluorescence spectra was lower than that for FTIR spectra. Fluorescence spectroscopy was more applicable than FTIR in the adulteration detection of walnut oil, both from the determination limit and prediction deviation. ",Food chemistry,"['D004042', 'D005506', 'D031324', 'D010938', 'D013050', 'D017550']","['Dietary Fats, Unsaturated', 'Food Contamination', 'Juglans', 'Plant Oils', 'Spectrometry, Fluorescence', 'Spectroscopy, Fourier Transform Infrared']",Rapid detection of authenticity and adulteration of walnut oil by FTIR and fluorescence spectroscopy: a comparative study.,"['Q000032', 'Q000032', 'Q000737', 'Q000737', 'Q000379', 'Q000379']","['analysis', 'analysis', 'chemistry', 'chemistry', 'methods', 'methods']",https://www.ncbi.nlm.nih.gov/pubmed/25794716,2015
25624257,"To ensure authenticity of vegetable oils, isoflavones (genistein, genistin, daidzein and daidzin) and resveratrols (cis-resveratrol and trans-resveratrol) were selected as the putative markers for adulteration of soybean and peanut oils. Firstly, mixed mode solid-phase extraction coupled with liquid chromatography tandem mass spectrometry (mixed-mode SPE LC-MS/MS) method was developed to analyze isoflavones and resveratrols in vegetable oils. The concentration of marker compounds in vegetable oils were 0.08-1.47mgkg(-1) for daidzein, ND-78.9μgkg(-1) for daidzin, 0.40-5.89mgkg(-1) for genistein, 1.2-114.9μgkg(-1) for genistin, 3.1-85.0μgkg(-1) for trans-resveratrol and 1.9-51.0μgkg(-1) for cis-resveratrol, which are compatible with the raw materials for oil press. Additionally, the applicability of this method has been successfully tested in thirteen vegetable oils from the market. Mixed-mode SPE LC-MS/MS method can simultaneously detect isoflavones and resveratrols in vegetable oils and assess adulteration and quality of soybean and peanut oils. ",Food chemistry,"['D010367', 'D002851', 'D002853', 'D005506', 'D007529', 'D013058', 'D010938', 'D000077185', 'D052616', 'D013025', 'D013267']","['Arachis', 'Chromatography, High Pressure Liquid', 'Chromatography, Liquid', 'Food Contamination', 'Isoflavones', 'Mass Spectrometry', 'Plant Oils', 'Resveratrol', 'Solid Phase Extraction', 'Soybeans', 'Stilbenes']",Simultaneous determination of isoflavones and resveratrols for adulteration detection of soybean and peanut oils by mixed-mode SPE LC-MS/MS.,"['Q000737', 'Q000379', 'Q000379', None, 'Q000737', 'Q000379', 'Q000737', None, 'Q000379', 'Q000737', 'Q000737']","['chemistry', 'methods', 'methods', None, 'chemistry', 'methods', 'chemistry', None, 'methods', 'chemistry', 'chemistry']",https://www.ncbi.nlm.nih.gov/pubmed/25624257,2015
25577096,"Trypsin was purified 35.64-fold with 4.97% recovery from the viscera of carp Cirrhinus mrigala (mrigal) by ammonium sulfate precipitation, ion exchange and affinity chromatography. The purified enzyme was active at a wide range of pH (7.0-9.2) and temperature (10-50°C). The purified enzyme exhibited high thermal stability up to 50°C for 1h. The enzyme activity was stabilized by Ca(+2) (2mM) up to 7h at 40°C. The Km and kcat values of purified enzyme were 0.0672 mM and 92.09/s/mM, respectively. Soybean trypsin inhibitor and phenylmethylsulphonylflouride completely inhibited the enzyme activity. The specific inhibitor of trypsin, N-α-p-tosyl-L-lysine chloromethyl ketone inhibited 99.67% activity. Na(+), K(+) and Li(+) inhibited 20.99 ± 5.25%, 16.53 ± 4.80% and 18.99 ± 1.42% of enzyme activity, respectively. Divalent ions Mg(+2), Zn(+2), Co(+2), Hg(+2) and Cd(+2) inhibited 21.61 ± 2.22%, 31.62 ± 1.78%, 31.62 ± 1.96%, 85.68 ± 1.51% and 47.95 ± 2.13% enzyme activity, respectively. SDS-PAGE showed that the molecular mass of purified enzyme was 21.7 kDa. MALDI-TOF study showed a peptide sequence of AFCGGSLVNENKMHSAGHCYKSRIQV at the N-Terminal. This sequence recorded 76-84% identity with trypsin from Thunnus thynnus and other fish species. This confirmed that the purified protein was trypsin. The purified enzyme has potential applications in detergent and food industry because of its thermal stability and alkaline nature.",Food chemistry,"['D000595', 'D000818', 'D002347', 'D004064', 'D004591', 'D008969', 'D014357']","['Amino Acid Sequence', 'Animals', 'Carps', 'Digestive System', 'Electrophoresis, Polyacrylamide Gel', 'Molecular Sequence Data', 'Trypsin']","Trypsin from the digestive system of carp Cirrhinus mrigala: purification, characterization and its potential application.","[None, None, 'Q000378', 'Q000201', None, None, 'Q000737']","[None, None, 'metabolism', 'enzymology', None, None, 'chemistry']",https://www.ncbi.nlm.nih.gov/pubmed/25577096,2015
25566290,"Plasmopara viticola, the causal agent of grapevine downy mildew, is one of the most devastating grape pathogen in Europe and North America. Although phytochemicals are used to control pathogen infections, the appearance of resistant strains and the concern for possible adverse effects on environment and human health are increasing the search for alternative strategies. In the present investigation, we successfully tested two protein hydrolysates from soybean (soy) and casein (cas) to trigger grapevine resistance against P. viticola. On Vitis vinifera cv. Marselan plants, the application of soy and cas reduced the infected leaf surface by 76 and 63%, as compared to the control, respectively. Since both hydrolysates might trigger the plant immunity, we investigated their ability to elicit grapevine defense responses. On grapevine cell suspensions, a different free cytosolic calcium signature was recorded for each hydrolysate, whereas a similar transient phosphorylation of two MAP kinases of 45 and 49 kDa was observed. These signaling events were followed by transcriptome reprogramming, including the up-regulation of defense genes encoding pathogenesis-related (PR) proteins and the stilbene synthase enzyme responsible for the biosynthesis of resveratrol, the main grapevine phytoalexin. Liquid chromatography analyses confirmed the production of resveratrol and its dimer metabolites, δ- and ε-viniferins. Overall, soy effects were more pronounced as compared to the cas ones. Both hydrolysates proved to act as elicitors to enhance grapevine immunity against pathogen attack. ",Frontiers in plant science,[],[],Soybean and casein hydrolysates induce grapevine immune responses and resistance against Plasmopara viticola.,[],[],https://www.ncbi.nlm.nih.gov/pubmed/25566290,2015
25476308,"Proficiency testing (PT) for the determination of pesticide residues in soybean samples was organized by the National Metrology Institute of Japan (NMIJ). The candidate certified reference material, NMIJ CRM 7509-a, that was prepared from the raw soybeans containing target pesticides (diazinon, fenitrothion, chlorpyrifos, and permethrin) was used as the test sample. Forty participants submitted two sets of analytical results along with the details of the analytical method and conditions they applied. Two types of assigned values were established for each target pesticide: one was derived from the analytical results of the participants, and the other was provided from the analytical results by isotope-dilution mass spectrometry (IDMS). The latter values were 7.4-16% higher than the former values, plausibly because the analytical values from the IDMS measurements were not affected by the recovery ratio of the target pesticides during the analytical process. Thus, two kinds of z-scores were calculated for individual participants using the corresponding assigned values: one (z1-score) showed the relative performance score for the present PT and the other (z2-score) could be used for evaluation of the trueness of their analytical methods. ",Talanta,"['D004390', 'D003976', 'D005278', 'D005506', 'D006801', 'D059021', 'D015588', 'D026023', 'D010575', 'D011865', 'D012015', 'D012107', 'D013025']","['Chlorpyrifos', 'Diazinon', 'Fenitrothion', 'Food Contamination', 'Humans', 'Laboratory Proficiency Testing', 'Observer Variation', 'Permethrin', 'Pesticides', 'Radioisotope Dilution Technique', 'Reference Standards', 'Research Design', 'Soybeans']",Proficiency testing for determination of pesticide residues in soybean: comparison of assigned values from participants' results and isotope-dilution mass spectrometric determination.,"['Q000032', 'Q000032', 'Q000032', None, None, 'Q000706', None, 'Q000032', 'Q000032', None, None, None, 'Q000737']","['analysis', 'analysis', 'analysis', None, None, 'statistics & numerical data', None, 'analysis', 'analysis', None, None, None, 'chemistry']",https://www.ncbi.nlm.nih.gov/pubmed/25476308,2015
