PMID,abstract,journal,mesh_UIds,mesh_terms,paper,qual_UIds,qual_terms,webpage,year
18656676,"Two ferric-ion-based total antioxidant capacity methods: 1,10-phenanthroline (Phen) and ferric reducing antioxidant power (FRAP) were used for determination of antioxidant capacities (AC) of the acetonic and methanolic extracts of vegetable oils. The obtained mean Phen and FRAP values for acetonic extracts of olive oils, rapeseed, rice and four sunflower oils (39.3-336.5 and 39.5-339.6 micromol Fe/100g) were higher than for methanolic extracts (22.8-307.3 and 23.5-300.1 micromol Fe/100g). However, antioxidant capacities of methanolic extracts of corn oil, blended oils and two sunflower oils with garden green flowers (56.5-312.9 and 53.9-306.5 micromol Fe/100g for Phen and FRAP methods, respectively) were higher than for acetonic extracts of these oils (54.2-249.2 and 52.9-244.7 micromol Fe/100g for Phen and FRAP methods, respectively). There is a linear and significant correlation between these two analytical methods (r=0.9989 and 0.9986 for acetonic and methanolic extracts). Also, total phenolic compounds (TPC) in the studied oils correlated with their antioxidant capacities determined by Phen and FRAP methods (r=0.9012, 0.7818 and 0.8947, 0.7830 for acetonic and methanolic extracts, respectively). The comparable precision (R.S.D.=0.8-4.6%, 0.9-4.9% and 0.7-4.0%, 0.6-4.0% for acetonic and methanolic extracts, respectively) and sensitivity (epsilon=1.27 x 10(4), 1.11 x 10(4) and 2.62 x 10(4)dm(3)mol(-1)cm(-1)) for the proposed Phen and the modified FRAP methods, demonstrate the benefit of the Phen method in the routine analysis of antioxidant capacities of vegetable oils.",Talanta,"['D000096', 'D000975', 'D002623', 'D005504', 'D007477', 'D007501', 'D000432', 'D010636', 'D010936', 'D010938', 'D025341', 'D013053', 'D000074242']","['Acetone', 'Antioxidants', 'Chemistry Techniques, Analytical', 'Food Analysis', 'Ions', 'Iron', 'Methanol', 'Phenols', 'Plant Extracts', 'Plant Oils', 'Principal Component Analysis', 'Spectrophotometry', 'Sunflower Oil']",Determination of antioxidant capacities of vegetable oils by ferric-ion spectrophotometric methods.,"['Q000032', 'Q000032', 'Q000379', 'Q000379', None, 'Q000032', 'Q000032', 'Q000032', 'Q000032', 'Q000032', None, 'Q000379', None]","['analysis', 'analysis', 'methods', 'methods', None, 'analysis', 'analysis', 'analysis', 'analysis', 'analysis', None, 'methods', None]",https://www.ncbi.nlm.nih.gov/pubmed/18656676,2008
18524325,"The present study had as objectives to identify and to quantify organochlorine pesticide residues (OCP) hexachlorobenzene (HCB), lindane, cis-chlordane, heptachlor, aldrin, dieldrin, endrin and o,p'-DDT in vegetable oils of corn, soybean, sunflower and mixtures of oils, sold in the city of Maracaibo, Venezuela. 30 samples of 4 types of vegetable oils of 10 commercial brands were analyzed. The extraction of OCP residues was done according to the Official Method of AOAC. A gas chromatograph with an electronic capture detector (GC-ECD) was used for identification and quantification of OCP residues and confirmation was done with a gas chromatograph coupled with a mass spectrometer (GC-MS). All the OCP residues investigated were detected in the analyzed samples. Aldrin (0.0088), lindane (0.0054) and o,p'-DDT (0.0035) were the OCP residues detected in higher concentrations (microg/g). The statistical analysis showed significant differences (P<0.05) for the concentration of OCP in the different types and commercial brands of vegetable oils. Lindane concentration in the corn oil (0.0125 microg/g), as well as cischlordane (0.0091 microg/g) and aldrín (0.0287 microg/g) in the soybean oil exceeded maximal residual limits (MRL) established by Food and Agriculture Organization of the United Nations/World Health Organization (FAO/WHO). In conclusion, it was detected a high incidence of OCP residues in vegetable oils analyzed.",Archivos latinoamericanos de nutricion,"['D002849', 'D005506', 'D006843', 'D010573', 'D010938']","['Chromatography, Gas', 'Food Contamination', 'Hydrocarbons, Chlorinated', 'Pesticide Residues', 'Plant Oils']",[Organochlorine pesticide residues in 4 types of vegetable oils].,"[None, 'Q000032', 'Q000032', 'Q000032', 'Q000737']","[None, 'analysis', 'analysis', 'analysis', 'chemistry']",https://www.ncbi.nlm.nih.gov/pubmed/18524325,2008
18197356,"Levels of 16 organochlorine pesticides (OCPs) were investigated in 39 composite samples of agricultural crops, related by-products, and foodstuffs collected in Vojvodina, Serbia, in 2002 through 2004. After extraction and cleanup, OCPs were determined by capillary gas chromatography using electron-capture detection. The highest mean level of 0.971 ng/g whole weight (ww) was found for alpha-HCH in wheat flour samples. OCPs levels were well lower than the respective maximum residue limits set by current European and Serbian regulations. Mean OCP levels were low (<1 ng/g ww) for all sample types. The most frequently determined residue was 4,4'-DDT (identified in 76.9% of all samples analyzed), followed by gamma-HCH (66.7%), beta-HCH (48.7%), and endosulfan II (41.0%). OCP levels were compared with data from other international surveys. Calculated daily intakes of OCPs by way of consumption of the crop products included in this study according to data of the Serbian National Institute for Statistics were compared with the acceptable daily intakes established by the Food and Agriculture Organization/World Health Organization. The average level of contamination of the Vojvodina diet was believed to be harmless regarding the studied food commodities.",Archives of environmental contamination and toxicology,"['D027461', 'D018556', 'D003634', 'D004032', 'D004435', 'D004784', 'D005062', 'D005433', 'D005504', 'D005506', 'D006843', 'D008965', 'D010575', 'D010938', 'D011786', 'D018570', 'D013395', 'D000074242', 'D014908', 'D015022']","['Beta vulgaris', 'Crops, Agricultural', 'DDT', 'Diet', 'Eating', 'Environmental Monitoring', 'European Union', 'Flour', 'Food Analysis', 'Food Contamination', 'Hydrocarbons, Chlorinated', 'Molasses', 'Pesticides', 'Plant Oils', 'Quality Control', 'Risk Assessment', 'Sucrose', 'Sunflower Oil', 'Triticum', 'Yugoslavia']","Levels of organochlorine pesticides in crops and related products from Vojvodina, Serbia: estimated dietary intake.","['Q000737', 'Q000737', 'Q000032', None, None, 'Q000379', None, 'Q000032', 'Q000379', 'Q000032', 'Q000032', 'Q000032', 'Q000032', 'Q000737', None, None, 'Q000737', None, 'Q000737', None]","['chemistry', 'chemistry', 'analysis', None, None, 'methods', None, 'analysis', 'methods', 'analysis', 'analysis', 'analysis', 'analysis', 'chemistry', None, None, 'chemistry', None, 'chemistry', None]",https://www.ncbi.nlm.nih.gov/pubmed/18197356,2008
17613061,"A semi-automatic method for the determination of polycyclic aromatic hydrocarbons (PAHs) in edible oils using a combined gel permeation chromatography/solid-phase extraction (GPC/SPE) clean-up is presented. The method takes advantage of automatic injections using a Gilson ASPEC XL sample handling system equipped with a GPC column (S-X3) and pre-packed silica SPE columns for the subsequent clean-up and finally gas chromatography-mass spectrometry (GC-MS) determination. The method was validated for the determination of PAHs in vegetable oils and it can meet the criteria for the official control of benzo[a]pyrene levels in foods laid down by the Commission of the European Communities. A survey of 69 vegetable oils sampled from the Danish market included olive oil as well as other vegetable oils such as rapeseed oil, sunflower oil, grape seed oil and sesame oil. Levels of benzo[a]pyrene in all the oils were low (<0.2-0.8 microg kg(-1)), except for one sample of sunflower oil containing 11 microg kg(-1) benzo[a]pyrene.",Food additives and contaminants,"['D002850', 'D004042', 'D005504', 'D005506', 'D011084']","['Chromatography, Gel', 'Dietary Fats, Unsaturated', 'Food Analysis', 'Food Contamination', 'Polycyclic Aromatic Hydrocarbons']",Analysis of polycyclic aromatic hydrocarbons in vegetable oils combining gel permeation chromatography with solid-phase extraction clean-up.,"['Q000379', 'Q000032', 'Q000379', 'Q000032', 'Q000032']","['methods', 'analysis', 'methods', 'analysis', 'analysis']",https://www.ncbi.nlm.nih.gov/pubmed/17613061,2007
17611742,"An analytical method for the sequential detection, identification and quantitation of extra virgin olive oil adulteration with four edible vegetable oils--sunflower, corn, peanut and coconut oils--is proposed. The only data required for this method are the results obtained from an analysis of the lipid fraction by gas chromatography-mass spectrometry. A total number of 566 samples (pure oils and samples of adulterated olive oil) were used to develop the chemometric models, which were designed to accomplish, step-by-step, the three aims of the method: to detect whether an olive oil sample is adulterated, to identify the type of adulterant used in the fraud, and to determine how much aldulterant is in the sample. Qualitative analysis was carried out via two chemometric approaches--soft independent modelling of class analogy (SIMCA) and K nearest neighbours (KNN)--both approaches exhibited prediction abilities that were always higher than 91% for adulterant detection and 88% for type of adulterant identification. Quantitative analysis was based on partial least squares regression (PLSR), which yielded R2 values of >0.90 for calibration and validation sets and thus made it possible to determine adulteration with excellent precision according to the Shenk criteria.",Analytical and bioanalytical chemistry,"['D002845', 'D005504', 'D005506', 'D000069463', 'D010938']","['Chromatography', 'Food Analysis', 'Food Contamination', 'Olive Oil', 'Plant Oils']","Sequential (step-by-step) detection, identification and quantitation of extra virgin olive oil adulteration by chemometric treatment of chromatographic profiles.","['Q000379', 'Q000379', 'Q000032', None, 'Q000032']","['methods', 'methods', 'analysis', None, 'analysis']",https://www.ncbi.nlm.nih.gov/pubmed/17611742,2007
17487605,"A protocol for the measurement of 27 polycyclic aromatic hydrocarbons (PAHs) in vegetable oils by GC/MS has undergone single-laboratory validation. PAHs were measured in three oils (olive pomace, sunflower and coconut oil). Five samples of each oil (one unfortified, and four fortified at concentrations between 2 and 50 microg kg(-1)) were analysed in replicate (four times in separate runs). Two samples (one unfortified and one fortified at 2 microg kg(-1)) of five oils (virgin olive oil, grapeseed oil, toasted sesame oil, olive margarine and palm oil) were also analysed. The validation included an assessment of measurement bias from the results of 120 measurements of a certified reference material (coconut oil BCR CRM458 certified for six PAHs). The method is capable of reliably detecting 26 out of 27 PAHs, at concentration <2 microg kg(-1) which is the European Union maximum limit for benzo[a]pyrene, in vegetable oils, olive pomace oil, sunflower oil and coconut oil. Quantitative results were obtained that are fit for purpose for concentrations from <2 to 50 microg kg(-1) for 24 out of 27 PAHs in olive pomace oil, sunflower oil and coconut oil. The reliable detection of 2 microg kg(-1) of PAHs in five additional oils (virgin olive oil, grapeseed oil, toasted sesame oil, olive margarine and palm oil) has been demonstrated. The method failed to produce fit-for-purpose results for the measurement of dibenzo[a,h]pyrene, anthanthrene and cyclopenta[c,d]pyrene. The reason for the failure was the large variation in results. The likely cause was the lack of availability of (13)C isotope internal standards for these PAHs at the time of the study. The protocol has been shown to be fit-for-purpose and is suitable for formal validation by inter-laboratory collaborative study.",Food additives and contaminants,"['D000074263', 'D005504', 'D005506', 'D008401', 'D000069463', 'D010938', 'D011084', 'D000074242']","['Coconut Oil', 'Food Analysis', 'Food Contamination', 'Gas Chromatography-Mass Spectrometry', 'Olive Oil', 'Plant Oils', 'Polycyclic Aromatic Hydrocarbons', 'Sunflower Oil']",Single-laboratory validation of a GC/MS method for the determination of 27 polycyclic aromatic hydrocarbons (PAHs) in oils and fats.,"[None, 'Q000379', 'Q000032', 'Q000379', None, 'Q000737', 'Q000032', None]","[None, 'methods', 'analysis', 'methods', None, 'chemistry', 'analysis', None]",https://www.ncbi.nlm.nih.gov/pubmed/17487605,2007
16637674,"Ethyl esters (FAEE) and trideuterium-labeled methyl esters (d3-FAME) of fatty acids were prepared and investigated regarding their suitability as internal standards (IS) for the determination of fatty acids as methyl esters (FAME). On CP-Sil 88, ethyl esters of odd-numbered fatty acids eluted approximately 0.5 min after the respective FAME, and only coelutions with minor FAME were observed. Depending on the problem, one or even many FAEE can be added as IS for the quantification of FAME by both GC-FID and GC-MS. By contrast, d3-FAME coeluted with FAME on the polar GC column, and the use of the former as IS requires application of GC-MS. In the SIM mode, m/z 77 and 90 are suggested for d3-methyl esters of saturated fatty acids, whereas m/z 88 and 101 are recommended for ethyl esters of saturated fatty acids. These m/z values give either no or very low response for FAME and can thus be used for the analysis of FAME in food by GC-MS in the SIM mode. Fatty acids in sunflower oil and mozzarella cheese were quantified using five saturated FAEE as IS. Gravimetric studies showed that the transesterification procedure could be carried out without of loss of fatty acids. GC-EI/MS full scan analysis was suitable for the quantitative determination of all unsaturated fatty acids in both food samples, whereas GC-EI/MS in the SIM mode was particularly valuable for quantifying minor fatty acids. The novel GC-EI/MS/SIM method using fatty acid ethyl esters as internal standards can be used to quantify individual fatty acids only, that is, without determination of all fatty acids (the common 100% method), although this is present. This was demonstrated by the exclusive quantification of selected fatty acids including methyl-branched fatty acids, erucic acid (18:1n-9trans), and polyunsaturated fatty acids in cod liver oil and goat's milk fat.",Journal of agricultural and food chemistry,"['D000818', 'D002849', 'D003060', 'D003903', 'D004883', 'D004952', 'D005231', 'D005504', 'D008401', 'D006041', 'D008745', 'D008892', 'D044242']","['Animals', 'Chromatography, Gas', 'Cod Liver Oil', 'Deuterium', 'Erucic Acids', 'Esters', 'Fatty Acids, Unsaturated', 'Food Analysis', 'Gas Chromatography-Mass Spectrometry', 'Goats', 'Methylation', 'Milk', 'Trans Fatty Acids']",Application of ethyl esters and d3-methyl esters as internal standards for the gas chromatographic quantification of transesterified fatty acid methyl esters in food.,"[None, 'Q000592', 'Q000737', None, 'Q000032', 'Q000032', 'Q000032', 'Q000379', None, None, None, 'Q000737', 'Q000032']","[None, 'standards', 'chemistry', None, 'analysis', 'analysis', 'analysis', 'methods', None, None, None, 'chemistry', 'analysis']",https://www.ncbi.nlm.nih.gov/pubmed/16637674,2006
16610671,"The aim of the study was to compare lipolytic activity and radial growth rate changes during the incubation of Thermomyces lanuginosus strains on natural (sunflower oil, soybean oil, rapeseed oil, and corn oil) and synthetic (tributyrin, Tween 20, Tween 40, Tween 60, Tween 80, and Tween 81) fatty substrata. The general lipolytic activity index decreased on natural substrata and increased on synthetic substrata during a five-day incubation period. The general daily growth rate changes were found to be similar on both natural and synthetic fatty substrates.",Roczniki Panstwowego Zakladu Higieny,"['D001673', 'D002851', 'D005506', 'D005658', 'D006801', 'D010938', 'D014280']","['Biodegradation, Environmental', 'Chromatography, High Pressure Liquid', 'Food Contamination', 'Fungi', 'Humans', 'Plant Oils', 'Triglycerides']",Lipolytic activity and radial daily growth rate changes during incubation of thermomyces lanuginosus on natural and synthetic fatty substrates.,"[None, None, 'Q000032', 'Q000254', None, 'Q000378', 'Q000378']","[None, None, 'analysis', 'growth & development', None, 'metabolism', 'metabolism']",https://www.ncbi.nlm.nih.gov/pubmed/16610671,2006
16541407,"The recently introduced technique of an atmospheric pressure photoionization (APPI) source coupled to quadrupole time-of-flight mass spectrometry (QqTOFMS) has been applied to fast olive oil fingerprinting on the basis of the accurate mass measurements obtained with this instrumentation. The key compounds can be characterized as [M+H]+ (produced by proton transfer) or as [M]+* (by charge transfer) ions in the mass spectra. [M+H]+ ions, however, show higher abundance, especially for triacylglycerols. Other ions present in APPI-MS are the acylium ion [RiCO]+ and [RiCO-H2O]+. This latter ion is absent in the electrospray ionization (ESI)-MS spectra, and this represents valuable complementary information. Several critical parameters in the APPI source were optimized such as LC eluent composition, ion spray voltage and, especially, declustering potential. APPI-QqTOFMS allows easy discrimination among different edible oils: olive, extra virgin olive, olive-pomace, hazelnut, sunflower, corn and several mixed oils, with high throughput (approximately 1 min per sample). Cluster analysis was applied to obtain the best experimental conditions for oil discrimination on the basis of declustering potential. Principal components analyses of these APPI-MS spectra show that the approach can be used for studies of olive oil adulteration with other oils, even in the case of hazelnut oil that exhibits a high chemical similarity with olive oil.",Rapid communications in mass spectrometry : RCM,"['D031211', 'D017022', 'D005506', 'D006368', 'D007202', 'D013058', 'D000069463', 'D010777', 'D010938', 'D025341', 'D003313']","['Corylus', 'Flow Injection Analysis', 'Food Contamination', 'Helianthus', 'Indicators and Reagents', 'Mass Spectrometry', 'Olive Oil', 'Photochemistry', 'Plant Oils', 'Principal Component Analysis', 'Zea mays']",Use of flow injection atmospheric pressure photoionization quadrupole time-of-flight mass spectrometry for fast olive oil fingerprinting.,"['Q000737', None, 'Q000032', 'Q000737', None, None, None, None, 'Q000032', None, 'Q000737']","['chemistry', None, 'analysis', 'chemistry', None, None, None, None, 'analysis', None, 'chemistry']",https://www.ncbi.nlm.nih.gov/pubmed/16541407,2007
16428640,"Based on the potential benefits of cis-9, trans-11 conjugated linoleic acid (CLA) for human health, there is a need to develop effective strategies for enhancing milk fat CLA concentrations. Levels of cis-9, trans-11 CLA in milk can be increased by supplements of fish oil (FO) and sunflower oil (SO), but there is considerable variation in the response. Part of this variance may reflect time-dependent ruminal adaptations to high levels of lipid in the diet, which lead to alterations in the formation of specific biohydrogenation intermediates. To test this hypothesis, 16 late lactation Holstein-British Friesian cows were used in a repeated measures randomized block design to examine milk fatty acid composition responses to FO and SO in the diet over a 28-d period. Cows were allocated at random to corn silage-based rations (8 per treatment) containing 0 (control) or 45 g of oil supplement/kg of dry matter consisting (1:2; wt/wt) of FO and SO (FSO), and milk composition was determined on alternate days from d 1. Compared with the control, the FSO diet decreased mean dry matter intake (21.1 vs. 17.9 kg/d), milk fat (47.7 vs. 32.6 g/kg), and protein content (36.1 vs. 33.3 g/kg), but had no effect on milk yield (27.1 vs. 26.4 kg/d). Reductions in milk fat content relative to the FSO diet were associated with increases in milk trans-10 18:1, trans-10, cis-12 CLA, and trans-9, cis-11 CLA concentrations (r(2) = 0.74, 0.57, and 0.80, respectively). Compared with the control, the FSO diet reduced milk 4:0 to 18:0 and cis 18:1 content and increased trans 18:1, trans 18:2, cis-9, trans-11 CLA, 20:5 n-3, and 22:6 n-3 concentrations. The FSO diet caused a rapid elevation in milk cis-9, trans-11 CLA content, reaching a maximum of 5.37 g/100 g of fatty acids on d 5, but these increases were transient, declining to 2.35 g/100 g of fatty acids by d 15. They remained relatively constant thereafter. Even though concentrations of trans-11 18:1 followed the same pattern of temporal changes as cis-9, trans-11 CLA, the total trans 18:1 content of FSO milk was unchanged because of the concomitant increases in the concentration of other isomers (Delta(4-10) and Delta(12-15)), predominantely trans-10 18:1. In conclusion, supplementing diets with FSO enhances milk fat cis-9, trans-11 CLA content, but the high level of enrichment declines because of changes in ruminal biohydrogenation that result in trans-10 replacing trans-11 as the major 18:1 biohydrogenation intermediate formed in the rumen.",Journal of dairy science,"['D000824', 'D000818', 'D002417', 'D004032', 'D005223', 'D005227', 'D005260', 'D005395', 'D008401', 'D006865', 'D044243', 'D008892', 'D008894', 'D010938', 'D012417', 'D012820', 'D000074242', 'D003313']","['Animal Nutritional Physiological Phenomena', 'Animals', 'Cattle', 'Diet', 'Fats', 'Fatty Acids', 'Female', 'Fish Oils', 'Gas Chromatography-Mass Spectrometry', 'Hydrogenation', 'Linoleic Acids, Conjugated', 'Milk', 'Milk Proteins', 'Plant Oils', 'Rumen', 'Silage', 'Sunflower Oil', 'Zea mays']",Examination of the persistency of milk fatty acid composition responses to fish oil and sunflower oil in the diet of dairy cows.,"[None, None, 'Q000378', None, 'Q000032', 'Q000032', None, 'Q000008', None, None, 'Q000032', 'Q000737', 'Q000032', 'Q000008', 'Q000378', None, None, None]","[None, None, 'metabolism', None, 'analysis', 'analysis', None, 'administration & dosage', None, None, 'analysis', 'chemistry', 'analysis', 'administration & dosage', 'metabolism', None, None, None]",https://www.ncbi.nlm.nih.gov/pubmed/16428640,2006
16277380,"A method using gas chromatography/electron ionization-mass spectrometry (GC/EI-MS) in the selected ion monitoring (SIM) mode was developed for the analysis of fatty acids as methyl esters (FAMEs) in order to determine their percentage contribution to the fatty acid profile in food. In the GC/EI-MS-SIM mode, saturated fatty acids were determined with m/z 87, monoenoic fatty acids were determined with m/z 74, and polyenoic fatty acids were determined via the sum of m/z 79 and m/z 81. The ratios of these fragment ions and the GC retention data provided additional information for tentative structural assignments. The 28 FAME standards tested provided similar results for the novel GC/EI-MS-SIM method and GC/EI-MS in the full scan mode, both of which were slightly worse than GC/flame ionization detection (FID). Analysis of sunflower oil, suet, and cod liver oil verified that both major and minor fatty acids (20-60% and down to 0.001% contribution to the fatty acid pattern) were determined with sufficient quality that justifies application of the GC/EI-MS-SIM method for the analysis of food samples. Furthermore, the method was approximately 20- or approximately 10-fold more sensitive than GC/EI-MS in the full scan mode or GC/FID, respectively. The method is suited for both quantitative purposes and fatty acid identification in samples where only low amounts of lipids are available.",Journal of agricultural and food chemistry,"['D002849', 'D004951', 'D005227', 'D005504', 'D008745', 'D015203', 'D012680', 'D021241']","['Chromatography, Gas', 'Esterification', 'Fatty Acids', 'Food Analysis', 'Methylation', 'Reproducibility of Results', 'Sensitivity and Specificity', 'Spectrometry, Mass, Electrospray Ionization']",A gas chromatography/electron ionization-mass spectrometry-selected ion monitoring method for determining the fatty acid pattern in food after formation of fatty acid methyl esters.,"[None, None, 'Q000032', 'Q000379', None, None, None, None]","[None, None, 'analysis', 'methods', None, None, None, None]",https://www.ncbi.nlm.nih.gov/pubmed/16277380,2006
16028716,"The presence of TAG hydroperoxides in the epithelial cells of the small intestines in growing pigs was studied after they had consumed a diet rich in either nonoxidized or oxidized sunflower seed oil (PV in oils, 1 and 190 mequiv O2/kg, respectively). To obtain molecular-level information on the oxidized TAG structures, a new approach based on TLC and HPLC-electrospray ionization-MS was used in the analysis of the samples. TAG hydroperoxides were not detected in the small intestinal mucosa or adipose tissue of either group, whereas TAG hydroxides, ketones, and epoxides were detected in all samples. The results suggest that dietary TAG hydroperoxides do not lead to the appearance of these molecules in the tissues.",Lipids,"['D000818', 'D002852', 'D004041', 'D007413', 'D007421', 'D015227', 'D008297', 'D013552', 'D014280']","['Animals', 'Chromatography, Ion Exchange', 'Dietary Fats', 'Intestinal Mucosa', 'Intestine, Small', 'Lipid Peroxidation', 'Male', 'Swine', 'Triglycerides']",Triacylglycerol hydroperoxides not detected in pig small intestinal epithelial cells after a diet rich in oxidized triacylglycerols.,"[None, None, 'Q000378', 'Q000166', 'Q000378', 'Q000502', None, None, 'Q000737']","[None, None, 'metabolism', 'cytology', 'metabolism', 'physiology', None, None, 'chemistry']",https://www.ncbi.nlm.nih.gov/pubmed/16028716,2006
